ChartMill,,2019-05-21 14:37:00,6.525,The technical rating of CENX is bad and it also does not present a quality setup at the moment chartmillcomanalyzephpu
tigertale,,2019-05-21 13:23:00,6.541,CENX solid consolidation today should rebound by EOW or early next wk hopefully
FishOnSalt,,2019-05-21 11:38:00,6.548,CENX but dip in the morning pump this up Sell for 010 profits day traders not buying it
Navinkk2808,True,2019-05-21 10:17:00,6.626,CENX I can see all aluminum stocks going up AA MT CSTM
matrix1233,,2019-05-21 10:12:00,6.595,CENX Does anybody know what is going on with this stock
gp1M,,2019-05-21 09:40:00,6.494,CENX red yet again
