VolumeBot,,2019-05-21 14:10:00,255.53,Short volume for HUM on 052019 was 90th percentile in terms of last 20 trading days volumebotcomsHUM
EstimizeAlerts,,2019-05-21 14:06:00,255.51,HUMs Consolidated Benefit Ratio is a key growth metric for their next report on 0731 BMO Will they beat last quarters 862 Consolestimizecomintrohumchar
GLOBALCITIZEN,True,2019-05-21 13:06:00,254.245,HUM Broke downtrend to the upside RSI back in bullish zone 5 ema crossed the 10 ema to the upside Expecting both to cross the 20 ema upwards
lk12,,2019-05-21 10:56:00,255.45,UNH ANTM HUM CI CNC Time to revisit recent Citi upgrade 510 and Cowen call think last Thursday Citi upgrades Anthem Centene UnitedHealth to Buy after extreme selloff theflycomlandingPageNews Move lower in managed care stocks appears overdone says Cowen theflycomlandingPageNews
lk12,,2019-05-21 10:42:00,254.41,UNH ANTM CNC MOH HUM all up nicely esp ANTM which is up close to 8 points now whoa
Kerbouchard,,2019-05-21 09:38:00,252.229,HUM Interesting analysis seekingalphacomarticle42
