29Cu,,2019-05-30 15:27:00,1.171,CNET crapnet
mrinvestorpro,,2019-05-30 15:18:00,1.194,CNET its getting old to those who dont understand but these type of markets come along very very rarely and Im going to buy like I did when I started in 2008 il get grey hair il get heart burn and il have to run to the bathroom regularly but Im continuously going to buy everything I can Trust me my friends this changes fast
mrinvestorpro,,2019-05-30 15:15:00,1.194,CNET I love how china says we may wait out the election lol I like trump for certain things but hate for others as iv been very clear Im neutral there is no good option for politics right now Anyways besides that be honest everyone whos going to beat trump in the next election There simply whether we like it or not just nobody even close Sure Biden rubs women and well Ill get past that My point is in this next election nobody has even a remote chance so by China saying we will wait for the election hoping the other side gets in so they can take advantage of them it actually tells me something deep It tells me a deal is coming because they know trump and his ego and when he wins he will set fire to them even harder simply for the test they tried on him This will get delt with as iv said from the beginning it already is but I mean it will be publicly announced soon maybe not a week or a month but absolutely no doubt they China know hes going to win
mrinvestorpro,,2019-05-30 13:09:00,1.19,CNET holding up well guys and gals glad to see Sign of things to come Remember this stock can run 200 in a second with good news so Im not concerned with dips if u are holding higher dont stress If worried buy something else but thought Id let u know
evenmorehating,True,2019-05-30 10:10:00,1.218,CNET lets go
mongul,,2019-05-30 09:34:00,1.152,CNET There goes RBZ Actually I am looking for a June 1 China deal progress announcement There was a June 1 deadline of sorts in previous news reports
