Ocean432,,2019-05-30 14:48:00,16.52,KEM why did I buy calls if mgmt is selling shares Im an idiot However its at a nice price right now
risenhoover,,2019-05-30 14:04:00,16.69,Insider Oyama Shignori reports selling 3102 shares of KEM for a total cost of 5235977 httpsfintelionuskem
cctranscripts,,2019-05-30 13:58:00,16.69,Kemet Corporations Executive VPMSA BG just disposed of 3102 shares conferencecalltranscriptso KEM
fla,,2019-05-30 13:57:00,16.7,KEM filed SEC form 4 Executive VPMSA BG Oyama Shignori Sold 2903 of Common Stock at price 1688 on 20190530 secgovArchivesedgardata
livetraderalerts,,2019-05-30 13:57:00,16.7,KEM 09m ago On 20190530 Oyama Shignori Executive VPMSA BG disposed of 3102 22 shares at 1688share Sale secgovArchivesedgardata
Last10K,,2019-05-30 11:00:00,16.875,Last10K highlighted 153 positive and negative remarks in KEMs 10K filed today See them in the Annual Report last10kcomsecfilingskem
