Lach14,,2019-05-30 14:45:00,25.165,WYNN down 26 in 4 wks China China China Imagine if govt tells gamblers to stop visiting American casinos Ha MGM BJK SPY
AnalystRatingsNetwork,,2019-05-30 13:55:00,25.291,MGM Resorts announces more job cuts calls layoffs complete MGM MGM marketbeatcomarticlesmgm
BearWrastler,,2019-05-30 13:22:00,25.296,MGM WYNN LVS CZR 557 layoffs coming Mainly management fox5vegascommgmresortsa
SparkySC,,2019-05-30 10:57:00,25.257,WYNN MGM CZE LVS SPY what if Macau is made off limits to USA owned casinos Macau is a Special Administrative Region SAR of the Peoples Republic of ChinaCould this designation be changed by China swiftly That appears to be the main risk here with USChina issues
EstimizeAlerts,,2019-05-30 10:51:00,25.316,Heres what 9 Estimize analysts believe MGM will report for Q2 2019 revenue Reporting 0801 AMCestimizecomintromgmchar
Pawtpie,False,2019-05-30 09:43:00,25.395,MGM 2344
