EquityFeedAlerts,,2019-03-26 13:48:00,4.345,BLOCK TRADE Microcap ABEV 273900 shares 434 134526
Stockhoot,,2019-03-26 12:34:00,4.288,US MARKET MOST ACTIVES AMD NIO BAC BBBY GE CHK ABEV AAPL GG SIRI stockhootcomextTopMovers
EquityFeedAlerts,,2019-03-26 10:31:00,4.23,BLOCK TRADE Microcap ABEV 1000000 shares 423 102853
EquityFeedAlerts,,2019-03-26 10:20:00,4.213,BLOCK TRADE Microcap ABEV 271328 shares 423 101933
EquityFeedAlerts,,2019-03-26 10:16:00,4.22,BLOCK TRADE Microcap ABEV 255900 shares 423 101354
risenhoover,,2019-03-26 09:56:00,4.253,ABEV Ambev SA files form 6KA httpsfinteliofilingsusabev
