Ro_Patel,,2019-03-26 15:12:00,264.83,ADBE new partnership w ROKU will help advertisers engage w 27M OTT viewers
Option_Wolf,True,2019-03-26 15:11:00,264.8,Watch our Live Webinar now as we analyze NFLX AMZN BA ADBE YMF and much more
Sentieo,,2019-03-26 12:47:00,265.02,High and sustained increases in YoY Twitter mentions and search trends for AdobeSummit ADBE foreshadowed Adobes sustained revenue growt
tediwatchmarkets,,2019-03-26 12:44:00,264.992,Is it time to jump into ADBE iwatchmarketscom2019032
sleekOptions,True,2019-03-26 12:37:00,265.072,Update6 ADBE Apr05 260 Calls Up 116 since alerted on Mar 19
cashincloud,False,2019-03-26 12:26:00,265.379,ADBE soon to be 262
Option_Wolf,,2019-03-26 11:46:00,265.827,All out on ADBE calls for now Great trade team Looking for the next setup now
Option_Wolf,,2019-03-26 11:46:00,265.868,All out on ADBE calls for now Great trade team Looking for the next setup now
ChartMill,,2019-03-26 11:32:00,266.52,LIQT ADBE and PAYC are showing a squeeze play pattern today They could be ready for breakout chartmillcomstockscreener
EstimizeAlerts,,2019-03-26 11:31:00,266.672,Heres what 42 Estimize analysts believe ADBE will report for Q2 2019 revenue Reporting 0618 AMCestimizecomintroadbecha
TalkMarkets,,2019-03-26 11:22:00,266.3,Adobe Delivers Via PaaS ADBE talkmarketscomcontentsto
VolumeBot,,2019-03-26 09:53:00,266.63,Short volume for ADBE on 032519 was 50th percentile in terms of last 20 trading days volumebotcomsADBE
