katherinehampton,True,2019-03-26 15:59:00,19.017,CARA I saw that 19
katherinehampton,True,2019-03-26 15:56:00,18.94,CARA GO GIRRRL Were going to be back at 20 this week
Alex1183,,2019-03-26 14:37:00,18.59,CARA Im selling as soon as we get some news I bet the dilute shares 2 days after
charlieL,,2019-03-26 13:56:00,18.56,CARA here comes the phase 3 results
itsupbecauseitsnotdown,False,2019-03-26 11:49:00,18.678,CARA here comes the drop
katherinehampton,True,2019-03-26 11:22:00,18.835,CARA Low volume and still solid Lets make that run back over 19
Alex1183,,2019-03-26 11:18:00,18.783,CARA boring but amazing how shes holding up on nothing wonder how long it will last no news will bring us back to 1314 fast
katherinehampton,True,2019-03-26 10:54:00,18.872,CARA XBI ripping up almost at 90
katherinehampton,True,2019-03-26 10:09:00,18.7,CARA THATS MY GIRL FIGHT IT
