Lunacy,,2019-03-26 13:00:00,1.175,CNAT Earlier results showed no efficacy in decompensated population which is the target group for next readout Selloff likely to continue
RobinhoodTraderz,,2019-03-26 12:06:00,1.163,CNAT Potential multiple bottom here 115 price On Watch for move up to 140 or higher
onlyiknow,,2019-03-26 11:41:00,1.178,CNAT Now that the analysts have finished lets see where we go waiting for shorts and badgers to reply now
AnalystRatingsNetwork,,2019-03-26 10:33:00,1.177,Conatus Pharmaceuticalss neutral rating reiterated at Roth Capital marketbeatcomstocksNASDA CNAT
topstockalerts,,2019-03-26 10:20:00,1.179,Benzingas Top Upgrades Downgrades For March 26 2019MOS CNAT NVDA BBT CRTO ALGT BBBY VRTX CMCM INO DNKN TSmbenzingacomarticle1341
Benzinga,,2019-03-26 10:02:00,1.174,Benzingas Top Upgrades Downgrades For March 26 ALGT BBBY BBT VRTX TS CNAT CMCM CRTO DNKN MOS NVDA INO benzingacomanalystrating
DividendBot,,2019-03-26 09:59:00,1.179,CNAT has moved 15 on 0326 Check out the movement and peers at dividendbotcomsCNAT
silverjet2,,2019-03-26 09:54:00,1.16,Notable Analyst Downgrades 0326 CNAT TS NVZMY KGFHY CRTO CMCM SUI ELS
Stocktrader1234,True,2019-03-26 09:51:00,1.152,CNAT
jsmith14,True,2019-03-26 09:45:00,1.181,BIOC CNAT good entry
fishinNbanjo,True,2019-03-26 09:44:00,1.177,CNAT who is still selling
