sleekOptions,True,2019-03-26 15:46:00,126.207,Update2 DATA Mar29 129 Calls Up 81 since alerted on Mar 25
EstimizeAlerts,,2019-03-26 14:21:00,126.02,DATA estimates distribution heres what 3 Estimize analysts are expecting DATA to report for Q1 License Revenue on 0501 AMCestimizecomintrodatacha
INCRDHULKtrder,,2019-03-26 14:20:00,125.985,DATA I dont trust this sht Im out
MandigoCapital,,2019-03-26 13:51:00,126.22,MDB TWLO SQ CRM DATA NVDA IBM FB IQ TEUM people talking 1999 but that is bs This is 1995 folks
MandigoCapital,,2019-03-26 13:51:00,126.515,MDB TWLO SQ CRM DATA NVDA IBM FB IQ TEUM people talking 1999 but that is bs This is 1995 folks
EveryTimeICash,,2019-03-26 12:58:00,126.748,DATA Clear wedge CRM SPLK
TalonStrike,True,2019-03-26 11:21:00,127.713,DATA back above ST supporting ascend trend started 122618 TA improving except for CMF LT Ascend Chl135 to 148
EstimizeAlerts,,2019-03-26 10:57:00,128.369,DATA estimates distribution heres what 17 Estimize analysts are expecting DATA to report for Q1 Reporting 0501 AMCestimizecomintrodatacha
