topstockalerts,,2019-03-26 15:54:00,6.555,IPOs Do They Live Up To The HypeFIT AAPL GPRO SNAP FB AMZNmbenzingacomarticle1342
Radwyatt,True,2019-03-26 15:49:00,6.555,GPRO bought more
EstimizeAlerts,,2019-03-26 14:36:00,6.515,GPRO estimates distribution heres what 5 Estimize analysts are expecting GPRO to report for Q1 Units Shipped on 0502 AMCestimizecomintrogprocha
Benzinga,,2019-03-26 13:15:00,6.53,IPOs Do They Live Up To The Hype AAPL AMZN SNAP FIT GPRO FB benzingacomnews1903134
Radwyatt,True,2019-03-26 11:36:00,6.559,GPRO lets goo to the moon baby 7 EOW
EstimizeAlerts,,2019-03-26 11:21:00,6.595,Estimize EPS expectations are 1298 higher than that of Wall Street for GPRO Q1 Reporting 0502 AMCestimizecomintrogprocha
MrTraveler,False,2019-03-26 11:03:00,6.62,NIO I used to be on stocktwits to cheer on GPRO couple years ago and lost my shirt this feels very similar
yellowdogs,True,2019-03-26 09:57:00,6.668,GPRO 666 like it
