EveryTimeICash,,2019-03-26 12:58:00,124.275,DATA Clear wedge CRM SPLK
wolvgang,True,2019-03-26 11:21:00,125.225,SPLK price target is at 140
TalonStrike,True,2019-03-26 11:18:00,125.332,SPLK hammer today so far slightly above the 50dMA Very encouraging TA improving LT Ascend Chl131 to 149 Monitoring to add LT view
EstimizeAlerts,,2019-03-26 11:14:00,125.602,Estimize EPS expectations are 1224 higher than that of Wall Street for SPLK Q1 Reporting 0523 AMCestimizecomintrosplkcha
adrianbull,,2019-03-26 10:32:00,124.865,SPLK would it go up
sleekOptions,True,2019-03-26 09:50:00,124.85,Peak gain for last 5 expired setups SPLK 10000 9000 15488 18015 19375 6061
