treading_under_water,True,2019-03-26 15:00:00,1.702,VTVT Adding here
Winston_Shade,,2019-03-26 14:10:00,1.71,VTVT New rating by Shade capital AVOID
Winston_Shade,,2019-03-26 14:09:00,1.701,VTVT sub 1 within 3 weeks
BullCaholic,,2019-03-26 12:23:00,1.71,VTVT Watching for an entry here
stocksplus,True,2019-03-26 09:51:00,1.74,VTVT its a simple question folks why is one institution willing to hold 68 of shares outstanding and they keep buying
scoobyjones1,True,2019-03-26 09:35:00,1.749,VTVT Interesting movementwho is buying
