JiggyTookie,True,2019-03-27 11:39:00,0.3938,ABIO Looking heavy retest of 3738
BenJaminit,True,2019-03-27 11:05:00,0.3933,AVEO SRAX FOSL DCAR ABIO lunch watch
Grover48,True,2019-03-27 10:28:00,0.3937,ABIO good long term hold
AZona,True,2019-03-27 10:27:00,0.3935,LTBR 230 ET CEO to Participate on NDFP spotlights progress demonstration capabilities supply chain developmentZKIN TRIL ABIO
BMP8,True,2019-03-27 09:49:00,0.4176,ABIO moving
sunnyp129,,2019-03-27 09:49:00,0.4176,ABIO any news or just jumping for the hell of it
