EstimizeAlerts,,2019-03-27 15:39:00,52.865,ORCL reported 6662M Cloud Service Revenue last quarter Next report is on 0619 AMC Jury is still out on expectations Whats yoursestimizecomintroorclcha
trill5556,,2019-03-27 12:49:00,52.653,CLDR this will be in single digits and stay there until someone ORCL buys this out
intelligentinvestisseur,,2019-03-27 12:41:00,52.548,AMZN recovery GOOGL NFLX NVDA ALGN MSFT TSLA LSRG VMW AVGO ADBE PANW ASML UTX ORCL IBM NXPI CSCO INTC EBAY AMD MU BA
EstimizeAlerts,,2019-03-27 12:27:00,52.566,Heres what 31 Estimize analysts believe ORCL will report for Q4 2019 revenue Reporting 0619 AMCestimizecomintroorclcha
sleekoptions_daytrade,True,2019-03-27 11:51:00,52.443,Update2 ORCL Apr05 54 Calls Down 65 since alerted on Mar 26
VolumeBot,,2019-03-27 10:17:00,53.05,Per data reported to FINRA short volume divided by total volume for ORCL was 4557 on 032619 volumebotcomsORCL
