lecorb,,2019-03-27 15:50:00,135.52,Palladium plunges amid bubble concerns a week after setting record high seekingalphacomnews34462 AAUKF AAUKY PPLT PALL PTM PGM PLTM PLG PALDF
ETFDailyNews,,2019-03-27 15:43:00,135.639,PALL Palladium sees its largest oneday drop in 19 years etfdailynewscom20190327
TalkMarkets,,2019-03-27 15:22:00,135.839,Precious Metals Report Wednesday March 27 GLD GDX SLV JJCTF PPLT PALL UUP talkmarketscomcontentus
cctranscripts,,2019-03-27 12:32:00,135.953,ETFS PALLADIUM TRUST just filed a prospectus suggesting it plans to soon issue some securities conferencecalltranscriptso PALL
Stocks_All_Day,,2019-03-27 11:26:00,138.849,PALL breaking major trend
ajb_2010,,2019-03-27 10:07:00,140.107,PALL hmmmm not looking good today
TradeIdeasQuant,,2019-03-27 09:30:00,141.499,PALL tradeideascomtickyticky Might need a medicwe have a bleeder Running down 152 in 3 minutes 52 seconds
