Smackdabid,,2019-03-27 14:07:00,6.075,TMUS Someone on Twitter posted that Dealreporter saying State AGs will oppose TMUS S merger
w97,False,2019-03-27 13:49:00,6.131,S Wow down big time May buy more bery soon
JMoral1,False,2019-03-27 13:49:00,6.131,S Could drop more big volume coming in
TradeAcademyCo,,2019-03-27 13:39:00,6.187,327 Unusual Option Volume Watch List LQD XRX CLDR ITB EWU LEN S BIIB ZNGA BHP LULU
MariaC82,,2019-03-27 13:10:00,6.262,S Vote of confidence in Sprint as shares slip
EstimizeAlerts,,2019-03-27 11:00:00,6.34,Estimize EPS expectations are 397 higher than that of Wall Street for S Q4 Reporting 0501 BMOestimizecomintroschart
