BlindCommissioner,,2019-02-21 15:28:00,2.137,EMES stabilizing at 2 would be a great entry
lecorb,,2019-02-21 14:01:00,2.08,EnergyMaterials gainersPioneer Energy Services and SM Energy among losers httpsseekingalphacomnews3435775sourceansh TMST HSC TRCH KL ALB PES SM SNMP BRS EMES
Shortmasters,,2019-02-21 13:51:00,2.087,EMES cover 2084 dan gtg thanks
LoebsWrong,,2019-02-21 12:56:00,2.08,EMES btf babies
chenx,,2019-02-21 12:50:00,2.09,EMES havent been here in a while Whats going on with this
Stuballs,,2019-02-21 12:36:00,2.098,EMES Give us a break WTF
