Glenderblender,True,2019-02-21 15:17:00,8.553,SLDB i should really just hold this for a month or two
Glenderblender,True,2019-02-21 15:14:00,8.57,SLDB back in at 86 Hoping this is a higher low
scalp3r,,2019-02-21 15:05:00,8.566,SLDB chasers and day traders now gone
cptnobvs,,2019-02-21 14:27:00,8.84,SLDB got some consolidation going on here breaks around 300
seanmonte,,2019-02-21 14:20:00,8.844,SLDB thanks for triggering my SL only to jump right back up
TimothyEnt,,2019-02-21 14:16:00,8.881,SLDB cross the 9s and Ill be happy for the week
LongInvestor1,True,2019-02-21 14:10:00,8.883,SLDB Should be a nice day tomorrow here Word is slowly getting out Might head over 950 tomorrow GLTAL
Jspit,True,2019-02-21 14:04:00,8.91,SLDB out at 892 may be back on some dips GLTA
heycenda,True,2019-02-21 14:03:00,8.909,SLDB this stock trades like an idiot
FreedomUsa,True,2019-02-21 14:03:00,8.909,SLDB here is the 52wk low printinglooking for the bounce
ChartMill,,2019-02-21 14:02:00,8.903,A Current Ratio of 1395 indicates that SLDB has no problem at all paying its short term obligations chartmillcomanalyzephpu
free2dream,,2019-02-21 14:00:00,8.883,SLDB unbelievable how dumb just because Wise bought in few shares this company has nothing now just hope Buy SRPT CLDX AXGT TENX
almaz,,2019-02-21 13:54:00,8.866,SLDB do we keeep or we selll
LongInvestor1,True,2019-02-21 13:48:00,8.9,SLDB I hope everyone is loading up down here we should be in the double digits soon on our way to about 1516 GLTAL
wekilledshorts147,True,2019-02-21 13:43:00,8.78,SLDB float is tiny
wekilledshorts147,True,2019-02-21 13:43:00,8.78,SLDB paid 810 average on 12500 shares sold the trading shares 9 average thanks Will buy leaps on pull back soon this will be 20
greggsk,,2019-02-21 13:39:00,8.828,SLDB what exactly did Fast bunny say I did not listen
al_smith,,2019-02-21 13:38:00,8.805,SLDB Was looking at this at 810 just before the CNBC sheeple piled in Shoulda woulda coulda
TimothyEnt,,2019-02-21 13:33:00,8.761,SLDB wtf did I miss I was gone for like an hour
Glenderblender,True,2019-02-21 13:33:00,8.761,SLDB out at 875 Thank you sldb
scalp3r,,2019-02-21 13:32:00,8.759,SLDB bidding the vwap
BrokerThanYourBroker,,2019-02-21 13:31:00,8.734,SLDB waiting for the pump to subside so I can start a small position
Hopupinu,True,2019-02-21 13:30:00,8.803,OMED ZSAN SLDB in all BOOM
Liverpool_,True,2019-02-21 13:29:00,8.822,FastMoneyEspresso JL buy SLDB was crushed when they failed a drug trial but the smartest biotech investors I know did NOT sell it
wekilledshorts147,True,2019-02-21 13:28:00,8.826,SLDB what did he say on cnbc
Glenderblender,True,2019-02-21 13:27:00,8.81,SLDB that was a very fast 10 gain
Dave_,,2019-02-21 13:26:00,8.825,SLDB still a double top Will it break
Mrkenny,,2019-02-21 13:26:00,8.825,SLDB AVP up over 50 since Bill Miller pumped it on cnbc It happens theflycomlandingPageNews
ramfire,True,2019-02-21 13:24:00,8.86,SLDB looks up is that the moon i see
LongInvestor1,True,2019-02-21 13:22:00,8.878,SLDB Should run for a few days into next week Watching for 12 very soon and 1618 in about 3 months GLTAL
Dave_,,2019-02-21 13:22:00,8.878,SLDB wtf
Hopupinu,True,2019-02-21 13:21:00,8.8,SLDB get that NHOD Turn and burn
scalp3r,,2019-02-21 13:21:00,8.8,SLDB looks healthy to me I see a close over 9
wekilledshorts147,True,2019-02-21 13:20:00,8.8,SLDB just buy and hold soon 20
Mrkenny,,2019-02-21 13:20:00,8.8,SLDB Thank Stephen Weiss founder managing partner and chief investment officer at Short Hills Capital Partners for big pump
Sadrick,,2019-02-21 13:18:00,8.805,SLDB just watching here Insane action Down from 9 and then up again in 25 minutes What drives this thing like crazy
Sterling7272,,2019-02-21 13:14:00,9.005,SLDB that was quite a jump Lets get through this 9 level and hold Yahooooo
LongInvestor1,True,2019-02-21 13:12:00,8.9,SLDB See you all at 15 fairly soon Gonna run for a few days here
scalp3r,,2019-02-21 13:11:00,8.909,SLDB squeeze over 911
artonkabashi,True,2019-02-21 13:11:00,8.909,SLDB lots of buying squeeze
greggsk,,2019-02-21 13:10:00,8.9,SLDB what just happened I was in a meeting and the stock jumped almost 090 anyone
luckeee,,2019-02-21 13:09:00,8.92,SLDB too easy straight up from entry
tomwalt,,2019-02-21 13:09:00,8.92,SLDB Thats why Im here heard the pump on CNBC
TOO_BEAUCOUP,,2019-02-21 13:09:00,8.92,SLDB Sheep Sheep Sheep So if Fast money guessers say jump off a bridge would you do it
BrokerThanYourBroker,,2019-02-21 13:08:00,8.905,SLDB CNBC pump thats what brought this to my attention
scalp3r,,2019-02-21 13:08:00,8.905,SLDB resistance at whole dollar 9 will be chasing at 95s lol
TeachMeHowToStockie,,2019-02-21 13:08:00,8.905,SLDB
TraderDav1,True,2019-02-21 13:06:00,8.876,SLDB hopefully you did not fall for the head fake before 11 its going over in the coming days
mercguy22,True,2019-02-21 13:05:00,8.762,SLDB Dont chase it
samwallstreet1,,2019-02-21 13:05:00,8.762,Option in SLDB money well spent cant wait for it to hit 9
Hopupinu,True,2019-02-21 13:04:00,8.83,SLDB awww thats better good to be green again
LongInvestor1,True,2019-02-21 13:04:00,8.83,SLDB Get ready for some news release folks See you at 15 soon enough
glouis,,2019-02-21 13:04:00,8.83,SLDB just the beginning
scalp3r,,2019-02-21 13:04:00,8.83,SLDB huge squeezes going on
al_smith,,2019-02-21 13:03:00,8.77,SLDB wtf
NiceTryMortimer,,2019-02-21 13:03:00,8.77,SLDB glad i grabbed some at 815
tuzic,True,2019-02-21 13:03:00,8.77,SLDB caboom go sky high baby
cptnobvs,,2019-02-21 13:03:00,8.77,SLDB wow that makes me feel a little better about my lifes decisions
STUDLIE,True,2019-02-21 13:02:00,8.567,SLDB finally adjusted for the day
Hopupinu,True,2019-02-21 13:02:00,8.567,SLDB go green baby
Mrkenny,,2019-02-21 13:01:00,8.519,SLDB the ugly dude on cnbc just pumped it
scalp3r,,2019-02-21 13:01:00,8.519,SLDB back over 9
Md2bjsk,,2019-02-21 13:00:00,8.5,SLDB whoa
Glenderblender,True,2019-02-21 13:00:00,8.5,SLDB ridiculous
TraderJos,True,2019-02-21 12:34:00,8.18,SLDB why did this drop
Hopupinu,True,2019-02-21 12:12:00,8.134,SLDB hope we get back to 9 by eod
Glenderblender,True,2019-02-21 12:04:00,8.085,SLDB sold 873 back in at 809 nice swings on this stock and on its way up by the look of it
BumbleBeeTr,,2019-02-21 12:00:00,8.099,SLDB Loaded more at 840 but oh well at least I got a few more at 805
wekilledshorts147,True,2019-02-21 11:58:00,8.076,SLDB lol Huge move up coming
Sugarsweet,True,2019-02-21 11:28:00,8.16,SLDB Got more
seanmonte,,2019-02-21 11:01:00,8.199,SLDB market is bleeding red today
Jake077,True,2019-02-21 11:00:00,8.21,SLDB 815 820Good buys
TeachMeHowToStockie,,2019-02-21 10:56:00,8.23,SLDB price forecast
TradeIdeasQuant,,2019-02-21 10:27:00,8.28,SLDB tradeideascomtickyticky is trading Down Significantly Today Down 5 for the day
LongStrongTillImAllGone,,2019-02-21 10:14:00,8.451,SLDB like I said POS holds its gains worse than AYTU
TimothyEnt,,2019-02-21 10:10:00,8.486,SLDB damn I should have waited to buy in this dip fml
scalp3r,,2019-02-21 10:09:00,8.368,SLDB buying large down here
Hopupinu,True,2019-02-21 09:48:00,8.99,SLDB boom
Dave_,,2019-02-21 09:47:00,8.985,SLDB made a small little profit and Im happy with it Im not coming back here lol It was so hard to sell the option it kept denying it
scalp3r,,2019-02-21 09:47:00,8.985,SLDB lets really make it hurt now
dannytechtrader,True,2019-02-21 09:44:00,8.89,SLDB about to break 9
Dave_,,2019-02-21 09:41:00,8.838,SLDB options value isnt even changingggggg
TimothyEnt,True,2019-02-21 09:32:00,8.79,SLDB bought another 130 share at 887 Have an average of 751 now immma just hold out
StocksWithFlav,,2019-02-21 09:32:00,8.79,SLDB adding
