Pacer,True,2019-02-21 14:41:00,4.392,TRPX down today in reaction to market MJ is also down today I took advantage and loaded more Still very
mitigator,True,2019-02-21 14:25:00,4.316,TRPX
Pacer,True,2019-02-21 14:23:00,4.316,TRPX bullish channel trend since late January News for another BO could be out any day I keep adding long
UnluckyDiggs,,2019-02-21 11:58:00,4.369,TRPX someone waiting in the shadows for cheapies
B_C_Jones,True,2019-02-21 11:42:00,4.343,TRPX I was really hoping to scoop us some more shares in the 420s today Doesnt look like its going to happen
KennyHinSD,True,2019-02-21 11:22:00,4.44,TRPX loving the grind up Sustainable bull move
