Risky07,True,2019-02-21 15:07:00,0.4802,TYHT just waiting for the news
Jdogg85,,2019-02-21 14:50:00,0.4992,TYHT been under 1 for a long time the delisting notice has to almost be expired by now
Russell007xx,False,2019-02-21 13:54:00,0.4838,TYHT sell this garbage
kiakar,,2019-02-21 12:40:00,0.4982,TYHT As i said this stock will be zero this year The company is a shit chinese unsecure company
YumYumDividends,True,2019-02-21 11:46:00,0.497,TYHT patience is key
Russell007xx,False,2019-02-21 11:24:00,0.4881,TYHT this sucker will never move
Jdogg85,,2019-02-21 09:34:00,0.4641,TYHT 46
