anywhereyournot,,2019-03-01 14:44:00,1.775,MNKD exactly what I expected 1718 for a while okay by me
PhilMcKraken,,2019-03-01 14:43:00,1.775,MNKD mike and pat on scripsMike Pat why do scrips still suck Pat Fuck you Mike they are better than when you ran sales Mike ok
PhillyTime,True,2019-03-01 14:41:00,1.775,MNKD Under 2 not going to be around much longer at all in my opiniondo your DD
PhillyTime,True,2019-03-01 14:39:00,1.775,MNKD
IamWithU,True,2019-03-01 14:30:00,1.79,MNKD MikeCEO announce a BIG SECRET partnership with our Technosphere
Lakerstrader,True,2019-03-01 14:01:00,1.765,MNKD Its going to be a bumpy ride and shorts wont go down without a fight Bring it I got my on Mike C
Art_Keller,,2019-03-01 13:44:00,1.775,MNKD If your in this stock you should keep your seat belt on cause it will be a bumpy ride until MNKD is consistently profitable
ChartMill,,2019-03-01 13:35:00,1.778,Based on estimates for the next 2 years MNKD will show a very strong growth in EPS 2591 on average per year chartmillcomanalyzephpu
RRgames,,2019-03-01 13:27:00,1.778,MNKD let RSI drop with a flat line then let it go up again
Gator123,,2019-03-01 13:15:00,1.775,MNKD could todays chart be higher high and lower high
rooksleanne,,2019-03-01 13:11:00,1.78,MNKD
ChillyMutt,,2019-03-01 13:06:00,1.777,MNKD Surge Part Deux
wildpig,,2019-03-01 13:04:00,1.775,MNKD the Master ME tries very hard not to patronize u grasshoppas but i must say most of yalls posts are equal to used toilet paper
Keeportrade,True,2019-03-01 13:01:00,1.775,MNKD If u r worrying about these daily moves unless u r a trader imo it is a waste of time Just a given now Afrezza or not
MrWaikoloa,True,2019-03-01 12:59:00,1.775,MNKD Rule of thumb Hold core Trade around it and take green whenever possible MMS can slap it down 10 cents in a heartbeat
Harryx1,True,2019-03-01 12:52:00,1.779,MNKD Remember its not only Afrezza now should be adding more this year IMO Im looking forward to 40 in 2020
Sophia_Petrillo,True,2019-03-01 12:52:00,1.779,MNKD redeemed myself selling 185 and buying core back at 178
rozey1,,2019-03-01 12:51:00,1.775,MNKD WTF just happened Jeeze nice short attack UGH
sanantoniosal,,2019-03-01 12:48:00,1.772,MNKD its the pump praise hour
bowieinspace,,2019-03-01 12:47:00,1.765,MNKD Damn I missed that great swing window Got clobbered on that move up
Harryx1,True,2019-03-01 12:39:00,1.843,MNKD In 1 year TNDM is up 2100 Just imagine if MNKD does that it would 40 per share If you understand tech between 2 its possible
Avrage,True,2019-03-01 12:37:00,1.844,MNKD United is the FIRST of many companies to realize the genius of taking an expiring patent and putting the molecule on technosphere
Shanely,,2019-03-01 12:35:00,1.855,MNKD They can drop DTC scrips bomb anytime soon
Avrage,True,2019-03-01 12:29:00,1.855,MNKD 350m market cap is a joke for a turnaround growth story like Mannkind
BigPharmaBull,True,2019-03-01 12:27:00,1.86,MNKD where did all the shorts from this morning disappear to Anyone know Getting worried
Jaboie,,2019-03-01 12:26:00,1.859,MNKD what news did they get that shot them past 150
Avrage,True,2019-03-01 12:25:00,1.858,MNKD 2 bucks thats the short term target Short term being today
greekmafioso,,2019-03-01 12:24:00,1.863,MNKD gonna be swimming soon in MNKD cash baby
iratepirate,True,2019-03-01 12:23:00,1.855,MNKD
BigPharmaBull,True,2019-03-01 12:22:00,1.845,MNKD hi shorts
mistakotta,True,2019-03-01 12:22:00,1.845,MNKD EDGX MM protecting his short how cute
BlackjackAces,,2019-03-01 12:19:00,1.84,MNKD see ya at the pool party creeper
Kuka,True,2019-03-01 12:18:00,1.845,MNKD
GrosseEier,,2019-03-01 12:17:00,1.842,MNKD Im giving away 2 dolla show me your belly dance
anywhereyournot,True,2019-03-01 12:14:00,1.841,MNKD just hold for couple years Wont be disappointed
McLoven,True,2019-03-01 12:13:00,1.842,MNKD cant deny consistent upward trajectory of script counts Yall cant deny it Ima fckin rider You dont wanna fck with me
iratepirate,True,2019-03-01 12:11:00,1.83,MNKD yupper
CommonOrdinaryYokel,True,2019-03-01 12:06:00,1.845,MNKD Go go go
OTCBBKing,True,2019-03-01 12:06:00,1.845,MNKD run on 200 this afternoon Hmm
schtik,True,2019-03-01 12:05:00,1.845,MNKD
cgiscgis,,2019-03-01 11:58:00,1.813,MNKD sandiegouniontribunecombu
bigsal,True,2019-03-01 11:55:00,1.812,MNKD lets do this baby
IamWithU,True,2019-03-01 11:55:00,1.812,MNKD Congrats MikeCEO and longs Have a nice weekend Believer
patten1962,True,2019-03-01 11:47:00,1.805,MNKD Green now
jdhouse30,,2019-03-01 11:46:00,1.81,MNKD And todays action is like youtubecomwatchv77qc4Zt
zomill63,True,2019-03-01 11:42:00,1.79,MNKD House of Cards Actor Paul SParks speaks before congress 2017 about Afrezza youtubecomwatchvOZPKIh5
frumenti,True,2019-03-01 11:36:00,1.785,MNKD Huge short dump at open Longs refuted it Institutes being patientWhy run PPS up when shorts provide wonderful supply prices
czarnikokai,,2019-03-01 11:32:00,1.785,MNKD
inv4future,,2019-03-01 11:22:00,1.772,MNKD 300M Market Cap is way undervalued
cgiscgis,,2019-03-01 11:17:00,1.78,MNKD
RossOMalley,,2019-03-01 11:04:00,1.768,MNKD A little SNY Schadenfreude to brighten your morning fiercepharmacomvaccinesp
SNOOSNU,True,2019-03-01 10:57:00,1.765,MNKD I love this every bid is let with double the ask 7500x8000 the algos are working hard when it get above 5millvolume
CDSmooth,,2019-03-01 10:55:00,1.785,MNKD just got my bonus debating buying more just to average down but every time I have that feeling and buy it drops more
Pantera420,False,2019-03-01 10:48:00,1.785,MNKD patients drop off of Afrezza like prom dresses Its always been that way and isnt going to change Cant sustain on vouchers
rozey1,,2019-03-01 10:43:00,1.785,MNKD My gut says news on Monday UTHR launch of TrepT Brazil deal or another investorpartnerdrug Needed to wait until after earnings
LeeTheGreatest,True,2019-03-01 10:42:00,1.785,MNKD going to run up soon and now while you can
3xx,True,2019-03-01 10:38:00,1.786,MNKD I am in Will be adding more
firefox2778,,2019-03-01 10:32:00,1.779,MNKD seekingalphacomnews34389 Pfizer unit Meridian under civil investigation Pretty scaringNot saying Epinhale solves this but
sanantoniosal,,2019-03-01 10:31:00,1.779,MNKD laggard receding unaccepted
Harryx1,True,2019-03-01 10:31:00,1.779,MNKD 5 weeks left in the Qtr I think we get close to 12M and get the blade of the stick then the stick the rest of the year
Zeebrahed,True,2019-03-01 10:27:00,1.777,MNKD New bears old FUD
Kuka,True,2019-03-01 10:22:00,1.766,MNKD they are protecting 180 pretty hard today not worth watching Im gonna have a few cocktails and go look at some Hot Thai Chicks
BigCheeze,,2019-03-01 10:19:00,1.782,MNKD The vermin are out again
GrosseEier,,2019-03-01 10:10:00,1.793,MNKD BigPharmaBull dont be fooled by him sitting on a gold mine yeah he thinks of his pile of shit as gold
SNOOSNU,True,2019-03-01 10:08:00,1.815,MNKD Cant hold it down anymore The channel is set and morning attempts have been week Multiple account FUD know what you own
BigPharmaBull,True,2019-03-01 10:08:00,1.815,MNKD just keep adding folks You are sitting on a gold mine Block out the noise
rozey1,,2019-03-01 10:07:00,1.814,MNKD Same action almost everyday this week including on earnings day as well Shorts smack it down buyers jump in Very good sign
McLoven,True,2019-03-01 10:07:00,1.814,MNKD consistent script growth satisfied patients technosphere partnerships
quentc,,2019-03-01 10:07:00,1.814,MNKD Flat to positive today after scripts like that Not retail buying the numbers Im thinking shortsinstitutions
BigPharmaBull,True,2019-03-01 10:00:00,1.803,MNKD lmao at shorts Lets take a moment of silence for those who tried to bring this down today
uncleal,,2019-03-01 10:00:00,1.803,MNKD Tandem CEO on Mad Money Tonight Call in
rghb,True,2019-03-01 09:57:00,1.783,MNKD short
TheNotorious,False,2019-03-01 09:54:00,1.78,MNKD like I said back to a dolla soon
ForMankind,True,2019-03-01 09:54:00,1.78,MNKD Shorts are just giving the longs shares at a discount today
kevinmik,,2019-03-01 09:51:00,1.756,MNKD as more patients signup for Afrezza with positive outcomes more clinical data with positive outcomes will lead to exponential growth
firefox2778,,2019-03-01 09:50:00,1.752,MNKD relaxguysrelax Trade it inout do your money hold a core and enjoy life
MannonaMission,,2019-03-01 09:50:00,1.752,MNKD HmmI was off on my 80K RX prediction I am using Azizlabs confiscated algorithmic enigma machine which needs to be recalibrated
surplusvalue,,2019-03-01 09:50:00,1.752,MNKD Cant even break 700 anymore You still think the strategy isnt broken Just watch your burn execs rollin in it
surplusvalue,,2019-03-01 09:48:00,1.753,MNKD And the scripts arePATHETIConce againIve been telling you for months that NRX have been flattening out BAD SIGN
SuiGeneris,,2019-03-01 09:48:00,1.753,MNKD After watching chrisbeg I finally learnt this ticker is a pump dump stock Pray for a BO
Sophia_Petrillo,True,2019-03-01 09:48:00,1.753,MNKD swung out at low of morning and again at 174 Stopped back into full core at 176 oh well you win some you lose some
BigPharmaBull,True,2019-03-01 09:46:00,1.76,MNKD and this is why shorts are scared Keep adding We are going to triple digits in stock price
rozey1,,2019-03-01 09:46:00,1.76,MNKD Well back to where the pre XMAS massacre took place I guess we were to optimistic No PR for UTHR trepT P3 trial Good buy price
GhostOfKoolAid,,2019-03-01 09:45:00,1.75,MNKD Nothing like the weekly Rx to throw some cold water on a MNKD rally
BigPharmaBull,True,2019-03-01 09:44:00,1.749,MNKD shorts are out in full force 2 today They scared
oldyahooposter,,2019-03-01 09:44:00,1.749,MNKD why is this getting cornholed like PhillyTime in a back alley near eagle stadium
ForMankind,,2019-03-01 09:40:00,1.735,MNKD Weekly scripts review is over people Its like looking at a quiz score and inferring it will be your final grade
YoureSoMoney,,2019-03-01 09:37:00,1.74,MNKD Typical morning selloff Going green is my bet
wildpig,,2019-03-01 09:37:00,1.74,MNKD ignert grasshoppas how many times dd de MasterME have 2 tell yo ignert asses MMs control de gainlossNOT shorts dam yall r stoopid
oldyahooposter,,2019-03-01 09:36:00,1.73,MNKD why is this tanking We were told this would be over 2 by now Lying pumtards
kevinmik,,2019-03-01 09:34:00,1.718,MNKD 1000 Direct Purchases Weekly potentially could add 90 Pack 120 120K Gross 56K Net 180 Pack 199 199K Gross 93K Net
CT_Biker,,2019-03-01 09:33:00,1.731,MNKD So why do refills still suck
GrosseEier,,2019-03-01 09:33:00,1.731,MNKD i cant wait to pick this up at 131 again
free1inchrist,,2019-03-01 09:33:00,1.731,MNKD there isnt enough catalyst to move this stock
wildpig,,2019-03-01 09:32:00,1.738,MNKD wtf is wrong with u morons still bringing up sanifi nonsense gotta be the dummest thread on ST bar none
BigCheeze,,2019-03-01 09:30:00,1.82,MNKD Clearly need more social mediainternet advertising which is cost effectiveWe should be over 10000 Rxswkno excuses
czarnikokai,,2019-03-01 09:30:00,1.82,MNKD
