cctranscripts,,2019-03-01 12:48:00,36.885,Pembina Pipeline News Release Dated March 1 2019 httpwwwconferencecalltranscriptsorg8summary2id5855481 PBA
risenhoover,,2019-03-01 12:45:00,36.88,PBA Pembina Pipeline files form 6K httpsfinteliosuspba
fla,,2019-03-01 12:37:00,36.834,PBA filed press release on March 01 122000 Pembina Pipeline Corporation Provides Notice of Series 17 Preferred Share Conversion Right prnewswirecomnewsrelease
livetraderalerts,,2019-03-01 12:29:00,36.833,PBA 96m ago Pembina Pipeline Corporation Provides Notice of Series 17 Preferred Share Conversion Right and Announces R prnewswirecomnewsrelease
livetraderalerts,,2019-03-01 12:29:00,36.833,PBA 93m ago Pembina Pipeline Corporation Provides Notice of Series 17 Preferred Share Conversion Right and Announces R prnewswirecomnewsrelease
ChartMill,,2019-03-01 10:49:00,36.884,ALRM FB and PBA showing up in our technical breakout setup screen chartmillcomstockscreener
