AngryTrading,,2019-06-06 15:55:00,257.684,DIA another rally on no volume Im the duummy who sold all my calls and kept my puts Lol Its comical
SmallShare,,2019-06-06 15:52:00,257.95,DIA thats a strong move to the upside this afternoonlooks good youtubecomwatchvsqeSXxn
FullyProfitable,True,2019-06-06 15:38:00,258.268,It seems we will back to ATH by mid June Thats what i call FOMO SPY QQQ IWM DIA
IsabellaDC,,2019-06-06 15:37:00,258.248,DIA SPX QQQ Bulls mentality They charge in droves once the gate is open Still cautious and just swinging the swings
TradingGods,,2019-06-06 15:09:00,257.168,DIA SPY QQQ IWM Mixed Bag on Wednesday tradinggodsnettradinggod
cybercash28,,2019-06-06 15:04:00,257.116,MSFT HH 13046 next DIA QQQ SPY XLK
TankTopTrader,False,2019-06-06 14:58:00,257.057,SPY DIA QQQ esf Trump said multiple time he is the tariff man Im confident hell put tariff country by country thats the ONLY way to prevent company from shifting My only advice to US company planning to shift to another countrybetter be careful because the tariff man not born yesterday
cybercash28,,2019-06-06 14:50:00,257.118,AAPL HH higher than body of ydays candle is bullish Good for tech mrkt DIA QQQ SPY SOXX
TankTopTrader,False,2019-06-06 14:49:00,257.116,SPY DIA QQQ if youre american company and try to smart and move to another country to avoid tariff Trump agenda will screw you When he say make america great again he means you better open biz in USA ONLY
TankTopTrader,False,2019-06-06 14:47:00,257.228,SPY DIA QQQ esf I honestly dont think trump has no intention to make deals He just fishing to see what country willing to give up for trade deal for future plays For his tariff agenda to work you practically have to put tarriff in every country to prevent biz from shifting one to another
morphues,,2019-06-06 14:46:00,257.226,SPY DIA QQQ VIX 5 Tariffs at least 150 points on dow 10 Tariffs at least 300 Points on dow and so on Tariffs are GREAT
davidmoadel,,2019-06-06 14:46:00,257.226,DJIA Hop on now before Dow reaches 40000 says forecaster who nailed 2018 selloff marketwatchcomstoryhopo DIA
redbear7,False,2019-06-06 14:44:00,257.3,DIA SPY atleast before chump we could pretend the market was real now the 4th wall is broken no one can argue this is capitalism this is a communist regime and must be stopped
TankTopTrader,False,2019-06-06 14:41:00,257.13,SPY DIA QQQ esf Im pretty sure trump will put tariff in every country just to prevent company to shift country to country
russellkbrett,,2019-06-06 14:39:00,257.103,SPX SPY DIA QQQ Market is on hair trigger The tiniest bit of positive news sends it
ironwill21,True,2019-06-06 14:39:00,257.103,QQQ SPY DIA Everyone is getting tacos tonight
redbear7,False,2019-06-06 14:38:00,257.084,SPY DIA enjoy falacing yourelfs to chumps 3rd chin chumpanezes
russellkbrett,,2019-06-06 14:37:00,256.989,SPY QQQ DIA USO Stocks jump on report US may delay Mexico tariffscnbccom20190606stockm
NewBullFeb2018,,2019-06-06 14:35:00,257.088,DIA what news
charlieRobinson,False,2019-06-06 14:27:00,256.601,QQQ SPY DIA market is so backwards right now Contrarians will bank the biggest through the summer
TradingGods,,2019-06-06 14:08:00,256.568,DIA SPY QQQ Volatility Experienced on Wednesday tradinggodsnettradinggod
The_Shadow,,2019-06-06 14:03:00,256.546,SPY QQQ DIA IWMAny individual stocks youre watchingLet me know and Ill take a look at the charts to see if anything stands out
cybercash28,,2019-06-06 14:01:00,256.519,MTCH YES BTD SPY IWM DIA Match Group MTCH Up 51 Since Last Earnings Report Can It Continue financeyahoocomnewsmatc Outlook Estimates have been trending upward for the stock and the magnitude of these revisions looks promising It comes with little surprise Match Group has a Zacks Rank 1 Strong Buy We expect an above average return from the stock in the next few months
cybercash28,,2019-06-06 13:52:00,256.637,All we need is AAPL to be a little stronger then this mrkt can really take off NDX weak bc of AAPL DIA SPY SOXX
morphues,,2019-06-06 13:48:00,256.6,SPY DIA QQQ VIX 5 Tariffs at least 150 points on dow 10 Tariffs at least 300 Points on dow and so on Tariffs are GREAT
proton471,,2019-06-06 13:45:00,256.628,SPY DIA QQQ So this guy walks into the bathroom at the airport And he sees a vending machine that says Wife away from home Select proper size hole insert and deposit 25 cents Hmmm he says and checks under the stalls looks to see if theres anybody in the bathroom with him He doesnt see anyone So he takes out a quarter selects a hole and sticks it in and deposits his quarter and screams out in pain looks down and sees a big button sewn on the end of it Thats how the market works too
morphues,,2019-06-06 13:39:00,256.537,SPY DIA QQQ VIX CUT Rates 33 chance of recession cut cut cut cause the economy is great go Trump getting a bailout
TradingGods,,2019-06-06 13:37:00,256.56,DIA SPY QQQ IWM Mixed Bag for Mays Employment Situation Report tradinggodsnettradinggod
drpax,True,2019-06-06 13:33:00,256.604,DIA SPY NDX Precisely II marketwatchcomstorystop
TankTopTrader,False,2019-06-06 13:30:00,256.655,SPY DIA QQQ esf will the mexico trade get settled Hell I dunno Im just going with what I see internally Hard to figure out with machine running the show Going to suck if Im caught on the wrong side
redbear7,False,2019-06-06 13:09:00,256.475,DIA SPY Market dead until chump takes a dump
ChartMill,,2019-06-06 12:59:00,256.51,DIA has an average volume of 3557440 This is a good sign as it is always nice to have a liquid stock chartmillcomanalyzephpu
cybercash28,,2019-06-06 12:52:00,256.466,MSFT HH Beautiful weekly hammer Bull flag Great addbuy QQQ SPY DIA XLK
seeitmarket,,2019-06-06 12:40:00,256.382,Could Bullish Ascending Triangles Fuel New Stock Market Highs seeitmarketcombullishasc blog by KimbleChartingSPY QQQ IYT DIA
AngryTrading,,2019-06-06 12:34:00,256.52,DIA lol let get a list of all the stocks up over 15 in three days Lol
StockTrend,,2019-06-06 11:53:00,256.186,Not taking any position senator will again say something and move the market at the close SPY DIA TQQQ STZ cash is the king
TankTopTrader,False,2019-06-06 11:49:00,256.1,SPY DIA QQQ imo VIX should be at least 20 no idea why its so subdued I long VOL ETP
Fitzy800,,2019-06-06 11:48:00,256.212,SPY SPX DJIA DIA Western Central Banks are going to be incapable of dealing with the next recession after what theyve done for the last decade They are the problem while everyone is sure they are the solution Im betting squarely against the Fed ECB BOJ the trifecta of monetary fuckery Free money doesnt boost the real economy it distorts it inflates bubbles leads to misallocation of capital Kicking the can over a cliff is whats coming
Fitzy800,,2019-06-06 11:44:00,256.574,SPY SPX DJIA DIA there is a big difference between US financial media European financial media about the ECB today The US seems to think Draghi going to cut rates ramp stimulus Europe understands that the ECB is all out of bullets The only thing they can do is push back rate hike expectations because they literally have rates pinned to the ground and have nothing left Enjoy that
MarketCharts,,2019-06-06 11:40:00,256.6,Dow Stocks With Daily RSI Below 30 5Jun5Day 0 10Day 0 14Day 0 DJIA DIAIndexIndicatorscom
PaulEbeling,,2019-06-06 11:40:00,256.6,The SP 500 continues to trade higher by 02 The DJIA is up 04 while the NAS Comp is UnchangedSPY SOX QQQ DIA
Fitzy800,,2019-06-06 11:36:00,256.768,SPY SPX DJIA DIA Meanwhile in actual Fed policy they keep tightening the screws Dovish words with hawklite policy prescriptions If and when they do try to cut rates the USD is going to shit the bed and inflation is going to be a big problem Thats where the stagflation will bitch slap the people who think the Fed is some benevolent force that is controlling the biggest markets in the world like a video game
briefingcom,,2019-06-06 11:28:00,256.685,Ratecut expectations keep stocks higher SPY DIA QQQ DJIA UAL briefingcominvestormarke
MRKEE,,2019-06-06 10:49:00,256.249,SPY QQQ DIA You guys need to think about buying some IWM
Fitzy800,,2019-06-06 10:49:00,256.249,SPY SPX DJIA DIA Germany needs to get a sound money proponent to chair the ECB The Italians are a joke There is zero evidence extreme monetary policy works yet the major central banks keep trying There is ample evidence its actually keeping a lid on real growth because its causing rampant misallocation of capital Asset bubbles are not the answer they are the problem
Tradealike,,2019-06-06 10:44:00,256.313,MCD DIA FB GDX TSLA VolatileOptions MommyTrades moneymaker
MadMartigen1776,False,2019-06-06 10:34:00,255.794,SPY QQQ DIA bewildering that we respect every single price resistance zone on the way down no matter how minor But on the way up we blew through multiple major resistance zones like they werent even there Isnt it supposed to be elevator down stairs up
MWM,False,2019-06-06 10:24:00,255.847,So we are slapping Tariffs on everything and the market thinks this is going to end well SPY SPX QQQ DIA GL with that A crash is coming Short everything AMD LOL GL
ilias2019,,2019-06-06 10:22:00,255.867,SPY DIA QQQ Data are screeaming for the coming bear market check TNXGLDSLV XRT XLUISMPMIFed but people as always refuse to sell They want to get burnt at the peak of the market
harsh2010,,2019-06-06 10:05:00,256.047,DJX SPY QQQ DIA everyone quick get on SBUX trade war will do nothing to this stock keeps going up and up to new 52wk highs despite all this tariff and stuff
MadMartigen1776,False,2019-06-06 10:02:00,255.861,SPY DIA QQQ crazy that this hasnt rolled over yet At this rate China could ban all US companies and wed go up Cause rate cuts lol
