MonkeyBiznas,,2019-02-11 15:41:00,275.2,AVGO 13 normal volume wtf near all time highshope we get a China deal before ER this will pop then all in short
SurpSippinWinner,,2019-02-11 15:20:00,275.268,AVGO everybody wants a piece of that AVGO ass only thing next to burrito co that hasnt gone tits up
cybercash28,,2019-02-11 15:20:00,275.268,AVGO HH strong stk SOXX SOXL
InsiderForms,,2019-02-11 15:11:00,275.32,Wellington Shields Capital Management LLChas filed Form 13F for Q4 2018Opened NEW positions in AVGO CI ENB HAS KLXE TGT VDE
triplehstocks,True,2019-02-11 15:09:00,275.44,24 possible upside for Broadcom Inc AVGOtriplehstockscom2019021
cctranscripts,,2019-02-11 14:13:00,274.28,The Vanguard Group just provided an update on share ownership of Avago Technologies Limited conferencecalltranscriptso AVGO
livetraderalerts,,2019-02-11 13:37:00,274.252,AVGO 18m ago SEC Beneficial Ownership Report SC 13G Broadcom Inc secgovArchivesedgardata
InsiderForms,,2019-02-11 13:12:00,274.38,FAIRFIELD BUSH COhas filed Form 13F for Q4 2018Opened NEW positions in BABA AVGO SYMC VO
EstimizeAlerts,,2019-02-11 13:02:00,274.683,Estimize revenue expectations are 002 higher than that of Wall Street for AVGO Q1 Reporting 0314 AMCestimizecomintroavgocha
EstimizeAlerts,,2019-02-11 13:01:00,274.543,AVGO analysts on Estimize expect 477 YoY growth in Gross Margins for Q1 up from 385 in previous year Reporting 0314 AMCestimizecomintroavgocha
SurpSippinWinner,,2019-02-11 12:03:00,274.798,AVGO where is it going to the moon thats where if it were tesla itd be going to mars
MonkeyBiznas,False,2019-02-11 11:50:00,274.875,AVGO just go down you bloated POS
IcebergBot,,2019-02-11 11:15:00,273.661,02112019 Potential Whale Trades for AVGO Largest Trade 421 of Volume icebergbotcomsAVGO
