InsiderForms,,2019-02-11 15:45:00,338.667,Fort Point Capital Partners LLChas filed Form 13F for Q4 2018Opened NEW positions in ABX CHTR CY DOCU EHTH FRPT IDEV PAGP RHT
risenhoover,,2019-02-11 13:50:00,337.232,Vanguard Group Inc has filed an amended 13GA reporting 531 ownership in CHTR httpsfinteliosouschtr
InsiderForms,,2019-02-11 13:41:00,337.834,Buckingham Asset Management LLChas filed Form 13F for Q4 2018Opened NEW positions in AWR ADSK MFL BSQR CASM CI CHTR CROX EQR
risenhoover,,2019-02-11 12:50:00,337.405,BlackRock Inc has filed a new 13G reporting 52 ownership in CHTR httpsfinteliosouschtr
EstimizeAlerts,,2019-02-11 12:32:00,340.675,CHTR analysts on Estimize are expecting 498 YoY revenue growth for Q1 down from 593 in Q4 Reporting 0425 BMOestimizecomintrochtrcha
Ro_Patel,,2019-02-11 12:17:00,340.633,US rev growth from 20142023est rev mkt share 20092018 SIRI FB GOOG SNAP AMZN TWTR ROKU T DISH DIS CMCSA CHTR NYT GHC
cctranscripts,,2019-02-11 12:08:00,340.586,The Vanguard Group just provided an update on share ownership of Charter Communications conferencecalltranscriptso CHTR
livetraderalerts,,2019-02-11 12:05:00,340.81,CHTR 19m ago SEC Amended Beneficial Ownership Report SC 13GA CHARTER COMMUNICATIONS INC MO secgovArchivesedgardata
cctranscripts,,2019-02-11 11:22:00,342.115,BlackRock Inc just provided an update on share ownership of Charter Communications conferencecalltranscriptso CHTR
InsiderForms,,2019-02-11 11:14:00,341.166,Tesco Pension Investment Ltdhas filed Form 13F for Q4 2018Opened NEW positions in CHTR MIME
livetraderalerts,,2019-02-11 11:11:00,341.16,CHTR 51m ago SEC Beneficial Ownership Report SC 13G CHARTER COMMUNICATIONS INC MO secgovArchivesedgardata
