RNV,True,2019-02-11 15:04:00,52.12,CPRT come on Jay sell that iron
EstimizeAlerts,,2019-02-11 11:29:00,51.98,Estimize EPS expectations are 590 lower than that of Wall Street for CPRT Q2 Reporting 0226 AMChttpwwwestimizecomintrocprtchartchangeovertimemetricnameepsutmcontentCPRTutmmediumepsdifferenceutmsourcestocktwits
cctranscripts,,2019-02-11 11:11:00,51.996,The Vanguard Group just provided an update on share ownership of Copart conferencecalltranscriptso CPRT
livetraderalerts,,2019-02-11 10:53:00,52.029,CPRT 21m ago SEC Amended Beneficial Ownership Report SC 13GA COPART INC secgovArchivesedgardata
risenhoover,,2019-02-11 10:53:00,52.029,Vanguard Group Inc has filed an amended 13GA reporting 983 ownership in CPRT httpsfinteliosouscprt
shortvolumes,,2019-02-11 10:19:00,51.905,Short sale volume not short interest for CPRT at 20190208 is 71 shortvolumescomtCPRT via shortvolumes
