ZacksResearch,,2019-02-11 15:04:00,51.715,This weeks top stock picks are Saleforce CRM and Cree Inc CREE zackscomstocknews353640
EstimizeAlerts,,2019-02-11 13:21:00,51.78,Estimize EPS expectations are 034 lower than that of Wall Street for CREE Q3 Reporting 0501 AMCestimizecomintrocreecha
EstimizeAlerts,,2019-02-11 13:21:00,51.78,CREE reported 333 Gross Margins last quarter Next report is on 0501 AMC Jury is still out on expectations Whats yoursestimizecomintrocreecha
risenhoover,,2019-02-11 12:50:00,51.734,BlackRock Inc has filed an amended 13GA reporting 128 ownership in CREE httpsfinteliosouscree
InsiderForms,,2019-02-11 12:41:00,51.746,First Eagle Investment Management LLChas filed Form 13F for Q4 2018Opened NEW positions in AKTS BLFS CNST CREE KODK FTDR XRX
cctranscripts,,2019-02-11 11:21:00,51.644,BlackRock Inc just provided an update on share ownership of Cree conferencecalltranscriptso CREE
livetraderalerts,,2019-02-11 11:11:00,51.598,CREE 51m ago SEC Amended Beneficial Ownership Report SC 13GA CREE INC secgovArchivesedgardata
