EstimizeAlerts,,2019-02-11 14:48:00,31.235,DISH analysts on Estimize expect 33077 YoY growth in Net PayTV Subscriber Change for Q4 down from 3929 in previous year Reportestimizecomintrodishcha
risenhoover,,2019-02-11 13:59:00,31.421,Dodge Cox has filed an amended 13GA reporting 107 ownership in DISH httpsfinteliosousdish
EstimizeAlerts,,2019-02-11 13:09:00,31.477,DISH estimates distribution heres what 3 Estimize analysts are expecting DISH to report for Q4 Net PayTV Subscriber Change on 02estimizecomintrodishcha
risenhoover,,2019-02-11 12:50:00,31.439,BlackRock Inc has filed an amended 13GA reporting 78 ownership in DISH httpsfinteliosousdish
BravoTrader,,2019-02-11 12:33:00,31.53,Main earningsWeek Feb 1115thTue SHOP ATVI TWLO UAAWed DISH CSCO TRIP TEVAThr KO NVDA CGCFri PEP YNDXThanks eWhispers
EstimizeAlerts,,2019-02-11 12:26:00,31.503,DISH estimates distribution heres what 7 Estimize analysts are expecting DISH to report for Q1 Reporting 0507 BMOestimizecomintrodishcha
EstimizeAlerts,,2019-02-11 12:25:00,31.482,DISH reported Net PayTV Subscriber Change last quarter Next report is on 0507 BMO Jury is still out on expectations Whats yoursestimizecomintrodishcha
Ro_Patel,,2019-02-11 12:17:00,31.5,US rev growth from 20142023est rev mkt share 20092018 SIRI FB GOOG SNAP AMZN TWTR ROKU T DISH DIS CMCSA CHTR NYT GHC
cctranscripts,,2019-02-11 12:08:00,31.509,Dodge Cox just provided an update on share ownership of DISH Network Corporation conferencecalltranscriptso DISH
livetraderalerts,,2019-02-11 12:03:00,31.51,DISH 22m ago SEC Amended Beneficial Ownership Report SC 13GA DISH Network CORP secgovArchivesedgardata
EstimizeAlerts,,2019-02-11 11:32:00,31.499,DISH analysts on Estimize are expecting 2818 YoY EPS growth for Q4 down from 4386 in Q3 Reporting 0213 BMOestimizecomintrodishcha
DividendBot,,2019-02-11 11:32:00,31.499,DISH bears have 1 reason on 0211 to pay more attention dividendbotcomsDISH
EstimizeAlerts,,2019-02-11 11:31:00,31.479,Heres what 3 Estimize analysts believe DISH will report for Q4 Net PayTV Subscriber Change on 0213 BMOestimizecomintrodishcha
cctranscripts,,2019-02-11 11:23:00,31.568,BlackRock Inc just provided an update on share ownership of DISH Network Corporation conferencecalltranscriptso DISH
livetraderalerts,,2019-02-11 11:11:00,31.492,DISH 51m ago SEC Amended Beneficial Ownership Report SC 13GA DISH Network CORP secgovArchivesedgardata
