cctranscripts,,2019-02-11 13:58:00,25.151,The Vanguard Group just provided an update on share ownership of FIRST DATA CORP conferencecalltranscriptso FDC
livetraderalerts,,2019-02-11 13:38:00,25.165,FDC 19m ago SEC Amended Beneficial Ownership Report SC 13GA FIRST DATA CORP secgovArchivesedgardata
EstimizeAlerts,,2019-02-11 12:35:00,25.243,FDC analysts on Estimize are expecting 1219 YoY EPS growth for Q1 up from 1364 in Q4 Reporting 0429 BMOestimizecomintrofdcchar
InsiderForms,,2019-02-11 12:14:00,25.253,CANNELL PETER B CO INChas filed Form 13F for Q4 2018Opened NEW positions in APHQF ABX CI ROX GLW CEQP DISCK ETRN FDC IONS
InsiderForms,,2019-02-11 11:44:00,25.273,BANK HAPOALIM BMhas filed Form 13F for Q4 2018Opened NEW positions in ADBE BKNG FDC HUM ICSH MS SEDG VT VHT VOO
robertmolnar,,2019-02-11 09:52:00,25.379,FDC putting in buy stop 2551
