sleekOptions,True,2019-02-11 15:23:00,58.134,LUV In the last one month 11 Winners above 30 and 6 Losers below 30
risenhoover,,2019-02-11 14:58:00,58.05,Vanguard Group Inc has filed an amended 13GA reporting 652 ownership in LUV httpsfinteliosousluv
cctranscripts,,2019-02-11 14:35:00,58.075,The Vanguard Group just provided an update on share ownership of Southwest Airlines Company httpwwwconferencecalltranscriptsorg13Gsummaryid5758028 LUV
cctranscripts,,2019-02-11 14:32:00,58.08,The Vanguard Group just provided an update on share ownership of Southwest Airlines Company conferencecalltranscriptsorg LUV
livetraderalerts,,2019-02-11 14:17:00,58.12,LUV 21m ago SEC Amended Beneficial Ownership Report SC 13GA SOUTHWEST AIRLINES CO secgovArchivesedgardata
EstimizeAlerts,,2019-02-11 13:32:00,58.161,Heres what 8 Estimize analysts believe LUV will report for Q1 2019 revenue Reporting 0425 BMOestimizecomintroluvchar
EstimizeAlerts,,2019-02-11 13:31:00,58.125,LUVs PRASM is a key growth metric for their next report on 0425 BMO Will they beat last quarters 1317 PRASMestimizecomintroluvchar
MarketRealist,,2019-02-11 12:21:00,58.16,Investing in United Airlines Stock Highlights for Investors AAL DAL UAL LUV SAVE IYT marketrealistcom201902a
