AnalystRatingsNetwork,,2019-02-11 15:33:00,34.729,Tapestrys PT cut by MKM Partners to 5200 marketbeatcomstocksNYSE TPR
BullYa,True,2019-02-11 14:59:00,34.785,TPR back up to 38 by Friday or sooner giddy up Lets go
EstimizeAlerts,,2019-02-11 13:39:00,34.81,TPR analysts on Estimize are expecting 265 YoY revenue growth for Q3 up from 090 in Q2 Reporting 0509 BMOestimizecomintrotprchar
risenhoover,,2019-02-11 12:52:00,34.824,Price T Rowe Associates Inc md has filed an amended 13GA reporting 100 ownership in COH httpsfinteliosouscoh
cctranscripts,,2019-02-11 11:27:00,34.774,T ROWE PRICE ASSOCIATES INC just provided an update on share ownership of Coach conferencecalltranscriptso COH
cctranscripts,,2019-02-11 11:11:00,34.729,T ROWE PRICE ASSOCIATES INC just provided an update on share ownership of Coach conferencecalltranscriptso COH
livetraderalerts,,2019-02-11 11:07:00,34.724,TPR 22m ago SEC Amended Beneficial Ownership Report SC 13GA TAPESTRY INC secgovArchivesedgardata
risenhoover,,2019-02-11 10:53:00,34.693,Price T Rowe Associates Inc md has filed an amended 13GA reporting 99 ownership in COH httpsfinteliosouscoh
livetraderalerts,,2019-02-11 10:52:00,34.72,TPR 22m ago SEC Amended Beneficial Ownership Report SC 13GA TAPESTRY INC secgovArchivesedgardata
thestockmarketinfo,,2019-02-11 10:48:00,34.73,TPR Tapestry stock price target lowered from 63 to 52 by MKM Partnersthestockmarketinfocomanal
moe1234,True,2019-02-11 10:09:00,34.718,TPR what a nice trade sold 60 at 3463 and all out at 3482 i still think there is more room for upside
