DividendBot,,2019-02-11 14:32:00,50.505,USB has moved 012 on 0211 Check out the movement and peers at dividendbotcomsUSB
getvolatility,,2019-02-11 14:25:00,50.545,Attractive call overwrites PBR calls more expensive than 100 of history KEY 100 NOK 100 ECA 100 APC 100 LQD 100 USB 100
EstimizeAlerts,,2019-02-11 13:15:00,50.63,USB analysts on Estimize are expecting 325 YoY revenue growth for Q1 down from 387 in Q4 Reporting 0417 BMOestimizecomintrousbchar
risenhoover,,2019-02-11 10:24:00,50.634,Vanguard Group Inc has filed an amended 13GA reporting 706 ownership in USB httpsfinteliosoususb
cctranscripts,,2019-02-11 10:17:00,50.66,The Vanguard Group just provided an update on share ownership of US Bancorp conferencecalltranscriptso USB
livetraderalerts,,2019-02-11 10:05:00,50.7,USB 21m ago SEC Amended Beneficial Ownership Report SC 13GA US BANCORP DE secgovArchivesedgardata
