Armarium,,2019-06-05 15:10:00,3.062,INFN They let down shareholders badly same mistakes and disappointments over and over again zero credibility
Armarium,,2019-06-05 14:31:00,3.067,INFN Zero strength even at 3 management screwed up royally
ChartMill,,2019-06-05 13:49:00,3.12,INFN has a bad technical rating but it does show a decent setup pattern chartmillcomanalyzephpu
EquityFeedAlerts,,2019-06-05 13:22:00,3.115,BLOCK TRADE Microcap INFN 329200 shares 311 132223
Fajiggles,,2019-06-05 11:56:00,3.058,INFN anyone real people left here
taguru,,2019-06-05 11:10:00,3.074,INFN Infinera INFN 318 was the markets top winner yesterday jumping 325 Expect an Uptrend reversal tickeroncomappnewsSearch
Turtletrading,,2019-06-05 10:13:00,3.185,INFN Infinera INFN 318 was the months biggest loser descending 28 Expect a Downtrend continuation tickeroncomappnewsSearch
