kellysmith1,True,2019-06-05 14:34:00,7.721,RRC GPOR doing share buy back moved over there
Td4716,,2019-06-05 13:20:00,7.728,CHK RRC SWN Free Gas for everyone Gas will be cheaper than water
AV8,,2019-06-05 11:19:00,7.78,RRC You probably know this already but if it loses 760well ya know whats comes next
hkm_trader,,2019-06-05 11:17:00,7.792,RRC pump till bkpt
Bacharu,False,2019-06-05 11:08:00,7.8,CHK RRC ECR UGAZ Definitely into ugly heading toward omg
taguru,,2019-06-05 11:00:00,7.827,RRC Range Resources RRC 831 was the markets top weekly gainer with a 6 jump Expect an Uptrend reversal tickeroncomappnewsSearch
EstimizeAlerts,,2019-06-05 11:00:00,7.827,Heres what 15 Estimize analysts believe RRC will report for Q2 2019 EPS Reporting 0729 AMCestimizecomintrorrcchar
jwort,,2019-06-05 10:22:00,7.905,SWN AR GPOR RRC 52 week low incoming for these names
taguru,,2019-06-05 09:52:00,7.985,RRC Range Resources RRC 831 was this quarters top loser falling 21 Expect a Downtrend continuation httpstickeroncomgo168704
