ChartMill,,2019-05-31 15:02:00,3.25,Compared to an average industry price book ratio of 341 DFFN is valued rather cheaply chartmillcomanalyzephpu
GGoose,True,2019-05-31 12:56:00,3.25,DFFN beautiful doji could see a big move monday
Dman20200,True,2019-05-31 10:54:00,3.217,DFFN they already closed it earlier this week this should have nice bounce going into next week stay above 3 and Pt1 350370 Pt2 4 IMO long idea
DK_TRADES,True,2019-05-31 10:33:00,3.23,DFFN on watch
11B,True,2019-05-31 10:02:00,3.25,DFFN is all up from here
Dman20200,True,2019-05-31 10:00:00,3.25,DFFN another bottom reversal set up should be on your watch list for today and going into next week
tediwatchmarkets,,2019-05-31 09:56:00,3.25,DFFN iwatchmarketscom2019053
Sathix,,2019-05-31 09:50:00,3.115,DFFN i dont get it so much outflow day by day
