juicykielbasa,,2019-05-31 12:39:00,4.929,PHUN were these insider transactions buys or were the shares given to them
T_GER,,2019-05-31 11:02:00,4.855,PHUN you only have loss if you sell at a loss
Daytrader418,,2019-05-31 10:53:00,4.84,PHUN sure is painful to see red everyday I have lost about 10K on this stocksigh wonder if I can ever break even
T_GER,,2019-05-31 10:24:00,4.87,PHUN Friday No volume Price at the moment not meaningful Unsafe market Just keep your cool and wait
T_GER,,2019-05-31 10:23:00,4.87,PHUN Friday No volume Price at the moment not meaningful Unsafe market Just keep your cool and wait
Katewins,,2019-05-31 10:22:00,4.86,PHUN RandallCrowder can u tell story how your stock fell from 550 to 486 Just story wont run this stock we need action
