KJJ773,,2019-02-13 15:19:00,152.992,CMI and away we go
ChartMill,,2019-02-13 14:08:00,152.555,Great fundamentals for MOMO MGA and CMI while not overvalued chartmillcomstockscreener
lara,True,2019-02-13 14:03:00,152.635,DE CAT MMM CMI PPT pump time
Last10K,,2019-02-13 13:46:00,152.58,Last10K highlighted 116 positive and negative remarks in CMIs 10K filed Monday See them in the Annual Report last10kcomsecfilingscmi
EstimizeAlerts,,2019-02-13 13:41:00,152.515,Heres what 8 Estimize analysts believe CMI will report for Q1 2019 revenue Reporting 0430 BMOestimizecomintrocmichar
JustTradingHoy,,2019-02-13 09:45:00,152.532,BA CAT CMI UTX ILMN are China plays Watch the down As long as the index is strong their momos are positive
