EstimizeAlerts,,2019-02-13 14:21:00,4.51,CRNT reported 350 Gross Margins last quarter Next report is on 0220 BMO Jury is still out on expectations Whats yoursestimizecomintrocrntcha
EstimizeAlerts,,2019-02-13 14:09:00,4.516,CRNTs Gross Margins is a key growth metric for their next report on 0506 BMO Will they beat last quarters Gross Marginsestimizecomintrocrntcha
EstimizeAlerts,,2019-02-13 12:42:00,4.5,CRNTs Gross Margins is a key growth metric for their next report on 0220 BMO Will they beat last quarters 350 Gross Marginsestimizecomintrocrntcha
EstimizeAlerts,,2019-02-13 11:08:00,4.522,Estimize EPS expectations are 899 higher than that of Wall Street for CRNT Q1 Reporting 0506 BMOestimizecomintrocrntcha
EstimizeAlerts,,2019-02-13 11:03:00,4.49,CRNT reported 350 Gross Margins last quarter Next report is on 0220 BMO Jury is still out on expectations Whats yourshttpwwwestimizecomintrocrntcharthistoricalmetricnamegrossmarginsutmcontentCRNTutmmediummetricreportdateutmsourcestocktwits
EstimizeAlerts,,2019-02-13 09:36:00,4.476,Heres what 11 Estimize analysts believe CRNT will report for Q4 2018 EPS Reporting 0220 BMOestimizecomintrocrntcha
