MatrixChild,,2019-02-13 13:20:00,9.435,ERIC could break out
prairiefirehk,,2019-02-13 12:28:00,9.421,NOK look at youERIC is doing good job and you
Ryuk,True,2019-02-13 11:57:00,9.405,ERIC Banning of Huawei devices should bold well for this and NOK
Throughwinters,True,2019-02-13 11:47:00,9.39,ERIC i decided to go ahead and get in more long term anyways so ill just pick up more if it happens to go down more
TraderLeibniz,,2019-02-13 11:32:00,9.36,More 5Gdatacomcloud hype CSCO ER Today ANET ER Tomorrow ERIC STM MTSI NOK LSCC XLNX AAOI
Throughwinters,True,2019-02-13 10:32:00,9.345,ERIC i want in on this long termat least a few years good time to get in or think i can wait and will drop back a bit
EstimizeAlerts,,2019-02-13 10:18:00,9.3,Estimize EPS expectations are 170 lower than that of Wall Street for ERIC Q1 Reporting 0417 BMOestimizecomintroericcha
