IcebergBot,,2019-02-13 15:31:00,4.73,Big Trade Blocks for INSY Largest Trade 128 of Volume icebergbotcomsINSY
stockemup45,True,2019-02-13 14:57:00,4.665,INSY Current PT is 10
BlindCommissioner,,2019-02-13 13:26:00,4.615,INSY Break 5 and I am convinced
EstimizeAlerts,,2019-02-13 11:11:00,4.717,INSY estimates distribution heres what 3 Estimize analysts are expecting INSY to report for Q1 Reporting 0507 AMCestimizecomintroinsycha
Bully310,True,2019-02-13 10:46:00,4.716,INSY In at 464
EstimizeAlerts,,2019-02-13 10:09:00,4.64,INSY analysts on Estimize are expecting 5285 YoY EPS growth for Q4 up from 7619 in Q3 Reporting 0307 AMCestimizecomintroinsycha
taylorpamm,,2019-02-13 09:41:00,4.762,Watching APRN INSY and REFR for quick moves and APRN could be a decent swing trade for a few days I like the chart a lot
