dave43,,2019-02-13 15:21:00,2.615,NEON All this is coming together Looking forward to CC perhaps March 8th This is springloaded Still largely ignored glad to be in
ludantas,,2019-02-13 14:55:00,2.666,NEON A very important aspect is that the AWM did not break with the Swedish attack and increased position They believe
ludantas,,2019-02-13 14:50:00,2.67,NEON in my opinion Gravelius is another piece in the strategy of Swedish shareholders to dominate the company Together they must have 50
tjones3,True,2019-02-13 14:48:00,2.67,NEON Liking this got a starter
InsiderForms,,2019-02-13 14:42:00,2.68,AWM Investment Company Inchas filed Form 13F for Q4 2018Opened NEW positions in WIFI CVU ETON IMMR MCFT MLND NEON VJET ZEAL
risenhoover,,2019-02-13 14:40:00,2.68,AWM Investment Company Inc has filed an amended 13GA reporting 94 ownership in NEON httpsfinteliosousneon
ludantas,,2019-02-13 14:30:00,2.613,NEON The cake is still on the table Now we have something new Carl Grevelius with 504 and AWM to stay in the race It has 94
cctranscripts,,2019-02-13 13:41:00,2.61,AWM Investment Company Inc just provided an update on share ownership of Neonode Inc conferencecalltranscriptso NEON
pnchv59,,2019-02-13 09:38:00,0,NEON seekingalphacomarticle42
