rcantrell,True,2019-02-13 15:58:00,21.657,NWL Such a tease ER will make or break my portfolio for Q1
JBB,True,2019-02-13 15:01:00,21.741,NWL Started a new significant pos in advance of earnings
PhilBurfeind,True,2019-02-13 13:22:00,21.657,NWL one last opportunity to load up
Willrise23,True,2019-02-13 13:02:00,21.649,NWL Every retailer does better after Christmas quarter guys Sure to boost to 25 Monday
themarketmaker,True,2019-02-13 13:02:00,21.649,NWL Algos keeping the price down until the number 26 friday
MarketMakerr,,2019-02-13 12:51:00,21.7,NWL failed at 22 again
Willrise23,True,2019-02-13 12:39:00,21.75,NWL
EstimizeAlerts,,2019-02-13 11:23:00,21.905,Estimize revenue expectations are 253 higher than that of Wall Street for NWL Q4 Reporting 0215 BMOestimizecomintronwlchar
Rick2006,True,2019-02-13 10:42:00,21.838,NWL lets try to break through 22
