taguru,,2019-02-13 14:05:00,18.095,PE Parsley Energy PE 1789 was this quarters top loser falling 19 tickeroncomeventid607971
Joobacca,True,2019-02-13 13:02:00,18.158,PE 2500 by end of the week you heard it here first
cctranscripts,,2019-02-13 11:07:00,18.331,Boston Partners just provided an update on share ownership of Parsley Energy conferencecalltranscriptso PE
livetraderalerts,,2019-02-13 11:03:00,18.334,PE 21m ago SEC Amended Beneficial Ownership Report SC 13GA Parsley Energy Inc secgovArchivesedgardata
EstimizeAlerts,,2019-02-13 10:48:00,18.3,Estimize EPS expectations are 600 higher than that of Wall Street for PE Q1 Reporting 0502 AMCestimizecomintropechart
EstimizeAlerts,,2019-02-13 09:48:00,18.342,Estimize EPS expectations are 236 lower than that of Wall Street for PE Q4 Reporting 0221 AMCestimizecomintropechart
