DividendBot,,2019-02-13 15:32:00,113.945,In terms of positives for PEP there are 2 bullish indicators as of 0213 httpsdividendbotcomsPEP
InsiderForms,,2019-02-13 13:44:00,113.85,HOPLITE CAPITAL MANAGEMENT LPhas filed Form 13F for Q4 2018Opened NEW positions in BABA GOOG ANTM HOME PEP UNH WMT
EstimizeAlerts,,2019-02-13 13:38:00,113.87,Estimize EPS expectations are 555 higher than that of Wall Street for PEP Q1 Reporting 0425 BMOestimizecomintropepchar
Subkom,,2019-02-13 13:06:00,113.893,PEP freed up some cash if it misses and hit 105 i am gonna add tons
InsiderForms,,2019-02-13 12:10:00,113.89,Decatur Capital Management Inchas filed Form 13F for Q4 2018Opened NEW positions in CELG CHD EQIX FISV GILD INTC KLAC MFC PEP
SpadesofAce,True,2019-02-13 10:18:00,114.045,ATVI sold at 4472 Bullish on PEP to reap some Superbowl rewards
