risenhoover,,2019-02-13 15:20:00,11.086,Foresite Capital Fund III LP has filed an amended 13GA reporting 46 ownership in RCUS httpsfinteliosousrcus
themarketblows,,2019-02-13 14:58:00,10.96,RCUS Hey Dr Rosen Scam how about a PR to get this scam of yours over 11
InsiderForms,,2019-02-13 13:44:00,10.812,ALLIANCEBERNSTEIN LPhas filed Form 13F for Q4 2018Opened NEW positions in HIVE AGFS AMOT ALLO AMRC AMRB AMEH APHQF ACA RCUS
cctranscripts,,2019-02-13 13:29:00,10.89,Statement of acquisition of beneficial ownership by individuals conferencecalltranscriptso RCUS
livetraderalerts,,2019-02-13 13:02:00,10.854,RCUS 21m ago SEC Amended Beneficial Ownership Report SC 13GA Arcus Biosciences Inc secgovArchivesedgardata
themarketblows,,2019-02-13 10:46:00,10.735,RCUS Wow its up Can this scam get over 11 and 1094 resistance I doubt it it will puke like it always does
themarketblows,,2019-02-13 09:43:00,10.81,RCUS Another market rally day and another day without news from this scam
InsiderForms,,2019-02-13 09:41:00,10.81,Swiss National Bankhas filed Form 13F for Q4 2018Opened NEW positions in ALLK AMAL CRMT AMRS ATRS AMEH APHQF APTI APTX ACA RCUS
themarketblows,,2019-02-13 09:40:00,10.81,RCUS Pos scam Market rallying 2 days in a row and this pos scam pukes both days Giant
