InsiderForms,,2019-02-13 14:42:00,46.065,Steel Canyon Capital LLChas filed Form 13F for Q4 2018Opened NEW positions in AAL AAPL BLK DAL GS SCHW LUV WFC
EstimizeAlerts,,2019-02-13 13:21:00,46,SCHW analysts on Estimize are expecting 1356 YoY revenue growth for Q1 down from 1905 in Q4 Reporting 0416 BMOestimizecomintroschwcha
topstockalerts,,2019-02-13 11:06:00,46.497,Schwab Doubles CommissionFree ETF Lineup To Over 500BLK STT WETF SCHW IVZmbenzingacomarticle1315
GIMonroe,True,2019-02-13 10:57:00,46.422,SCHW
Benzinga,,2019-02-13 09:40:00,46.441,Fidelitys CommissionFree ETF Platform Is Growing benzingacomnews1902131 FDLO FDVV SCHW
Benzinga,,2019-02-13 09:35:00,46.37,Schwab Doubles CommissionFree ETF Lineup To Over 500 httpsbenzingacomz13153850 BLK IVZ SCHW STT WETF
