EstimizeAlerts,,2019-02-13 15:54:00,52.385,SHAKs Same Shack Sales is a key growth metric for their next report on 0502 AMC Will they beat last quarters Same Shack Salesestimizecomintroshakcha
EstimizeAlerts,,2019-02-13 15:44:00,52.404,SHAK estimates distribution heres what 5 Estimize analysts are expecting SHAK to report for Q4 Same Shack Sales on 0225 AMCestimizecomintroshakcha
DividendBot,,2019-02-13 14:40:00,52.907,Bulls just notched a win SHAK rallied 128 on 0213 See peers at httpsdividendbotcomsSHAK
EstimizeAlerts,,2019-02-13 13:48:00,52.915,SHAK analysts on Estimize are expecting 2868 YoY revenue growth for Q1 in Q4 Reporting 0502 AMCestimizecomintroshakcha
EstimizeAlerts,,2019-02-13 13:09:00,52.73,Heres what 13 Estimize analysts believe SHAK will report for Q4 2018 revenue Reporting 0225 AMCestimizecomintroshakcha
IcebergBot,,2019-02-13 11:47:00,52.31,Latest Trading Days Big Trades for SHAK Largest Trade 129 of Volume httpsicebergbotcomsSHAK
