EstimizeAlerts,,2019-02-13 15:44:00,30.814,URBNs Comparable Retail Sales is a key growth metric for their next report on 0305 AMC Will they beat last quarters 80 Comparablestimizecomintrourbncha
EstimizeAlerts,,2019-02-13 13:09:00,30.542,URBN analysts on Estimize are expecting 2059 YoY EPS growth for Q4 down from 7073 in Q3 Reporting 0305 AMCestimizecomintrourbncha
cctranscripts,,2019-02-13 12:46:00,30.549,Statement of acquisition of beneficial ownership by individuals conferencecalltranscriptso URBN
risenhoover,,2019-02-13 12:33:00,30.54,FMR LLC Fidelity has filed a new 13G reporting 5278 ownership in URBN httpsfinteliosousurbn
livetraderalerts,,2019-02-13 12:17:00,30.488,URBN 107m ago SEC Beneficial Ownership Report SC 13G URBAN OUTFITTERS INC secgovArchivesedgardata
tradecruz,,2019-02-13 11:58:00,30.465,URBN chart patterns dont always work out Heres an undercut with stop at 3575 Take small losses before they turn into bigger losses
