risenhoover,,2019-02-13 14:59:00,92.18,Renaissance Technologies LLC has filed an amended 13GA reporting 641 ownership in UTMD httpsfinteliosousutmd
cctranscripts,,2019-02-13 13:29:00,91.547,Renaissance Technologies LLC just provided an update on share ownership of Utah Medical Product conferencecalltranscriptso UTMD
livetraderalerts,,2019-02-13 13:16:00,91.541,UTMD 19m ago SEC Amended Beneficial Ownership Report SC 13GA UTAH MEDICAL PRODUCTS INC secgovArchivesedgardata
cctranscripts,,2019-02-13 12:49:00,91,Statement of acquisition of beneficial ownership by individuals conferencecalltranscriptso UTMD
risenhoover,,2019-02-13 12:34:00,91,FMR LLC Fidelity has filed an amended 13GA reporting 12774 ownership in UTMD httpsfinteliosousutmd
livetraderalerts,,2019-02-13 12:15:00,91.284,UTMD 93m ago SEC Amended Beneficial Ownership Report SC 13GA UTAH MEDICAL PRODUCTS INC secgovArchivesedgardata
