toni65,,2019-02-27 15:14:00,1.385,RWLK when I bought CVRS at 0 84 share price sentiment and messages were all deeply redcoloured Yesterday a large tute bought 1087M
newfguy,True,2019-02-27 13:09:00,1.405,CVRS 140 support level doin its job
toni65,,2019-02-27 12:56:00,1.409,CVRS We could see a 3step equity investment by MDT like the one described here meddeviceonlinecomdocmed
risenhoover,,2019-02-27 12:16:00,1.399,Also if you are new to CVRS heres some background for you httpsfinteliobcvrscorindusvascularroboticsanalysisandresearchreport17570
risenhoover,,2019-02-27 12:16:00,1.399,CVRS Corindus Vascular Robotics files form 8K httpsfinteliosuscvrs
DomLuminous,,2019-02-27 10:19:00,1.367,CVRS zero news on ER Its not getting bought out because they wouldnt do a private placement
