Bastard_Factory,True,2019-02-27 09:57:00,0.1294,Okay out of SYGP MTP and brought it ALL to ESNC 5 days down and done accumulating
Sneakyredwolf,True,2019-02-27 09:57:00,0.1294,ESNC
Nickibarra666,True,2019-02-27 09:56:00,0.125,ESNC
Casinobully,True,2019-02-27 09:55:00,0.12,ESNC we already know its not if but when
therealbrandon,True,2019-02-27 09:55:00,0.12,ESNC fine Im here
CatDog38,True,2019-02-27 09:54:00,0.1199,ESNC Run
FoShoJay,True,2019-02-27 09:54:00,0.1199,ESNC is that pagan turd still crying
Casinobully,,2019-02-27 09:54:00,0.1199,MTP bring profits to ESNC about to run soon
rayankhader,True,2019-02-27 09:54:00,0.1199,ESNC when this break 012 We gonna fly
gdanaj,True,2019-02-27 09:53:00,0.1197,MTP VTL SGYP Cut your lossesbring your profits to ESNC going off as I type
rayankhader,True,2019-02-27 09:52:00,0.1179,ESNC Im still holding
chuckeecheesee,True,2019-02-27 09:52:00,0.1179,ESNC We flyin
LuvRuebens,,2019-02-27 09:51:00,0.1217,ESNC
Casinobully,,2019-02-27 09:51:00,0.1217,ESNC alert alert alert
reneespinosa,,2019-02-27 09:51:00,0.1217,ESNC 1 mill in 20 minutes
gdanaj,True,2019-02-27 09:51:00,0.1217,ESNC Going vertical Last call before takeoff MTP VTL SGYP
Casinobully,,2019-02-27 09:50:00,0.1223,ESNC
Stock_Trader__,True,2019-02-27 09:49:00,0.1198,ESNC Read this but read what the last paragraph says BUY investingbizzcom201902e
Bastard_Factory,True,2019-02-27 09:43:00,0.1165,ESNC Sell Limit set 23
Bastard_Factory,True,2019-02-27 09:42:00,0.1165,MTP Our team moved it all over to ESNC
reneespinosa,,2019-02-27 09:41:00,0.1155,ESNC lets go BULLS
gdanaj,True,2019-02-27 09:40:00,0.1147,Fxck MTP the run has yet to happen at ESNC just needs more volume
Analyzethisstock0324,True,2019-02-27 09:39:00,0.1142,SGYP holy volumeESNC MTP BPMX
BullBullBill,,2019-02-27 09:39:00,0.1142,ESNC
Bastard_Factory,True,2019-02-27 09:39:00,0.1142,ESNC Portfolio Diversity 10000
thePagan,True,2019-02-27 09:37:00,0.1112,ESNC TO DA MOOOON
Bastard_Factory,True,2019-02-27 09:37:00,0.1112,ESNC
feelinboolish,,2019-02-27 09:37:00,0.1112,ESNC AVERAGE TF DOWWWWWNNNNNNNN
Ever87,True,2019-02-27 09:35:00,0.1143,ESNC gonna launch soon
reneespinosa,,2019-02-27 09:34:00,0.115,ESNC half a mill in 3 minutes
reneespinosa,,2019-02-27 09:33:00,0.1133,ESNC something is up havent seen this much movement at opening
thePagan,False,2019-02-27 09:32:00,0.1119,ESNC added at 112 expecting 115125 EOD
Casinobully,,2019-02-27 09:32:00,0.1119,ESNC if it continues this Ill just average down by selling and buying dips
Stock_Trader__,,2019-02-27 09:32:00,0.1119,ESNC I am still salty as fuck over missing MTP It is running again
Casinobully,,2019-02-27 09:31:00,0.1137,ESNC its not like people dont panic sell then ask whats a good entry my average is 16 where am I going Whos scared of money
Casinobully,,2019-02-27 09:30:00,0.1201,ESNC balls of steel dont care been here When it wants to give it will give People still making money on dips Ill just hold for now
