FalconJohn,False,2019-02-27 14:58:00,0.2136,GNMX blah groundhog day
smc66car,True,2019-02-27 14:09:00,0.2129,GNMX uggh
Musami,,2019-02-27 14:05:00,0.213,GNMX when do we get to have fun
Mrm0923,,2019-02-27 12:13:00,0.2132,GNMX we near bottom here
BobzStock,,2019-02-27 11:25:00,0.2158,Moved MTP profits into ESNC GNMX and HSGX that was a crazy run
AmarilloSlim1,True,2019-02-27 11:21:00,0.215,GNMX thanks for more shares at 211
VerticallyIntegrated,True,2019-02-27 11:13:00,0.2162,AMRH TENX PHIO GNMX lets go
reddheadsc,True,2019-02-27 10:31:00,0.218,GNMX I think everything is red today
reddheadsc,True,2019-02-27 09:52:00,0.2207,GNMX
