EstimizeAlerts,,2019-02-27 15:43:00,53.875,LUVs PRASM is a key growth metric for their next report on 0425 BMO Will they beat last quarters 1317 PRASMestimizecomintroluvchar
sleekOptions,True,2019-02-27 15:32:00,53.736,Peak gain the last 3 expired setups LUV 78148 5000 24000 10000
sleekOptions,False,2019-02-27 15:31:00,53.73,Update37 LUV Mar01 56 Puts Up 557 since alerted on Feb 14 Peak 594
EstimizeAlerts,,2019-02-27 12:18:00,53.684,Estimize revenue expectations are 084 higher than that of Wall Street for LUV Q1 Reporting 0425 BMOestimizecomintroluvchar
freericky,False,2019-02-27 11:16:00,53.708,LUV this should be 50 by next week weakest of the airlines
Atlanteax,True,2019-02-27 11:16:00,53.708,LUV on its way back above 54 and to 55 undervalued after overreaction to shutdown costs
