cybercash28,,2019-02-27 15:40:00,239.848,PYPL ATH NOW ATH
EstimizeAlerts,,2019-02-27 15:40:00,239.848,NOW reported 6661M Subscription Revenue last quarter Next report is on 0424 AMC Jury is still out on expectations Whats yoursestimizecomintronowchar
yidarmy,False,2019-02-27 15:37:00,239.994,NOW goes up every day nice bubble
SonGoku,,2019-02-27 15:37:00,239.994,Man this is such a beast NOW
Chrisdodge,False,2019-02-27 14:34:00,238.38,SPY NOW ANET IRBT V OLED BA INTU MA CMG PANW CYBR WDAY VMW UBNT GRMN CSCO once in lifetime shorts here WOW markets crazy
Last10K,,2019-02-27 13:02:00,236.928,Last10K highlighted 105 positive and negative remarks in NOWs 10K filed today See them in the Annual Report last10kcomsecfilingsnow
risenhoover,,2019-02-27 12:10:00,237.724,NOW ServiceNow files form 10K httpsfinteliofilingsusnow
EstimizeAlerts,,2019-02-27 12:09:00,237.903,Estimize revenue expectations are 048 higher than that of Wall Street for NOW Q1 Reporting 0424 AMCestimizecomintronowchar
retiringverysoon,True,2019-02-27 12:01:00,237.86,IBM GOOG GOOGL MSFT CRM AMZN AAPL FB NOW are just a few of the growing Partnerships with BOX Big earnings day for BOX today AMC
