lecorb,,2019-02-15 13:05:00,5.25,Midday movers and shakers httpsseekingalphacomnews3434036sourceansh OCC TNET CFMS TLND SAEX BSGM BLNK ADRO VVPR UXIN AKAO MRIN FUV IFMK TRUE PTX
trade_nut,,2019-02-15 12:52:00,5.206,Midday Gainers OCC TNET CFMS TLND SAEX BSGM BLNK ADRO VVPR UXIN
TwitOfWits,True,2019-02-15 12:44:00,5.37,BPMX BSGM pharm peeps i tried to tell you this morning We got a multi day runner here BSGM come check it out Room left
JosephMM,True,2019-02-15 12:09:00,5.126,BSGM yummy
TwitOfWits,True,2019-02-15 11:58:00,5.15,BSGM You do see that upward trend line on the chart right
TwitOfWits,True,2019-02-15 11:55:00,5.01,BSGM This one still a sleeper Stocktwits cant even keep up with the correct price changes
TwitOfWits,True,2019-02-15 11:53:00,5.03,BSGM Broke past resistance of 495 Next level up now
TwitOfWits,True,2019-02-15 11:46:00,5.133,BSGM Taking off Just the beginning of a multi day runner
TwitOfWits,True,2019-02-15 10:38:00,4.55,BPMX BSGM Now that youre done spending on your 1st love Valentines Time to spend on your 2nd love BSGM get in before the run
