cantelope,,2019-02-15 14:58:00,4.46,PETX sector bump
Eurostarjohn,True,2019-02-15 13:09:00,4.462,PETX Hmmmjust noticed institutional ownership is back over 70 Looks ready to make another run
packattack,True,2019-02-15 13:02:00,4.481,PETX Ill add 455 if volume good finally moving
CTS8073,,2019-02-15 12:47:00,4.457,PETX did people finally realize they also have AT019 Galliprant 20 Elanco Should bo just for protection let alone save Roy MS prod
packattack,True,2019-02-15 12:35:00,4.425,PETX looks like back to 450 wonder if ER will gap back to 6
fatcoin888,,2019-02-15 12:25:00,4.417,PETX volume needed and push over 45
