exHawaiian,True,2019-02-15 15:22:00,76.63,VFFCA you can see VFF greenhouses from the moon get it while you can CGC ACB CRON TLRY APHA WEED
InvestorPlace,,2019-02-15 15:05:00,77.06,Tilrays Quarter Will Be Seriously Judged Like Its Rivals TLRY investorplacecom201902t
Camelopardalis,,2019-02-15 15:04:00,77.081,TGODCA TLRY ACB CRON APHA CGC PYX its not too late to jump ship to VFFCA NASDAQ approval check out investor presentation DYODD
MarketRealist,,2019-02-15 14:56:00,77.118,How Cannabis Stocks Are Doing as This Week Wraps Up WEED TLRY CRON APHA HMMJ marketrealistcom201902h
mrmeshuga,True,2019-02-15 14:55:00,77.14,APHA CRON ACB CGC TLRY VFFIF Village Farms moving to Nasdaq financeyahoocomnewsvill
TheSilentInvestor,True,2019-02-15 14:53:00,77.052,CRBP Well we told you this was moving like TLRY Our Algos predicted this
pumpnass1000,True,2019-02-15 14:50:00,77.085,NEPT no debt 15mm cash on hand license CGC and Lonza deals largest extraction plant on earth now producing CRON TLRY GWPH
hockeysniper,True,2019-02-15 14:43:00,77.133,TLRY APHA in march calls
ChartMill,,2019-02-15 14:37:00,77.139,An AltmanZ score of 12012 indicates that TLRY is not in any danger for bankruptcy at the moment chartmillcomanalyzephpu
Wood87,,2019-02-15 14:34:00,77.045,PYX we now have a higher number of shorts than what TLRY had with a smaller float Once they cover well easily be 100 CRON ACB CGC
DipAddicted,True,2019-02-15 14:23:00,77.104,TLRY long here respecting the trend
coolcats1001,,2019-02-15 14:23:00,77.104,CRON TLRY CGC OTCPK PLPL going to reverse strong Pushed down for so long
coolcats1001,,2019-02-15 14:19:00,76.995,CRON TLRY CGC OTCPK PLPL hope this company comes back from pink sheets Too much to contribute to the sector plandaibiotechcomindexphp
coolcats1001,,2019-02-15 14:12:00,77.03,CRON TLRY CGC OTCPK PLPL this traded at almost 4 once
coolcats1001,,2019-02-15 14:03:00,77.245,CRON CGC TLRY once in a centuries oppbOTCPK PLPL I am long
TraderLeibniz,True,2019-02-15 13:57:00,77.29,Damn NEPT was the real winner today CGC CRON NBEV ACB TLRY APHA
PerfectHindsight,True,2019-02-15 13:54:00,77.355,CGC TPB CRON TLRY up 5 on APDN REED already Good CALL Ready for the double digits next week
superbigdaddy,,2019-02-15 13:51:00,77.36,TLRY cybercash28 told him not to short mj and biotech nastynate1 trevorcorey garcia450 CousinVinny
BoCap,,2019-02-15 13:44:00,77.229,TLRY can we dream of a 185 bid
WorldDom,,2019-02-15 13:42:00,77.171,TLRY interesting news
Seraphim_,,2019-02-15 13:40:00,77.212,ACB CGC HEXO CRON APHA WEEDCA TLRY What are your favorite indicators Noob here
WarmingTrend,,2019-02-15 13:37:00,77.335,PYX Great post Hey TLRY CRON ACB CGC NBEV CRBP Think of it this way PYX runs from 20s to 200 and thenPrice to Sales Ratio 1
WorldDom,,2019-02-15 13:36:00,77.19,TLRY interestingtheflycomlandingPageNews
Trader_Rick_999,,2019-02-15 13:31:00,77.114,TLRY TLRY hiring goldman for ma how do they want to buy NBEV
ShortyMcFly,,2019-02-15 13:30:00,77.056,CGC Asset was clearly worth the SHORT SELL up above 49 handle will hold anything from 4850 I think we get a Retest of low 47 ACB TLRY
InfiniteAMG,,2019-02-15 13:22:00,77.357,ACB amzing the Diff between TLRY and CGC and ACB in pricing yet the latter is expected to generate more MJ but no consortium
jlfromli,,2019-02-15 13:19:00,77.525,PYX when this starts trading at TLRY valuation The sp will be north of 825 per share
InvestorsUnderground,,2019-02-15 13:16:00,77.64,TLRY popped on hiring Goldman Sachs for possible MA if they take 78 into close could get fun its been so stuck in range thats th
RosemaryThyme,,2019-02-15 13:09:00,77.58,CRON CGC APHA TLRY I havent seen any ACB peers project EBITDApositive or cashflowpositive dates Pls let me know if you have
coolcats1001,,2019-02-15 13:08:00,77.64,CRON CGC TLRY I am long this under radar play OTCPK PLPL
flytrader1,True,2019-02-15 13:06:00,77.314,TLRY chatter
WorldDom,,2019-02-15 13:03:00,77.5,TLRY see if it can get over 80
gerr102,,2019-02-15 13:03:00,77.5,TLRYTilray Shares Spike 12 As Traders Circulate Dealreporter Speculation Co Has Hired Goldman Sachs To Advise For MA
WorldDom,,2019-02-15 13:02:00,77.669,TLRY what a strong move to close out 1hr
Bill29485,,2019-02-15 12:58:00,77.7,CRON CGC TLRY starting to move to the upside can it last
js26,,2019-02-15 12:54:00,77.052,TLRY Do we know when earnings will be yet
PerfectHindsight,True,2019-02-15 12:52:00,77.109,CGC TLRY CRON TPB adding APDN REED to my list lets do this
mindphasr,True,2019-02-15 12:48:00,77.067,I bet you didnt know by the end of next year CGC and LZAGY partner NEPT will have 6000000 kg of extraction capacity CGC TLRY CRON
Jumpy,,2019-02-15 12:48:00,77.067,TLRY This stock is not following the Cannabis sector Here is why
Robin777,,2019-02-15 12:39:00,76.992,TLRY Uxin
jmjhold,True,2019-02-15 12:35:00,76.95,CGC ACB CRON TLRY DCAR
lucasbarnes,False,2019-02-15 12:33:00,77.18,APHA APHCA ACB ACBCA TLRY CRON
beemdouble,False,2019-02-15 12:28:00,77.134,ACB needs to learn ABC of business from CRON APHA PYX TLRY or change its ticker to ABC so kids can buy and play and make fun of lol
coolcats1001,,2019-02-15 12:20:00,77.322,CRON TLRY CGC OTCPK PLPL plandaibiotechcomcannabis
coolcats1001,,2019-02-15 12:15:00,77.3,CRON TLRY CGC OTCPK PLPL who is shorting this stock
AUTigersGrad,,2019-02-15 12:15:00,77.3,PYX TLRY Potential Such low float This thing has a long way to run to 50 then 65 At this rate well be there in a month
VFF_MAN,True,2019-02-15 12:14:00,77.305,VFFCA ACCA ACB APH BBD TLRY TGOD CGC CANADA UNITE
Wood87,True,2019-02-15 12:13:00,77.419,PYX PYX AVAILABLE SHARES FOR RETAIL 2578942 Short Interest as of 131 2634286 Youwant a TLRY type of move PYX is it CRON CGC
coolcats1001,,2019-02-15 12:12:00,77.46,CRON TLRY CGC OTCPK PLPL have patience folks This is not overnight 10 stock
trader365,True,2019-02-15 12:11:00,77.356,PYX The more shorts pile on the more it goes upTLRY moves
WorldDom,,2019-02-15 12:11:00,77.356,TLRY lets see if break of 7767 can push it to 80
Zen67,,2019-02-15 12:07:00,77.359,TLRY when is the next earnings report
WorldDom,,2019-02-15 12:05:00,77.195,TLRY nice bounce but still needs to break 80 before anything gets serious
WarmingTrend,,2019-02-15 12:05:00,77.195,PYX Perhaps CGC TLRY ACB CRON folks missed this from PYX CC this week 100000kg 100000000 grams 450 mil net sales 20 EPS
lexingtonh,,2019-02-15 12:03:00,77.242,CGC trust me CGC will lead us into the 2020 future of Cannabis it want be TLRY nor ACB nor CRON
exHawaiian,True,2019-02-15 12:03:00,77.242,VFFCA lets tell the others CGC CRON APHA TLRY PYX TGOD we will be bigger than ACB
lexingtonh,,2019-02-15 12:02:00,77.15,CGC this will go to 52 once TLRY wr report and its revealed that they suck and shares will fall and people will run to CGC
mindphasr,True,2019-02-15 11:59:00,77.168,CGC LZAGY partner NEPT raised guidance200kg extraction capacity next month expanding to 6000 MT PYX HEXO CRON ACB APHA TLRY
Wood87,True,2019-02-15 11:59:00,77.168,PYX AVAILABLE SHARES FOR RETAIL 2578942 Short Interest as of 131 2634286 You want a TLRY type of move PYX is it CRON CGC
CalculatedRisks,True,2019-02-15 11:57:00,76.925,PYX Literally only at 130th the Market Cap of TLRY or ACB
Camelopardalis,True,2019-02-15 11:52:00,76.795,CRON TLRY CGC APHA PYX NBEV join your brothers at VFFCA for the party tonight
brandon337,True,2019-02-15 11:36:00,76.613,TLRY CGC ER shows the size of Canadian market with a 300 cannabis sales growth YOY This alleviates many concerns for TLRYs ER IMO
Wood87,True,2019-02-15 11:35:00,76.683,PYX AVAILABLE SHARES FOR RETAIL 2578942 Short Interest as of 131 2634286 You want a TLRY type of move PYX is it CRON CGC
coolcats1001,,2019-02-15 11:32:00,76.673,CRON TLRY CGC otcpk PLPL could easily run to 10 ultra small cap Cannabis play hard to find these days I am long
tradebeast22,,2019-02-15 11:23:00,76.592,PYX Nice move where is this headed today CGC ACB TLRY the squeeze is on Any technical chartist out there have a good read on it
Eric1986,True,2019-02-15 11:18:00,76.632,TLRY In the fourth quarter Calpers more than tripled its holdings of Tilraybarronscomarticlesretire
TheBrain,True,2019-02-15 11:15:00,76.506,Pinky and I just added our last batch of VFFCA all rocket and bottles popping emojis are appropriate at this time CGC CRON TLRY
PerfectHindsight,True,2019-02-15 11:06:00,76.517,TLRY CRON CGC TPB looking up low float pot stocks heard of the rest but never saw anyone promote REED Im gonna try this one
SaiyanWarrior,,2019-02-15 10:57:00,76.805,TLRY options premium on this stock is crazy Who tf keeps buying calls
Live2Trd,,2019-02-15 10:48:00,76.812,TLRY when is ER for TLRY
Wood87,True,2019-02-15 10:46:00,76.906,PYX AVAILABLE SHARES FOR RETAIL 2578942 Short Interest as of 131 2634286 You want a TLRY type of move This is it CGC CRON
ShortyMcFly,False,2019-02-15 10:38:00,76.865,CGC and we have Liftoff OR NOT Bagholders holding Massive Ls above 4850 49 Yall gon Learn TaDay CRON TLRY ACB MJ
CalculatedRisks,True,2019-02-15 10:35:00,76.758,PYX We might reach 8000 watchers today ACB CRON NBEV CGC TLRY 25 increase in watchers in a little over a week think about that
coolcats1001,,2019-02-15 10:34:00,76.887,CRON CGC TLRY OTCPK PLPL I am a beleiver in this company I am long
TraderJoe03,,2019-02-15 10:34:00,76.887,ACB APHA APHCA TLRY CGC CRON IIPR MJ Low floater with lots of shorts that still need to cover here PYX
rlatona,False,2019-02-15 10:27:00,76.542,TLRY Damn this flag is getting tight Where we going next
BullionNation,True,2019-02-15 10:19:00,77.063,VFFCA Officially joins TLRY CRON has the ONLY Cannabis LPs on NASDAQ Entering with a Market Cap of 340M US vs 18B
WarmingTrend,,2019-02-15 10:19:00,77.063,PYX TLRY CRON CGC ACB Should take note of what made PYX fly AQR Blackrock David Smith and Dimension just grabbed 31 of the shares
SaltydogTrader,True,2019-02-15 10:17:00,76.948,CGC remember when TLRY popped to 300 something to think about 100
mindphasr,True,2019-02-15 10:16:00,76.638,CGC LZAGY partner NEPT raised guidance200kg extraction capacity next month expanding to 6000 MT PYX HEXO CRON ACB APHA TLRY
ShortyMcFly,False,2019-02-15 10:12:00,76.398,CGC see you around 44 today poss lower Bulls cant be serious even w CEO delaying ER to soften the AH SELLOFF blow ACB TLRY CRON MJ
Wood87,True,2019-02-15 10:12:00,76.398,PYX SSHARES FOR RETAIL 2578942 Short Interest as of 131 2634286 You want a TLRY type of move This is it CGC CRON
chrispycrunch,True,2019-02-15 10:10:00,76.456,APHA will burst through 10 again today CRON CGC TLRY
pram1,,2019-02-15 10:10:00,76.456,TLRY Can this scam stay green with others for a change
AUTigersGrad,,2019-02-15 10:07:00,76.347,PYX EPIC SQUEEZE IS HAPPENING NOW ACB TLRY
Wood87,,2019-02-15 10:05:00,76.568,PYX SHARES FOR RETAIL 2578942 Short Interest as of 131 2634286 You want a TLRY type of move This is it CGC CRON
TrollingBaggies,False,2019-02-15 10:05:00,76.568,TLRY the other cannabis ERs were weak This one will be weaker IMO
WarmingTrend,,2019-02-15 10:03:00,76.38,PYX Pay attention TLRY CGC CRON ACB PYX might just go parabolic here
Wood87,True,2019-02-15 10:02:00,76.231,PYX AVAILABLE SHARES FOR RETAIL 2578942 Short Interest as of 131 2634286 You want a TLRY type of move This is it CGC CRON
coolcats1001,,2019-02-15 09:59:00,76.37,CRON CGC TLRY if people start realizing the true potential here for otcpkplpl you would not be selling for pennies on the dollar
coolcats1001,,2019-02-15 09:58:00,76.013,CRON CGC TLRY otcpk plpl under radar under valued Cannabis play
coolcats1001,,2019-02-15 09:54:00,76.348,CRON CGC TLRY OTCPK PLPL huge volume lately about to explode
creativeflood,,2019-02-15 09:54:00,76.348,TLRY shook me out Glta
coolcats1001,,2019-02-15 09:52:00,76.01,CRON CGC TLRY OTCPK PLPL hiding in pink sheets and I am sure 99 will not buy it until its listed on NYSE
Divine4,False,2019-02-15 09:48:00,76.632,CRON ACB TLRY NBEV weed is down today Im out See you next week
coolcats1001,,2019-02-15 09:47:00,76.48,CRON TLRY CGC otcpk plpl let me know if anyone wants to join for South Africa expedition
mindphasr,True,2019-02-15 09:46:00,76.888,CGC LZAGY partner NEPT raised guidance200kg extraction capacity next month expanding to 6000 MT PYX HEXO CRON ACB APHA TLRY
wasserjunge,,2019-02-15 09:45:00,77.154,TLRY The 20d EMA is having none of it
RosemaryThyme,,2019-02-15 09:45:00,77.154,Gross Profit Margin CRON 56 prior qtr ACB 54 TLRY 31 CGC 13 lowest I recall seeing to date in the cannabis sector
coolcats1001,,2019-02-15 09:44:00,77.081,CRON CGC TLRY Going on a field trip to SouthAfrica to learn more about Plandai
coolcats1001,,2019-02-15 09:42:00,76.994,CRON CGC TLRY otcpkplpl holding this since years Patience
WarmingTrend,,2019-02-15 09:41:00,77.251,PYX It could go parabolic at any moment There just arent any shares out there Like TLRY In fact many articles written it will
Divine4,False,2019-02-15 09:41:00,77.251,TLRY I bailed
coolcats1001,,2019-02-15 09:40:00,77.103,CRON CGC TLRY Plandai Biotechnology Discusses Cannabis Extract Opportunities and Research Potential read about bioavailability
Timoto,True,2019-02-15 09:37:00,77.416,TLRY 100 into TLRY this month Back to 80 means I got a free 2week paycheck through savvy investing
coolcats1001,,2019-02-15 09:36:00,77.505,CRON CGC TLRY easy runner to 5 to 10 under radar play OTCPK PLPL
ChartMill,,2019-02-15 09:33:00,78.2,TLRY has a bad technical rating but it does show a decent setup pattern chartmillcomanalyzephpu
AJLee,True,2019-02-15 09:33:00,78.2,Great open Happy Friday TLRY NBEV
fortunebuilder1969,True,2019-02-15 09:32:00,77.968,PYX when this pops past 24 shorties will lose hope Hold tight CGC and TLRY a CRON all near days high
JorelLaraKalel,,2019-02-15 09:32:00,77.968,12 Things You Must Know About Canopy Growths ThirdQuarter Report CGC STZ TLRY CRON ACB APHA MJ foolcominvesting201902
ChrisVermeulen,True,2019-02-15 09:31:00,78.073,Marijuana stocksPost Stocks primed for final push thetechnicaltraderscomare MJ ACT ARNA AAPC CRON TRPX ZYNE TLRY PMD CRBP GWPH
