NVCN,2019-02-06 12:28:00,0.7052,0.7178,,-1,0.0126,1.78673,6,0,0.7063,0.712,0.7087,NVCN
NVCN,2019-02-06 12:27:00,0.7052,0.7178,True,1,0.0126,1.78673,9,0,0.7093,0.712,0.7087,NVCN super tight Needs to hold 70
NVCN,2019-01-25 09:52:00,0.7052,0.7178,True,1,0.0126,1.78673,1,0,0.7094,0.712,0.7087,NVCN will bounce off 65 Entry alert 65 with stop loss at 62
BPMX,2019-01-10 12:23:00,0.1244,0.132,True,1,0.0076,6.10932,3,0,0.1229,0.127,0.1241,BPMX 11 is yearly support Needs to hold News by next Friday in my opinion
BPMX,2019-01-09 12:18:00,0.1244,0.132,,-1,0.0076,6.10932,0,0,0.1237,0.127,0.1241,BPMX played off the yearly
BPMX,2019-01-08 12:50:00,0.1244,0.132,True,1,0.0076,6.10932,6,1,0.1243,0.127,0.1241,BPMX we might be seeing a push end of day
BPMX,2019-01-07 13:05:00,0.1244,0.132,True,1,0.0076,6.10932,2,0,0.1245,0.127,0.1241,BPMX here we go
NVCN,2018-11-28 12:20:00,0.8242,0.9668,,-1,0.1426,17.30163,0,0,0.8373,0.8564,0.8041,NVCN holy
BPMX,2018-11-02 12:53:00,0.1685,0.169,True,1,0.0005,0.29674,5,0,0.1701,0.1688,0.1681,BPMX expecting news by next week Reversal in play based off 36 month charts
