FEYE,2019-03-25 13:58:00,16.645,16.535,False,1,-0.11,-0.66086,2,2,16.532,16.54,16.483,What no bulls like to read bearish arguments about FEYE seekingalphacomarticle42
XLNX,2019-02-05 14:22:00,110.909,109.95,True,0,-0.959,-0.86467,0,0,110.4,110.365,110.5,XLNX This company continues to surprise analysts and investors Discover why httpsseekingalphacomarticle4236756xilinxbestpositionedindustry
WDAY,2019-02-05 14:20:00,189.137,188.044,,-1,-1.093,-0.57789,0,0,189.601,189.218,190.147,The history of growth VS profitability aparently there is no problem while WDAY continues to grow seekingalphacomarticle42
NOW,2019-02-05 14:17:00,228.305,225.656,True,0,-2.649,-1.16029,0,0,229.21,226.768,229.042,NOW Earnings review The high premium really worth the risk httpsseekingalphacomarticle4238245servicenowprofitabilityaddedgrowthstory
ARW,2019-03-19 13:31:00,78.266,78.665,,-1,0.399,0.5098,0,0,78.54,78.392,78.275,A value investing option or a value trap Read moreARW seekingalphacomarticle41
ARW,2019-03-08 14:33:00,78.266,78.665,True,1,0.399,0.5098,0,0,78.62,78.392,78.275,ARW Strong 2017 results with record growth in sales so Why the price has not picked up
VUZI,2019-02-07 11:58:00,4.025,4.14,,-1,0.115,2.85714,4,0,4.05,4.15,4.13,VUZI Technology on ARVR
