CGC,2019-01-24 12:29:00,44.185,43.145,,-1,-1.04,-2.35374,1,0,43.762,43.61,44,Bot CGC
GRUB,2019-01-24 12:28:00,77.301,74.601,,-1,-2.7,-3.49284,1,0,76.25,74.247,75.221,Long GRUB
ETSY,2019-01-10 11:45:00,51.365,51.656,False,0,0.291,0.56653,2,1,51.035,50.58,51.15,ETSY looks like hell
AAPL,2019-01-09 12:09:00,153.359,150.79,,-1,-2.569,-1.67515,0,1,153.893,151.921,152.435,AAPL gap filled trade likely to the downside from here
AAPL,2019-01-08 13:42:00,153.359,150.79,,-1,-2.569,-1.67515,0,0,154.132,151.921,152.435,AAPL expect gap at 154 to fill before more headline risk sends it lower Target remains 130
HYG,2019-01-07 14:51:00,83.163,82.594,,-1,-0.569,-0.6842,0,1,83.042,82.785,83.03,I meant Short HYG via puts
SGMO,2019-01-07 14:27:00,12.752,12.271,,-1,-0.481,-3.77196,2,24,12.637,12.249,12.471,howardlindzon SGMO is the XRP of the gene therapy space Bulls will never learn their lesson unfortunately
AMD,2019-01-07 13:57:00,20.573,19.318,False,1,-1.255,-6.10023,2,0,20.41,19.621,19.772,AMD fade it
AAPL,2018-12-14 10:44:00,165.484,168.609,,-1,3.125,1.8884,2,0,166.907,167.301,166.224,AAPL 150 seems reasonable
