SENS,2019-02-08 11:26:00,2.304,2.318,,-1,0.014,0.60764,4,9,2.24,2.3,2.25,SENS Never hated a stock more than this one Cant wait to gtfoh
SENS,2019-01-31 13:25:00,2.304,2.318,,-1,0.014,0.60764,5,0,2.25,2.3,2.25,SENS Bring me 3 so I can get rid of you forever
SENS,2018-11-27 10:45:00,2.304,2.318,,-1,0.014,0.60764,0,3,2.25,2.3,2.25,SENS Can I get back in at 330
SENS,2018-11-26 14:55:00,2.304,2.318,,-1,0.014,0.60764,2,8,2.301,2.3,2.25,SENS If she hits 340 exiting and buying back in later this week
SENS,2018-11-16 15:19:00,2.304,2.318,,-1,0.014,0.60764,2,0,2.283,2.3,2.25,SENS Bring me that close I asked for
SENS,2018-11-16 10:30:00,2.304,2.318,,-1,0.014,0.60764,3,0,2.25,2.3,2.25,SENS Good morning my friends GREEN close today lets get it Happy friday
VKTX,2018-11-16 09:55:00,11.645,11.299,,-1,-0.346,-2.97123,1,0,11.672,11.877,11.766,VKTX 1122 for the ride
