AKAO,2019-02-13 14:19:00,1.591,1.41,True,0,-0.181,-11.37649,1,0,1.54,1.42,1.44,AKAO
AKAO,2019-02-08 13:14:00,1.591,1.41,,-1,-0.181,-11.37649,1,0,1.45,1.42,1.44,AKAO wtf
AUPH,2019-01-10 14:08:00,7.117,7.091,True,0,-0.026,-0.36532,1,2,7.08,7.14,7.19,AUPH Buffet is coming
AUPH,2019-01-10 13:46:00,7.117,7.091,True,0,-0.026,-0.36532,0,0,7.04,7.14,7.19,AUPH Government shut down to try and slow Glick down
AUPH,2019-01-10 13:27:00,7.117,7.091,True,0,-0.026,-0.36532,2,0,7.05,7.14,7.19,AUPH whose more hung Tiger or Glick
AKAO,2019-01-04 14:12:00,1.68,1.23,True,0,-0.45,-26.78571,3,1,1.88,1.213,1.308,AKAO really want to give my boss the middle finger next week and that I quit Lets gooooo
TXMD,2018-12-28 15:14:00,3.926,3.939,True,1,0.013,0.33113,1,1,3.965,3.97,3.9,usctrojan TXMD the fear is real so
DERM,2018-11-07 14:55:00,12.527,12.359,True,0,-0.168,-1.3411,2,0,12.42,12.09,12.49,DERM anyone watching reruns of South Park today and happen to catch the Dermira commercials for excessive sweating So fuggin
