NAK,2019-02-18 12:01:00,0.887,0.9547,True,1,0.0677,7.63247,2,8,0.9056,0.9041,0.9006,NAK List of Activist Short Sellers winfo on eachshortselleriolistofactiCan get notified of new short seller attacks
NAK,2019-02-15 11:48:00,0.887,0.9547,True,1,0.0677,7.63247,3,0,0.897,0.9041,0.9006,NAK like a wall
NAK,2019-02-14 14:53:00,0.887,0.9547,True,1,0.0677,7.63247,5,2,0.8871,0.9041,0.9006,NAK Yes its VDay so I went to JaredActually she sent me this pic
NAK,2019-02-14 10:53:00,0.887,0.9547,True,1,0.0677,7.63247,3,0,0.8956,0.9041,0.9006,NAK showing some love or is it revenge
NAK,2019-02-13 12:26:00,0.887,0.9547,True,1,0.0677,7.63247,0,0,0.9075,0.9041,0.9006,NAK br br br BR BR BR BEAR
NAK,2019-02-11 10:42:00,0.887,0.9547,True,1,0.0677,7.63247,14,0,0.8999,0.9041,0.9006,NAK Running at full speed it cranks out 100 shitting bears per minute
NAK,2019-02-08 15:51:00,0.887,0.9547,True,1,0.0677,7.63247,3,1,0.8901,0.9041,0.9006,NAK Shoot Im dying to buy some right now
NAK,2019-02-07 10:01:00,0.887,0.9547,True,1,0.0677,7.63247,9,0,0.9052,0.9041,0.9006,NAK My sell order is 1850 just for old times sake Kind of feel sorry for shorty not sharing my shares
NAK,2019-02-07 09:30:00,0.887,0.9547,True,1,0.0677,7.63247,5,0,0.9547,0.9041,0.9006,NAK
NAK,2019-02-06 15:59:00,0.887,0.9547,True,1,0.0677,7.63247,7,0,0.887,0.9041,0.9006,NAK 5M day
NAK,2019-02-06 12:44:00,0.887,0.9547,True,1,0.0677,7.63247,1,0,0.8908,0.9041,0.9006,NAK RSI recalculating recalculating recalculating
NAK,2019-02-06 12:35:00,0.887,0.9547,True,1,0.0677,7.63247,3,0,0.9066,0.9041,0.9006,NAK If I remember right rockets go straight up
NAK,2019-02-06 11:03:00,0.887,0.9547,True,1,0.0677,7.63247,17,0,0.9009,0.9041,0.9006,NAK Think Ill sell for a profitAFTER BUY OUT
NAK,2019-02-04 11:24:00,0.887,0.9547,True,1,0.0677,7.63247,1,0,0.8872,0.9041,0.9006,NAK nice surprise WTF
NAK,2019-02-03 12:28:00,0.887,0.9547,True,1,0.0677,7.63247,12,1,0.9047,0.9041,0.9006,NAK Ive lost my hat if you see one or know where I can buy another please let me know Mine Pebble
NAK,2019-02-01 15:58:00,0.887,0.9547,True,1,0.0677,7.63247,4,0,0.894,0.9041,0.9006,NAK that 80 wall Dang it
NAK,2019-02-01 13:42:00,0.887,0.9547,True,1,0.0677,7.63247,3,3,0.8904,0.9041,0.9006,NAK interesting kind of
NAK,2019-02-01 11:48:00,0.887,0.9547,True,1,0.0677,7.63247,6,0,0.897,0.9041,0.9006,NAK grab that green candle throw it up on the 80 shelf
NAK,2019-01-28 15:13:00,0.887,0.9547,True,1,0.0677,7.63247,5,0,0.8847,0.9041,0.9006,NAK shorty has been so smugly well not so much todayNice steady today
NAK,2019-01-28 10:57:00,0.887,0.9547,True,1,0.0677,7.63247,7,1,0.8904,0.9041,0.9006,NAK like a dam bursting flooding the shorts
NAK,2019-01-27 14:16:00,0.887,0.9547,,-1,0.0677,7.63247,6,2,0.8872,0.9041,0.9006,NAK Incredibly humbling when you realize that one great investment can make your year decade and even careermicrocapclubcom201811al
NAK,2019-01-24 12:58:00,0.887,0.9547,,-1,0.0677,7.63247,3,2,0.891,0.9041,0.9006,NAK A new Dr Ned Mamula book is a good find tasermac
NAK,2019-01-17 15:14:00,0.887,0.9547,True,1,0.0677,7.63247,1,3,0.8899,0.9041,0.9006,NAK This is a Year of Earth Pig starting from Feb 5 2019 Chinese New Year and lasting to Jan 24 2020KWYO
NAK,2019-01-16 14:22:00,0.887,0.9547,True,1,0.0677,7.63247,0,1,0.8918,0.9041,0.9006,NAK you are cleared for taxiway N75 copy
NAK,2019-01-16 13:22:00,0.887,0.9547,True,1,0.0677,7.63247,8,0,0.8935,0.9041,0.9006,NAK Could be a very bad day for Jeeves wait sorry with only 200 shares not the end of the world
NAK,2019-01-08 14:03:00,0.887,0.9547,True,1,0.0677,7.63247,1,9,0.89,0.9041,0.9006,NAK hkf looking at 6 month chart we real close to a Golden Cross
NAK,2019-01-08 12:13:00,0.887,0.9547,True,1,0.0677,7.63247,2,2,0.9084,0.9041,0.9006,NAK 6699
NAK,2019-01-07 14:44:00,0.887,0.9547,True,1,0.0677,7.63247,4,0,0.8899,0.9041,0.9006,NAK To 70 and beyond
NAK,2019-01-07 14:43:00,0.887,0.9547,,-1,0.0677,7.63247,1,0,0.888,0.9041,0.9006,NAK Gotta run that was fun That 70 wall aint sheet
NAK,2019-01-07 14:36:00,0.887,0.9547,False,0,0.0677,7.63247,6,0,0.896,0.9041,0.9006,NAK Oh well so much for going to the moon
NAK,2019-01-07 14:22:00,0.887,0.9547,False,0,0.0677,7.63247,2,0,0.8918,0.9041,0.9006,NAK Whats the number to call 911 Oh what Im I thinking I need to call the FBI NAK is a MEGA SCAM
NAK,2019-01-07 14:10:00,0.887,0.9547,,-1,0.0677,7.63247,2,0,0.8868,0.9041,0.9006,NAK some teddy bear blocked me
NAK,2019-01-07 14:05:00,0.887,0.9547,False,0,0.0677,7.63247,4,6,0.8899,0.9041,0.9006,NAK Heard some insider bought 25 million shares so I went all in doing zero DD Im so gawddam dumb should have bought HMNY
NAK,2019-01-07 13:59:00,0.887,0.9547,False,0,0.0677,7.63247,3,1,0.8945,0.9041,0.9006,NAK I really thought this would hold at 50 Gawddamit Im a dumbass NAK going to 10
NAK,2019-01-07 13:57:00,0.887,0.9547,False,0,0.0677,7.63247,3,0,0.8971,0.9041,0.9006,NAK I flushed PLM to buy this crap Yes biggest MO FO mistake in my entire life Bearish
NAK,2019-01-07 13:53:00,0.887,0.9547,False,0,0.0677,7.63247,3,0,0.8908,0.9041,0.9006,NAK Buying real human shit is worth more than NAK
NAK,2019-01-07 13:50:00,0.887,0.9547,True,1,0.0677,7.63247,3,0,0.8913,0.9041,0.9006,NAK Last call Im personally holding this at below 70 so the rest can get on board
NAK,2019-01-07 10:21:00,0.887,0.9547,True,1,0.0677,7.63247,3,0,0.9071,0.9041,0.9006,NAK
NAK,2019-01-04 12:29:00,0.887,0.9547,True,1,0.0677,7.63247,4,0,0.9047,0.9041,0.9006,NAK Short all you want shorty This party is for everyone
NAK,2019-01-04 11:46:00,0.887,0.9547,True,1,0.0677,7.63247,3,2,0.8979,0.9041,0.9006,NAK Im up 15 should I sell shorty Shirley
NAK,2018-12-31 14:00:00,0.887,0.9547,True,1,0.0677,7.63247,4,0,0.89,0.9041,0.9006,NAK Gold is the icing on the cake for NAK Looking promising
NAK,2018-12-31 13:44:00,0.887,0.9547,True,1,0.0677,7.63247,1,1,0.89,0.9041,0.9006,NAK At these prices almost like free shares added another 25k
NAK,2018-12-31 12:09:00,0.887,0.9547,True,1,0.0677,7.63247,5,0,0.907,0.9041,0.9006,NAK added 29k more Time is fast running out
NAK,2018-12-29 14:04:00,0.887,0.9547,True,1,0.0677,7.63247,8,4,0.89,0.9041,0.9006,NAK year in review day by day condensedstupefied
NAK,2018-12-29 12:08:00,0.887,0.9547,True,1,0.0677,7.63247,11,1,0.902,0.9041,0.9006,NAK Good news if CHINAUS deal works out All that cash on the sidelines must be burning holes in pocketsexcluding myself Mine Pebble
NAK,2018-12-26 15:57:00,0.887,0.9547,True,1,0.0677,7.63247,2,0,0.8949,0.9041,0.9006,NAK 1000 up DOW
NAK,2018-12-21 15:31:00,0.887,0.9547,True,1,0.0677,7.63247,2,0,0.8848,0.9041,0.9006,NAK get the wall then lets go mining
NAK,2018-12-21 14:43:00,0.887,0.9547,True,1,0.0677,7.63247,4,2,0.888,0.9041,0.9006,NAK Dunleavy Shively Brune are exploding heads of Never Pebble environmentalistsHard uphill work about donektooorg20181220whatdo
NAK,2018-12-19 14:26:00,0.887,0.9547,True,1,0.0677,7.63247,3,0,0.8919,0.9041,0.9006,NAK maybe B00B5 is Phil The real sick ones come back to the scene of the crimelol
NAK,2018-12-19 12:47:00,0.887,0.9547,True,1,0.0677,7.63247,7,0,0.8931,0.9041,0.9006,NAK Hit the road B00B5 Your useless posts mostly trying to piss people off is pathetic just plain a waste of my time Blocked
NAK,2018-12-11 11:29:00,0.887,0.9547,True,1,0.0677,7.63247,1,0,0.8919,0.9041,0.9006,NAK Live news8000comnewsnational
NAK,2018-12-11 10:54:00,0.887,0.9547,True,1,0.0677,7.63247,3,0,0.8902,0.9041,0.9006,NAK Obama smack down party
NAK,2018-12-10 12:27:00,0.887,0.9547,True,1,0.0677,7.63247,4,0,0.9075,0.9041,0.9006,NAK Motley Fool advisors always has 10 stocks they like better after you pay them What a fool believesPeople in here know better
NAK,2018-11-13 15:47:00,0.887,0.9547,True,1,0.0677,7.63247,4,3,0.8918,0.9041,0.9006,NAK Back in after almost a month going long again Oversold
