NBEV,2019-01-30 10:50:00,6.995,6.899,,-1,-0.096,-1.37241,2,3,7.298,6.834,7.155,NBEV should I buy a put just in case this goes down to 6 again
CGC,2019-01-30 10:33:00,47.991,47.447,,-1,-0.544,-1.13355,0,6,48.64,47.936,48.746,CGC I dont get it why does it keep going up Whens the dip
CGC,2019-01-29 11:04:00,47.991,47.447,,-1,-0.544,-1.13355,0,1,49.217,47.936,48.746,CGC how low is it gonna go
CGC,2019-01-29 10:43:00,47.991,47.447,False,1,-0.544,-1.13355,0,0,48.849,47.936,48.746,CGC just sell everybody sell
AAPL,2019-01-08 11:37:00,150.659,149.366,False,1,-1.293,-0.85823,1,0,149.564,149.12,149.024,AAPL apples time is up
AAPL,2019-01-08 11:20:00,150.659,149.366,,-1,-1.293,-0.85823,1,1,150.162,149.12,149.024,AAPL there goes my put
AAPL,2019-01-08 09:31:00,150.659,149.366,,-1,-1.293,-0.85823,1,0,149.409,149.12,149.024,AAPL PLEASE TELL ME THIS IS GONNA DIP TODAY
NBEV,2019-01-03 13:16:00,5.395,5.226,False,1,-0.169,-3.13253,2,3,5.535,5.17,5.41,NBEV well that was fun
NBEV,2018-12-14 09:43:00,5.395,5.226,False,1,-0.169,-3.13253,0,0,5.196,5.17,5.41,NBEV can somebody please tell me what is going on Is this the end of road for this stock
