TPNL,2019-02-12 12:19:00,7.232,7.828,,-1,0.596,8.24115,1,0,7.023,7.19,7.298,bearcharts TPNL shorted some token shares In the money Huge gap to be filled
SNAP,2019-02-06 11:47:00,8.586,8.583,,-1,-0.003,-0.03494,1,0,8.868,8.689,8.751,bearcharts SNAP shorted token shares at 895
ICAD,2019-02-04 13:39:00,5.179,5.34,,-1,0.161,3.10871,0,1,5.2,5.31,5.32,bearcharts ICAD You think it will hit 500 In the money now Is greed good
ICAD,2019-01-30 09:51:00,5.179,5.34,,-1,0.161,3.10871,0,3,5.311,5.31,5.32,bearcharts ICAD so far so good I guess it stopped going up Think it will hit 500
ICAD,2019-01-24 13:25:00,5.179,5.34,,-1,0.161,3.10871,0,3,5.181,5.31,5.32,bearcharts ICAD shorted some token shares Good or bad
ICAD,2019-01-24 11:50:00,5.179,5.34,,-1,0.161,3.10871,0,0,5.2,5.31,5.32,ICAD it will fall soon Short it into the abyss below while shares are still available
ICAD,2019-01-23 12:27:00,5.179,5.34,,-1,0.161,3.10871,1,0,5.189,5.31,5.32,ICAD LOOKS PRIMED FOR A SHORT
DB,2018-12-10 11:33:00,8.375,8.681,,-1,0.306,3.65373,0,1,8.271,8.623,8.513,bearcharts DB how low do you think this will go Will it recover
