CZR,2019-02-08 15:49:00,9.317,9.2,,-1,-0.117,-1.25577,1,0,9.34,9.274,9.23,CZR that was cool I might buy more next dip
EA,2019-02-05 10:27:00,92.465,89.135,,-1,-3.33,-3.60136,0,0,90.457,90.94,90.605,EA a new Jade Empires game in the works
LODE,2019-01-22 13:13:00,0.1326,0.1399,,-1,0.0073,5.50528,2,0,0.1324,0.1334,0.1362,LODE T Minus negative 2 weeks hahahaha
LODE,2019-01-14 13:07:00,0.1326,0.1399,,-1,0.0073,5.50528,1,0,0.132,0.1334,0.1362,LODE next up day Im getting out I dont even care any more
LODE,2019-01-04 13:06:00,0.1326,0.1399,,-1,0.0073,5.50528,3,2,0.1324,0.1334,0.1362,LODE really hope this hits a good price eventually so I can get out
MNGA,2018-11-15 10:06:00,0.2859,0.3145,,-1,0.0286,10.0035,1,0,0.2899,0.293,0.2905,Im in with MNGA
HPJ,2018-11-13 09:53:00,2.463,2.59,,-1,0.127,5.15631,2,0,2.6,2.6,2.52,HPJ smash and grab here
OHGI,2018-11-07 15:17:00,0.23,0.22,,-1,-0.01,-4.34783,1,0,0.2321,0.2268,0.22,OHGI woo it hit 25 Peace out
