CHK,2019-02-15 14:04:00,2.605,2.555,,-1,-0.05,-1.91939,0,2,2.605,2.594,2.574,CHK sold a lot of call credit spreads at 125 strike for easy 175 premium per contract and 99 chance out of the money
SPY,2019-02-14 09:42:00,274.399,273.745,,-1,-0.654,-0.23834,0,1,273.472,273.585,274.261,SPY i Have a feeling a lot of people buy and sell news without ever reading charts
NFLX,2019-02-08 14:46:00,347.568,339.861,True,0,-7.707,-2.21741,0,0,347.48,340.199,342.65,NFLX strong support 200 SMA near 336 which held as the market sold off today Look for good entry to go long for a scalp
NVAX,2019-02-08 14:43:00,2.275,2.239,,-1,-0.036,-1.58242,1,7,2.263,2.224,2.215,NVAX my trade March 15 Iron Condor with very far away strikes Profit from these days of waiting for clinical results
IMGN,2019-02-08 14:41:00,5.668,5.549,,-1,-0.119,-2.09951,0,0,5.61,5.68,5.472,IMGN trade idea 18 April Iron Condor Implied Volatility will pay you well
NVAX,2019-02-08 11:05:00,2.275,2.239,,-1,-0.036,-1.58242,1,0,2.215,2.224,2.215,NVAX recommendation if youre speculating this trial news with options you need at least 3 month out expiry Time decayIV is working
SPY,2019-02-07 11:36:00,270.109,270.973,False,0,0.864,0.31987,3,0,268.569,270.653,271.425,SPY bulls all month who cares whats happening the markets going up bulls today omg theres no reason for the market to go down
SPY,2019-02-07 11:01:00,270.109,270.973,,-1,0.864,0.31987,1,1,269.866,270.653,271.425,SPY this is why you dont ride waves
