CLVS,2019-03-21 12:14:00,26.11,25.305,True,0,-0.805,-3.08311,4,0,25.967,25.202,25.47,CLVS Love the Bounce off of the lower Trendline and above 50 DMA Would like to see more volume behind this
CLVS,2019-03-20 14:10:00,26.11,25.305,True,0,-0.805,-3.08311,1,0,25.851,25.202,25.47,CLVS Added once I saw 25 was holding Still looking to 50DMA Lower trendline to act as support here see chart below
CVS,2019-03-20 10:58:00,56.223,56.724,True,1,0.501,0.89109,2,0,56.122,56.331,55.957,CVS Added a bit under 56
CLVS,2019-03-20 10:36:00,25.294,26.128,True,1,0.834,3.29722,0,0,25.673,25.815,25.774,CLVS Looking for the 50 DMA to act as support here also happens to be lower trend line support lets see
CLVS,2019-03-13 12:14:00,25.294,26.128,,-1,0.834,3.29722,1,0,25.471,25.815,25.774,CLVS Webcast to conference irclovisoncologycominves
CLVS,2019-03-13 12:12:00,25.294,26.128,True,1,0.834,3.29722,1,0,25.472,25.815,25.774,CLVS Adding some here on this dip
NVDA,2019-03-13 09:53:00,168.631,163.956,True,0,-4.675,-2.77233,0,0,166.261,166.454,167.495,NVDA Holding long from 158 added a bit yesterday and now letting my winner ride 175 200 PT Semis seem to be back in favor
CLVS,2019-03-13 09:52:00,27.831,28.051,True,1,0.22,0.79049,3,1,28.56,28.602,28.35,CLVS Looking good If we can hold above 2850 we could see a test the 200 DMA around 3050
CLVS,2019-03-12 13:10:00,27.831,28.051,True,1,0.22,0.79049,3,0,28.04,28.602,28.35,CLVS Backtest of previous res 26xx held Looks to go higher and test 32 A break and close above 2850 would be very bullish imo
CLVS,2019-03-11 10:06:00,27.831,28.051,True,1,0.22,0.79049,3,1,28.601,28.602,28.35,CLVS Added2606
CVS,2019-03-06 11:26:00,54.018,54.503,True,1,0.485,0.89785,1,0,54.97,54.336,54.629,CVS Going Red 2 Green First time in a while
CLVS,2019-03-04 11:21:00,29.615,30.41,True,1,0.795,2.68445,2,1,29.383,30.37,30.305,CLVS My Projected Move from last week seems to be playing out Watching the 262527 area very closely to add if it does get there
CLVS,2019-02-28 13:44:00,29.615,30.41,True,1,0.795,2.68445,0,0,29.81,30.37,30.305,CLVS May very well just keep pushing and not look back But I am hoping I get to load more lower Still holding my core position of course
CLVS,2019-02-28 13:43:00,29.615,30.41,True,1,0.795,2.68445,0,0,29.748,30.37,30.305,CLVS This is my basic plan on how to play this breakout and what I am expecting 265 retest then breakout out back out of the channel
CLVS,2019-02-28 13:39:00,29.615,30.41,True,1,0.795,2.68445,2,2,29.709,30.37,30.305,CLVS Would love a pullback and retest of 2650 ish level to reload even more before resuming the breakout Very strong here though lets see
CVS,2019-02-28 13:32:00,57.865,58.491,True,1,0.626,1.08183,4,0,57.87,58.254,57.982,CVS Added 5790
CLVS,2019-02-28 11:55:00,30.291,29.369,True,0,-0.922,-3.04381,1,0,31.23,29.935,29.84,CLVS 200 DMA test 3150 and the daily
CLVS,2019-02-27 13:15:00,30.291,29.369,True,0,-0.922,-3.04381,2,3,31.949,29.935,29.84,CLVS Not sure why ppl are posting this is done it gapped up in AM and has been holding continuously making new highs
CLVS,2019-02-27 10:42:00,30.291,29.369,True,0,-0.922,-3.04381,0,0,29.75,29.935,29.84,CLVS Filling the gap
CLVS,2019-02-26 15:19:00,30.291,29.369,True,0,-0.922,-3.04381,2,0,30.811,29.935,29.84,CLVS Close above 2650 would be huge
CLVS,2019-02-26 12:19:00,30.291,29.369,True,0,-0.922,-3.04381,3,0,31.47,29.935,29.84,CLVS Key resistance for some time nowbreaking as I speak
CLVS,2019-02-26 12:16:00,30.291,29.369,True,0,-0.922,-3.04381,1,0,31.475,29.935,29.84,CLVS Looks like it may break Res here Break and close above and we should begin to fill gap to 3160 Lets see Looking good though
CLVS,2019-02-26 10:39:00,30.291,29.369,True,0,-0.922,-3.04381,4,0,29.768,29.935,29.84,CLVS Who bought the dip
CVS,2019-02-25 10:51:00,61.288,62.107,True,1,0.819,1.33631,5,1,62.094,61.939,61.784,CVS Added another lot under 62 here
CLVS,2019-02-19 11:15:00,24.372,25.51,True,1,1.138,4.66929,3,0,25.103,24.952,24.67,CLVS Added more under 25
CLVS,2019-02-15 10:21:00,24.372,25.51,True,1,1.138,4.66929,1,0,25.075,24.952,24.67,CLVS Cmonbreak that 26 and close above
TUR,2019-02-14 14:46:00,27.847,27.639,True,0,-0.208,-0.74694,2,0,27.939,27.603,27.647,TUR Long 2791
CLVS,2019-02-14 11:58:00,25.462,25.008,True,0,-0.454,-1.78305,2,0,25.319,24.988,24.966,CLVS Looking for this to finally break and close above 26 resistance
CLVS,2019-02-14 11:15:00,25.462,25.008,True,0,-0.454,-1.78305,1,0,25.191,24.988,24.966,CLVS Nice lots of big funds buying in recently
KTOV,2019-02-07 15:40:00,1.238,1.201,,-1,-0.037,-2.98869,0,0,1.24,1.192,1.204,KTOV Volume coming in looks like update news is spreading
KTOV,2019-02-07 15:32:00,1.238,1.201,True,0,-0.037,-2.98869,0,0,1.21,1.192,1.204,KTOV Kitov Pharma Reports Year End 2018 Financial Results and Provides Business Update financeyahoocomnewskito
ATVI,2019-02-07 12:22:00,43.935,43.233,True,0,-0.702,-1.59781,3,3,43.978,44.007,43.805,ATVI What u need 2 understand is when markets are down this much ppl can either buy all time hi stocks or beaten up quality cos like this
KTOV,2019-02-01 09:46:00,1.175,1.254,,-1,0.079,6.7234,0,0,1.213,1.174,1.183,KTOV 112 124 in minutes
KTOV,2019-02-01 09:46:00,1.175,1.254,,-1,0.079,6.7234,1,0,1.213,1.174,1.183,KTOV lol
KTOV,2019-01-31 11:10:00,1.175,1.254,True,1,0.079,6.7234,8,0,1.187,1.174,1.183,KTOV Added 125 Liking the new norm of vol KTOV used to trade less than my entire holding on a daily basis
CLVS,2019-01-31 10:02:00,25.441,24.26,True,0,-1.181,-4.64211,2,1,25.262,24.902,24.981,CLVS Breaking that key 25 level here lets see if it can stay and close above
CLVS,2019-01-24 12:38:00,25.441,24.26,True,0,-1.181,-4.64211,1,0,24.97,24.902,24.981,CLVS News financeyahoocomnewsclov
CLVS,2019-01-18 09:44:00,25.441,24.26,True,0,-1.181,-4.64211,0,5,24.64,24.902,24.981,CLVS Would love to load in the 1819 range
KTOV,2019-01-16 14:19:00,1.6,2.402,,-1,0.802,50.125,6,0,1.71,2.26,2.09,KTOV This is a fool me once type situation A leopard does not change its spots I just lost whatever shred of trust I had left in mgmt
KTOV,2019-01-16 14:17:00,1.6,2.402,,-1,0.802,50.125,1,0,1.699,2.26,2.09,KTOV SAME chart after every spike SMH
KTOV,2019-01-16 14:10:00,1.6,2.402,,-1,0.802,50.125,7,1,1.684,2.26,2.09,KTOV the last time this happened after FDA approval we trailed lower for 8 straight months to 59 cents Just sayin
KTOV,2019-01-16 14:00:00,1.6,2.402,,-1,0.802,50.125,0,0,1.691,2.26,2.09,KTOV of course
KTOV,2019-01-16 13:23:00,1.6,2.402,,-1,0.802,50.125,5,0,2.445,2.26,2.09,KTOV 250 critical here break above and we make new highs
KTOV,2019-01-16 13:12:00,1.6,2.402,,-1,0.802,50.125,0,2,2.423,2.26,2.09,KTOV Over 20070000 Value traded today so far
KTOV,2019-01-16 12:51:00,1.6,2.402,True,1,0.802,50.125,3,0,2.422,2.26,2.09,KTOV Snapshot of Battle zone between 50 100 DMA on the 15 Minute chart Beaks above the 50 and this looks to go higher
KTOV,2019-01-16 12:47:00,1.6,2.402,True,1,0.802,50.125,2,0,2.458,2.26,2.09,KTOV Battle zone between the 100 DMA and 50 DMA 251 on the 15 minute
KTOV,2019-01-16 12:44:00,1.6,2.402,,-1,0.802,50.125,1,0,2.483,2.26,2.09,KTOV Volume coming in
KTOV,2019-01-16 12:09:00,1.6,2.402,True,1,0.802,50.125,4,0,2.287,2.26,2.09,KTOV Shifting on multiple timeframes here Looks to go higher
KTOV,2019-01-16 11:38:00,1.6,2.402,,-1,0.802,50.125,1,0,2.223,2.26,2.09,KTOV Looks to have found a short term bottom at the 50 DMA on the 30 Min
KTOV,2019-01-15 14:50:00,1.6,2.402,,-1,0.802,50.125,0,1,1.576,2.26,2.09,KTOV How are we not trending
KTOV,2019-01-15 13:41:00,1.6,2.402,True,1,0.802,50.125,0,0,1.841,2.26,2.09,KTOV looks to grind higher into EOD
CLVS,2019-01-09 10:36:00,23.768,24.174,,-1,0.406,1.70818,0,1,23.688,24.158,23.695,CLVS may add on the daily 11 am dip here
PYPL,2019-01-08 11:27:00,88.682,88.305,,-1,-0.377,-0.42511,0,5,87.996,88.477,88.29,PYPL Bought 83 Feb 22 Puts
KTOV,2019-01-03 14:43:00,1.13,1.247,True,1,0.117,10.35398,3,0,1.187,1.27,1.159,KTOV Shifting here on multiple time frames Looks to go higher
KTOV,2019-01-02 12:02:00,1.13,1.247,True,1,0.117,10.35398,3,2,1.17,1.27,1.159,KTOV Love the 13 Love the L2 Picture so far today Now just missing VOL
