SEEL,2019-03-25 14:40:00,2.772,2.491,,-1,-0.281,-10.13709,0,3,3.018,2.662,2.609,swapsomestock Are you watching SEEL
JAGX,2019-03-18 13:31:00,0.4767,0.1647,,-1,-0.312,-65.44997,0,0,0.3099,0.1855,0.2199,JAGX this stock just go all the way up to 30s and and back to 10 cents again
ASNS,2019-03-13 15:27:00,3.092,3.24,,-1,0.148,4.78655,0,0,3.282,3.21,3.222,ASNS
ASNS,2019-03-12 11:12:00,3.092,3.24,True,1,0.148,4.78655,2,1,3.456,3.21,3.222,ASNS How long do you want me to wait But I dont mind waitingTake your time coz I know whats going to happen
ASNS,2019-02-25 14:13:00,3.092,3.24,,-1,0.148,4.78655,1,0,3.1,3.21,3.222,ASNS Finally started
ASNS,2019-02-06 15:53:00,3.092,3.24,,-1,0.148,4.78655,2,0,3.13,3.21,3.222,ASNS finally started to go MT Everest
BIOC,2019-01-31 15:23:00,1.992,1.907,,-1,-0.085,-4.26707,4,0,1.995,1.87,1.865,BIOC Let go all the way to 3
BIOC,2019-01-31 15:23:00,1.992,1.907,,-1,-0.085,-4.26707,0,0,1.995,1.87,1.865,BIOC time to fly
BIOC,2019-01-31 13:46:00,1.992,1.907,True,0,-0.085,-4.26707,1,0,1.93,1.87,1.865,BIOC Lets do it
