CLNE,2019-04-11 10:32:00,3.272,3.313,True,1,0.041,1.25306,1,0,3.366,3.332,3.295,CLNE Where the pumpers at lmao There is money to be made here
ALDX,2019-03-26 10:15:00,9.698,9.367,True,0,-0.331,-3.41307,1,3,10.54,9.133,9.428,ALDX 15 pt
ALDX,2019-03-26 10:14:00,9.698,9.367,True,0,-0.331,-3.41307,1,0,10.564,9.133,9.428,ALDX Next run is starting get in now or dont complain later for not pulling the trigger
CLNE,2019-03-18 14:25:00,2.985,3.01,True,1,0.025,0.83752,1,3,2.946,2.965,3.004,CLNE Long term PTs anyone
YY,2019-03-05 12:52:00,81.373,80.87,,-1,-0.503,-0.61814,2,0,83.993,79.736,78.45,YY Out at 8465 GL all
OLED,2019-05-08 12:14:00,168.997,165.506,True,0,-3.491,-2.06572,2,0,168.86,164.517,164.072,OLED This should start picking up quite rapidly within the next few days D
OLED,2019-05-07 11:55:00,171.173,167.843,True,0,-3.33,-1.9454,0,0,170.895,167.49,167.19,OLED trading isnt for the meek If you cant handle volatility you should do yourself and everyone else a favor and find something else
OLED,2019-04-25 10:41:00,163.294,161.621,False,1,-1.673,-1.02453,0,10,166.99,164.97,166.557,OLED Ill say it again this will continue lower until corp is legally allowed to buy back its shares on May 8th Until then Im bearish
ATVI,2019-04-04 15:46:00,46.94,47.2,True,1,0.26,0.5539,3,0,46.976,47.055,47.3,ATVI I may of been early but I wasnt wrong
