HUNT,2019-03-26 15:59:00,92.23,34.94,True,0,-57.29,-62.11645,1,3,92.23,41.44,34.83,HUNT Hold because tomorrow will have another 100
HUNT,2019-03-26 15:39:00,92.23,34.94,True,0,-57.29,-62.11645,1,0,83.029,41.44,34.83,HUNT Cant go down anymore wheather you like it or not over 100 today tomorrow 300
HUNT,2019-03-26 15:30:00,92.23,34.94,True,0,-57.29,-62.11645,0,0,72.25,41.44,34.83,HUNT will go to 100 before closing
HUNT,2019-03-26 15:18:00,92.23,34.94,True,0,-57.29,-62.11645,1,0,58.63,41.44,34.83,HUNT HOD at 4pm
HUNT,2019-03-26 14:58:00,92.23,34.94,True,0,-57.29,-62.11645,0,0,53.526,41.44,34.83,HUNT ON POINT
HUNT,2019-03-26 14:32:00,92.23,34.94,,-1,-57.29,-62.11645,1,2,45.25,41.44,34.83,HUNT People will start to cover in 30 min If it goes up slowly before closing it may run again tomorrow Still on Watch
FNKO,2019-03-26 14:17:00,21.046,21.26,True,1,0.214,1.01682,1,0,21.152,22.271,22.01,FNKO
HUNT,2019-03-26 12:08:00,92.23,34.94,,-1,-57.29,-62.11645,2,0,49.88,41.44,34.83,HUNT If it still up in one hour I will consider to buy
HUNT,2019-03-26 11:33:00,92.23,34.94,,-1,-57.29,-62.11645,0,0,56.85,41.44,34.83,HUNT Halted
HUNT,2019-03-26 11:30:00,92.23,34.94,True,0,-57.29,-62.11645,0,0,49.918,41.44,34.83,HUNT Squeeze imminent
HUNT,2019-03-26 11:17:00,92.23,34.94,,-1,-57.29,-62.11645,0,0,44.593,41.44,34.83,HUNT If theres a round two there will be no down until closing
HUNT,2019-03-26 11:14:00,92.23,34.94,,-1,-57.29,-62.11645,1,0,44.088,41.44,34.83,HUNT Who is shorting a low float You will get squeezed very hard remember what ORGO did in january more than 1000 whole day up
CTRM,2019-03-26 10:19:00,10.228,4.943,False,1,-5.285,-51.67188,1,0,6.569,8.544,7.097,CTRM Dont get in wait until it goes back to 4 and stabilizes It will happen again soon dont worry
CTRM,2019-03-26 10:10:00,10.228,4.943,True,0,-5.285,-51.67188,0,0,9.882,8.544,7.097,CTRM I knew it way before stocktwits opened that board in at 410 Easiest 100 ever
AVGR,2019-03-25 14:44:00,0.8515,0.8698,True,1,0.0183,2.14915,7,3,0.86,0.8195,0.7988,AVGR Deja vu
DCIX,2019-03-25 11:07:00,1.29,1.185,,-1,-0.105,-8.13953,0,0,1.263,1.207,1.24,DCIX Decreased Volatility Down again soon
SEEL,2019-03-22 12:25:00,2.59,2.664,,-1,0.074,2.85714,0,0,3.2,2.658,3.005,SEEL Crazy day today this is the only one still standing
AVGR,2019-03-22 12:13:00,0.8891,0.9184,True,1,0.0293,3.29547,2,0,0.8675,0.9039,0.875,AVGR In again
SRNE,2019-03-22 10:36:00,5.917,5.681,True,0,-0.236,-3.98851,1,0,5.69,5.998,5.628,SRNE This chart though Fake pump and dump repeat
SRNE,2019-03-22 09:49:00,5.917,5.681,True,0,-0.236,-3.98851,0,0,6.058,5.998,5.628,SRNE is the one today you merge I merge
DCIX,2019-03-22 09:34:00,1.196,1.216,,-1,0.02,1.67224,0,0,1.22,1.126,1.149,DCIX Im out 12
TOPS,2019-03-21 11:49:00,0.9237,0.8346,True,0,-0.0891,-9.64599,1,0,0.8532,0.8235,0.8296,TOPS There she goes
CUR,2019-03-20 15:56:00,0.6591,0.5638,True,0,-0.0953,-14.45911,9,0,0.6563,0.574,0.6099,CUR Its nice to not be alone anymore on this page D
CUR,2019-03-20 15:30:00,0.6591,0.5638,True,0,-0.0953,-14.45911,0,0,0.6617,0.574,0.6099,CUR Thats it nothing to stop it
CUR,2019-03-20 14:35:00,0.6591,0.5638,True,0,-0.0953,-14.45911,3,0,0.6208,0.574,0.6099,CUR Only one resistance at 65 left after that we rocket
AVGR,2019-03-20 14:33:00,0.9657,1.03,True,1,0.0643,6.65838,0,0,0.9326,0.9896,0.9466,AVGR Now volatility will decrease Range between 92 and 86 is a good buy Will go up slowly the next days
AVGR,2019-03-20 14:15:00,0.9657,1.03,True,1,0.0643,6.65838,1,0,0.9752,0.9896,0.9466,AVGR Back to 92 for another dip dont chase and buy all dips
AVGR,2019-03-20 14:12:00,0.9657,1.03,True,1,0.0643,6.65838,0,0,0.9492,0.9896,0.9466,AVGR Do not chase it will stay in that range for one day at least try to get every dip
AVGR,2019-03-20 14:07:00,0.9657,1.03,True,1,0.0643,6.65838,3,0,0.8864,0.9896,0.9466,AVGR Time to buy again
CUR,2019-03-20 12:04:00,0.6591,0.5638,True,0,-0.0953,-14.45911,2,0,0.6079,0.574,0.6099,CUR About to break this week I can smell it
TOPS,2019-03-20 11:19:00,0.8191,0.8257,True,1,0.0066,0.80576,0,0,0.8216,0.816,0.8161,TOPS Im coming back again before tonight All the other shipment stocks reached their bottom again ready for round 2
GLBS,2019-03-20 10:58:00,3.361,3.93,True,1,0.569,16.92949,4,0,3.41,3.4,3.364,GLBS Its time to buy again
AVGR,2019-03-20 10:56:00,0.9657,1.03,,-1,0.0643,6.65838,0,0,0.9897,0.9896,0.9466,AVGR I will buy again between 88 and 92 I dont expect any up moves until it reaches that level again
AVGR,2019-03-20 10:41:00,0.9657,1.03,,-1,0.0643,6.65838,1,0,1.002,0.9896,0.9466,AVGR It did it again D
CUR,2019-03-20 10:13:00,0.6591,0.5638,True,0,-0.0953,-14.45911,0,0,0.62,0.574,0.6099,CUR Push it Push it
CUR,2019-03-20 10:11:00,0.6591,0.5638,True,0,-0.0953,-14.45911,0,0,0.6124,0.574,0.6099,CUR She wants it
CUR,2019-03-20 10:09:00,0.6591,0.5638,True,0,-0.0953,-14.45911,0,0,0.5875,0.574,0.6099,CUR If it reach 62 I will buy to push it
CPRX,2019-03-20 10:01:00,4.045,3.594,True,0,-0.451,-11.14957,1,0,3.959,3.962,3.895,CPRX Solid
FCSC,2019-03-20 09:46:00,2.317,2.226,True,0,-0.091,-3.92749,0,0,3.228,2.614,2.413,FCSC
TLGT,2019-03-19 15:33:00,1.284,1.196,,-1,-0.088,-6.85358,1,1,1.333,1.25,1.217,TLGT Worst FDA approval ever
TLGT,2019-03-19 14:39:00,1.284,1.196,,-1,-0.088,-6.85358,2,10,1.378,1.25,1.217,TLGT Hmmm I was expecting more enthusiasm
APPS,2019-03-19 13:41:00,3.562,3.53,True,0,-0.032,-0.89837,4,0,3.76,3.67,3.81,APPS What a beast
SRNE,2019-03-19 12:44:00,3.755,2.76,,-1,-0.995,-26.498,0,0,3.777,3.199,3.22,SRNE Whats happening here
DRAD,2019-03-19 10:52:00,1.004,0.863,True,0,-0.141,-14.04382,0,0,1.098,0.9339,1.018,DRAD Wow Nothing can stop it
APPS,2019-03-19 10:27:00,3.562,3.53,True,0,-0.032,-0.89837,1,0,3.831,3.67,3.81,APPS Give us a 435
CUR,2019-03-19 10:25:00,0.5791,0.57,True,0,-0.0091,-1.5714,2,0,0.587,0.5873,0.5899,CUR it has to break 62
TRVN,2019-03-19 10:02:00,1.875,1.69,True,0,-0.185,-9.86667,1,0,1.825,1.81,1.864,TRVN Either we stay at this level or we go to 229 lets see if we can bring the volume
TRVN,2019-03-19 09:51:00,1.875,1.69,True,0,-0.185,-9.86667,0,4,1.785,1.81,1.864,TRVN wont break 178 today but next time up will be 229
TRVN,2019-03-19 09:42:00,1.875,1.69,True,0,-0.185,-9.86667,1,0,1.768,1.81,1.864,TRVN Get in before 178 or it will be too late
TRVN,2019-03-19 09:41:00,1.875,1.69,True,0,-0.185,-9.86667,0,0,1.769,1.81,1.864,TRVN What did I tell you
ATOS,2019-03-18 15:23:00,4.376,4.009,True,0,-0.367,-8.38665,1,0,4.732,4.03,4.875,ATOS Fasten your seat belts
ADMA,2019-03-18 15:03:00,4.21,4.019,True,0,-0.191,-4.53682,0,0,4.243,4.055,4.08,ADMA I said 5 HOD dont make me a liar
TRVN,2019-03-18 14:51:00,1.652,1.56,True,0,-0.092,-5.56901,1,0,1.66,1.611,1.61,TRVN So proud of this one
ATOS,2019-03-18 14:50:00,4.376,4.009,True,0,-0.367,-8.38665,1,0,5.005,4.03,4.875,ATOS They want your cheap shares for power hour
ATOS,2019-03-18 14:36:00,4.376,4.009,True,0,-0.367,-8.38665,0,1,5.168,4.03,4.875,ATOS Watch
ATOS,2019-03-18 13:02:00,4.376,4.009,True,0,-0.367,-8.38665,1,1,4.904,4.03,4.875,ATOS Biggest moves between 230 and 4pm
ATOS,2019-03-18 12:57:00,4.376,4.009,True,0,-0.367,-8.38665,3,0,4.9,4.03,4.875,ATOS You cant lie anymore you will go to 6 and you know it
ADMA,2019-03-18 12:44:00,4.21,4.019,True,0,-0.191,-4.53682,2,0,4.175,4.055,4.08,ADMA 5 HOD
ATOS,2019-03-18 11:18:00,4.376,4.009,True,0,-0.367,-8.38665,0,0,4.769,4.03,4.875,ATOS Bazooka next 10 mins
ATOS,2019-03-18 11:10:00,4.376,4.009,True,0,-0.367,-8.38665,0,0,4.761,4.03,4.875,ATOS Up
ATOS,2019-03-18 10:43:00,4.376,4.009,,-1,-0.367,-8.38665,0,1,5.095,4.03,4.875,ATOS If it breaks this level there will be no limit
NIO,2019-03-18 10:34:00,5.757,5.678,True,0,-0.079,-1.37224,0,0,5.713,5.6,5.717,NIO I think its time to buy again
DERM,2019-03-18 10:30:00,12.584,13.272,True,1,0.688,5.46726,0,0,13.944,14.426,13.944,DERM Holding well got in at 14 before 10am lets see where this leads us
SLNO,2019-03-15 15:59:00,2.612,3.053,,-1,0.441,16.88361,1,0,2.612,4.228,4.393,SLNO Holy hahaha I wasnt expecting that man im so lucky i got out at 440
TOPS,2019-03-15 14:53:00,0.8311,0.8454,True,1,0.0143,1.72061,3,0,0.8304,0.819,0.816,TOPS This is the time to buy
SLNO,2019-03-15 14:27:00,2.612,3.053,,-1,0.441,16.88361,0,0,4.389,4.228,4.393,SLNO One short getting out yeah
SLNO,2019-03-15 14:14:00,2.612,3.053,True,1,0.441,16.88361,3,0,4.26,4.228,4.393,SLNO I just wait for a squeeze to get out before closing
SLNO,2019-03-15 10:36:00,2.612,3.053,,-1,0.441,16.88361,0,0,4.418,4.228,4.393,SLNO Short interest accumulating at this level if this breaks the squeeze will be huge
SLNO,2019-03-15 10:26:00,2.612,3.053,,-1,0.441,16.88361,0,0,4.47,4.228,4.393,SLNO Too much resistance
TOPS,2019-03-15 10:16:00,0.8311,0.8454,True,1,0.0143,1.72061,2,1,0.8106,0.819,0.816,TOPS Reversal today next week is the one
PHUN,2019-03-15 10:11:00,53.648,67.998,True,1,14.35,26.74843,0,5,71.467,70.217,69.4,PHUN Nearly doubled my initial order with this So healthy no stress trading stocks should everyday be like this
ATOS,2019-03-14 14:29:00,7.054,4.716,True,0,-2.338,-33.14432,1,0,5.737,5.412,4.988,ATOS We reach 10 tomorrow this dump was so obviously fake Dont let them get your shares
ATOS,2019-03-14 13:35:00,7.054,4.716,,-1,-2.338,-33.14432,0,0,4.71,5.412,4.988,ATOS What an ugly move
EVOK,2019-03-14 11:10:00,1.401,1.347,True,0,-0.054,-3.85439,1,0,1.635,1.493,1.492,EVOK
ATOS,2019-03-14 10:55:00,7.054,4.716,True,0,-2.338,-33.14432,0,0,5.467,5.412,4.988,ATOS I swing until tomorrow
PHUN,2019-03-14 10:44:00,66.003,66.983,True,1,0.98,1.48478,1,0,68.4,68.331,68.75,PHUN Im in love with that stock
ATOS,2019-03-14 10:32:00,7.054,4.716,True,0,-2.338,-33.14432,0,0,5.12,5.412,4.988,ATOS 30M shares we wont move much today If chart looks good the whole day we may run tomorrow again
OXBR,2019-03-14 10:22:00,1.458,0.88,,-1,-0.578,-39.64335,0,0,2.708,1.52,2.402,OXBR holy moly
ATOS,2019-03-14 10:15:00,7.054,4.716,True,0,-2.338,-33.14432,3,0,5.377,5.412,4.988,ATOS Short cover wave imminent
ATOS,2019-03-14 10:09:00,7.054,4.716,True,0,-2.338,-33.14432,1,0,5.138,5.412,4.988,ATOS Some bear traps before taking their money
ATOS,2019-03-14 10:08:00,7.054,4.716,True,0,-2.338,-33.14432,0,0,5.146,5.412,4.988,ATOS 20M shares
ATOS,2019-03-14 10:00:00,7.054,4.716,True,0,-2.338,-33.14432,2,0,5.412,5.412,4.988,ATOS Big bang coming soon
PHUN,2019-03-14 09:40:00,66.003,66.983,True,1,0.98,1.48478,0,0,70.996,68.331,68.75,PHUN Smooth criminal
AKTX,2019-03-13 15:57:00,5.84,2.115,True,0,-3.725,-63.78425,0,0,5.92,3.3,4.691,AKTX Congrats
AKTX,2019-03-13 15:56:00,5.84,2.115,True,0,-3.725,-63.78425,1,0,5.652,3.3,4.691,AKTX Soon HOD
PHUN,2019-03-13 15:54:00,61.208,54.253,True,0,-6.955,-11.36289,0,1,60.096,54.405,54.5,PHUN Why is this going up like a beast
TOPS,2019-03-11 13:24:00,0.92,0.936,True,1,0.016,1.73913,2,0,0.9324,0.9262,0.9076,TOPS Soon you will know why we chose TOPS instead of GLBS
TOPS,2019-03-11 12:41:00,0.92,0.936,True,1,0.016,1.73913,3,1,0.9146,0.9262,0.9076,TOPS Were launching
BPTH,2019-03-11 12:38:00,32.205,22.933,,-1,-9.272,-28.79056,1,1,26.5,29.471,29.801,BPTH Doesnt it remind you something
TOPS,2019-03-11 11:38:00,0.92,0.936,True,1,0.016,1.73913,0,0,0.9174,0.9262,0.9076,TOPS From healthcare to Shipments Make your transition
TOPS,2019-03-11 10:18:00,0.92,0.936,True,1,0.016,1.73913,3,0,0.9239,0.9262,0.9076,TOPS October deja vu Only up from now on lets reach 2 this week
TENX,2019-03-08 13:28:00,1.91,1.754,True,0,-0.156,-8.16754,4,0,2.344,1.772,2.15,TENX If you sold your shares you have no idea haha in few days you will hit your head against the wall
TENX,2019-03-08 13:26:00,1.91,1.754,True,0,-0.156,-8.16754,2,0,2.327,1.772,2.15,TENX only 14M shares available they just want yours at a small price like I do
TENX,2019-03-08 13:22:00,1.91,1.754,True,0,-0.156,-8.16754,3,0,2.317,1.772,2.15,TENX Im just buying more haha I know its value next week
TENX,2019-03-08 13:19:00,1.91,1.754,True,0,-0.156,-8.16754,1,0,2.539,1.772,2.15,TENX knocking at 270 door is like me trying to keep my poopoo at work It has to go through somewhen
TENX,2019-03-08 13:05:00,1.91,1.754,True,0,-0.156,-8.16754,2,0,2.634,1.772,2.15,TENX At 10M shares I will open a bottle of Champagne
TENX,2019-03-08 12:56:00,1.91,1.754,True,0,-0.156,-8.16754,3,0,2.57,1.772,2.15,TENX Were launching baby
TENX,2019-03-08 12:06:00,1.91,1.754,True,0,-0.156,-8.16754,3,8,2.279,1.772,2.15,TENX Will finish in beauty and run tomorrow like a beast
TENX,2019-03-08 11:52:00,1.91,1.754,True,0,-0.156,-8.16754,1,0,2.4,1.772,2.15,TENX Slowly but surely
TENX,2019-03-08 11:43:00,1.91,1.754,True,0,-0.156,-8.16754,0,0,2.302,1.772,2.15,TENX The only one which still has a chance today
SBOT,2019-03-08 10:24:00,1.515,1.748,,-1,0.233,15.37954,0,0,2.572,2.447,2.509,SBOT Let it fly
SBOT,2019-03-08 10:04:00,1.515,1.748,True,1,0.233,15.37954,0,0,2.318,2.447,2.509,SBOT 3M shares already lez go
SBOT,2019-03-08 10:02:00,1.515,1.748,True,1,0.233,15.37954,0,0,2.353,2.447,2.509,SBOT Volume growth dont lie
SBOT,2019-03-08 10:01:00,1.515,1.748,True,1,0.233,15.37954,1,0,2.274,2.447,2.509,SBOT Full in
BPTH,2019-03-07 15:32:00,38.483,18.058,,-1,-20.425,-53.07538,2,0,38.8,24.607,26.145,BPTH TLRY 3month chart copy paste dont hold tonight everything has an end
ARQL,2019-03-07 13:15:00,5.472,4.501,,-1,-0.971,-17.74488,1,0,5.824,4.856,4.477,ARQL Stairway to heaven
ARQL,2019-03-07 12:55:00,5.472,4.501,True,0,-0.971,-17.74488,0,0,5.359,4.856,4.477,ARQL Still very solid compared to all the other top stocks
ALT,2019-03-07 12:46:00,4.516,3.831,True,0,-0.685,-15.16829,0,0,4.885,3.474,3.51,ALT Come back
ALT,2019-03-07 11:34:00,4.516,3.831,True,0,-0.685,-15.16829,0,0,4.294,3.474,3.51,ALT Definitely the one today
BPTH,2019-03-07 11:21:00,38.483,18.058,,-1,-20.425,-53.07538,0,0,50.623,24.607,26.145,BPTH Haha its not over it has to hit 100
BPTH,2019-03-07 11:05:00,38.483,18.058,,-1,-20.425,-53.07538,0,0,48.622,24.607,26.145,BPTH A bubble doesnt end like this I initially thought it would crash after 15min but now oh man this can go to 100
BPTH,2019-03-07 09:36:00,38.483,18.058,,-1,-20.425,-53.07538,0,10,21.363,24.607,26.145,BPTH Take your profit and run asap Will crash at 945
BPTH,2019-03-06 15:42:00,38.483,18.058,True,0,-20.425,-53.07538,2,1,36.63,24.607,26.145,BPTH 3 MINNUTES
BPTH,2019-03-06 15:25:00,38.483,18.058,True,0,-20.425,-53.07538,2,0,40.35,24.607,26.145,BPTH Houston were launching to 15 in 20 min
BPTH,2019-03-06 15:13:00,38.483,18.058,True,0,-20.425,-53.07538,1,0,40.235,24.607,26.145,BPTH HOD at 1545
BPTH,2019-03-06 12:00:00,38.483,18.058,True,0,-20.425,-53.07538,1,0,35.154,24.607,26.145,BPTH I will buy in 20 mins
AYTU,2019-03-06 10:36:00,1.41,1.787,True,1,0.377,26.73759,3,0,1.531,1.596,1.51,AYTU BPTH is crashing soon and volume will come here
AYTU,2019-03-06 10:28:00,1.41,1.787,,-1,0.377,26.73759,0,0,1.58,1.596,1.51,AYTU 10M Shares
AWSM,2019-03-05 15:41:00,4.02,4.046,,-1,0.026,0.64677,2,0,4.31,3.771,3.95,AWSM Hmm this smells like a squeeze
BLNK,2019-03-05 13:51:00,3.925,3.9,True,0,-0.025,-0.63694,0,0,4.095,3.853,3.731,BLNK Got in this morning at 4 this news is saving my life haha
AWSM,2019-03-05 12:32:00,4.02,4.046,,-1,0.026,0.64677,1,1,4.233,3.771,3.95,AWSM oh yes oh yes
AWSM,2019-03-05 12:14:00,4.02,4.046,,-1,0.026,0.64677,0,0,3.968,3.771,3.95,AWSM It just needs a 4 in 15 mins
AWSM,2019-03-05 12:03:00,4.02,4.046,,-1,0.026,0.64677,0,0,3.866,3.771,3.95,AWSM The other top stocks are dropping cross fingers for this one
AWSM,2019-03-05 11:53:00,4.02,4.046,,-1,0.026,0.64677,2,1,3.904,3.771,3.95,AWSM We need some magic here the whole market is catastrophic for day traders This is still the most promising stock today
CIFS,2019-03-04 15:27:00,5.002,4.993,,-1,-0.009,-0.17993,0,0,5.029,5.402,6.098,CIFS The last 30 mins are going to be fun
CIFS,2019-03-04 13:50:00,5.002,4.993,True,0,-0.009,-0.17993,0,0,5.129,5.402,6.098,CIFS Haha you are going to get squeezed short get out now
CIFS,2019-03-04 13:24:00,5.002,4.993,True,0,-0.009,-0.17993,0,0,5.19,5.402,6.098,CIFS HOD at 1545
CIFS,2019-03-04 11:36:00,5.002,4.993,True,0,-0.009,-0.17993,0,0,5.502,5.402,6.098,CIFS Got in at 215 I wont sell until I have my short squeeze today
VUZI,2019-03-04 10:44:00,3.55,3.078,,-1,-0.472,-13.29577,0,0,4.13,3.441,3.74,VUZI Where is this going D
BPTH,2019-03-01 15:50:00,7.634,2.7,,-1,-4.934,-64.63191,2,0,8.504,4.792,4.91,BPTH HOLY
BPTH,2019-03-01 15:44:00,7.634,2.7,,-1,-4.934,-64.63191,3,1,7.565,4.792,4.91,BPTH This is going to finish at 9
BPTH,2019-03-01 15:18:00,7.634,2.7,,-1,-4.934,-64.63191,4,1,6.383,4.792,4.91,BPTH back to 7 again this is a joke right D
BPTH,2019-03-01 12:07:00,7.634,2.7,True,0,-4.934,-64.63191,1,0,7.29,4.792,4.91,BPTH Were definitely over 10 today just wait for it
BPTH,2019-03-01 11:57:00,7.634,2.7,True,0,-4.934,-64.63191,0,0,6.93,4.792,4.91,BPTH Give it 30 min people have to eat too D
BPTH,2019-03-01 11:55:00,7.634,2.7,True,0,-4.934,-64.63191,0,0,7.359,4.792,4.91,BPTH 748 is the limit buy around that price
BPTH,2019-03-01 11:10:00,7.634,2.7,True,0,-4.934,-64.63191,2,0,6.53,4.792,4.91,BPTH I initially thought it was a pump and dump Now it got too far I think its a bubble and nobody can stop it today
BPTH,2019-03-01 10:57:00,7.634,2.7,,-1,-4.934,-64.63191,1,5,6.515,4.792,4.91,BPTH Hmmmmmm thats the pattern of a bubble could be that nothing can stop it
CIFS,2019-03-01 10:03:00,3.14,2.398,True,0,-0.742,-23.63057,0,0,2.737,2.685,2.545,CIFS Wait for BPTH to crash and this will run
BPTH,2019-03-01 10:02:00,7.634,2.7,,-1,-4.934,-64.63191,0,0,4.693,4.792,4.91,BPTH Crash imminent
BPTH,2019-03-01 09:54:00,7.634,2.7,,-1,-4.934,-64.63191,0,0,4.567,4.792,4.91,BPTH No news bad news
RKDA,2019-02-28 15:29:00,8.07,8.136,,-1,0.066,0.81784,0,0,8.116,7.2,7.74,RKDA tick tack tick tack what time is it its squeeze time well 510 mins left
KL,2019-02-28 13:15:00,36.64,36.026,True,0,-0.614,-1.67576,0,0,36.489,36.44,36.295,KL JUL19 40C Money Rain
RKDA,2019-02-28 13:07:00,8.07,8.136,,-1,0.066,0.81784,0,0,8.821,7.2,7.74,RKDA Get out asap its over volume too low to get it back
RKDA,2019-02-28 12:14:00,8.07,8.136,True,1,0.066,0.81784,1,0,10.151,7.2,7.74,RKDA 105 in few seconds
RKDA,2019-02-28 12:13:00,8.07,8.136,True,1,0.066,0.81784,1,0,10.095,7.2,7.74,RKDA Ok now the volume is coming D
RKDA,2019-02-28 12:12:00,8.07,8.136,True,1,0.066,0.81784,0,0,9.958,7.2,7.74,RKDA I dont understand why people are not investing in it such a healthy chart
RKDA,2019-02-28 12:07:00,8.07,8.136,True,1,0.066,0.81784,1,0,9.873,7.2,7.74,RKDA Out at 10 waiting for next dip not enough volume
RKDA,2019-02-28 11:57:00,8.07,8.136,True,1,0.066,0.81784,1,0,8.895,7.2,7.74,RKDA Volume is still not coming whats wrong
RKDA,2019-02-28 11:54:00,8.07,8.136,True,1,0.066,0.81784,0,0,9.07,7.2,7.74,RKDA Haha thank you Zeus for this thunderbolt
RKDA,2019-02-28 11:12:00,8.07,8.136,,-1,0.066,0.81784,1,1,8.409,7.2,7.74,RKDA Thanks for the dip now i can get in
RKDA,2019-02-28 10:52:00,8.07,8.136,,-1,0.066,0.81784,0,0,9.25,7.2,7.74,RKDA It smells like a dip is coming I hope to get in
MTP,2019-02-27 11:26:00,0.7735,0.7169,True,0,-0.0566,-7.31739,4,0,0.8271,0.927,0.8439,MTP Same time yesterday everybody thought it was over the rest is history
MTP,2019-02-27 10:09:00,0.7735,0.7169,True,0,-0.0566,-7.31739,1,0,0.9133,0.927,0.8439,MTP 12 in 7 mins
MTP,2019-02-27 09:54:00,0.7735,0.7169,True,0,-0.0566,-7.31739,0,0,0.8209,0.927,0.8439,MTP Reminds me of ALT Short squeeze volatility halt repeat
MTP,2019-02-27 09:51:00,0.7735,0.7169,True,0,-0.0566,-7.31739,0,0,1.052,0.927,0.8439,MTP It will jump to 120 when it opens the shorts are screwed
MTP,2019-02-27 09:40:00,0.7735,0.7169,True,0,-0.0566,-7.31739,0,0,0.8,0.927,0.8439,MTP over 1 in one hour
MTP,2019-02-27 09:37:00,0.7735,0.7169,True,0,-0.0566,-7.31739,0,0,0.9023,0.927,0.8439,MTP It wont drop will continue the whole day
MTP,2019-02-26 15:04:00,0.7735,0.7169,,-1,-0.0566,-7.31739,0,0,0.7586,0.927,0.8439,MTP Jesus christ
IFMK,2019-02-26 13:27:00,1.186,0.9,,-1,-0.286,-24.11467,0,10,1.253,0.95,0.9146,IFMK Were getting close to 4pm I dont think more people will want to get in at that time
IFMK,2019-02-26 12:49:00,1.186,0.9,,-1,-0.286,-24.11467,0,0,1.25,0.95,0.9146,IFMK What Im watchin this since 113 and it just keep going looking for an entry
NIO,2019-02-26 10:19:00,9.762,9.167,True,0,-0.595,-6.09506,0,0,9.855,9.445,9.806,NIO She wants a 10
FTNW,2019-02-26 10:05:00,2.29,3.384,,-1,1.094,47.77293,0,0,2.9,3.06,2.87,FTNW Its over I nearly bought it though Something is wrong with this stock and news
FTNW,2019-02-26 09:54:00,2.29,3.384,True,1,1.094,47.77293,0,0,3.108,3.06,2.87,FTNW 7M shares rocket launch in 5 minutes
FTNW,2019-02-26 09:51:00,2.29,3.384,True,1,1.094,47.77293,0,0,3.166,3.06,2.87,FTNW 6M shares Im soon in
FTNW,2019-02-26 09:47:00,2.29,3.384,True,1,1.094,47.77293,1,0,3.1,3.06,2.87,FTNW 4M shares already it will stabilize buy at 10am
FTNW,2019-02-26 09:45:00,2.29,3.384,True,1,1.094,47.77293,0,0,3.043,3.06,2.87,FTNW I will consider to get in when volume reaches 23M Need to change hands
FTNW,2019-02-26 09:41:00,2.29,3.384,,-1,1.094,47.77293,1,0,3.2,3.06,2.87,FTNW Cant go up anymore the morning bulls are trapped as soon as the price goes they get out on the opportunity Stock to watch
CIFS,2019-02-25 13:56:00,2.847,1.86,,-1,-0.987,-34.66807,1,1,3.273,2.123,2.673,CIFS So Im out with a nice 100 be careful from now on 2 hours left before closing
CIFS,2019-02-25 13:12:00,2.847,1.86,True,0,-0.987,-34.66807,1,0,3.006,2.123,2.673,CIFS BABA going up again CIFS will follow
CIFS,2019-02-25 12:16:00,2.847,1.86,True,0,-0.987,-34.66807,1,0,3.14,2.123,2.673,CIFS With 33M shares it cant move too fast find a good entry dont panic sell and give it time
CIFS,2019-02-25 11:51:00,2.847,1.86,,-1,-0.987,-34.66807,3,2,2.79,2.123,2.673,CIFS Are short shares still available
CIFS,2019-02-25 11:48:00,2.847,1.86,True,0,-0.987,-34.66807,1,0,2.816,2.123,2.673,CIFS Critical moment and resistance seems to be strong
CIFS,2019-02-25 11:22:00,2.847,1.86,True,0,-0.987,-34.66807,1,0,2.724,2.123,2.673,CIFS 25M shares this is not over
CIFS,2019-02-25 11:05:00,2.847,1.86,True,0,-0.987,-34.66807,1,0,2.919,2.123,2.673,CIFS 2M shares
CIFS,2019-02-25 10:30:00,2.847,1.86,True,0,-0.987,-34.66807,1,0,2.673,2.123,2.673,CIFS 12M shares Huge when I bought at 163 this morning we only had 400k
CIFS,2019-02-25 10:26:00,2.847,1.86,True,0,-0.987,-34.66807,2,0,2.6,2.123,2.673,CIFS 550 EOD
CIFS,2019-02-25 10:03:00,2.847,1.86,True,0,-0.987,-34.66807,1,0,2.308,2.123,2.673,CIFS This want to fly apparently huge growth of volume
CIFS,2019-02-25 09:41:00,2.847,1.86,True,0,-0.987,-34.66807,0,0,1.64,2.123,2.673,CIFS Stock to watch
ZSAN,2019-02-22 09:32:00,4.51,5.581,True,1,1.071,23.74723,0,0,6.036,5.035,4.86,ZSAN Haha thank youuuu
ZSAN,2019-02-21 15:58:00,4.51,5.581,True,1,1.071,23.74723,0,0,4.496,5.035,4.86,ZSAN Jesus that volume
ZSAN,2019-02-21 15:46:00,4.51,5.581,True,1,1.071,23.74723,1,0,4.358,5.035,4.86,ZSAN Im laughing
ZSAN,2019-02-21 15:05:00,4.51,5.581,True,1,1.071,23.74723,2,3,4.431,5.035,4.86,ZSAN To all the people who are too scared to get in believe me its not too late this is only round 1
ZSAN,2019-02-21 14:54:00,4.51,5.581,True,1,1.071,23.74723,2,0,4.668,5.035,4.86,ZSAN Thats it that was the ridiculous 3pm sell off D
ZSAN,2019-02-21 14:52:00,4.51,5.581,True,1,1.071,23.74723,2,0,4.66,5.035,4.86,ZSAN Dont even try to sell it will go up until tomorrow
ZSAN,2019-02-21 14:35:00,4.51,5.581,True,1,1.071,23.74723,7,1,4.729,5.035,4.86,ZSAN one year salary in one day
ZSAN,2019-02-21 14:26:00,4.51,5.581,True,1,1.071,23.74723,1,0,4.777,5.035,4.86,ZSAN Thats it I hold overnight for a nice 15 tomorrow
ZSAN,2019-02-21 14:12:00,4.51,5.581,True,1,1.071,23.74723,0,0,4.77,5.035,4.86,ZSAN Nothing can stop it it has to run tomorrow too and double again If it doesnt fall before closing I will hold this baby
ZSAN,2019-02-21 14:08:00,4.51,5.581,True,1,1.071,23.74723,1,1,4.762,5.035,4.86,ZSAN I want a 666 and then I go out smiling like the devil
ZSAN,2019-02-21 13:58:00,4.51,5.581,True,1,1.071,23.74723,1,0,4.784,5.035,4.86,ZSAN We still got one safe hour to go to 6
ZSAN,2019-02-21 13:50:00,4.51,5.581,True,1,1.071,23.74723,0,0,4.818,5.035,4.86,ZSAN Now short will cover
ZSAN,2019-02-21 12:04:00,4.51,5.581,True,1,1.071,23.74723,0,0,4.85,5.035,4.86,ZSAN It will still run two hours dont panic dont sell yet
ZSAN,2019-02-21 11:53:00,4.51,5.581,True,1,1.071,23.74723,0,0,4.871,5.035,4.86,ZSAN 5 in 321
ZSAN,2019-02-21 11:21:00,4.51,5.581,True,1,1.071,23.74723,0,1,4.809,5.035,4.86,ZSAN Jesus I said 40 min
ZSAN,2019-02-21 11:18:00,4.51,5.581,True,1,1.071,23.74723,0,1,4.891,5.035,4.86,ZSAN 420 in 40 min
ZSAN,2019-02-21 11:12:00,4.51,5.581,True,1,1.071,23.74723,1,0,4.89,5.035,4.86,ZSAN 660 HOD
ZSAN,2019-02-21 11:09:00,4.51,5.581,True,1,1.071,23.74723,1,0,4.785,5.035,4.86,ZSAN Guys we created a monster
TRVN,2019-02-21 10:33:00,1.399,1.401,True,1,0.002,0.14296,3,6,1.359,1.381,1.36,TRVN Load as much as you can today you will never have this price again
ZSAN,2019-02-21 10:22:00,5.997,2.742,True,0,-3.255,-54.27714,1,1,2.943,2.719,2.9,ZSAN Sooner that i expected D
BLNK,2019-02-21 10:21:00,3.543,3.78,,-1,0.237,6.68925,1,0,3.862,3.71,3.944,BLNK Hahaha nailed it 46 EOD Im not kidding
BLNK,2019-02-21 10:20:00,3.543,3.78,True,1,0.237,6.68925,0,0,3.81,3.71,3.944,BLNK Watch this bid Its time to close your short positions guys
ZSAN,2019-02-21 10:14:00,5.997,2.742,True,0,-3.255,-54.27714,2,1,2.651,2.719,2.9,ZSAN 29 in 15 min
ADIL,2019-02-21 10:09:00,3.985,3.329,,-1,-0.656,-16.46173,0,0,4.37,4.478,4.263,ADIL Dont buy get out and dont short Will stay between 4 and 450 today
BLNK,2019-02-21 10:07:00,3.543,3.78,True,1,0.237,6.68925,0,0,3.72,3.71,3.944,BLNK 58 short yesterday or 23M shares It wont go down more than that Im so looking forward for this squeeze D
ADIL,2019-02-21 10:02:00,3.985,3.329,,-1,-0.656,-16.46173,0,0,4.518,4.478,4.263,ADIL Offering financeyahoocomnewsadia
ZSAN,2019-02-21 09:58:00,5.997,2.742,True,0,-3.255,-54.27714,5,0,2.833,2.719,2.9,ZSAN This will fly today
