SHOP,2019-05-17 11:51:00,273.564,269.887,,-1,-3.677,-1.34411,1,0,274.303,272.204,269.585,SHOP hope youre not being a bag holdereveryone told its dn grd and overpricedbig money moving outtake out now rides overATH how long has any stock stayed there apple amazon
STZ,2019-04-04 15:17:00,191.485,190.95,,-1,-0.535,-0.2794,0,0,192.735,190.049,190.82,STZ Swim w the tide baby
STZ,2019-04-04 15:06:00,191.485,190.95,,-1,-0.535,-0.2794,4,2,191.978,190.049,190.82,STZ May gap up to 200 overnight tonightwell see
STZ,2019-04-04 14:51:00,191.485,190.95,,-1,-0.535,-0.2794,0,0,191.54,190.049,190.82,STZ Power Hour coming onbears be like speed bumps
GOOGL,2019-04-25 09:51:00,1268.298,1271.293,,-1,2.995,0.23614,1,1,1263.166,1268.787,1275.35,GOOGL wow reallysuper computer master manipulating the marketslet it crash and give me some 1000 GOOG
BABA,2019-04-18 15:13:00,187.007,184.415,,-1,-2.592,-1.38604,2,0,186.573,185.348,185.387,BABA there is the 18250 someone asked about this morning
AMZN,2019-04-04 10:16:00,1818.153,1830.328,,-1,12.175,0.66964,1,0,1823.06,1832.38,1830.836,AMZN earnings day 3 weeks from todaythese prices will be gone
BABA,2019-04-03 14:13:00,178.31,177.106,,-1,-1.204,-0.67523,0,0,178.672,180.093,178.914,BABA Thankor Tank you for the shares at 174 now getty on up outta dare
