AKRX,2019-05-01 13:43:00,2.765,2.77,True,1,0.005,0.18083,1,0,2.79,2.74,2.715,AKRX Akorn general meeting end company has enough cash flows for the rest of the year without any increase of capital need it Bid imminent
EME,2019-04-18 13:48:00,79.597,79.439,True,0,-0.158,-0.1985,0,1,79.621,80.775,79.45,EME EMCOR GROUP recieved a takeover aproach 100 Per share
AMRN,2019-04-09 15:51:00,19.078,19.089,True,1,0.011,0.05766,0,0,19.115,19.417,19.664,AMRN high call buying volume next week strike 20
AKRX,2019-04-04 12:02:00,3.414,3.45,True,1,0.036,1.05448,0,1,3.49,3.465,3.406,Let see who is right on Monday about AKRX akorn and private equity CVC
MYL,2019-03-26 14:47:00,28.171,28.188,,-1,0.017,0.06035,0,1,28.08,27.973,28.196,MYL I agree and it will be confirm warren interest before Friday
MYL,2019-03-26 14:46:00,28.171,28.188,True,1,0.017,0.06035,0,0,28.05,27.973,28.196,Mylan MYL Rumors Swirl But Fall Flat as Completion of Strategic Review Nears streetinsidercomRumorsMy vía StreetInsider
