GOOGL,2019-05-15 12:18:00,1171.815,1171.605,True,0,-0.21,-0.01792,2,0,1161.49,1183.299,1191.439,GOOGL Solid play no china exposure
TTD,2019-05-15 12:18:00,199.793,199.87,True,1,0.077,0.03854,0,1,194.533,204.351,206.661,TTD Where is this heading UP
NBEV,2019-05-15 12:06:00,5.165,5.183,True,1,0.018,0.3485,0,1,5.155,5.154,5.125,NBEV Upcoming catalyst Not sure whether to buy calls or puts Dilution though
UBER,2019-05-10 15:36:00,41.494,38.287,False,1,-3.207,-7.72883,1,0,42.093,38.547,38.433,UBER Early investors have been waiting almost a decade to sell their shares and buy mansions and lambos easiest short
NBEV,2019-05-10 15:35:00,5.275,5.163,True,0,-0.112,-2.12322,1,0,5.251,5.075,5.122,NBEV Weed is way up
TTD,2019-05-09 12:47:00,189.882,190.993,False,0,1.111,0.5851,0,1,196.163,186.342,185.074,TTD Sell now more losses to come Look at put options
NBEV,2019-05-09 11:51:00,5.235,5.132,True,0,-0.103,-1.96753,1,1,5.322,5.12,5.125,NBEV Now waiting for FDA decision on CBD 15
TTD,2019-05-09 11:50:00,189.882,190.993,False,0,1.111,0.5851,0,0,185.486,186.342,185.074,TTD This thing is dead
NBEV,2019-05-07 13:59:00,5.247,5.224,True,0,-0.023,-0.43835,0,1,5.282,5.17,5.155,NBEV Why announce now instead of during ER WTF BW Did you go to grad school
NBEV,2019-04-25 11:44:00,5.785,5.507,True,0,-0.278,-4.80553,1,0,5.899,5.378,5.421,NBEV Accumulating CBD vials are huge
TSLA,2019-04-24 15:57:00,258.711,252.29,False,1,-6.421,-2.48192,0,0,258.902,255.15,255.079,TSLA Massive short
TSLA,2019-04-24 15:38:00,258.711,252.29,False,1,-6.421,-2.48192,3,1,260.121,255.15,255.079,TSLA Huge short position Lets see
NBEV,2019-04-24 15:29:00,5.525,5.996,True,1,0.471,8.52489,8,2,5.566,5.86,5.705,NBEV If we hold we can demolish them shorts But people want their few pennies lol
NBEV,2019-04-24 15:28:00,5.525,5.996,True,1,0.471,8.52489,6,2,5.555,5.86,5.705,NBEV Broke resistance if news is good tomorrow can hit 7
NBEV,2019-04-24 14:45:00,5.525,5.996,True,1,0.471,8.52489,2,2,5.453,5.86,5.705,NBEV CBD lips CBD cream CBD what else
NBEV,2019-04-24 13:46:00,5.525,5.996,True,1,0.471,8.52489,1,2,5.35,5.86,5.705,NBEV CBD skin creams tomorrow what else
NBEV,2019-04-23 15:35:00,5.233,5.2,True,0,-0.033,-0.63061,1,0,5.209,5.213,5.175,NBEV Anyone buying in Walmart
NBEV,2019-04-10 11:13:00,5.847,5.855,True,1,0.008,0.13682,3,0,5.799,5.868,5.881,NBEV AEON news next week Should be another 2030 boost One of the largest retailers in Japan and it will be for CBD
NBEV,2019-04-08 14:31:00,6.572,6.145,True,0,-0.427,-6.49726,3,0,6.45,5.972,6.028,NBEV WIN WIN WIN Can go to 7 premarket tomorrow
NBEV,2019-04-08 14:22:00,6.572,6.145,True,0,-0.427,-6.49726,3,0,6.306,5.972,6.028,NBEV Let it ride can go to 7 today starbucks and japan news still coming
NBEV,2019-04-08 14:21:00,6.572,6.145,True,0,-0.427,-6.49726,0,0,6.282,5.972,6.028,NBEV HOLY COWWWWWWW
NBEV,2019-04-08 13:55:00,6.572,6.145,True,0,-0.427,-6.49726,2,0,6,5.972,6.028,NBEV ton of good PR WALMART is only the beginning Asia also in sight
NBEV,2019-04-08 11:14:00,6.572,6.145,True,0,-0.427,-6.49726,3,0,5.7,5.972,6.028,NBEV 8 price target fairfieldcurrentcomnews2
NBEV,2019-04-04 14:18:00,4.945,4.863,False,1,-0.082,-1.65824,0,1,4.96,4.74,4.721,NBEV BW is selling several million dollars worth of shares I would get out if you are still holding
NBEV,2019-03-08 14:11:00,5.076,5.097,False,0,0.021,0.41371,1,0,5.036,5.17,5.353,NBEV DEAD
NBEV,2019-03-08 14:01:00,5.076,5.097,False,0,0.021,0.41371,3,0,5.013,5.17,5.353,NBEV 45 next Buy puts
NBEV,2019-03-08 13:59:00,5.076,5.097,False,0,0.021,0.41371,2,1,5.017,5.17,5.353,NBEV Dead fish Until BW leaves this company has no hope
NBEV,2019-03-07 15:32:00,5.215,4.997,True,0,-0.218,-4.18025,2,0,5.224,5.131,5.056,NBEV Notice how all the bulls are gone Theyll be back to scalp you when this thing reverses But now its DEAD
NBEV,2019-03-07 15:26:00,5.215,4.997,True,0,-0.218,-4.18025,0,0,5.23,5.131,5.056,NBEV DILUTE DILUTE DILUTE THANK YOU
NBEV,2019-03-07 15:23:00,5.215,4.997,True,0,-0.218,-4.18025,0,0,5.229,5.131,5.056,NBEV Falling knife
NBEV,2019-03-07 15:21:00,5.215,4.997,True,0,-0.218,-4.18025,1,0,5.235,5.131,5.056,NBEV 25 million dollar dilution incoming RUN
NBEV,2019-03-07 15:20:00,5.215,4.997,True,0,-0.218,-4.18025,2,1,5.236,5.131,5.056,NBEV REPLACE BW
NBEV,2019-03-07 15:20:00,5.215,4.997,True,0,-0.218,-4.18025,1,1,5.236,5.131,5.056,NBEV No news bad news Deals signed unconfirmed SCAM
NBEV,2019-03-07 15:19:00,5.215,4.997,True,0,-0.218,-4.18025,0,0,5.229,5.131,5.056,NBEV This company is a hype and scam Buy puts Easy money Up 300 in 1 month
NBEV,2019-03-07 14:33:00,5.215,4.997,True,0,-0.218,-4.18025,0,1,5.258,5.131,5.056,NBEV Show is a huge disappointment Heading to 475 next week
NBEV,2019-03-07 12:43:00,5.215,4.997,True,0,-0.218,-4.18025,1,7,5.313,5.131,5.056,NBEV Just saw the booth total disaster Staff was not ready to answer questions about delivery time frame etc So disappointed No ER
NBEV,2019-03-06 13:10:00,5.45,5.433,True,0,-0.017,-0.31193,0,0,5.355,5.315,5.313,NBEV SELL SELL SELL
NBEV,2019-03-06 13:04:00,5.45,5.433,True,0,-0.017,-0.31193,1,1,5.343,5.315,5.313,NBEV 40 price target No news no partnerships Just dilutions Easy puts
NBEV,2019-03-06 13:01:00,5.45,5.433,True,0,-0.017,-0.31193,1,0,5.348,5.315,5.313,NBEV Everyone is selling dilution incoming
NBEV,2019-03-06 13:00:00,5.45,5.433,True,0,-0.017,-0.31193,1,0,5.343,5.315,5.313,NBEV DEAD DEAD DEAD
NBEV,2019-03-04 13:09:00,5.696,5.55,True,0,-0.146,-2.5632,3,0,5.498,5.62,5.589,NBEV Replace BW
NBEV,2019-03-04 13:09:00,5.696,5.55,True,0,-0.146,-2.5632,2,0,5.498,5.62,5.589,NBEV Brent Willis is so incompetent
