AMRS,2019-04-11 13:58:00,2.899,2.249,True,0,-0.65,-22.42152,1,0,2.809,2.8,2.78,AMRS turd soup2020 calls the rest is garbageride the roller coaster
HIIQ,2019-04-09 12:57:00,25.93,25.937,True,1,0.007,0.027,6,0,26.046,26.29,25.98,HIIQ i just keep buyingthanks for the bs news
WB,2019-03-29 14:44:00,61.98,63.22,True,1,1.24,2.00065,0,0,62.133,63.894,64.1,WB Been holding this bag too longLFG turn that corner baby
WB,2019-03-19 15:48:00,63.002,61.687,,-1,-1.315,-2.08724,1,0,62.848,61.785,61.987,WB same heresucks to be us
MLNX,2019-03-13 13:37:00,118.19,118.298,,-1,0.108,0.09138,0,3,118.391,118.085,118.093,MLNX can anyone let me know as to why this stock is not at bid price of 125
TEUM,2019-03-12 15:31:00,3.914,4.55,True,1,0.636,16.24936,9,1,4.006,4.719,4.8,TEUM all in not sure whyjust cant bear to see this take off without me
ORGO,2019-03-11 15:31:00,10.09,13.61,True,1,3.52,34.88603,5,1,10.612,12.08,11.293,ORGO all in
