AMRS,2019-05-01 12:27:00,4.03,4.313,,-1,0.283,7.02233,1,1,4.104,4.244,4.314,AMRS Unless a pos PR this will drop till delayed report is issued Why so long to issue If news was good why not release
AMRS,2019-04-30 12:55:00,4.48,4.43,,-1,-0.05,-1.11607,1,0,4.392,4.255,4.24,AMRS Has been at low 3 or under 3 times last six months I might miss out but I think Ill wait a bit for reentry Plus neg news might com
EXEL,2019-04-17 14:14:00,21.347,21.324,,-1,-0.023,-0.10774,0,0,21.18,20.835,20.452,EXEL Thought I was ok when I bought in at the 100 drop Wrong again Using the magic word might help WHOA
RAD,2019-04-16 09:33:00,0.45,0.4501,,-1,0.0001,0.02222,2,2,0.4413,0.439,0.44,RAD If this keeps dropping we could be under a 100 at the rs I was long now Im just feeling exhausted with this stock
AMRS,2019-03-18 13:37:00,3.835,3.949,True,1,0.114,2.97262,1,0,3.94,3.7,3.504,AMRS Dont jump to fast after earnings either way Its not what they show this time its what they say that will move it up or down GLTA
TRVN,2019-03-05 11:58:00,1.52,1.517,True,0,-0.003,-0.19737,0,0,1.536,1.47,1.47,TRVN I like the risk vs reward I feel its 5050or bettor And in pharma stocks Ill take that any day
AMRS,2019-05-16 14:57:00,4.31,4.254,,-1,-0.056,-1.2993,2,0,4.16,4.301,4.364,AMRS Hopefully today is not a tragedy but a buying discount At least I hope for it got me to buy on the drop today Good luck to me
AMRS,2019-05-10 11:03:00,4.545,4.42,True,0,-0.125,-2.75028,4,0,4.693,4.397,4.315,AMRS Their selling in small choppy blocks eating up your shares then buying in large blocks to gain the lower price point prior to earnings
