NVCN,2019-05-23 15:51:00,0.5343,0.498,,-1,-0.0363,-6.79394,2,0,0.5419,0.4881,0.4943,NVCN anyone who did not take some profit at 80 gains should not be trading there lunch momey
NVCN,2019-05-23 12:24:00,0.5343,0.498,,-1,-0.0363,-6.79394,0,0,0.6502,0.4881,0.4943,NVCN as a bag holder no I wont be dumping my shares ty very much
NVCN,2019-05-23 12:16:00,0.5343,0.498,,-1,-0.0363,-6.79394,3,2,0.6422,0.4881,0.4943,NVCN pretty fn awesome and its a Friday to
NVCN,2019-05-23 11:33:00,0.5343,0.498,,-1,-0.0363,-6.79394,1,1,0.6734,0.4881,0.4943,NVCN holding 40 gains pretty well and people not happy ok
AVGR,2019-05-21 13:17:00,0.4757,0.4716,,-1,-0.0041,-0.86189,6,2,0.4818,0.4773,0.4816,AVGR reverse cowgirl forming on the 30 day
AVGR,2019-05-20 14:53:00,0.5086,0.4985,,-1,-0.0101,-1.98584,3,4,0.5088,0.4899,0.4849,AVGR I like money I wish I had more of it
NVCN,2019-05-20 14:51:00,0.471,0.4799,,-1,0.0089,1.8896,0,0,0.4779,0.4754,0.4824,NVCN no chimichangas this party sucks
NVCN,2019-05-20 14:42:00,0.471,0.4799,,-1,0.0089,1.8896,0,7,0.4773,0.4754,0.4824,NVCN we are all gonna die all of us we are all gonna die this stock will be the death of you me fred jim and bob all will die who dabble in this toxic horrific stuff we are all gonna die run away be afraid
NVCN,2019-05-20 10:29:00,0.471,0.4799,,-1,0.0089,1.8896,0,0,0.4742,0.4754,0.4824,NVCN go fact check your biatch mother
NVCN,2019-05-20 10:02:00,0.471,0.4799,,-1,0.0089,1.8896,3,20,0.4734,0.4754,0.4824,NVCN my god 15 years with this stock just destroying me and my family its a fact it has continuingly gone down for 15 years I own 86000k and im fucked someone call me out I dare ya tell me it has not and either you lie or cant read
NVCN,2019-05-17 12:46:00,0.4899,0.4855,,-1,-0.0044,-0.89814,0,0,0.4831,0.4762,0.4746,NVCN DateFormInvestorOptPrev SharesCurrent SharesChange PercentPrev Value 1000Current Value 1000Change Percent 20190515 13F ROYAL BANK OF CANADA 3567 7116 2 3 20190515 13F Magnetar Financial LLC 1018344 1130865 614 476
AVGR,2019-05-16 12:36:00,0.4925,0.4994,,-1,0.0069,1.40102,1,0,0.4981,0.4968,0.4881,AVGR its bigger than anything trump has
AVGR,2019-05-16 12:36:00,0.4925,0.4994,,-1,0.0069,1.40102,0,0,0.4981,0.4968,0.4881,AVGR what a wall man
NVCN,2019-05-16 11:59:00,0.4944,0.49,,-1,-0.0044,-0.88997,2,0,0.4863,0.4943,0.4875,NVCN we can go up 2 cents but gota go down 4 cents first
AVGR,2019-05-16 11:57:00,0.4925,0.4994,,-1,0.0069,1.40102,1,0,0.4986,0.4968,0.4881,AVGR suck it up bitches no pain no gain
AVGR,2019-05-16 11:33:00,0.4925,0.4994,,-1,0.0069,1.40102,0,0,0.4857,0.4968,0.4881,AVGR here comes another battle one more time into the fray
NVCN,2019-05-16 11:04:00,0.4944,0.49,,-1,-0.0044,-0.88997,7,2,0.4851,0.4943,0.4875,NVCN ok 85k shares up for sale for 20 bucks a share
NVCN,2019-05-16 10:59:00,0.4944,0.49,,-1,-0.0044,-0.88997,2,0,0.4901,0.4943,0.4875,NVCN shh you here that me either not even crickets something wicked this way comes muuhahahaha
NVCN,2019-05-15 13:32:00,0.4951,0.498,,-1,0.0029,0.58574,1,2,0.4941,0.4951,0.4929,NVCN hmm wont fill at 4934 muy intresante
NVCN,2019-05-14 13:35:00,0.4835,0.5012,,-1,0.0177,3.66081,0,3,0.4884,0.48,0.4841,NVCN totally loosing my boner
NVCN,2019-05-14 13:11:00,0.4835,0.5012,,-1,0.0177,3.66081,0,0,0.4872,0.48,0.4841,NVCN crazy this and avinger my only stocks both in exaxt same situation and both stuck at 48 fkn cents me thinks bio is just a tough sector
NVCN,2019-05-10 12:22:00,0.4953,0.4899,,-1,-0.0054,-1.09025,0,0,0.4869,0.4799,0.4619,NVCN feed that biatch
NVCN,2019-05-10 12:08:00,0.4953,0.4899,,-1,-0.0054,-1.09025,1,0,0.4764,0.4799,0.4619,NVCN I ll buy at 47 all day
NVCN,2019-05-09 14:48:00,0.5735,0.5131,,-1,-0.0604,-10.53182,3,1,0.5843,0.5111,0.51,NVCN man I hope my lady dont see what I did here today lol my account is spent lol
NVCN,2019-05-09 14:47:00,0.5735,0.5131,True,0,-0.0604,-10.53182,2,0,0.5938,0.5111,0.51,NVCN we might pass avinger today they stuck at 60ish
NVCN,2019-05-09 13:38:00,0.5735,0.5131,,-1,-0.0604,-10.53182,0,1,0.5769,0.5111,0.51,NVCN i have a funny feeling in my pants
NVCN,2019-05-09 13:36:00,0.5735,0.5131,,-1,-0.0604,-10.53182,0,0,0.5752,0.5111,0.51,NVCN no complaints today
NVCN,2019-05-09 12:34:00,0.5735,0.5131,,-1,-0.0604,-10.53182,0,0,0.5689,0.5111,0.51,NVCN absolutely unpredictable
NVCN,2019-05-09 12:33:00,0.5735,0.5131,,-1,-0.0604,-10.53182,1,0,0.5649,0.5111,0.51,NVCN this is where the battle starts
NVCN,2019-05-09 12:31:00,0.5735,0.5131,,-1,-0.0604,-10.53182,0,0,0.5606,0.5111,0.51,NVCN come on baby
NVCN,2019-05-09 11:58:00,0.5735,0.5131,,-1,-0.0604,-10.53182,1,0,0.5444,0.5111,0.51,NVCN here it comes booooom
NVCN,2019-05-09 11:56:00,0.5735,0.5131,,-1,-0.0604,-10.53182,2,0,0.5417,0.5111,0.51,NVCN me up to 70k shares at 53
NVCN,2019-05-09 11:15:00,0.5735,0.5131,,-1,-0.0604,-10.53182,1,0,0.5395,0.5111,0.51,NVCN here
AVGR,2019-05-07 15:38:00,0.653,0.6752,,-1,0.0222,3.39969,1,1,0.6629,0.6825,0.6931,AVGR womg s face looks like he has a weener up his ass
AVGR,2019-05-07 15:37:00,0.653,0.6752,True,1,0.0222,3.39969,0,0,0.6601,0.6825,0.6931,AVGR suck like you suck dick queer
NVCN,2019-04-23 12:11:00,0.4755,0.4699,,-1,-0.0056,-1.17771,0,1,0.4544,0.4689,0.464,NVCN seriously starting to think class action law suit 15 years I been with nvcn looking pretty crooked
NVCN,2019-04-23 11:31:00,0.4755,0.4699,,-1,-0.0056,-1.17771,0,0,0.4609,0.4689,0.464,NVCN must be with my 10k in freds pocket
AVGR,2019-04-23 11:29:00,0.5499,0.55,,-1,0.0001,0.01819,4,1,0.5273,0.5733,0.6988,AVGR yes but lets not even hold zacks as relevant the are bought n paid for always wrong on tech stalks DO own reasearc
NVCN,2019-04-22 10:46:00,0.485,0.4844,,-1,-0.0006,-0.12371,0,2,0.4894,0.4698,0.47,NVCN lol getting my ass kicked 57k536 just do it do it
AVGR,2019-04-22 10:12:00,0.5415,0.5526,,-1,0.0111,2.04986,5,0,0.5595,0.5259,0.5197,AVGR yea 10 k down on a penny stock fuck ya
NVCN,2019-04-18 12:58:00,0.5164,0.5116,,-1,-0.0048,-0.92951,1,0,0.5486,0.4826,0.5024,NVCN do you guys like touch yourself when you see a penny some times I do not all the time though
NVCN,2019-04-18 12:55:00,0.5164,0.5116,,-1,-0.0048,-0.92951,0,0,0.5521,0.4826,0.5024,NVCN common its not like they quit selling booze buck up
NVCN,2019-04-18 12:15:00,0.5164,0.5116,,-1,-0.0048,-0.92951,0,0,0.5767,0.4826,0.5024,NVCN I think this hot burrito need some hot sauce hehehehehehe
AVGR,2019-04-18 12:11:00,0.584,0.575,,-1,-0.009,-1.5411,1,0,0.5876,0.5415,0.5432,AVGR uhhh hehe uuuuuu were all gonna die ya yayaaayya die mmm hmmm hmm yay ya
NVCN,2019-04-18 11:08:00,0.5164,0.5116,,-1,-0.0048,-0.92951,6,0,0.5999,0.4826,0.5024,NVCN almost 10 mill volume
NVCN,2019-04-18 09:35:00,0.5164,0.5116,,-1,-0.0048,-0.92951,0,0,0.5948,0.4826,0.5024,nope its not goldNVCN
NVCN,2019-04-18 09:34:00,0.5164,0.5116,True,0,-0.0048,-0.92951,2,0,0.6083,0.4826,0.5024,NVCN 3 mil traded already
NVCN,2019-04-16 15:43:00,0.4179,0.437,,-1,0.0191,4.57047,0,1,0.4115,0.4343,0.4298,NVCN STUPID NO GOOD GOD DAM WORTHLESS NO IT ALL JERKS I FORGOT UGLY LAZY AND DISRESPECTFUL
AVGR,2019-04-16 15:41:00,0.59,0.686,,-1,0.096,16.27119,0,2,0.5998,0.6399,0.6482,AVGR lol people are so funny loosing your asses and still saying I dont think ill loose any more
AVGR,2019-04-16 14:56:00,0.59,0.686,,-1,0.096,16.27119,0,0,0.5953,0.6399,0.6482,AVGR wow fda and total destruction in one week
AVGR,2019-04-16 14:54:00,0.59,0.686,,-1,0.096,16.27119,0,0,0.5916,0.6399,0.6482,AVGR tiiiiiimmmmbeeerrrr
NVCN,2019-04-16 13:35:00,0.4179,0.437,,-1,0.0191,4.57047,1,0,0.4129,0.4343,0.4298,NVCN im just out of positive after 15 year holding seen this all lastyear
AVGR,2019-04-16 13:20:00,0.59,0.686,,-1,0.096,16.27119,2,2,0.6251,0.6399,0.6482,AVGR man only 2 stocks I ever bought this and NVCN both are biggest pos on the market I am destroyed research and facts do not matter here
NVCN,2019-04-16 12:41:00,0.4179,0.437,,-1,0.0191,4.57047,0,4,0.416,0.4343,0.4298,NVCN wow fda is such a crock agr just got approved and crashes 50 just like this piece of shit anyone with knowledge expain why it happen
AVGR,2019-04-16 12:34:00,0.59,0.686,,-1,0.096,16.27119,0,0,0.626,0.6399,0.6482,AVGR not saying anything is like pissing in my face
AVGR,2019-04-16 12:23:00,0.59,0.686,,-1,0.096,16.27119,1,0,0.6243,0.6399,0.6482,AVGR only reason
AVGR,2019-04-16 12:22:00,0.59,0.686,,-1,0.096,16.27119,1,0,0.6273,0.6399,0.6482,AVGR yes managment
NVCN,2019-04-16 12:21:00,0.4179,0.437,,-1,0.0191,4.57047,0,1,0.4111,0.4343,0.4298,NVCN lol dividends with penny stock lolo 5cents a year yahoo
AVGR,2019-04-16 12:18:00,0.59,0.686,,-1,0.096,16.27119,0,0,0.6297,0.6399,0.6482,AVGR bullshit same thing happened last time they got fda management fucked it up
NVCN,2019-04-16 12:09:00,0.4179,0.437,,-1,0.0191,4.57047,1,0,0.4154,0.4343,0.4298,NVCN this is theft out right
AVGR,2019-04-16 12:08:00,0.59,0.686,,-1,0.096,16.27119,0,0,0.6231,0.6399,0.6482,AVGR theft
AVGR,2019-04-16 12:07:00,0.59,0.686,,-1,0.096,16.27119,0,0,0.6235,0.6399,0.6482,AVGR theft
AVGR,2019-04-16 12:06:00,0.59,0.686,,-1,0.096,16.27119,0,0,0.6221,0.6399,0.6482,AVGR theft out right theft we all got suckered
NVCN,2019-04-16 11:42:00,0.4179,0.437,,-1,0.0191,4.57047,2,1,0.4111,0.4343,0.4298,NVCN got I cant wait to bail on this someday worst management for stock holders zero integrity zero communication fuck fred
AVGR,2019-04-15 14:59:00,0.6575,0.66,,-1,0.0025,0.38023,0,1,0.6623,0.6474,0.6242,AVGR no gas
AVGR,2019-04-15 13:00:00,0.6575,0.66,,-1,0.0025,0.38023,0,0,0.6649,0.6474,0.6242,AVGR oh that was an april fools day joke lol sorry buddy
AVGR,2019-04-15 12:59:00,0.6575,0.66,,-1,0.0025,0.38023,0,0,0.6608,0.6474,0.6242,oh that was a april fools joke buddy sorry lolAVGR
AVGR,2019-04-15 12:50:00,0.6575,0.66,,-1,0.0025,0.38023,0,0,0.67,0.6474,0.6242,AVGR never done
NVCN,2019-04-15 12:45:00,0.4169,0.4149,,-1,-0.002,-0.47973,0,0,0.4194,0.4103,0.4273,NVCN of course I do but im broke cause I bought avgr
AVGR,2019-04-15 12:40:00,0.6575,0.66,,-1,0.0025,0.38023,0,0,0.6719,0.6474,0.6242,AVGR oh what a positive lil hobbit lol
AVGR,2019-04-15 12:36:00,0.6575,0.66,,-1,0.0025,0.38023,0,0,0.6734,0.6474,0.6242,AVGR starving
AVGR,2019-04-15 12:36:00,0.6575,0.66,,-1,0.0025,0.38023,0,0,0.6734,0.6474,0.6242,AVGR I dont even get to have cheese in my mac and cheese no chonga in my chimichonga
AVGR,2019-04-15 12:34:00,0.6575,0.66,,-1,0.0025,0.38023,0,3,0.6704,0.6474,0.6242,AVGR fda does not always go up lol lesson I finally learned
AVGR,2019-04-15 12:33:00,0.6575,0.66,True,1,0.0025,0.38023,1,1,0.6711,0.6474,0.6242,AVGR lol were fkd this is exactly what happened last may exactly I feeling stupid please look it up fda then crashed this also happen NVCN
AVGR,2019-04-11 15:32:00,0.7251,0.6812,True,0,-0.0439,-6.05434,0,0,0.7285,0.7097,0.6821,nope its a reverse cowgirlAVGR
AVGR,2019-04-11 14:34:00,0.7251,0.6812,,-1,-0.0439,-6.05434,2,0,0.697,0.7097,0.6821,AVGR smells like poopy
AVGR,2019-04-11 11:47:00,0.7251,0.6812,True,0,-0.0439,-6.05434,0,0,0.7129,0.7097,0.6821,everybody was kunkfoo fighting this is awsomeAVGR
AVGR,2019-04-03 09:33:00,0.9649,0.9628,True,0,-0.0021,-0.21764,0,0,0.9522,0.963,0.9587,nother 1000k at 95AVGR
AVGR,2019-04-02 14:23:00,0.9894,0.9646,True,0,-0.0248,-2.50657,0,0,0.9751,0.9625,0.9676,waky wakyAVGR
NVCN,2019-04-02 14:22:00,0.4414,0.4499,True,1,0.0085,1.92569,0,0,0.449,0.4408,0.4495,waky wakyNVCN
AVGR,2019-04-02 13:22:00,0.9894,0.9646,True,0,-0.0248,-2.50657,5,1,0.9632,0.9625,0.9676,ok nother 1k AVGR
NVCN,2019-04-01 11:32:00,0.435,0.4396,True,1,0.0046,1.05747,1,0,0.4422,0.4489,0.4486,NVCN my butt is clinching lets take off
NVCN,2019-03-27 12:05:00,0.3888,0.3994,,-1,0.0106,2.72634,0,0,0.3752,0.3778,0.3776,ya feeling like a total suckerNVCN
NVCN,2019-03-26 14:13:00,0.4125,0.4168,,-1,0.0043,1.04242,0,0,0.4105,0.4018,0.4053,lol wow if i could sell tears i would be rich waaaaaaaaa im screwed to but im the one who pressed buy suck it upNVCN
NVCN,2019-03-25 14:42:00,0.4128,0.4105,,-1,-0.0023,-0.55717,0,0,0.4203,0.4042,0.4071,trulyNVCN
AVGR,2019-03-25 14:41:00,0.8515,0.8195,,-1,-0.032,-3.75807,0,0,0.86,0.8053,0.8186,stock twits gives me the shitsAVGR
AVGR,2019-03-25 13:29:00,0.8515,0.8195,,-1,-0.032,-3.75807,0,1,0.8436,0.8053,0.8186,AVGR 84
AVGR,2019-03-25 12:49:00,0.8515,0.8195,,-1,-0.032,-3.75807,1,0,0.8371,0.8053,0.8186,AVGR hello that was 84 please
AVGR,2019-03-25 12:49:00,0.8515,0.8195,,-1,-0.032,-3.75807,2,0,0.8371,0.8053,0.8186,AVGR do I hear 84 please uh please
AVGR,2019-03-25 12:48:00,0.8515,0.8195,,-1,-0.032,-3.75807,0,0,0.8371,0.8053,0.8186,AVGR 83838383838383
AVGR,2019-03-25 12:41:00,0.8515,0.8195,,-1,-0.032,-3.75807,2,0,0.838,0.8053,0.8186,AVGR 83838383838383838
AVGR,2019-03-25 12:37:00,0.8515,0.8195,,-1,-0.032,-3.75807,0,0,0.8383,0.8053,0.8186,what is with 8383 lolAVGR
NVCN,2019-03-25 11:20:00,0.4128,0.4105,,-1,-0.0023,-0.55717,0,0,0.41,0.4042,0.4071,NVCN so like crack
NVCN,2019-03-25 11:20:00,0.4128,0.4105,,-1,-0.0023,-0.55717,0,0,0.41,0.4042,0.4071,NVCN ahhhh dammit bought more
NVCN,2019-03-22 15:13:00,0.4108,0.4231,,-1,0.0123,2.99416,1,0,0.41,0.4004,0.4,NVCN looks like I gota keep my thumb up my ass a lil longer
NVCN,2019-03-21 14:29:00,0.4747,0.4583,,-1,-0.0164,-3.45481,5,3,0.5107,0.4399,0.4324,NVCN my hale marry 33k ave 60 cents I am now broke lol
AVGR,2019-03-14 13:01:00,0.7149,0.7298,,-1,0.0149,2.08421,0,0,0.6931,0.774,0.813,AVGR like a pair of crusty undies
AVGR,2019-03-14 12:57:00,0.7149,0.7298,,-1,0.0149,2.08421,1,0,0.6918,0.774,0.813,AVGR booo hooo
AVGR,2019-03-08 12:52:00,0.6127,0.6427,,-1,0.03,4.89636,7,2,0.6174,0.6355,0.645,AVGR another night dreaming of chocolate pudding another morning waking up with a spoon in my butt
NVCN,2019-03-06 13:55:00,0.5281,0.5352,,-1,0.0071,1.34444,2,0,0.5323,0.4894,0.5235,NVCN so happy for free knowlege on how to clean my god dam gutters
NVCN,2019-03-04 10:14:00,0.5136,0.5296,,-1,0.016,3.11526,0,0,0.475,0.5094,0.507,which day is earnings report nas says 27thNVCN
AVGR,2019-03-01 13:29:00,0.676,0.6905,,-1,0.0145,2.14497,1,1,0.6882,0.7007,0.6983,AVGR mecaleca hi meca hine ho
