SOLO,2019-02-15 09:50:00,4.373,4.587,,-1,0.214,4.89367,0,0,4.55,4.65,4.53,SOLO Well theres the 450 I was waiting for since yesterday just came later then I thought looks good now
SOLO,2019-02-14 10:59:00,4.8,5.787,,-1,0.987,20.5625,0,0,5.15,4.888,5.13,SOLO Ill be back here to pick up some around 450 end of day
SIG,2019-01-17 10:22:00,25.143,27.005,True,1,1.862,7.40564,2,0,25.976,25.862,25.727,SIG weve already found the floor today stock halted no short selling till after tomorrow close gonna ride the bounce
NFLX,2019-01-03 13:10:00,271.449,271.154,False,1,-0.295,-0.10868,0,0,271.95,268.522,267.383,NFLX waiting to death cross that 50ma
NFLX,2019-01-03 11:56:00,271.449,271.154,False,1,-0.295,-0.10868,1,1,271.251,268.522,267.383,NFLX tvcinvdncomakamaizednet stuck between 2 large down trends and a tiny up trend which will win take profits today boys
NFLX,2019-01-03 10:14:00,271.449,271.154,False,1,-0.295,-0.10868,3,0,266.711,268.522,267.383,NFLX feeling better about my puts I bought yesterday nflx cant fight the overall market trend
TLRY,2018-12-20 15:56:00,78.27,79.033,False,0,0.763,0.97483,1,0,78,77.811,77.989,TLRY Gonna close the gap tomorrow I bet big money has the lock up period end date on their calendars Dilution in 3 weeks
APHA,2018-12-03 10:57:00,5.735,6.344,,-1,0.609,10.61901,3,0,5.975,5.977,5.865,APHA foolcominvesting201812 positive article out today as well This will bounce back like SHOP and CRON did after the andrew left attack
