MNGA,2019-02-15 10:01:00,0.8694,0.9115,,-1,0.0421,4.84242,2,0,0.8517,0.8534,0.8734,MNGA no position here but hopefully this will make some giggle to the mooon
MNGA,2019-02-15 09:42:00,0.8694,0.9115,,-1,0.0421,4.84242,2,5,0.8605,0.8534,0.8734,MNGA good time to jump in No position here been watching it fall for a while
PCG,2019-01-25 09:51:00,11.712,12.775,,-1,1.063,9.07616,0,0,12.388,12.075,11.914,PCG whats the deal here fidelity shows this at 1188
AMRN,2019-01-10 15:40:00,18.356,15.209,True,0,-3.147,-17.14426,6,1,18.525,14.727,15.903,AMRN holy shitjust woke up to thisI work nights finally recovered losses but staying long
AMRN,2018-12-24 15:56:00,18.356,15.209,True,0,-3.147,-17.14426,2,0,18.273,14.727,15.903,AMRN now wheres that sob that told me I would not see single digits 6 weeks agoI hope hes right staying long
AMRN,2018-12-24 15:52:00,18.356,15.209,True,0,-3.147,-17.14426,0,18,18.351,14.727,15.903,AMRN average 2040 if only I had more to average down
AMRN,2018-11-14 10:25:00,18.356,15.209,True,0,-3.147,-17.14426,4,2,16.094,14.727,15.903,AMRN had to sell yesterday to cover margin debit Bad gamble lesson learned Now invested only what I can afford LONG
AMRN,2018-11-14 10:23:00,18.356,15.209,True,0,-3.147,-17.14426,12,0,15.662,14.727,15.903,AMRN cant blame longs for taking profits Results were positive AHA went well Going long and staying off this site to keep my sanity
