PBYI,2019-05-17 15:05:00,16.612,16.533,True,0,-0.079,-0.47556,0,0,16.64,16.085,15.995,PBYI sold a bunch of 17 calls Expire today Thanks for the premium
APHB,2019-05-08 13:35:00,0.3957,0.347,True,0,-0.0487,-12.3073,1,4,0.4008,0.3246,0.3177,APHB BBC News Phage therapy Viral cocktail saved my daughters lifebbccouknewshealth48199915
HRTX,2019-04-30 14:25:00,21.707,16.978,True,0,-4.729,-21.7856,5,2,21.935,18.022,18.66,HRTX JNJ will buy this
TSLA,2019-04-26 13:49:00,235.107,234.988,False,1,-0.119,-0.05062,5,0,234.71,237.942,239.258,TSLA Funding secured 50c
CFRX,2019-04-26 13:48:00,0.4893,0.4847,True,0,-0.0046,-0.94012,1,3,0.48,0.4853,0.4948,CFRX bought 10000 This will be back at 150 in 6 months
GT,2019-04-26 10:46:00,19.228,19.064,,-1,-0.164,-0.85292,0,0,19.299,19.577,19.569,GT You can bet this is being accumulated Its safe at this price with a good dividend to boot Sell covered calls when it hits 2050
UNFI,2019-03-12 13:03:00,13.425,13.35,,-1,-0.075,-0.55866,2,0,13.338,13.242,13.152,UNFI I had sold 15 calls This is great
HRTX,2019-03-11 12:43:00,25.249,25.45,True,1,0.201,0.79607,5,12,25.574,24.718,24.955,HRTX Im sad In 3 months the bird will no longer be an independent company
