Tr8rBoy,,2019-02-12 15:25:00,2.524,CRMD How are those Feb 15 25 calls doing right now
zaxby99,,2019-02-12 15:25:00,2.524,CRMD News very well may have leaked Institutions given the tipoff first
WallStpass,True,2019-02-12 15:25:00,2.524,CRMD Venture Capitalists success the channel is plug on the Street Congrats to all new and future millionaires
Luckierthangood,True,2019-02-12 15:24:00,2.521,CRMD where you at Earl You told us PM it would rock and roll
Guyco,True,2019-02-12 15:24:00,2.521,CRMD unleashed
IAmMsMoneyMaker,,2019-02-12 15:24:00,2.521,CRMD Its Nice knowing you are sitting on a bunch of shares 80k Total I will sleep well tonightAND this is just the BEGINNING
2DMooN,True,2019-02-12 15:24:00,2.521,CRMD THIS MOVEMENT WITH NO NEWS Imagine WHEN NEWS HIT HOLD ONNNNN
charles81076,,2019-02-12 15:24:00,2.521,CRMD tcon spiking too
JoeStockTrader,True,2019-02-12 15:23:00,2.513,CRMD most likely will never see below the 240 ever again
biolurker1,,2019-02-12 15:23:00,2.513,CRMD IMO News leaked and it will be fantastic
cdzTIC,,2019-02-12 15:23:00,2.513,CRMD Weekly chart
MJBIV,True,2019-02-12 15:23:00,2.513,CRMD welp this is fun but still here for the long game This didnt surprise me
xzano,,2019-02-12 15:23:00,2.513,CRMD all the 250 sell people are gonna be sorry
stk776,True,2019-02-12 15:22:00,2.494,CRMD AH will be more
Contributor,True,2019-02-12 15:22:00,2.494,CRMD damn I did say im out once I hit 1000 gains butfk it will try for 2000
Scalper777,True,2019-02-12 15:22:00,2.494,CRMD wonder what news we have after hours
Jemus,True,2019-02-12 15:22:00,2.494,CRMD volume is on
tnesbitt,,2019-02-12 15:22:00,2.494,CRMD I am expecting this increase in price to have some strength because it is driven my institutional investing Heythey know something
Absolutdude,True,2019-02-12 15:22:00,2.494,CRMD this day calls for a caucasian Cheers
buckdeeeznuts,,2019-02-12 15:22:00,2.494,CRMD wonder what Cornette is doing
vecheverri10,True,2019-02-12 15:21:00,2.527,CRMD up 12k gonna pay off these medical bills cause fuckcancer lets go neutrolin make mama some more coin
zigzag001,,2019-02-12 15:21:00,2.527,CRMD Cmon fat hippo You can do it Go eat through that 260 cmon
trixiemoneybags,True,2019-02-12 15:21:00,2.527,CRMD holy volume
aldawg21,,2019-02-12 15:21:00,2.527,CRMD HOLD TILL AT LEAST 6
GottaBlast,True,2019-02-12 15:21:00,2.527,CRMD I bought all I could afford and all of my HSA and IRA into this at the age of 31 10k 140 avg Make me proud
chhching,,2019-02-12 15:21:00,2.527,CRMD bunch of big buys out there
IAmMsMoneyMaker,,2019-02-12 15:21:00,2.527,CRMD NOW THIS IS FREAKIN FUN Worth the WAIT
JesseBohl,,2019-02-12 15:20:00,2.537,CRMD fellas and ladies As per CRMD history Be prepared for a massive pullback after a hard run Remember the fall fron 240 to 99
danny33,True,2019-02-12 15:20:00,2.537,CRMD about to make another run
SuperArtzy,,2019-02-12 15:20:00,2.537,CRMD epic climb just started
jpa11764,,2019-02-12 15:20:00,2.537,CRMD Tutes loading on upcoming news
DarkIlluzionz,True,2019-02-12 15:20:00,2.537,CRMD Not selling till 5 At least
cruzzz77,True,2019-02-12 15:20:00,2.537,CRMD Im holding strong selling target at 6
squidman69,True,2019-02-12 15:20:00,2.537,CRMD pulled out allmy shares out of a shit biotech stock yesterday and bought in last night Cant thank you ppl enough I LOVE YOU ALL
rvansomeren,True,2019-02-12 15:20:00,2.537,CRMD Loving the ride but this is so high off the 8dma At this level Im always concerned about short term pull back Thoughts
montanasky,,2019-02-12 15:20:00,2.537,CRMD whatever just happened
RosemaryThyme,,2019-02-12 15:20:00,2.537,CRMD Its at a 108week high
mdaneri,True,2019-02-12 15:20:00,2.537,CRMD today Im gaining 420000
catdaddy71,True,2019-02-12 15:19:00,2.533,CRMD Hold guys let get that 270 RELEASE THE DRAGON
Iamjustanoob,,2019-02-12 15:19:00,2.533,CRMD Now i wish i would of bought 10x more at 115 hmphhhh
soma_,,2019-02-12 15:19:00,2.533,CRMD I will start scaling out of march15 250 calls on rip and rebuy stock Not holding calls into opex GL
FWMC,,2019-02-12 15:19:00,2.533,CRMD Jack and Coke going to taste so good at 401 pm
WatchThePullBack,True,2019-02-12 15:19:00,2.533,CRMD lead the way well follow TTNP AMPE
DarkIlluzionz,True,2019-02-12 15:19:00,2.533,CRMD Wow Congrats to my fellow longs Today is a great day
DoubleDDer,True,2019-02-12 15:19:00,2.533,CRMD still holding from 119
MJBIV,True,2019-02-12 15:19:00,2.533,CRMD you might think Im crazy but Im not selling till 5
biolurker1,,2019-02-12 15:19:00,2.533,CRMD I am happier than Kim Kardashian at a Spandex sale You aint seen nothing yet
juicykielbasa,,2019-02-12 15:19:00,2.533,CRMD im so hard right now
benitocamelas01,,2019-02-12 15:19:00,2.533,CRMD I been trading this beauty since 065 a money maker machine will be up so good after fda approval in a couple months
Jemus,True,2019-02-12 15:19:00,2.533,CRMD Shits getting real Is longs have waited a long time for this News has to be dropping today or tomorrow
squidman69,True,2019-02-12 15:18:00,2.53,CRMD is there a price Target with this run
sthale,True,2019-02-12 15:18:00,2.53,CRMD like a bird set free
collucho,True,2019-02-12 15:18:00,2.53,CRMD WHY DIDNT I BUY MORE THIS MORNING
cwpalmer,,2019-02-12 15:18:00,2.53,CRMD waiting for sell off I have a feeling pumped trying to make a quick buck But Im ready
zaxby99,,2019-02-12 15:18:00,2.53,CRMD It seems exciting being in the 250s but in reality could be in the 2500s
TMLEVERAGE,True,2019-02-12 15:18:00,2.53,CRMD im naked lol
Wrangler66,,2019-02-12 15:18:00,2.53,CRMD boom Cheers again more to come
BioStockDD,True,2019-02-12 15:18:00,2.53,CRMD be smart and HOLD much more dollar upsides coming
cmac93,,2019-02-12 15:18:00,2.53,CRMD where iggy at
Billionaireclubcollc,,2019-02-12 15:18:00,2.53,CRMD family we moving like a nuclear This how u trade
DetPikachu,,2019-02-12 15:18:00,2.53,CRMD hopefully news soon to really crank it up
soma_,,2019-02-12 15:18:00,2.53,CRMD my previously stated range on this move was 235 to 320 looks like a multi day runner
DivFitness,True,2019-02-12 15:17:00,2.523,CRMD Still holding
MajorBuzzkill,,2019-02-12 15:17:00,2.523,CRMD okay this is either pd or FDA is coming within the next week or something since the government shutdown might not happen
DetPikachu,True,2019-02-12 15:17:00,2.523,CRMD happy for everyone who held through that shit storm
formerlysteelcity2,True,2019-02-12 15:17:00,2.523,CRMD boom grats fellow longs
Turgor359,True,2019-02-12 15:17:00,2.523,CRMD long since 157 avg 168 not selling
MJBIV,True,2019-02-12 15:17:00,2.523,CRMD love you guys
rvansomeren,True,2019-02-12 15:17:00,2.523,CRMD Technically theres no resistance level left until 326 which was hit Oct 2016
Jmac29,,2019-02-12 15:17:00,2.523,CRMD
jerryemerydelacruz,True,2019-02-12 15:17:00,2.523,CRMD Tacos for everybody
cruzzz77,True,2019-02-12 15:17:00,2.523,CRMD omfggggg
Lambo_Fund,,2019-02-12 15:17:00,2.523,CRMD HUGE cup
dixiebull,,2019-02-12 15:17:00,2.523,CRMD looks like it will flag in here then take off past 3 not seeing that today though
benitocamelas01,,2019-02-12 15:17:00,2.523,CRMD hit 52 week high Niceeeee
ipp1219,True,2019-02-12 15:17:00,2.523,CRMD I have 21 250 calls breakeven 260 Wish me luck
jpa11764,True,2019-02-12 15:17:00,2.523,CRMD WTF somebody knows something I dont Gotta be something big w these prices and volumes Seeing 50k bids popping like crazy Woo hoo
Cybertekmktg,True,2019-02-12 15:17:00,2.523,CRMD Classic FOMO
MartyNearDFW,True,2019-02-12 15:17:00,2.523,CRMD Still holding Not taking profits Still lots of room for CRMD to run in the next few months
stk776,True,2019-02-12 15:17:00,2.523,CRMD cup n handle No sell yet
HigherDesires,True,2019-02-12 15:17:00,2.523,CRMD 3 soon easy
Maximusgainz,True,2019-02-12 15:17:00,2.523,CRMD lol June 21st calls already in the money
ike3,True,2019-02-12 15:16:00,2.513,CRMD my 132 buyin feels pretty safe right now
soma_,,2019-02-12 15:16:00,2.513,CRMD people stop speculating on news do some homework its perfectly explainable as being driven by techs
Turgor359,True,2019-02-12 15:16:00,2.513,CRMD 3 eow
Sk8wizard,True,2019-02-12 15:16:00,2.513,CRMD didnt someone sell everything and buy 250 calls congrats to them
aceApproach,True,2019-02-12 15:16:00,2.513,CRMD any sellers Getting nervous man
cosmogo,,2019-02-12 15:16:00,2.513,CRMD
tnesbitt,,2019-02-12 15:16:00,2.513,CRMD Weeeeeand it is only the start
Tr8rBoy,,2019-02-12 15:16:00,2.513,CRMD Incredible Today alone made up for my losses over the past two quarters
prohope,True,2019-02-12 15:16:00,2.513,CRMD oh my
catdaddy71,True,2019-02-12 15:16:00,2.513,CRMD Theres gotta be a release News must be imminent
soma_,True,2019-02-12 15:16:00,2.513,CRMD glad I added 1500 at 232 when I said looks like a 15 day
BeeeeDooooh,True,2019-02-12 15:16:00,2.513,CRMD yeehawwwww
TAChartz,True,2019-02-12 15:15:00,2.518,CRMD we still got 45 minutes to go
dixiebull,,2019-02-12 15:15:00,2.518,CRMD through 250
blackwood821,True,2019-02-12 15:15:00,2.518,CRMD 260 coming
MJBIV,True,2019-02-12 15:15:00,2.518,CRMD wowwweeeee gotta love CRMD
KentTrades,True,2019-02-12 15:15:00,2.518,CRMD WHAT A DAY LADIES
mikeg0204,,2019-02-12 15:15:00,2.518,CRMD big money big money no whammy no whammyannnnd keep going up
emmanuel5,True,2019-02-12 15:15:00,2.518,CRMD I feel smart
Sk8wizard,True,2019-02-12 15:15:00,2.518,CRMD wow today has been GOOD
Triggr,True,2019-02-12 15:15:00,2.518,CRMD Yes patience pays off Thank You room
blackwood821,True,2019-02-12 15:15:00,2.518,CRMD slap that ask
CATFISH3R,True,2019-02-12 15:15:00,2.518,CRMD
TAChartz,,2019-02-12 15:15:00,2.518,CRMD
philmyorder,True,2019-02-12 15:15:00,2.518,CRMD big buys today icebergbotcomscrmd
slicktwit69,,2019-02-12 15:15:00,2.518,CRMD
moneygrabber3,,2019-02-12 15:15:00,2.518,CRMD
tc666,True,2019-02-12 15:15:00,2.518,CRMD next targets 27280285
rvansomeren,True,2019-02-12 15:15:00,2.518,CRMD Huge volume with this price action rvol is about 3 times higher than avg
davedemon,,2019-02-12 15:14:00,2.516,CRMD holy shit Batman Oooohhhhh yeah
servon,True,2019-02-12 15:14:00,2.516,CRMD last time it spiked wo news it dipped back to 1
slicktwit69,True,2019-02-12 15:14:00,2.516,CRMD WTF
SebiA2018,,2019-02-12 15:14:00,2.516,CRMD Jesus
Earlndunia,,2019-02-12 15:14:00,2.516,CRMD I call it news
MajorBuzzkill,,2019-02-12 15:14:00,2.516,CRMD man with how fast this is going up Im starting to feel concerned about a crash tomorrow or this week
Billionaireclubcollc,,2019-02-12 15:14:00,2.516,CRMD is moving
Holdmybeer1787,,2019-02-12 15:14:00,2.516,CRMD
Tr8rBoy,True,2019-02-12 15:14:00,2.516,CRMD The volume over the past 10 minutes is ridiculous
cwpalmer,,2019-02-12 15:14:00,2.516,CRMD watch for pull back peeps
zippyZ,True,2019-02-12 15:14:00,2.516,CRMD LETS GOOOOOO
TMLEVERAGE,True,2019-02-12 15:14:00,2.516,CRMD holy volume
kuzo55,,2019-02-12 15:14:00,2.516,CRMD This is insane
zaxby99,True,2019-02-12 15:14:00,2.516,CRMD That buy was huuuuuuuge
catdaddy71,True,2019-02-12 15:14:00,2.516,CRMD California
Zap360,True,2019-02-12 15:14:00,2.516,CRMD Can we hit 250 Ahhhhh
danny33,True,2019-02-12 15:14:00,2.516,CRMD wow this is insane
emmanuel5,True,2019-02-12 15:14:00,2.516,CRMD Oh snap yall
rich54,True,2019-02-12 15:13:00,2.482,CRMD come on HALT the damn thing release news IBB GILD
RosemaryThyme,,2019-02-12 15:13:00,2.482,CRMD Somebody knows something
ipp1219,,2019-02-12 15:13:00,2.482,CRMD look at her fly
Didgital,True,2019-02-12 15:13:00,2.482,CRMD zoom zoom zoom party people
h3llo3m,True,2019-02-12 15:13:00,2.482,CRMD If this hits 270 today I wish flash everyone on the road on my way home from work
blackjack17,,2019-02-12 15:13:00,2.482,CRMD news must be coming
LordDragon,True,2019-02-12 15:13:00,2.482,CRMD Damn girl250 already
tjtg1972,,2019-02-12 15:13:00,2.482,CRMD love you
bdiv,True,2019-02-12 15:13:00,2.482,CRMD 250
zaxby99,True,2019-02-12 15:13:00,2.482,CRMD Woah
KentTrades,True,2019-02-12 15:13:00,2.482,CLD meanwhile checkout CRMD rockingnew 52 week highs RIPPING
bmac123,,2019-02-12 15:13:00,2.482,CRMD and this is without news just think with news
StocZiggy,True,2019-02-12 15:13:00,2.482,CRMD what just happened
TMLEVERAGE,True,2019-02-12 15:13:00,2.482,CRMD look at her go
Scalper777,True,2019-02-12 15:13:00,2.482,CRMD holding with both hands and my dick
peakmindset,True,2019-02-12 15:13:00,2.482,CRMDGlad I didnt sell earlier this morning lol Im now up 340 I love this stock
zigzag001,,2019-02-12 15:12:00,2.43,CRMD HOLD IT HOLD IT DONT YOU EVEN THINK OF HITTING THAT SELL BUTTON I WILL SLAP YOU LIKE A BAD MONKEY DONT DO IT WAIT WAIT
KentTrades,True,2019-02-12 15:12:00,2.43,CRMD HOLD EVERYTHING multi year res broken
LordDragon,True,2019-02-12 15:12:00,2.43,CRMD OMG OMG OMG
MJBIV,True,2019-02-12 15:12:00,2.43,CRMD nice job team new 52 week high Teamwork makes the dream work
biolurker1,,2019-02-12 15:12:00,2.43,CRMD You think there is any news soon Cover shorts or loose more money
SuperArtzy,True,2019-02-12 15:11:00,2.428,CRMD look at double digits sonner then later
Grexican,True,2019-02-12 15:11:00,2.428,CRMD kinda like that
wheresthedog,,2019-02-12 15:11:00,2.428,CRMD holy sht
catdaddy71,True,2019-02-12 15:11:00,2.428,CRMD Told ya Hold your shares I see 270
Maddogs,True,2019-02-12 15:11:00,2.428,CRMD here we go
zaxby99,True,2019-02-12 15:10:00,2.436,CRMD With so many new institutional buys you have to think news is around the corner
Arberi,True,2019-02-12 15:10:00,2.436,CRMD remarkable And the pullbacks wont be that effective It is time for our exponential gains
HolyGrail24,True,2019-02-12 15:10:00,2.436,CRMD Need to drop news
KentTrades,True,2019-02-12 15:10:00,2.436,CRMD HARD AS A ROCK LADIES
Jmac29,True,2019-02-12 15:10:00,2.436,CRMD Bull god has been good to me YES In his name I pray
slicktwit69,True,2019-02-12 15:10:00,2.436,CRMD Incredible
jred3535,,2019-02-12 15:10:00,2.436,CRMD got me feeling like
jsmith0711,True,2019-02-12 15:10:00,2.436,CRMD holy sht Been away for 30 minutes and come back to this
MoneyJay33,,2019-02-12 15:09:00,2.446,CRMD New high
NVYS009,,2019-02-12 15:09:00,2.446,CRMD 270 HOD 52wkm Lets do it
catdaddy71,True,2019-02-12 15:09:00,2.446,CRMD Hold Ooon
golong411,True,2019-02-12 15:09:00,2.446,CRMD woooow
Crimsonwrath,True,2019-02-12 15:09:00,2.446,CRMD 52 WEEK HIGH
EJMaz,,2019-02-12 15:09:00,2.446,SENS Its nice to see Green Day here finally Thank you CramerSHL for the heads up on CRMD few months agolooking good and TNDM too
Maximusgainz,True,2019-02-12 15:09:00,2.446,CRMD wow Always blows away my expectations
IAmMsMoneyMaker,,2019-02-12 15:09:00,2.446,CRMD CRMD IS CRUSHING THE OLD 52 WEEK HIGH
JMJ243,True,2019-02-12 15:09:00,2.446,CRMD just left work and checked in here holy shit Congrats bulls
Rhys08,True,2019-02-12 15:09:00,2.446,CRMD there is no stopping this Takes out all the asks
TMLEVERAGE,True,2019-02-12 15:09:00,2.446,CRMD pivot point broken boohyah
ajl21,True,2019-02-12 15:09:00,2.446,CRMD ridiculous
danny33,True,2019-02-12 15:09:00,2.446,CRMD hold on
GreenForTheGreen,True,2019-02-12 15:09:00,2.446,CRMD yo this is wild
thewoodlandsoptimist,,2019-02-12 15:09:00,2.446,CRMD Yes sirrrrrrrrr
Sean2e,,2019-02-12 15:08:00,2.44,CRMD i love this stock
High_Camsta,True,2019-02-12 15:08:00,2.44,CRMD
Nthn_Drake,True,2019-02-12 15:08:00,2.44,CRMD new 52
zaxby99,True,2019-02-12 15:08:00,2.44,CRMD Volume picking up
moneygrabber3,True,2019-02-12 15:08:00,2.44,CRMD wooooooo keep going
IAmMsMoneyMaker,,2019-02-12 15:08:00,2.44,CRMD AND Were NOT DONE YET
JoeStockTrader,True,2019-02-12 15:08:00,2.44,CRMD massive cupandhandle Breakout
formerlysteelcity2,True,2019-02-12 15:08:00,2.44,CRMD hospital owners be like you got some of that Neutrolin
h3llo3m,True,2019-02-12 15:08:00,2.44,CRMD 243
Rhys08,True,2019-02-12 15:07:00,2.42,CRMD this makes my day after the TENX sell the news
prazey89,True,2019-02-12 15:07:00,2.42,CRMD some humongous buys there D
HolyGrail24,True,2019-02-12 15:07:00,2.42,CRMD Thats Buying power
StocZiggy,True,2019-02-12 15:07:00,2.42,CRMD WOW
ridethewave12,True,2019-02-12 15:07:00,2.42,CRMD I know some people on this board werent to happy with my comments after last conference call but so glad we are making together
chhching,,2019-02-12 15:07:00,2.42,CRMD whats next resistance
BeeeeDooooh,True,2019-02-12 15:07:00,2.42,CRMD PEW PEW
DrTalbytron,True,2019-02-12 15:07:00,2.42,CRMD Lets move The walls are like our Southern border small and gapped
ryangreene910,True,2019-02-12 15:07:00,2.42,CRMD there it is new high
avgdown,True,2019-02-12 15:07:00,2.42,CRMD hold ah Or this pd as usual w med
Sk8wizard,True,2019-02-12 15:07:00,2.42,CRMD NOTIFIED EVERYONE OF A NEW 52wk high
xzano,,2019-02-12 15:07:00,2.42,CRMD clink to everyone
tragichero,,2019-02-12 15:06:00,2.425,CRMD this wont stop omg
rate_limited,,2019-02-12 15:06:00,2.425,CRMD so mad I sold at in the 190s after the first pop GL to the longs who held
Earlndunia,,2019-02-12 15:06:00,2.425,CRMD it going to 250 wed should be the day
emmanuel5,True,2019-02-12 15:06:00,2.425,CRMD 52 week high
b2dddub2,True,2019-02-12 15:06:00,2.425,CRMD
IAmMsMoneyMaker,,2019-02-12 15:06:00,2.425,CRMD Waaaaaalah We DID it Wall Down
MajorBuzzkill,,2019-02-12 15:06:00,2.425,CRMD oh shit NEW 52 week high
TMLEVERAGE,True,2019-02-12 15:06:00,2.425,CRMD boom baby
danny33,True,2019-02-12 15:06:00,2.425,CRMD 250 coming
KentTrades,True,2019-02-12 15:06:00,2.425,CRMD WHAT A FUCKINGGG DAYYYYYY
TrippyAllen,True,2019-02-12 15:06:00,2.425,CRMD might get crazy up in here
restoration,True,2019-02-12 15:06:00,2.425,CRMD Lets goPatience works
chromashadows,True,2019-02-12 15:06:00,2.425,CRMD OKAY FINE 225 CHECK 240ISH CHECK ILL NOW CALL 258
EagleMania65,True,2019-02-12 15:06:00,2.425,CRMD NICE Blue sky
RawlsRoyce,True,2019-02-12 15:06:00,2.425,CRMD gotta love it
Earlndunia,,2019-02-12 15:06:00,2.425,CRMD there no my friend
BrandonDaisy,True,2019-02-12 15:06:00,2.425,CRMD Grilledx LETS GO
ptjammer1,True,2019-02-12 15:06:00,2.425,CRMD booooooom
zaxby99,True,2019-02-12 15:06:00,2.425,CRMD WOOT 52WK HIGH
Miketj,True,2019-02-12 15:06:00,2.425,CRMD bam
danny33,True,2019-02-12 15:06:00,2.425,CRMD POWER HOUR
MoneyJay33,,2019-02-12 15:06:00,2.425,CRMD Boom
mattd7,True,2019-02-12 15:06:00,2.425,CRMD Wow awesome
chhching,True,2019-02-12 15:06:00,2.425,CRMD BBBBOOOOOOMMMMMM
StocksArentSoHard,True,2019-02-12 15:05:00,2.398,CRMD NEW YEARLY HIGH Congrats to anyone who has bought CRMD this year and held New highs will keep coming We have all deserved this
Scalper777,True,2019-02-12 15:05:00,2.398,CRMD let me help with that 239 wall lol
MoneyJay33,,2019-02-12 15:05:00,2.398,CRMD 242
IAmMsMoneyMaker,,2019-02-12 15:05:00,2.398,CRMD WAIT FOR IT
Earlndunia,,2019-02-12 15:05:00,2.398,CRMD every one in going be happy for Valentines
IAmMsMoneyMaker,,2019-02-12 15:04:00,2.39,CRMD WOOHOO Here COMES THE NEW 52 WEEK HIGH
KentTrades,True,2019-02-12 15:04:00,2.39,CRMD SHORTS ARE FUCKKKKKKEDDDDDD
formerlysteelcity2,True,2019-02-12 15:04:00,2.39,CRMD
zaxby99,True,2019-02-12 15:04:00,2.39,CRMD MAGNUS SAMUELSON VIKING POWAH
Miketj,True,2019-02-12 15:04:00,2.39,CRMD 241
KentTrades,True,2019-02-12 15:03:00,2.39,CRMD HERE WE GO LADIES LAST CHANCE MASSIVE MOVE COMING
TMLEVERAGE,True,2019-02-12 15:02:00,2.362,CRMD Add some more whale oil to those gears please 3 white soldiers with a breakout of the 240 pivot for a closer please
Scalper777,True,2019-02-12 15:01:00,2.358,CRMD anyone with L2
Dkarma,,2019-02-12 15:01:00,2.358,CRMD cmon power hour
biolurker1,,2019-02-12 15:01:00,2.358,CRMD The CRMD walls are falling down faster than East Berlins
Earlndunia,,2019-02-12 15:01:00,2.358,CRMD set u clock Wednesday
catdaddy71,True,2019-02-12 15:00:00,2.355,CRMD California knows how to party
Scalper777,True,2019-02-12 15:00:00,2.355,CRMD T minus 60 minutes till launch
GreenTak,True,2019-02-12 15:00:00,2.355,APDN PH mover PH watchers CRMD PTI SCYX FET NMRD OTLK NAKD SPI CRMD MARA APDN WORX OPTT COTY CLD
RiskAndRun,True,2019-02-12 14:59:00,2.35,CRMD not that it needs anymore love but
Earlndunia,,2019-02-12 14:59:00,2.35,CRMD news coming
Jebus29,True,2019-02-12 14:59:00,2.35,CRMD buy know and receive 1 free
toast22,,2019-02-12 14:56:00,2.346,CRMD these resistance walls are the only walls I dont like
chavos,True,2019-02-12 14:56:00,2.346,CRMD date with fda yet
cdzTIC,,2019-02-12 14:55:00,2.35,CRMD Potential breakout
IAmMsMoneyMaker,,2019-02-12 14:54:00,2.349,CRMD This will be Fun during PH I envision price going UP like the electricity meter as the kilowatt hours run run
Slinger207,True,2019-02-12 14:53:00,2.342,CRMD anyone else notice that watchers list
TMLEVERAGE,True,2019-02-12 14:52:00,2.345,CRMD stop raid dont set stop losses
Earlndunia,,2019-02-12 14:51:00,2.34,CRMD who ever sell today is fool good news coming
2ManyPips,True,2019-02-12 14:50:00,2.35,CRMD not enough
Slinger207,True,2019-02-12 14:50:00,2.35,CRMD yall need to simmer down
Earlndunia,,2019-02-12 14:49:00,2.344,CRMD high volume we look good big boy no something
TMLEVERAGE,True,2019-02-12 14:48:00,2.341,CRMD 5M volume folks 110 to go
BioStockDD,True,2019-02-12 14:48:00,2.341,CRMD omg power hour is still coming too
emangez,,2019-02-12 14:48:00,2.341,CRMD we dont wanna go up too fast guys
Jebus29,True,2019-02-12 14:47:00,2.352,CRMD
NVYS009,True,2019-02-12 14:47:00,2.352,CRMD
KentTrades,True,2019-02-12 14:47:00,2.352,CRMD show me the cash UP front
KentTrades,True,2019-02-12 14:46:00,2.365,CRMD tutes are loaded
Tiger74Trader,True,2019-02-12 14:46:00,2.365,CRMD As the saying goesWall Street always knows first
IAmMsMoneyMaker,,2019-02-12 14:45:00,2.363,CRMD The 52 Week HIGH is going to be BROKEN DURING POWER HOURThe PH is our NEW HAPPY HOUR
zaxby99,True,2019-02-12 14:44:00,2.365,CRMD Breakout time
GottaBlast,True,2019-02-12 14:44:00,2.365,CRMD What happens when this is no longer attacked by shorts
Jonita,,2019-02-12 14:43:00,2.37,CRMD ok
MinnesotaTrader12,True,2019-02-12 14:43:00,2.37,CRMD buyers in control Lots of volume
stk776,True,2019-02-12 14:42:00,2.366,CRMD news imminent
IAmMsMoneyMaker,,2019-02-12 14:42:00,2.366,CRMD GOING UP BREAKOUTJust Happy to be out of the 229232 Range It was like watching water boillol
PoorNewbie,True,2019-02-12 14:42:00,2.366,CRMD New 52wk high lets go
Earlndunia,,2019-02-12 14:42:00,2.366,CRMD we going big after hr
ericmcnulty,,2019-02-12 14:42:00,2.366,CRMD 52 week high coming
prohope,True,2019-02-12 14:42:00,2.366,CRMD lets go pas hod
ericmcnulty,,2019-02-12 14:41:00,2.37,CRMD Holding since 23 waiting on 1000
TMLEVERAGE,True,2019-02-12 14:41:00,2.37,CRMD Lets do it bust that 240
alwaysgood2know,True,2019-02-12 14:41:00,2.37,CRMD Cannot keep this baby down UP UPUP
10diamonds,True,2019-02-12 14:41:00,2.37,CRMD hooooooooooooolyyyy
joelwork365,True,2019-02-12 14:41:00,2.37,CRMD here are some baby pictures from last fall its crazy how fast she has grown up
Covan9,True,2019-02-12 14:40:00,2.36,CRMD nice 11 green candle
rvansomeren,True,2019-02-12 14:40:00,2.36,CRMD Back in a position to smash through 240 just in time for PH
topstockalerts,True,2019-02-12 14:40:00,2.36,Top MoversPYX ADOM MDGS ALRN ELLI TROX ADMA COTY WORX CASM CGC APDN VKTX YGYI CLD CRBP CRMD CHGG APHA
IAmMsMoneyMaker,,2019-02-12 14:40:00,2.36,CRMD I called it The TREND UP IN THIS CASE IS YOUR FRIEND
GreenForTheGreen,True,2019-02-12 14:39:00,2.37,CRMD and were off
chhching,True,2019-02-12 14:39:00,2.37,CRMD I like it
biolurker1,,2019-02-12 14:39:00,2.37,CRMD Hilarious Fake walls are getting pulled
joelwork365,True,2019-02-12 14:39:00,2.37,CRMD if only we were still getting notifications with it this cheap
IAmMsMoneyMaker,,2019-02-12 14:38:00,2.356,CRMD Out of the PATTERN NOW 235 UP
biolurker1,,2019-02-12 14:35:00,2.33,CRMD Before you know it the next ceiling will be over 400
Rizk,True,2019-02-12 14:34:00,2.33,CRMD looking forward to POWA HOWA
catdaddy71,True,2019-02-12 14:34:00,2.33,CRMD All I can say is WOW Just wow This stock is
BeeeeDooooh,True,2019-02-12 14:34:00,2.33,CRMD
Slinger207,True,2019-02-12 14:32:00,2.329,ALRN nice job everyone CRMD doing great things as well
IAmMsMoneyMaker,,2019-02-12 14:31:00,2.33,CRMD TMinus 30 minutes till POWER HOUR kicks off It should be AWESOME
aldawg21,,2019-02-12 14:31:00,2.33,CRMD dont even think about selling THIS IS THE ENTRY We are headed to 6 after FDA approval
username32,True,2019-02-12 14:30:00,2.326,CRMD Personally I hope it just holds flat the rest of the day Lets enjoy a slow climb with healthy consolidation
TMLEVERAGE,True,2019-02-12 14:29:00,2.325,CRMD 3 white soldiers with a close at or above 240 pivot point would be awesome
Dnyshan,True,2019-02-12 14:26:00,2.33,CRMD very optimistic but EOD push to a 52 week high would be impressive as hell
GoldenKnightsFan,True,2019-02-12 14:26:00,2.33,CRMD I see large buy blocks again institutions addingperhaps
cobbs,,2019-02-12 14:25:00,2.321,CRMD market has a great day
MariaC82,,2019-02-12 14:25:00,2.321,Price or Vol Leaders ao218pmEST CASM GSUM APDN ADOM PYX ALRN ELLI TROX ADMA COTY WORX VKTX CLD CRBP CRMD CHGG APHA
emangez,True,2019-02-12 14:25:00,2.321,CRMD hope we consolidate above 240 for a couple months and build a new floor
moneygrabber3,True,2019-02-12 14:24:00,2.331,CRMD can we break this wall for power hour
JBuckster,True,2019-02-12 14:24:00,2.331,CRMD thru 35 with V is needed
10diamonds,True,2019-02-12 14:23:00,2.329,CRMD looks like heavyweight buying in progress
IAmMsMoneyMaker,,2019-02-12 14:21:00,2.33,CRMD LOLASK RECEIVE Movin ON
ProfitAsYouCan,True,2019-02-12 14:20:00,2.328,CRMD Neutrolin is the only reason this stock continues on its Mission To go to it highest point yet only to be interrupted with a BO
MJBIV,True,2019-02-12 14:19:00,2.333,CRMD should be some more buys towards Power Hour
HigherDesires,True,2019-02-12 14:19:00,2.333,CRMD entered in 125 been averaging up since I entered so much faith here
IAmMsMoneyMaker,,2019-02-12 14:18:00,2.336,CRMD I am READY for the Bid to be233And the Ask234 Then the PATTERN IS BROKEN The TREND IS UP
WallStpass,True,2019-02-12 14:18:00,2.336,CRMD Beautiful Strong MarketBeating potential Stay in and youll Win
