Xzibit,True,2019-02-12 14:16:00,2.325,IPCI CRMD CLD AMRH TRVN My top picks right now
thuggishsquash,,2019-02-12 14:15:00,2.321,CRMD is this spike solely based on BlackRock
DancingDave,,2019-02-12 14:15:00,2.321,CRMD
Didgital,True,2019-02-12 14:11:00,2.33,CRMD We gonna break the new 52 week high today or tmrw You cant just touch it and not break it
Arberi,True,2019-02-12 14:10:00,2.325,CRMD anyone in here thinking 6 by May
joelwork365,True,2019-02-12 14:10:00,2.325,CRMD remember the market size for Neutrolinoh and 10 year market exclusivity
Robgmbud,True,2019-02-12 14:10:00,2.325,CRMD getting nervous everyone is so cocky this kinda reminds me of when gern crashed
MJBIV,True,2019-02-12 14:07:00,2.315,CRMD According to latest SEC filings institutions at CorMedix Inc over past year have increased from 8490265 to 20390 121 shares
AM_510,,2019-02-12 14:06:00,2.316,CRMD whats a good entry point here
IAmMsMoneyMaker,,2019-02-12 14:06:00,2.316,CRMD READY to Break the Pattern I mentioned in my earlier post BECAUSE THE TREND IS UP
wallstpirate,,2019-02-12 14:06:00,2.316,CRMD Anyone know the market size for the US Thanks
DrTalbytron,True,2019-02-12 14:05:00,2.313,CRMD is this what the TA junkies call bull flagging
IAmMsMoneyMaker,,2019-02-12 14:03:00,2.325,CRMD Lets JUST get PAST 232 THEN OFF TO THE RACES
ProfitAsYouCan,True,2019-02-12 14:03:00,2.325,CRMD U know what strikes out as such a good thing CRMD only has 16419 watchers were moving up steadily under the radar Smilin
ChartMill,,2019-02-12 14:03:00,2.325,The industry average ROE is 2556 CRMD outperforms 87 of its industry peers chartmillcomanalyzephpu
MJBIV,True,2019-02-12 14:02:00,2.316,CRMD According to latest SEC filings insiders at CorMedix Inc have increased position in the stock by 4309 over the past 6 months
RocketStock21,True,2019-02-12 14:02:00,2.316,CRMD only wish I could get my tax return in time to make some even larger profits Just need to file my taxes first
chhching,True,2019-02-12 14:00:00,2.32,CRMD permission to launch
BioStockDD,True,2019-02-12 13:59:00,2.316,CRMD I see really no walls
HigherDesires,True,2019-02-12 13:59:00,2.316,CRMD adding more here
Jebus29,True,2019-02-12 13:56:00,2.308,CRMD this stock is going to force me into some tough decisionsred lambo or green lambo
issapunk,True,2019-02-12 13:56:00,2.308,CRMD I dont want a huge jump at PH that recedes the next day Lets steadily climb and break that 240 in the next 2 hours
jpjohansson1,,2019-02-12 13:54:00,2.29,CRMD What is the quickest way to get news on approvals buyouts etc Just the website
biolurker1,,2019-02-12 13:54:00,2.29,CRMD I have been saying this from when it was 59 Shorts are screwed here
cobbs,True,2019-02-12 13:50:00,2.315,CRMD order book is slim could see a true power hour
soma_,True,2019-02-12 13:48:00,2.312,CRMD looking now and I kinda think its gonna be a 15 day
TAChartz,True,2019-02-12 13:48:00,2.312,CRMD this is what Im waiting for It can drop any minute now
Earlndunia,,2019-02-12 13:47:00,2.317,CRMD news around corner short
Earlndunia,,2019-02-12 13:47:00,2.317,CRMD short cover u in trouble
MJBIV,True,2019-02-12 13:46:00,2.32,CRMD
KentTrades,True,2019-02-12 13:45:00,2.321,CRMD lol order got filled for another 2k at 229 on that last dip sweet now im really stiff
IAmMsMoneyMaker,,2019-02-12 13:45:00,2.321,CRMD For the past hour this is the range between 229 230 231 232 I FEEL A BREAKOUT COMING Just A Feelin
MJBIV,True,2019-02-12 13:44:00,2.332,CRMD volume picking up
KentTrades,True,2019-02-12 13:44:00,2.332,CRMD cant even think about selling a share until 35 plus
KentTrades,True,2019-02-12 13:43:00,2.32,CRMD 25s this week plus
MJBIV,True,2019-02-12 13:41:00,2.315,CRMD if this can go from 15 to 240 its not crazy to think this will be over 5 at all
mikeg0204,,2019-02-12 13:38:00,2.315,CRMD Really bummed i missed that drop to the 170s last week
TAChartz,True,2019-02-12 13:35:00,2.302,CRMD does his mean that FDA results can drop any minute now
StocksArentSoHard,True,2019-02-12 13:35:00,2.302,CRMD Another institutional buy from FRANKLIN RESOURCES INC
Grexican,True,2019-02-12 13:34:00,2.305,CRMD besrs left out of the fun lmao
BeeeeDooooh,True,2019-02-12 13:33:00,2.303,CRMD the bears hate us cuz they aint us
claudiagab,,2019-02-12 13:32:00,2.305,CRMD I like whats brewing volume picking up
Wrangler66,True,2019-02-12 13:31:00,2.309,CRMD VOLUME
MJBIV,True,2019-02-12 13:31:00,2.309,CRMD Tutes and smart retail moving our launch pad higher and higher till FDA news Live look
RyGuy79,True,2019-02-12 13:30:00,2.318,CRMD
UpToDaMoon,,2019-02-12 13:26:00,2.3,CRMD is the long cat still alive
UpToDaMoon,,2019-02-12 13:26:00,2.3,CRMD this is always a happy board
JBuckster,True,2019-02-12 13:24:00,2.305,CRMD 12 short interest
chromashadows,True,2019-02-12 13:24:00,2.305,CRMD since my 225 earlier did us well Ill call 245 for tomorrow
MJBIV,True,2019-02-12 13:22:00,2.295,CRMD
Shakedown321,True,2019-02-12 13:17:00,2.315,CRMD Someone picked super 250k shares today at 1130 Another insider or institution
biolurker1,,2019-02-12 13:17:00,2.315,CRMD The last 1 minute of the trading day is going to be a wild ride
Atwit4sure,True,2019-02-12 13:12:00,2.323,AMPE While waiting here loving the action on CRMD
chhching,True,2019-02-12 13:10:00,2.331,CRMD can someone explain what this forced conversion if over 225 What does this mean and is it bullish or bearish LOL
Earlndunia,,2019-02-12 13:09:00,2.328,CRMD going have good ah today
IAmMsMoneyMaker,,2019-02-12 13:09:00,2.328,CRMD We ARE Going HIGHERHuge VOLUMENEWS in the Wings TREND GOING UP
njlangfelder,True,2019-02-12 13:06:00,2.322,CRMD consolidating at 23 unbelievable
njlangfelder,True,2019-02-12 13:06:00,2.322,CRMD 24 gonna come quick
Long_Money,,2019-02-12 13:06:00,2.322,CRMD thx for convincing me to go long
IAmMsMoneyMaker,,2019-02-12 13:04:00,2.314,CRMD NOW Lunchtime is Over for EST peeps at least So lets get this PARTY STARTEDRESUME TAKEOFF
cruzzz77,True,2019-02-12 13:02:00,2.32,CRMD dont be discourage if it goes down its just part of the pattern
Arpeggio,,2019-02-12 13:02:00,2.32,CRMD If you like CRMD you will love TRVN when it gets approved LTBR set to move soonfor those that careor Love to make moneyIMO
MJBIV,True,2019-02-12 13:01:00,2.315,CRMD some sexy bull stair steps we building here
Jebus29,True,2019-02-12 12:56:00,2.318,CRMD nice to see it stop to build support Small pullbacks better than big dips
chhching,True,2019-02-12 12:56:00,2.318,CRMD does the ATM have anything to do with this volume Just reading some stuff over at IV
Burnt_Trader,True,2019-02-12 12:55:00,2.322,CRMD so for those wondering why insiders have stopped buying while tutes keep loading this is a possibility
cobbs,True,2019-02-12 12:53:00,2.325,CRMD holy shit Ive never seen it before in fullbut we have three white soldiers forming on the daily
Carlo123,,2019-02-12 12:49:00,2.301,CRMD Theres No Room for Bears here This is Longs VS Penny Flippers LMAO
Jemus,True,2019-02-12 12:49:00,2.301,CRMD Positive news is clearly coming very soon Way to much awesomeness happening for it not to be Big filings insider buys stopped
Carlo123,,2019-02-12 12:46:00,2.301,CRMD This is the news we are waiting for FDA Agrees with Cormedix to File NDA for NeutrolinThen the SP will shoot to 8
Fredsavage911,True,2019-02-12 12:42:00,2.332,TRVN AVGR CRMD OGEN
10diamonds,True,2019-02-12 12:39:00,2.322,CRMD now smaller institutions following the big Dawgs like Black rock way to go CRMD
BioStockDD,True,2019-02-12 12:39:00,2.322,CRMD institutions keep adding and they DONT add for 30 cents gainBuy and hold smart people
MJBIV,True,2019-02-12 12:39:00,2.322,CRMD 20190212 13F FRANKLIN RESOURCES INC 178295From 0 to 178295 Another Institutional filing today They keep coming
SgtBadger,True,2019-02-12 12:38:00,2.313,CRMD A nice morning here so im off to bed to make money while i sleep GLTA and have a profitable day
MJBIV,True,2019-02-12 12:36:00,2.299,CRMD 20190212 13F STATE STREET CORP 1474768247New Institution filing today
Carlo123,,2019-02-12 12:36:00,2.299,CRMD One Morning youll Wake up and the SP is 6 8
jnados1,,2019-02-12 12:34:00,2.313,CRMD check out VLRX
kingkong789,True,2019-02-12 12:33:00,2.314,CRMD selling a 25 of my position today Holding the rest for FDA news
Ryant19,True,2019-02-12 12:33:00,2.314,CRMD Has anyone heard any news about the European lawsuit
MJBIV,True,2019-02-12 12:31:00,2.303,CRMD when bears tell me its not coming back from the dip I just laugh and hold my shares
MJBIV,True,2019-02-12 12:30:00,2.312,CRMD ceiling is much higher with the data out Like FDA news soon based on this price action Uncharted territory over 240
MJBIV,True,2019-02-12 12:29:00,2.334,CRMD they thought I was crazy after the Data release CC Very similar to Q3 80 dip to 36 before rip to 240 Always dip before rip
CAPTAIN_UNDERPANTS,True,2019-02-12 12:28:00,2.335,CRMD Well shes certainly trying her best Escargot my car go 260 swiftly
LordDragon,True,2019-02-12 12:28:00,2.335,CRMD Hope all had a good luncha double espresso and we are set make the shorties sweat a bit more
Zap360,True,2019-02-12 12:28:00,2.335,CRMD Close above 230 is all I ask today 240 a bonus and 250 well Ill be damn
NVYS009,,2019-02-12 12:26:00,2.313,CRMD cant wait till power hourrrrr
Carlo123,,2019-02-12 12:25:00,2.306,CRMD FDA Guideline is 55 Neutrolin Result was 71 NDA News ComingWill Qualify Via LPAD
xzano,,2019-02-12 12:25:00,2.306,CRMD volume is nice somthins up CRMD goin hya
LunchTrader,True,2019-02-12 12:24:00,2.312,CRMD where you at chromashadows youre missing the party Man of the hour MJBIV is here
Earlndunia,,2019-02-12 12:24:00,2.312,CRMD there look happy today
Earlndunia,,2019-02-12 12:23:00,2.302,CRMD news around corner
Carlo123,,2019-02-12 12:22:00,2.305,CRMD 3 Today
ProfitAsYouCan,True,2019-02-12 12:22:00,2.305,CRMD Looks like Buys outweigh Sellers Sit on the side and watch If thats what youre into
MJBIV,True,2019-02-12 12:21:00,2.305,CRMD looking stable Like to see 52 week retest soon
CAPTAIN_UNDERPANTS,,2019-02-12 12:20:00,2.305,CRMD IT IS I THIS IS GOING TO BE ONE SPECIAL WEEK
squidman69,True,2019-02-12 12:19:00,2.305,CRMD 260
QualityTradez,True,2019-02-12 12:19:00,2.305,CRMD
ajl21,,2019-02-12 12:19:00,2.305,CRMD 5 15 30 min Charts looking weak
cruzzz77,True,2019-02-12 12:17:00,2.31,CRMD still holding strong I know theres way more to come
cruzzz77,True,2019-02-12 12:17:00,2.31,CRMD omg Im so happy now
biolurker1,,2019-02-12 12:10:00,2.312,CRMD This is huge
biolurker1,,2019-02-12 12:09:00,2.32,CRMD People need to understand what a game changer this is Far superior to anything in the market CMS hospitals and patients need this
wwwdotbrokenduckdotcom,,2019-02-12 12:09:00,2.32,CRMD there you go you broke that 20 day SMA daily so now it will restart the high of the day
Dnyshan,,2019-02-12 12:07:00,2.35,CRMD RETEST INCOMING
RyGuy79,True,2019-02-12 12:07:00,2.35,CRMD Looks like lunch is over
FraudBuster,,2019-02-12 12:07:00,2.35,CRMD Another strong move wvolume At the least I want to hold 226 on the close anything more is a bonus Above 240 next resistance 270
CarolWetzel,True,2019-02-12 12:06:00,2.332,CRMD The good news my average is 68 The bad news I only have 25 shares Lol
10diamonds,True,2019-02-12 12:06:00,2.332,CRMD lets goooooo I added another 1k to my position
wwwdotbrokenduckdotcom,,2019-02-12 12:06:00,2.332,CRMD niazh bounced off support red line but the blue 20 day SMA has become resistance on the daily At open it was above blue for the pop
TrippyAllen,True,2019-02-12 12:05:00,2.305,CRMD great volume today
stk776,True,2019-02-12 12:03:00,2.31,CRMD just need the news to drop
Bull_Bell,True,2019-02-12 12:02:00,2.305,CRMD HTGM NAK
FWMC,,2019-02-12 12:01:00,2.297,CRMD Its noon everyone go to the bar and have a hamburger and beer its on out buddy who has 13 million shares on the boardWish I was him
yodapr,True,2019-02-12 12:01:00,2.297,TTNP CRMD CCCL SEEL ZKIN
10diamonds,True,2019-02-12 12:01:00,2.297,CRMD So the black rock has 26 Million shares got in but anyone knows what price did they get and did they bought recently
MJBIV,True,2019-02-12 11:58:00,2.318,CRMD VLRX for today GL Bulls
PreacherBot,,2019-02-12 11:58:00,2.318,CRMD So this happened to Gilead And Neutrolin had a GREAT P3 Hoping for good FDA news financeyahoocomnewsgile
Outta_Pocket,True,2019-02-12 11:56:00,2.318,CRMD
Arberi,True,2019-02-12 11:55:00,2.312,CRMD more assurance today that our next dip most likely will not go below 200
xzano,,2019-02-12 11:54:00,2.31,CRMD tick tick tick
danny33,True,2019-02-12 11:54:00,2.31,CRMD question is how many times will it bounce off 240 wall
10diamonds,True,2019-02-12 11:53:00,2.29,CRMD got in at 217 lolfirst buy 210 enjoying the ride
Dnyshan,True,2019-02-12 11:52:00,2.28,CRMD when we break the 240 wall whos posting the gif of the ice king on the dragon blowing up the wall from GOT
biolurker1,,2019-02-12 11:50:00,2.27,CRMD Day traders are not the brightest bulbs on the circuit
kingpol86,True,2019-02-12 11:49:00,2.271,CRMD i dont think shorts will have a good time here
aldawg21,True,2019-02-12 11:49:00,2.271,CRMD stands for Cash Real Money Dudes
RyGuy79,True,2019-02-12 11:48:00,2.26,CRMD It aint pretty but once we break 240 this cup and handle is going to be epic
Earlndunia,,2019-02-12 11:47:00,2.272,CRMD we are love each other we big family here
Grexican,True,2019-02-12 11:46:00,2.277,CRMD gotta love earl though lol
Earlndunia,,2019-02-12 11:46:00,2.277,CRMD when news hit easy 5 plus
ajl21,,2019-02-12 11:45:00,2.285,CRMD expect we finish mid or maybe hi 220s not sure we give 240 a serious retest
catdaddy71,True,2019-02-12 11:45:00,2.285,CRMD We still have Lunch and PH Im not selling a single share
Earlndunia,,2019-02-12 11:44:00,2.285,CRMD news is come short cover today are u be crying
Earlndunia,,2019-02-12 11:42:00,2.278,CRMD let get this babe 242 or over
Holdmybeer1787,True,2019-02-12 11:41:00,2.269,CRMD bought more on the dip at 225
username32,True,2019-02-12 11:41:00,2.269,CRMD These week people selling at a 20 cent gain fail to see the big picture haha
GoldenKnightsFan,True,2019-02-12 11:41:00,2.269,CRMD there is no resistance behind 240It is the last wall to collapse
squidman69,True,2019-02-12 11:40:00,2.265,ONCS make your money back at CRMD
chromashadows,,2019-02-12 11:40:00,2.265,CRMD ask wall lv2 go kick it dow n
Earlndunia,,2019-02-12 11:39:00,2.263,CRMD Santa come in Feb
Joshbarn,,2019-02-12 11:39:00,2.263,CRMD just scooped another five shares folks
KentTrades,True,2019-02-12 11:39:00,2.263,CRMD holding all shares will pop right back up close above 24
chromashadows,True,2019-02-12 11:39:00,2.263,CRMD still holding patiently Got all the time in the world
Earlndunia,,2019-02-12 11:39:00,2.263,CRMD dont worry my friend it will go back up today over 230 over up up on way
dpveritasgold,,2019-02-12 11:38:00,2.251,CRMD Winning with this one and REFR today
alwaysgood2know,True,2019-02-12 11:38:00,2.251,CRMD will continue to climb and I will continue to hold
IAmMsMoneyMaker,,2019-02-12 11:38:00,2.251,CRMD HERE IS YOUR DIP After Lunch we RESUME our UPWARD Trajectory
chromashadows,,2019-02-12 11:37:00,2.247,CRMD lv2
catdaddy71,True,2019-02-12 11:36:00,2.253,CRMD Why sell a 600 share for 225 Why do that
r1ryderz08,True,2019-02-12 11:36:00,2.253,CRMD wrong damn way buddy
GoldenKnightsFan,True,2019-02-12 11:35:00,2.238,CRMD cancel your stop loss orders to prevent MMs and shorts from attacking and borrowing your shares Think about that folks
Ventura_Investments,True,2019-02-12 11:35:00,2.238,CRMD In this madness almost forgot about shorts
Billionaireclubcollc,,2019-02-12 11:35:00,2.238,CRMD I am sure it was a lot more this morning but I had DADDY DUTIES I have a new little 1 coming but congrats to our CRMD family
HigherDesires,True,2019-02-12 11:34:00,2.252,CRMD will be buying even more soon
enjigz,,2019-02-12 11:34:00,2.252,CRMD Coming down hardIm still holding
formerlysteelcity2,True,2019-02-12 11:34:00,2.252,CRMD even if we end up one cent longs will take a green day with over 10m volume
Crimsonwrath,True,2019-02-12 11:33:00,2.26,CRMD Price now doesnt matter you shouldnt be selling until FDA news
xzano,,2019-02-12 11:31:00,2.274,CRMD dont panic lunchtime sell off profit taker wannabeez they couldnt be more wrong dont sell CRMD for pennies dollars soon come
wwwdotbrokenduckdotcom,,2019-02-12 11:31:00,2.274,CRMD niazh see these lines Niazh These are your daily supports 240 is 52 week high so strong resistance there as always
b2dddub2,True,2019-02-12 11:31:00,2.274,CRMD
Joshbarn,,2019-02-12 11:31:00,2.274,CRMD people should avoid stop loss rt now and its triggers Monitor the price closely and then decide you will miss out otherwise
formerlysteelcity2,True,2019-02-12 11:30:00,2.277,CRMD what I shoulda said is that it needs volume and upwards movement to get over 2 macd Its currently doing that now
Luckbox24,,2019-02-12 11:30:00,2.277,CRMD none of you know what youre talking about
ajl21,,2019-02-12 11:29:00,2.281,CRMD Needs to come back to low 220s
DrScales,True,2019-02-12 11:29:00,2.281,CRMD okay this means news is on the way good news
rvansomeren,True,2019-02-12 11:28:00,2.279,CRMD 2 things here clearly the resistance at 240 is deadly strong But more importantly when it breaks it will be awesome
Rhys08,True,2019-02-12 11:28:00,2.279,CRMD thanks for the shares
RyGuy79,True,2019-02-12 11:27:00,2.28,CRMD Stop loss raid Time for some cheap shares
MYredCAP,,2019-02-12 11:27:00,2.28,CRMD lets take out those stop loss
Matt12345,True,2019-02-12 11:26:00,2.292,CRMD this will trade 225240 till next Monday when it breaks out just after all the 250 calls expire
danny33,True,2019-02-12 11:26:00,2.292,CRMD lunchtime break
Sk8wizard,True,2019-02-12 11:25:00,2.313,CRMD Ill check back after lunch good morning run Would have love to hold but Ill take it for now
TrippyAllen,True,2019-02-12 11:24:00,2.31,CRMD might be done until after lunch
kryptoknight,True,2019-02-12 11:24:00,2.31,CRMD looking at the comments I see more investors than traders
Alina91,False,2019-02-12 11:24:00,2.31,MNGA the money you guys are burning here you could have 2x3xed elsewhere like CRMD
cobbs,,2019-02-12 11:23:00,2.315,CRMD might see consolidation from here to the rest of the day
Earlndunia,,2019-02-12 11:21:00,2.331,CRMD big boys no good new FDA is come to u home
Arberi,True,2019-02-12 11:20:00,2.326,CRMD coming back down to mid 220s with 230s finish Id be happy w that
Investorh,True,2019-02-12 11:20:00,2.326,JD TRXC CPRX CRMD all in at bottom for long sitting now watching my money growing
mandymagoo,True,2019-02-12 11:20:00,2.326,CRMD glad I added on Thursdays dip
zaxby99,True,2019-02-12 11:20:00,2.326,CRMD If this goes over 240 we might start trending
catdaddy71,True,2019-02-12 11:20:00,2.326,CRMD Time for a rest If you eat breakfast you can run all day til 300
Joshbarn,,2019-02-12 11:20:00,2.326,CRMD this is the real deal
MJBIV,True,2019-02-12 11:18:00,2.355,CRMD added a few hundred shares id like to see a new 52 week High
Earlndunia,,2019-02-12 11:17:00,2.352,CRMD we going to have good Valentime day
IAmMsMoneyMaker,,2019-02-12 11:16:00,2.353,CRMD is getting READY TO SLAY THE 52 WEEK HIGHA Great Stock does not SIMPLY BEAT the 52 Week HighJust taking a BRIEF REST
danny33,True,2019-02-12 11:14:00,2.351,CRMD needs a breather Whew
Fredsavage911,True,2019-02-12 11:14:00,2.351,CRMD congrats to all in here very wise investment
RyGuy79,True,2019-02-12 11:14:00,2.351,CRMD Just waiting for the sound
vecheverri10,True,2019-02-12 11:14:00,2.351,CRMD is she halted Hmmm
Earlndunia,,2019-02-12 11:14:00,2.351,CRMD set u clock Wednesday 730
Grexican,True,2019-02-12 11:12:00,2.36,CRMD yawn let me know when were at 6 and legit bo talksPennies boys and girls We all know whats up here
jaybroni23,True,2019-02-12 11:12:00,2.36,CRMD where is CAPTAINUNDERPANTS i miss himher
KentTrades,True,2019-02-12 11:12:00,2.36,CRMD 25 this aft
Joshbarn,,2019-02-12 11:11:00,2.36,CRMD would be interesting and nice have a another 3 or more percent rise in the next 30 min
sebasjim96,True,2019-02-12 11:11:00,2.36,CRMD HEALTHY
lynntnic,True,2019-02-12 11:11:00,2.36,CRMD
peakmindset,True,2019-02-12 11:10:00,2.36,CRMD You sexy beast you Ive been in since last April at 050 and trying to figure out when to sell I missed several times over 220
LordDragon,True,2019-02-12 11:10:00,2.36,CRMD L2
Carlo123,,2019-02-12 11:10:00,2.36,CRMD if this breaks 240 we get to 3
GreenTak,True,2019-02-12 11:09:00,2.368,APDN NHOD Holding this one Watching today CRMD PTI SCYX FET NMRD OTLK NAKD SPI CRMD MARA APDN WORX OPTT COTY CLD
Luckierthangood,True,2019-02-12 11:08:00,2.375,CRMD space jam
posterboy,,2019-02-12 11:08:00,2.375,CRMD holy moly
bmac123,,2019-02-12 11:08:00,2.375,CRMD wheres earl
AlwaysPowerHourS0mewhere,True,2019-02-12 11:08:00,2.375,CRMD post lvl 2 please Thank you and lets go CRMD
RyGuy79,True,2019-02-12 11:08:00,2.375,CRMD One does not simply tie the 52week high
Didgital,True,2019-02-12 11:07:00,2.368,CRMD I love you all
Sk8wizard,True,2019-02-12 11:07:00,2.368,CRMD my shiny teeth and me
formerlysteelcity2,True,2019-02-12 11:07:00,2.368,CRMD sorry over 2 first Then by April 5
zaxby99,True,2019-02-12 11:07:00,2.368,CRMD news news news
Rhys08,True,2019-02-12 11:06:00,2.36,CRMD second try to break it
LordDragon,True,2019-02-12 11:06:00,2.36,CRMD Lunchtime coming up Intermission
formerlysteelcity2,True,2019-02-12 11:06:00,2.36,CRMD wants to go higher to get that macd over 5
cosmogo,True,2019-02-12 11:06:00,2.36,CRMD bears have no chance
ajl21,,2019-02-12 11:05:00,2.348,CRMD needs to retest 240
formerlysteelcity2,True,2019-02-12 11:05:00,2.348,CRMD JMU ALIM ANFI
chhching,,2019-02-12 11:05:00,2.348,CRMD so do you guys think this is due to tute loading and fomo or people actually knowing something that the rest of us dont
Sk8wizard,True,2019-02-12 11:05:00,2.348,CRMD going up
xzano,,2019-02-12 11:03:00,2.345,CRMD it just hit 239 jumped back down to 235
SgtBadger,True,2019-02-12 11:03:00,2.345,CRMD i block him and it goes upi should block more trolls and bears
issapunk,True,2019-02-12 11:03:00,2.345,CRMD this stock has taken over my entire life I think about it ALL day I would love a buyout ASAP so I can relax again lol
JUVECR7,True,2019-02-12 11:01:00,2.328,CRMD
jpa11764,True,2019-02-12 11:00:00,2.325,CRMD Somebody knows somethingcome on give it up News FDA
SgtBadger,True,2019-02-12 11:00:00,2.325,CRMD and heres my block lol
eatthepennies,False,2019-02-12 11:00:00,2.325,CRMD AND HERES THE DUMP
Matt12345,True,2019-02-12 10:58:00,2.325,CRMD you really think mm are gonna let everyone cash in on the 215 250 calls Nah
rvansomeren,True,2019-02-12 10:58:00,2.325,CRMD 52 wk high is always a great thing as it will trigger tons of trader alerts to the new milestone Some will buy based on just that
RyGuy79,True,2019-02-12 10:57:00,2.324,CRMD If youve sold you need to get back in There is no way we arent breaking the 52week high today
RubberDuck13,True,2019-02-12 10:57:00,2.324,CRMD
ybraya,,2019-02-12 10:57:00,2.324,CRMD nice consolidation This bad boy is testing the 52high
kryptoknight,True,2019-02-12 10:57:00,2.324,CRMD nobrainer
Arberi,,2019-02-12 10:57:00,2.324,CRMD this shit touched 240 and immediately dropped lmaoo
Crimsonwrath,True,2019-02-12 10:56:00,2.322,CRMD RIP 240
Carlo123,,2019-02-12 10:56:00,2.322,CRMD This is a 6 Stock NDA Application is coming FDA Guideline Requires 55 Primary Endpoint Heotrolin Result was 71 25 with BO
catdaddy71,True,2019-02-12 10:54:00,2.33,CRMD Like I said Get ready for the lunch run and power hour Longs hold on I see 260 today JMO
Carlo123,,2019-02-12 10:54:00,2.33,CRMD We should be breaking 3 Today
Joshbarn,,2019-02-12 10:54:00,2.33,CRMD bustttttttin our baby
HigherDesires,True,2019-02-12 10:53:00,2.333,CRMD if you havent noticed it pays to listen to the longs and ignore the trolls on this board
cosmogo,,2019-02-12 10:53:00,2.333,CRMD what a beast what a beauty
vecheverri10,,2019-02-12 10:53:00,2.333,CRMD debating selling half my position at 240 missed out on the chance last October with my 56 cent average hmmmm
TAChartz,True,2019-02-12 10:53:00,2.333,CRMD here we go retest that 240 lets gooo
KentTrades,True,2019-02-12 10:52:00,2.344,CRMD added back all my shares on that dip lets goo
RyGuy79,True,2019-02-12 10:52:00,2.344,CRMD
enjigz,True,2019-02-12 10:52:00,2.344,CRMD This tests 240 again before noon
tommycash44,True,2019-02-12 10:52:00,2.344,CRMD anybody in this for the past 3 months is up almost 100 The bears have no case here Bull or nothing at this point
cwpalmer,True,2019-02-12 10:51:00,2.342,CRMD just remember people do your own DD profit not matter how big or small if your decision CRMD
RyGuy79,True,2019-02-12 10:51:00,2.342,CRMD That was your dip
LordDragon,True,2019-02-12 10:50:00,2.329,CRMD Never forget shorties
issapunk,,2019-02-12 10:50:00,2.329,CRMD my coworker just told me to sell and that I never know when to sell I screamed at him He held TLRY at 300 lmao
Slinger207,True,2019-02-12 10:50:00,2.329,CRMD bullish af healthy pullback never hurt anyone
zaxby99,True,2019-02-12 10:49:00,2.323,CRMD Waiting on that halt to come
bdiv,,2019-02-12 10:48:00,2.305,CRMD up or dip
xzano,,2019-02-12 10:48:00,2.305,CRMD you gotta be nuts to sell your CRMD shares how many times do we need to tell you CRMD is going much higher better start listening
Carlo123,,2019-02-12 10:48:00,2.305,CRMD thats a lot of money for the penny flippers for breakfast lunch dinner pay apt rental gas and some beer lmao
Tony_Clifton,True,2019-02-12 10:47:00,2.312,CRMD Resistance at 233
LordDragon,True,2019-02-12 10:47:00,2.312,CRMD Shorties trying to bring it downhehehehehegood luck
Sk8wizard,True,2019-02-12 10:46:00,2.315,CRMD alright day traders you can leave now
GoldenKnightsFan,True,2019-02-12 10:46:00,2.315,CRMD 900 if approved for hemodialysis2030 if approved for broader usewhich will be eventually
Maximusgainz,True,2019-02-12 10:46:00,2.315,CRMD wheres that guy with the 12 million shares lol Guys made enough for a lambo past 2 days days
catdaddy71,True,2019-02-12 10:46:00,2.315,CRMD Buy the dips
