MoneyJay33,,2019-02-12 10:46:00,2.315,CRMD No news yetwhat happens when we get the newsshow me some
Vrodcarpediem1,,2019-02-12 10:46:00,2.315,CRMD Money money money I need more
BlackAxeCapital,True,2019-02-12 10:46:00,2.315,CRMD Im long Im not hedging on this opportunity for penniesMy average stays and so do I dont get caught without shares on hand News
xzano,,2019-02-12 10:46:00,2.315,CRMD you wanted a dip Here it is
StocksArentSoHard,True,2019-02-12 10:45:00,2.337,CRMD Another institutional buy today increasing their position by 362
mrinvestorpro,,2019-02-12 10:45:00,2.337,CRMD anyone can post multiple watch for these only some can give u the heads up seconds before
FWMC,,2019-02-12 10:45:00,2.337,CRMD Ok MOFos no selling for pennies hold the line
MajorBuzzkill,,2019-02-12 10:45:00,2.337,CRMD hey quick question Im locked in PDT with RH Can I sell a specific stock and buy it back the same day
joelwork365,True,2019-02-12 10:45:00,2.337,CRMD adding more if she dips
zaxby99,True,2019-02-12 10:45:00,2.337,CRMD News soon My guess is this week or next
mrinvestorpro,,2019-02-12 10:45:00,2.337,CRMD what was it I said few days ago
WOKEONE,True,2019-02-12 10:45:00,2.337,CRMD news coming think this could go double digits this year good luck to all
noname69,True,2019-02-12 10:44:00,2.346,CRMD is this fomo or news incoming
Riskybiskky,,2019-02-12 10:44:00,2.346,CRMD good job everybody
DrTalbytron,True,2019-02-12 10:44:00,2.346,CRMD 240 rejected Now for a dip to support and load up
KentTrades,True,2019-02-12 10:44:00,2.346,CRMD Im weak i had to take 2500 off there at 239 that just got me so hard added this morning at 22 wow
biolurker1,,2019-02-12 10:43:00,2.353,CRMD Must suck if youre short
bdiv,True,2019-02-12 10:43:00,2.353,CRMD looking for another dip to load up more
BuyLoweSellHi,,2019-02-12 10:43:00,2.353,CRMD man you just dont see charts like this very oftenWhat a beautyCongrats fellow bulls
SuperArtzy,True,2019-02-12 10:43:00,2.353,CRMD its just 1040am good morning longs
BioStockDD,True,2019-02-12 10:43:00,2.353,CRMD volume is smoking Anyone suspect we get some news within a week I do
Sk8wizard,True,2019-02-12 10:43:00,2.353,CRMD sellers Yawn
ajl21,,2019-02-12 10:43:00,2.353,CRMD out GL all Will reenter after it cools off
RepairGeekz,True,2019-02-12 10:42:00,2.354,CRMD this is nice
catdaddy71,True,2019-02-12 10:42:00,2.354,CRMD Can Somebody post a Lvl2
SuperArtzy,,2019-02-12 10:42:00,2.354,CRMD no pull back
RiverLife,True,2019-02-12 10:42:00,2.354,CRMD This is sweeeeeet
Bare_Rider,,2019-02-12 10:42:00,2.354,CRMD just paid for the rest of my college tuition today Bought in at 52 cents averaged up to 80 and have held patient What a DAY
2ManyPips,True,2019-02-12 10:42:00,2.354,CRMD off to 10
rollhorns,True,2019-02-12 10:41:00,2.372,CRMD our candles are about to start getting a whole lot taller FDA news must be right around the corner
Ladybug17,True,2019-02-12 10:41:00,2.372,CRMD Wow Lol Did I cover it all
alwaysgood2know,True,2019-02-12 10:41:00,2.372,CRMD to the moon
xzano,,2019-02-12 10:41:00,2.372,CRMD hate to say I told ya so but we told ya so Congrats CRMD family what a fun ride its just beginning
ajl21,True,2019-02-12 10:41:00,2.372,CRMD and MIME good for me today
ITvestor,True,2019-02-12 10:41:00,2.372,CRMD Remember even at 250 co EV is only 300 M This for a product sale potential of 1 5 Billions yes billions annually
Jemus,True,2019-02-12 10:41:00,2.372,CRMD So is it safe to say we wont be dropping back to the 190s again
enjigz,,2019-02-12 10:41:00,2.372,CRMD 50k wall at 240
catdaddy71,True,2019-02-12 10:41:00,2.372,CRMD you have seen anything Alerts are blazing
TMLEVERAGE,True,2019-02-12 10:41:00,2.372,CRMD break that 240 pivot point
moneygrabber3,True,2019-02-12 10:40:00,2.39,CRMD lets go break the 52 week high
montanasky,,2019-02-12 10:40:00,2.39,CRMD holyshit broke 52w
thesmallinvestor,True,2019-02-12 10:40:00,2.39,CRMD dear lord I love this stock haha tempted to sell but I know what happens after that news drops and it shoots to 5 haha
Rhys08,True,2019-02-12 10:40:00,2.39,CRMD it is storming off With this speed we will run over the 52week high
BeeeeDooooh,True,2019-02-12 10:40:00,2.39,CRMD
kryptoknight,,2019-02-12 10:40:00,2.39,CRMD suspiciously bullish
LordDragon,True,2019-02-12 10:40:00,2.39,CRMD Here shortieslunch is ready
rvansomeren,True,2019-02-12 10:40:00,2.39,CRMD 240 its game time right here
g_time,True,2019-02-12 10:40:00,2.39,CRMD I dont know who turned me on to this at 39 but I would like to thank them Making tons of off of this
chhching,True,2019-02-12 10:40:00,2.39,CRMD lets see if 240 gives us trouble
ybraya,True,2019-02-12 10:40:00,2.39,CRMD out at 238 GLTA
Sk8wizard,True,2019-02-12 10:40:00,2.39,CRMD 52wk high
erikmatson,,2019-02-12 10:40:00,2.39,CRMD whoa
MJBIV,True,2019-02-12 10:39:00,2.39,CRMD Beautiful
Dnyshan,,2019-02-12 10:39:00,2.39,CRMD We can taste that 52 week high
Sk8wizard,True,2019-02-12 10:39:00,2.39,CRMD my calls might be sold sooner than March 15
davedemon,,2019-02-12 10:39:00,2.39,CRMD there she blows
Earlndunia,,2019-02-12 10:39:00,2.39,CRMD up up way he we come 3
PoorNewbie,True,2019-02-12 10:39:00,2.39,CRMD My 4835 shares at 160 looking good right now Small position but still good
SgtBadger,True,2019-02-12 10:39:00,2.39,CRMD Come on baby lets break that 240
El_Duderino11,True,2019-02-12 10:39:00,2.39,CRMD
rvansomeren,True,2019-02-12 10:39:00,2.39,CRMD This has been triggering my alerts all morning I keep adding 2 more cents each time I think Ill just set it at 3
sgilley87,True,2019-02-12 10:39:00,2.39,CRMD oh yeah baby
trixiemoneybags,True,2019-02-12 10:39:00,2.39,CRMD god dayyyyummm
ptjammer1,,2019-02-12 10:39:00,2.39,CRMD
cruzzz77,True,2019-02-12 10:38:00,2.37,CRMD dudeeee Lets goooooo
emmanuel5,True,2019-02-12 10:38:00,2.37,CRMD 238
MYredCAP,,2019-02-12 10:38:00,2.37,CRMD time to take out 24
catdaddy71,True,2019-02-12 10:38:00,2.37,CRMD If you shorted you in trouble
Crimsonwrath,True,2019-02-12 10:38:00,2.37,CRMD Normally I would be skeptical about such gains on no direct news but this company has such an incredible future Ill just accept it
LordDragon,True,2019-02-12 10:38:00,2.37,CRMD guess shorties didnt wanna park at 235Lets go then Max Pain
JFigs28,True,2019-02-12 10:38:00,2.37,CRMD not much in the way to 240 congrats to the fellow longs
Sk8wizard,True,2019-02-12 10:38:00,2.37,CRMD were approaching 52wk high lets blast through it
BlackAxeCapital,True,2019-02-12 10:37:00,2.35,CRMD 1
ITvestor,True,2019-02-12 10:37:00,2.35,CRMD Up 10 on only 14 M shrs can you imagine what happens on 10 million shr day when FDA minutes are released Coming soon
adamcash,True,2019-02-12 10:37:00,2.35,CRMD is there news Cant find the reason its running today but Im not complaining Up 80 right now and not selling
jpa11764,True,2019-02-12 10:37:00,2.35,CRMD Sweet
enjigz,True,2019-02-12 10:37:00,2.35,CRMD Well be hitting 10 scanners soon
GreenTak,True,2019-02-12 10:37:00,2.35,APDN Bought in This is going parabolic Watching CLD CRMD PTI SCYX FET NMRD OTLK NAKD SPI CRMD MARA APDN WORX OPTT COTY
IAmMsMoneyMaker,,2019-02-12 10:37:00,2.35,CRMD Just 5 cents from the 52 WEEK HIGH NOW
Slinger207,True,2019-02-12 10:37:00,2.35,CRMD idk how to secure profits
tspigel,,2019-02-12 10:37:00,2.35,CRMD i OWNED 145000 SHARES AT 45 CENTS AND SOLD THEM AT 80 WHAT A MISTAKE
Crimsonwrath,True,2019-02-12 10:37:00,2.35,CRMD Its still going
erikmatson,,2019-02-12 10:37:00,2.35,CRMD whats the news here
rvansomeren,True,2019-02-12 10:37:00,2.35,CRMD The questionDoes this pullback today has clearly been answered
GardeningGirl,,2019-02-12 10:36:00,2.333,CRMD Woohoo 235
mdewit,True,2019-02-12 10:36:00,2.333,CRMD
noname69,True,2019-02-12 10:36:00,2.333,CRMD Earlndunia post a message next CC so we know youre not secretly Khoso
joelwork365,True,2019-02-12 10:36:00,2.333,CRMD a lot of new names here todayI love it Where are we all going on vacation together CABO TURKS
Ron415,True,2019-02-12 10:35:00,2.333,ACB CRMD VSTM Bullish
ShotCaller0187,True,2019-02-12 10:35:00,2.333,CRMD Sipping margaritas
CashVacuum,True,2019-02-12 10:35:00,2.333,CRMD
Earlndunia,,2019-02-12 10:34:00,2.328,CRMD news come big boy no
Slinger207,,2019-02-12 10:34:00,2.328,CRMD where is the top Pl0x
WhaleOfWallstreet,True,2019-02-12 10:34:00,2.328,CRMD Holy shit
rich54,,2019-02-12 10:34:00,2.328,CRMD Why arent we trending yet StockTwits
rkazz,True,2019-02-12 10:33:00,2.328,CRMD
RyGuy79,True,2019-02-12 10:33:00,2.328,CRMD 52week high anyone
davedemon,,2019-02-12 10:33:00,2.328,CRMD holy shit Yeah baby
TMLEVERAGE,True,2019-02-12 10:33:00,2.328,CRMD rest lower the rsi relax and go
HolyGrail24,True,2019-02-12 10:33:00,2.328,CRMD any idea when they get approved or denied by FDA
LunchTrader,True,2019-02-12 10:33:00,2.328,CRMD itshappeninggif
danny33,True,2019-02-12 10:32:00,2.33,CRMD gonna run soon
KentTrades,True,2019-02-12 10:32:00,2.33,CRMD im wet
StockPicksPro,,2019-02-12 10:32:00,2.33,CRMD on a verge of a breakout
catdaddy71,True,2019-02-12 10:32:00,2.33,CRMD Longs knew this was coming We did our DD and shared info left and right If you missed its on you but its not over
TMLEVERAGE,True,2019-02-12 10:31:00,2.334,CRMD eating up those profiteers
ATTILA_the_HUN,True,2019-02-12 10:31:00,2.334,CRMD what a beautiful sight My fav ticker at it again
Dr_Murrbotnic,,2019-02-12 10:31:00,2.334,CRMD Looking forward to whats next
swayit,True,2019-02-12 10:31:00,2.334,CRMD god damnit I need a buy opportunity
NVYS009,,2019-02-12 10:30:00,2.341,CRMD this looks amazing
Burnt_Trader,True,2019-02-12 10:30:00,2.341,CRMD consolidation please lol I dont know how much more we can go vertically
JMJ243,,2019-02-12 10:30:00,2.341,CRMD wow
ajl21,True,2019-02-12 10:30:00,2.341,CRMD could get stupid
TMLEVERAGE,True,2019-02-12 10:30:00,2.341,CRMD did the shorts get out in time lol
Miketj,True,2019-02-12 10:30:00,2.341,CRMD 234
joelwork365,True,2019-02-12 10:30:00,2.341,CRMD this think just overdosed on Viagra I think
Tr8rBoy,True,2019-02-12 10:30:00,2.341,CRMD If Earl is right and news drop tomorrow pre market we are in for a ride
montanasky,,2019-02-12 10:30:00,2.341,CRMD approaching 52w high
PharmDRE,True,2019-02-12 10:30:00,2.341,CRMD This stock is eating
SgtBadger,True,2019-02-12 10:30:00,2.341,CRMD Just a little push and we are over the 52 week
Mikep7703,,2019-02-12 10:30:00,2.341,CRMD wow congrats longs Looking really good
Jebus29,True,2019-02-12 10:29:00,2.337,CRMD 52wk high todaymaybe
Sk8wizard,True,2019-02-12 10:29:00,2.337,CRMD as a Mexican sports commentator GOOOOOOOOOAAAAAALLLLL
RawlsRoyce,True,2019-02-12 10:29:00,2.337,CRMD
MJBIV,True,2019-02-12 10:29:00,2.337,CRMD this is on steroids right now
ybraya,True,2019-02-12 10:29:00,2.337,CRMD my only problem is i couldnt get filled for another 1000 shares at 223
Sk8wizard,True,2019-02-12 10:29:00,2.337,CRMD GOOOO
Miketj,True,2019-02-12 10:29:00,2.337,CRMD 232
tommycash44,True,2019-02-12 10:28:00,2.319,CRMD cant chase this here But god damn its looking good
Mathew1193,True,2019-02-12 10:28:00,2.319,CRMD so after 240 we hit 8
Burnt_Trader,True,2019-02-12 10:27:00,2.315,CRMD always scary going vertical lol
bdiv,True,2019-02-12 10:27:00,2.315,CRMD This is well overdue
rvansomeren,True,2019-02-12 10:27:00,2.315,CRMD Sure is looking like well be testing the 240 level today
vegasmoney,True,2019-02-12 10:27:00,2.315,CRMD this could be one of todays overall top gainers
cwpalmer,,2019-02-12 10:27:00,2.315,CRMD keep it slow CRMD we like quality movement
TMLEVERAGE,True,2019-02-12 10:27:00,2.315,CRMD 232
BeeeeDooooh,True,2019-02-12 10:26:00,2.304,CRMD current mood Texans mascot
LordDragon,True,2019-02-12 10:26:00,2.304,CRMD damn 10k at 231
rich54,,2019-02-12 10:26:00,2.304,CRMD release the news of LPAD path acceptance it will be all over news Even CNBC It could be first few co to get that IBB XBI GILD
mausferd,True,2019-02-12 10:26:00,2.304,CRMD no signs of sell off
MJBIV,True,2019-02-12 10:26:00,2.304,CRMD 230
ybraya,True,2019-02-12 10:25:00,2.29,CRMD
LordDragon,True,2019-02-12 10:25:00,2.29,CRMD Pretty siteStairway to Heaven formation
Jebus29,True,2019-02-12 10:25:00,2.29,CRMD any stoploss you set here should be a limit buy
ITvestor,True,2019-02-12 10:24:00,2.29,CRMD p0006 if you understand buy big time before FDA meeting minutes are released within next 2 weeks
chhching,True,2019-02-12 10:24:00,2.29,CRMD VERY IMPORTANT REQUEST PLEASE FOR THE LOVE OF GOD SOMEONE RELEASE THE KRAKKEN
Dnyshan,,2019-02-12 10:24:00,2.29,CRMD is there any 1 year potential for 1500
catdaddy71,True,2019-02-12 10:24:00,2.29,CRMD Now let me share My opinion We will be ask to file the NDA without any more trials
TMLEVERAGE,True,2019-02-12 10:23:00,2.285,CRMD are the tuna gere or did whales finally make an apearance let the whales begin
KentTrades,True,2019-02-12 10:23:00,2.285,CRMD LETS GOOOO 23 there it is losers
iSpoiler,True,2019-02-12 10:22:00,2.28,CRMD Been in and out of this since 24 Anyone know what its popping again now
SGP,,2019-02-12 10:22:00,2.28,IDXG anybody into CRMD heck it out
zigzag001,,2019-02-12 10:22:00,2.28,CRMD 52 week is on the horizon Cmon 241
IAmMsMoneyMaker,,2019-02-12 10:22:00,2.28,CRMD ANOTHER HIGHER DAILY HIGH 230 Could we Possibly hit the 52 Week HIGH TODAY
Maximusgainz,True,2019-02-12 10:21:00,2.285,CRMD Cant wait to see what happens when lpad designation is granted
danny33,True,2019-02-12 10:21:00,2.285,CRMD beast mode
yourbuddystoo,True,2019-02-12 10:21:00,2.285,CRMD current return at 9929
emmanuel5,True,2019-02-12 10:21:00,2.285,CRMD Well push through 230 imo
prohope,True,2019-02-12 10:21:00,2.285,CLD SHOP CRMD
Vrodcarpediem1,True,2019-02-12 10:20:00,2.285,CRMD its up
SgtBadger,True,2019-02-12 10:20:00,2.285,CRMD yessssssss
catdaddy71,True,2019-02-12 10:20:00,2.285,CRMD Look at the time and the charts Nothing to stop us And a 600 PT
Tafari9,True,2019-02-12 10:20:00,2.285,CRMD we going up amir
Tr8rBoy,,2019-02-12 10:20:00,2.285,CRMD Havent made this great of an investment since IGC in September
Earlndunia,,2019-02-12 10:20:00,2.285,CRMD I told u
joe_momma,True,2019-02-12 10:20:00,2.285,CRMD
kingel,True,2019-02-12 10:19:00,2.285,CRMD one of my favorite stocks
Direwolf0110,True,2019-02-12 10:19:00,2.285,CRMD yo what color lambo
rich54,True,2019-02-12 10:19:00,2.285,CRMD seems like more short covering than buying Shorts always get the hint first Slow climb is better Something big is coming BULLISHHHH
TMLEVERAGE,True,2019-02-12 10:19:00,2.285,CRMD posted this arrow mid last week and looky magic wand lol
MJBIV,True,2019-02-12 10:19:00,2.285,CRMD damn get what you can This moving like a Walmart on Black Friday
BlueBird007,True,2019-02-12 10:19:00,2.285,CRMD on today Good job
Dr_Murrbotnic,,2019-02-12 10:18:00,2.285,CRMD Here we go
FWMC,,2019-02-12 10:18:00,2.285,CRMD damn only Tuesday but im breaking out the Jack tonight
emmanuel5,True,2019-02-12 10:18:00,2.285,CRMD whats causing the push
LordDragon,True,2019-02-12 10:17:00,2.28,CRMD 235 is a nice parking spot for the day What do you think shorties
KentTrades,True,2019-02-12 10:17:00,2.28,CRMD holding all shares no stops no limits
catdaddy71,True,2019-02-12 10:17:00,2.28,CRMD Hold your shares and watch Lunch and power hour might be wild 600 PT were so undervalued
BlackAxeCapital,True,2019-02-12 10:17:00,2.28,CRMD Ill post a pic after my order fills for all you to see
StocksArentSoHard,True,2019-02-12 10:17:00,2.28,CRMD Forget about it being 75 of our portfolios 85 for me All of us cant help but say we shouldve bought more
KentTrades,True,2019-02-12 10:16:00,2.27,CRMD
MJBIV,True,2019-02-12 10:16:00,2.27,CRMD crazy52 week high is right there for the taking Just need a good push
hikingthehills,True,2019-02-12 10:16:00,2.27,TBLT A sleeper that will explode soon CRMD ACB Amazing
BlackAxeCapital,True,2019-02-12 10:16:00,2.27,CRMD Today I go through the process of wiping clean all of my holdings big winners big losers and all in between are going into CRMD 50K
TMLEVERAGE,True,2019-02-12 10:15:00,2.275,CRMD we are in the show wheres the news Give us news
RosemaryThyme,,2019-02-12 10:15:00,2.275,CRMD such a rewarding stock to own over the past several months
IAmMsMoneyMaker,,2019-02-12 10:15:00,2.275,CRMD BIG BUYS COMING IN
Bobbykack,True,2019-02-12 10:15:00,2.275,CRMD
Wrangler66,,2019-02-12 10:15:00,2.275,CRMD run baby you got this lets create a solid floor
RyGuy79,True,2019-02-12 10:15:00,2.275,CRMD Clearing out price alerts faster than I can set them
LordDragon,True,2019-02-12 10:15:00,2.275,CRMD It will eat thru 228 easy
TAChartz,True,2019-02-12 10:15:00,2.275,CRMD next target is 240 LeTs Go
xzano,,2019-02-12 10:14:00,2.277,CRMD BOOM
prohope,True,2019-02-12 10:14:00,2.277,CRMD yeah
hummus,,2019-02-12 10:13:00,2.265,CRMD nice to be back in the 200 gains
EYEOTIGER,True,2019-02-12 10:13:00,2.265,CRMD Is the usual imbecile still trashing the Village Guru 247 on this now
El_Duderino11,True,2019-02-12 10:13:00,2.265,CRMD My fav stock EASY
Tr8rBoy,True,2019-02-12 10:13:00,2.265,CRMD Seems like people are removing their asks all together
StocksArentSoHard,True,2019-02-12 10:12:00,2.265,CRMD What a wicked week for for CRMD This thing is absolutely demolishing the charts this week and its not even an hour into day 2
1Minute,,2019-02-12 10:12:00,2.265,CRMD Youre on FIRE
MJBIV,True,2019-02-12 10:12:00,2.265,CRMD boom
cruzzz77,True,2019-02-12 10:12:00,2.265,CRMD holy st
BeeeeDooooh,True,2019-02-12 10:12:00,2.265,CRMD me likey
TAChartz,True,2019-02-12 10:12:00,2.265,CRMD broke that 226 wall
catdaddy71,True,2019-02-12 10:11:00,2.262,CRMD Eli Lilly is in play I feel it in my bones
collucho,True,2019-02-12 10:11:00,2.262,CRMD I like the positivity and lack of bears in here as well as the positive company outlook for those reasons I added here
chhching,,2019-02-12 10:11:00,2.262,CRMD whats a safe stop right now 10202 Dont wanna get stopped out but also want to protect
yodapr,True,2019-02-12 10:10:00,2.235,CRMD
MJBIV,True,2019-02-12 10:10:00,2.235,CRMD if this can be bought up 226 should hit the 52 wk high
emmanuel5,True,2019-02-12 10:10:00,2.235,CRMD I picked up another 200 here Lets push this through the roof bulls
IAmMsMoneyMaker,,2019-02-12 10:09:00,2.24,CRMD GOOD NEWS TRAVELS FAST EVERYONE IS JUMPING ON THE CRMD TRAIN NOW
MJBIV,True,2019-02-12 10:09:00,2.24,CRMD theres the 226 resistance
rvansomeren,True,2019-02-12 10:09:00,2.24,CRMD rvol is over twice of the avg at this point in the day
Jemus,True,2019-02-12 10:09:00,2.24,CRMD We have finally made it fellow longs Lets keep on rolling Good news is coming
Luckierthangood,True,2019-02-12 10:09:00,2.24,CRMD get ya popcorn ready
LordDragon,True,2019-02-12 10:09:00,2.24,CRMD At this paceshorties gonna have a heart attack
TMLEVERAGE,True,2019-02-12 10:08:00,2.25,CRMD big buys big buys
IAmMsMoneyMaker,,2019-02-12 10:08:00,2.25,CRMD We are GETTING CLOSER to the 52 Week HIGH
MYredCAP,,2019-02-12 10:08:00,2.25,CRMD lets break 226
zigzag001,,2019-02-12 10:08:00,2.25,CRMD wow 225 up UP and away
JesseBohl,,2019-02-12 10:08:00,2.25,CRMD damn i remember when this had 4k watchers
HigherDesires,True,2019-02-12 10:08:00,2.25,CRMD she wants to retest that 52wk high completely different run up this time
cwpalmer,True,2019-02-12 10:07:00,2.244,CRMD volume starting to pick up
danny33,True,2019-02-12 10:06:00,2.24,CRMD 230 coming
BeeeeDooooh,True,2019-02-12 10:06:00,2.24,CRMD let do dis
TAChartz,True,2019-02-12 10:05:00,2.24,CRMD keeps going
prazey89,True,2019-02-12 10:05:00,2.24,CRMD something is cooking here and it smells effin good
SnapStocksTrading,,2019-02-12 10:05:00,2.24,CRMD 226 break a necessity to make a new 52WeekHigh
TMLEVERAGE,True,2019-02-12 10:04:00,2.24,CRMD added today as well
biolurker1,,2019-02-12 10:04:00,2.24,CRMD Still Cheap
TMLEVERAGE,True,2019-02-12 10:03:00,2.244,CRMD lets do this
TradeIdeasQuant,,2019-02-12 10:02:00,2.23,CRMD tradeideascomtickyticky Quarterly Rev Growth is one reason for this move Up 5 for the day
LordDragon,True,2019-02-12 10:02:00,2.23,CRMD Shorties be likeOMG OMG OMG What happened here
Joshbarn,,2019-02-12 10:02:00,2.23,CRMD I loaded more even on the way up baby
EagleMania65,True,2019-02-12 10:01:00,2.22,CRMD Is it time to run again
Tmoney55,,2019-02-12 10:01:00,2.22,CRMD Exiting here with 300 gains Not bearish still a great stock Will continue to watch Good luck Everyone
Tr8rBoy,,2019-02-12 10:01:00,2.22,CRMD LivingSTDFree Still waiting on that 99 entry
IAmMsMoneyMaker,,2019-02-12 10:01:00,2.22,CRMD Nice VOLUME First 30 minutesVolume 6884K
MJBIV,True,2019-02-12 10:00:00,2.224,CRMD just the sentiment from big money tells you where this is heading You should get it while its cheaper imo
10diamonds,True,2019-02-12 10:00:00,2.224,CRMD is it too late to load more I am thinking to add another 5k
rollhorns,True,2019-02-12 10:00:00,2.224,CRMD If we break 225 the resistance will be futile Average up yall
prohope,True,2019-02-12 09:59:00,2.226,CRMD keeps going up
username32,True,2019-02-12 09:58:00,2.23,CRMD where are all the people waiting for the morning dip
rvansomeren,True,2019-02-12 09:58:00,2.23,CRMD Some resistance will be expected at 226 and after that nothing until 240
Zap360,True,2019-02-12 09:57:00,2.228,CRMD well consolidation above 2 is finally here lets hope for higher highslows and get back to the 52 WK high
LordDragon,True,2019-02-12 09:55:00,2.217,CRMD Hehehehehe Its cominggggg shortiessss Better get out of the way
IAmMsMoneyMaker,,2019-02-12 09:55:00,2.217,CRMD CANT Keep A GREAT Stock Down for long Its BREAKOUT TIME
KentTrades,True,2019-02-12 09:55:00,2.217,CRMD lets get that 23 today guys
MJBIV,True,2019-02-12 09:54:00,2.216,CRMD keep up the buyingadds if you sold be sure buy more or buy back in
zigzag001,,2019-02-12 09:54:00,2.216,CRMD HERE COMES THE BOOM HERE COMES THE BOOM
GoldenKnightsFan,True,2019-02-12 09:54:00,2.216,CRMD 400 Million sales 3 12 billion 12 billion 140 Million sharesafter all warrants and offerings 88 per share roughly
BuyLoweSellHi,,2019-02-12 09:52:00,2.225,CRMD just another ho hum stair step up with my CRMD familyHigher highs and higher lows
JMJ243,True,2019-02-12 09:52:00,2.225,CRMD knew we would break out sooner or later like I said its the best chart Ive seen in a while plus pipeline
matharoo,,2019-02-12 09:51:00,2.222,CRMD When is the FDA date
RyGuy79,True,2019-02-12 09:51:00,2.222,CRMD
bujer,,2019-02-12 09:51:00,2.222,CRMD 25 in sight Lets go
MFzewski87,True,2019-02-12 09:50:00,2.211,CRMD sold a 14 of my postion to lock in some profits but never sell all
IAmMsMoneyMaker,,2019-02-12 09:49:00,2.214,CRMD BIGGER BUYS Coming IN
itburnswhenipee,,2019-02-12 09:48:00,2.212,CRMD respect the trend
catdaddy71,True,2019-02-12 09:48:00,2.212,CRMD People are starting to realize that we are the real deal Cormedix is the
SgtBadger,True,2019-02-12 09:48:00,2.212,CRMD GLTA and have a profitable day
Luckierthangood,True,2019-02-12 09:48:00,2.212,CRMD is there a bear in the house I mean a dissenting voice would bewait never mind
MJBIV,True,2019-02-12 09:48:00,2.212,CRMD so close to 52 week high
Jack_Mehoff12,True,2019-02-12 09:48:00,2.212,CRMD any price predictions upon FDA Approval
SgtBadger,True,2019-02-12 09:47:00,2.209,CRMD Off work to a great looking stock today and a oldie but goodie song stuck in my head thanks to Biolurker going to be a good day
chromashadows,True,2019-02-12 09:47:00,2.209,CRMD half a mil vol and rising
GreenTak,,2019-02-12 09:47:00,2.209,CLD Def holding this rocket Watches today CRMD PTI SCYX FET NMRD OTLK NAKD SPI CRMD MARA APDN WORX OPTT COTY
StocZiggy,True,2019-02-12 09:46:00,2.201,CRMD The ROTH Cap analyst shows up in my Account today wa date of 119 600 Target All of a sudden he wants to be known Somethings up
MoneyJay33,,2019-02-12 09:46:00,2.201,CRMD LolWhat else do you expectLongs arent surprisedStill a ways to go
tryingtobuythefarm,True,2019-02-12 09:46:00,2.201,CRMD you youngns probably wont get this
MJBIV,True,2019-02-12 09:45:00,2.205,CRMD Keep it up guys This is easy They can only hold this down for so long
hjamaar,,2019-02-12 09:45:00,2.205,CRMD i really wonder what the realistic potential is
chhching,,2019-02-12 09:45:00,2.205,CRMD gotta get through 222 wall
TAChartz,True,2019-02-12 09:45:00,2.205,CRMD
biolurker1,,2019-02-12 09:44:00,2.21,CRMD There is a Bad Moon Rising if youre a short
Nednerb1,True,2019-02-12 09:44:00,2.21,CRMD Its all happening
Tr8rBoy,True,2019-02-12 09:44:00,2.21,CRMD I made purchases at 231 last time it was that high Would be nice to be even on those trades today
JLeyesopen,,2019-02-12 09:44:00,2.21,CRMD Easy money the trend is my friend
GreenForTheGreen,True,2019-02-12 09:44:00,2.21,CRMD this is the kind of stock youll be telling stories about getting into in the pennies for years to come
bmac123,,2019-02-12 09:44:00,2.21,CRMD lesssss go
chromashadows,True,2019-02-12 09:44:00,2.21,CRMD vol rising consistently Sp up Good Good
BioStockDD,True,2019-02-12 09:43:00,2.218,CRMD 223 shorts do yourselves a favor and just let it go Its okay to give up
Sk8wizard,True,2019-02-12 09:43:00,2.218,CRMD eastbound and down loading up and trucking
IAmMsMoneyMaker,,2019-02-12 09:43:00,2.218,CRMD MANY NEW HIGHER DAILY HIGHS THIS MORNING ALREADY
chromashadows,,2019-02-12 09:42:00,2.213,CRMD 222 on rh
Miketj,True,2019-02-12 09:42:00,2.213,CRMD 223
ProfitablePiggg,True,2019-02-12 09:42:00,2.213,OPTT once we break 38 its on id suggest gettin in before that navy cottract today low float MNGA CEI NVLN CRMD IZEA EGY
enjigz,True,2019-02-12 09:42:00,2.213,CRMD Dip or fly Im scared to sell and rebuy
enjigz,,2019-02-12 09:41:00,2.203,CRMD
chromashadows,,2019-02-12 09:40:00,2.19,CRMD love to see 225 today if possible
IAmMsMoneyMaker,,2019-02-12 09:40:00,2.19,CRMD ITS GETTING READY TO EXPLODE UP
catdaddy71,True,2019-02-12 09:40:00,2.19,CRMD If we get volume again this will be a great day
akadios,True,2019-02-12 09:39:00,2.182,Looking for an all green day CLD MLNT CRMD CFMS CAH VRS NVAX NBRV SCYX looking for CLD to lead they way and hoping the rest follow
hjamaar,,2019-02-12 09:39:00,2.182,CRMD strong hold over 200 D
