flipping,True,2019-02-12 15:59:00,1.978,MARK everyday last 10 minutes they try to close it red
macdaddygou,,2019-02-12 13:33:00,2.016,MARK Its ready
flipping,True,2019-02-12 13:23:00,2.027,MARK well nothing to see here shing get off the crapper already and do something
valuationgman,,2019-02-12 12:30:00,2.002,MARK lift offf starting
Sieppo,True,2019-02-12 10:50:00,2.01,MARK Also I like the chart a lot Higher wedging highs that might slowly turn the direction up Only three higher highs after rip so far
Sieppo,True,2019-02-12 10:45:00,1.996,MARK So short term risk reward can be VERY favourable
Sieppo,True,2019-02-12 10:45:00,1.996,MARK obv this is a speculative trashy stock at the moment Nt catalysts however Asset sale reqd by debtors growing KK rev real revs
FreeCal,,2019-02-12 09:54:00,2.019,MARK should run next few days or whoever bought 2500 calls at 275 is screwed and were all bored still
