taguru,,2019-02-12 15:08:00,124.519,NSP Insperity NSP 13197 was the markets top winner yesterday jumping 19 tickeroncomeventid603811
Tiberius009,,2019-02-12 14:55:00,124.1,NSP round 2
TradeIdeasQuant,,2019-02-12 14:50:00,123.705,NSP tradeideascomtickyticky High RSI Bollinger MACD Volume and the kitchen sink All filters satisfied
SuperF,,2019-02-12 14:17:00,123.577,NSP RSI never lie
Risk_Reward,True,2019-02-12 13:33:00,123.765,NSP long herr
Tiberius009,,2019-02-12 13:21:00,123.25,NSP wow having a hard time pulling the trigger on puts Not liking the resistance at the 123120 area
WarmingTrend,,2019-02-12 13:01:00,124.633,PYX just be careful DO NOT forget to take profits NSP up huge the same yest on far better ER Getting crushed today Likely same PYX
JohnyB5000,,2019-02-12 12:56:00,124.855,NSP dam covered WAY too early
