EstimizeAlerts,,2019-02-12 14:36:00,302.474,Heres what 5 Estimize analysts believe ULTA will report for Q4 Comparable Sales on 0314 AMCestimizecomintroultacha
EstimizeAlerts,,2019-02-12 13:06:00,302.37,ULTA analysts on Estimize are expecting 3081 YoY EPS growth for Q4 up from 2706 in Q3 Reporting 0314 AMCestimizecomintroultacha
BitcoinBear,,2019-02-12 12:52:00,302.071,NFLX AVGO ULTA CMG SPY QQQ what is the catalyst for the next leg up Oil only thing If that is case then CVIA HCLP SLCA
sleekoptions_daytrade,True,2019-02-12 12:51:00,302.205,Update10 ULTA Feb15 2925 Calls Up 153 since alerted on Feb 08
BitcoinBear,,2019-02-12 11:42:00,302.94,ULTA I have shorted you before in lunar orbit you are now on my radar again along with NFLX CMG AVGO
CrowdThnk,,2019-02-12 11:12:00,304.276,ULTA Market Positioning is Slightly Overweight CrowdThnks Algo forecasts 56 chance Moving Higher crowdthnkcomstocksULTA
debjm,,2019-02-12 09:36:00,304.478,ULTA pretty bullish longer term
