2019scarface,True,2019-05-28 15:13:00,5.522,AG SIF SLV GLD GDX DOOM LOOP BITCHS
staffpro1,,2019-05-28 14:02:00,5.532,AG will this thing ever have an up week lmao non stop ass rapage keith neumeyer should send each shareholder a tub of vaseline instead of a dividend cheaper too
Lil_pump_,,2019-05-28 13:08:00,5.502,AG tripple bottom
Ken99,,2019-05-28 12:45:00,5.525,AG this will be under 5 again possibly this week seems like bankers are trying to bankrupt this industry Never ending futures attacks on PMs first thing in the morning
prh1958,True,2019-05-28 11:10:00,5.61,AG Just need the banksters to over play their shell and pea game waiting
vstokes,,2019-05-28 10:01:00,5.629,AG something strange brewing lately Slv down almost 2 and this down 5 Miners not crushed Very interesting
swish24,,2019-05-28 09:40:00,5.61,AG for those with strong stomachs there will be point where this ugly sentiment will turn into one heck of a squeeze the question is when
2019scarface,,2019-05-28 09:35:00,5.601,AG gold to silver ratio 8944 SQUEEZE this MOTHERPHUCKER
