sleekOptions,True,2019-03-25 15:06:00,85.68,Peak gain for last 5 expired setups INCY 5000 20000 26923
SPQR23,,2019-03-25 12:37:00,84.787,ACAD SPY ZS INCY indexs will buckle today
DividendBot,,2019-03-25 12:16:00,85.12,INCY bulls have 3 reasons on 0325 to pay more attention dividendbotcomsINCY
SPQR23,,2019-03-25 11:23:00,85.25,INCY better make a new 52 week high soon or Im out
SPQR23,,2019-03-25 10:48:00,84.31,INCY losing my patience with this one
SPQR23,,2019-03-25 09:47:00,84.97,ZS ACAD INCY back to the mkt we had in Nov Dec rallies fade hard
