fredthebroker,,2019-06-07 15:54:00,2.005,AKS X Both are building a new base If this holds then we will get bigger moves once investors feel bottom is in
VolumeBot,,2019-06-07 15:53:00,2.005,Short volume percent for AKS was 4232 on 060619 a decrease of 182 from 060519 volumebotcomsAKS
Mugsy0316,,2019-06-07 15:34:00,2.003,AKS need this to go up or down Big Up to get back my losses or down to avg down 01 05 up or down doesnt do much for me Good luck longs and have a great weekend
FBK_Financial,,2019-06-07 15:17:00,2.005,AKS started a small position will gradually add if it goes lower and will accumulate shares and LEAPs every few weeksmonths
Golferbob,,2019-06-07 13:51:00,2.011,X AKS The next stop is the 20dma for both A ways to go yet Until then bias is down I think theyll get there though in time
raleigh_trader,True,2019-06-07 13:39:00,2.007,AKS even 750 could pay off nicely here
Golferbob,,2019-06-07 13:35:00,2,X AKS So stld trying to go positive and nu has I think a new high of the day would be in order for these two CLF though I have no position has me surprised and curious Gl folks
Unobtainium,True,2019-06-07 11:40:00,1.99,AKS This is gonna pay off Load up now
paul29m,,2019-06-07 09:34:00,1.96,AKS Starter at 196 Lets see what this baby can do
