ultra_52,,2019-06-07 15:48:00,0.5644,APDN I knew today would be a dud of a day have a great weekend
ultra_52,,2019-06-07 12:51:00,0.5714,APDN
dominicormston,True,2019-06-07 11:29:00,0.5902,APDN Momma take this stock offa meI cant use it anymoreIts gettin dark too dark to seeFeel like im knocking on sixtys doorKnock knock knockin on sixtys doorLast two days summed up Well get there eventually
Lazareaux985,,2019-06-07 10:28:00,0.5801,APDN Fall to 55c and let me lower this avg
dominicormston,,2019-06-07 10:23:00,0.6,APDN Sorry I should have put all 3 posts in one post Didnt mean to spam
dominicormston,,2019-06-07 10:13:00,0.5758,APDN That is one big ass block
dominicormston,,2019-06-07 10:10:00,0.588,APDN Forcing it down even further
dominicormston,,2019-06-07 09:38:00,0.6,APDN You know the drill by now
