Orlandotrader,,2019-06-07 15:10:00,1.87,CLSN For what its worth Nice Day Celsion
LOLOLOLOLOLOLOLOLOLOLOL,,2019-06-07 15:02:00,1.88,TEUM Theres money to be made everywhere in the market Heres some info FLNT 300 million in revenue profitable Way undervalued TRVN QT trial coming up Last step before FDA approval Catalyst in June QT submission TRXC Japan FDA approval Ray James says 20 robots sold in 2019 CLSN Thermodox trial interim results
LOLOLOLOLOLOLOLOLOLOLOL,,2019-06-07 14:37:00,1.84,TEUM This is going straight down to 1s Too much bad sentiment Regain some money at TRXC TRVN FLNT CLSN Huge catalysts for all
notmrright,True,2019-06-07 10:59:00,1.82,CLSN everyone wants to buy this at 240 250 but nobody wants in at 180 On sale
notmrright,True,2019-06-07 10:56:00,1.8,CLSN last two trading day 55 of the volume was short sellers Longs need to wait for early 2020 when second data readout has a solid chance Shares will be much higher in that runup
notmrright,True,2019-06-07 10:45:00,1.79,CLSN market cap is 35 mill and cash on hand is 20 Phase lll trial done and paid for plus Phase 2 product that looks strong Picked up 50000 more share yesterday and today
ostraderz,,2019-06-07 10:39:00,1.789,CLSN unloaded 40k shares done here good luck to all longs
SerialStockGains,True,2019-06-07 09:55:00,1.67,CLSN still here Good to see some action
