Lam6505,True,2019-06-07 14:37:00,205.41,TSLA 210 today
MUNEMAKER,True,2019-06-07 14:37:00,205.41,TSLA here come the losers They jump in the moment it turns red
karlosanta,,2019-06-07 14:37:00,205.41,TSLA will hit 250 next week but only if Larry Ellison sell all his assets and pump it into this dying camel As obviously this weeks 3 bln didnt make a difference
lingeringMusk,True,2019-06-07 14:37:00,205.41,TSLA Elon in Infrared Boy is Tesla Special or what Spin that Metal baby
biggp216,,2019-06-07 14:37:00,205.41,TSLA might just burn 67 200 and 205 put holders and 210 calls today Im sure theres thousands
fixitman,False,2019-06-07 14:36:00,205.376,TSLA timber
Egon12,False,2019-06-07 14:36:00,205.376,TSLA Bulls not taking profits here or protecting from more losses is very greedy This company is in a minefield
jackkorn,,2019-06-07 14:34:00,205.56,TSLA when they know that in 18 months the most they will pick up the pieces from bankruptcy court for pennies on the dollar
forsiz1,False,2019-06-07 14:34:00,205.56,TSLA Back under 200 next week for sure
lingeringMusk,True,2019-06-07 14:34:00,205.56,TSLA Letz Ride Catch them Creepin
Lam6505,True,2019-06-07 14:33:00,205.61,TSLA 210 today
jackkorn,,2019-06-07 14:33:00,205.61,TSLA WhaleDetector why would a GM or FORD buy the co Now and pay this ridicules price
WhaleDetector,True,2019-06-07 14:33:00,205.61,TSLA Some very big whales have been accumulating both stock and shortdated options The last time we saw this kind of volume on the buy side was before the run to 380
lingeringMusk,True,2019-06-07 14:33:00,205.61,TSLA PS PSS both Yup
ak_stock,True,2019-06-07 14:32:00,205.68,TSLA Go Baby Go
lingeringMusk,True,2019-06-07 14:32:00,205.68,TSLA Welcome to Death Rom Chronic Elon Syndrome
Lam6505,True,2019-06-07 14:32:00,205.68,TSLA tesla is a steal at 300s or less
muchlove,True,2019-06-07 14:31:00,205.611,TSLA Teslas only problem is the fake media
WhaleDetector,True,2019-06-07 14:31:00,205.611,TSLA Very high probability of some major announcements over the weekend Perhaps relating to a major stake or MA Elon has warmed up to the idea of selling and focusing on SpaceX fulltime
Dontpanicagain,True,2019-06-07 14:31:00,205.611,TSLA Breaking Tesla Model 3 Blasts Into Asia Pacific Region As Configurator Opens For 6 More Countries cleantechnicacom2019053
abiguzndt,False,2019-06-07 14:31:00,205.611,TSLA Monday
lingeringMusk,True,2019-06-07 14:31:00,205.611,TSLA I wont stop until they are all Safe BearZ out All Day I Dream About Tesla
Steven_L,False,2019-06-07 14:30:00,205.869,TSLA wake up bulls look over the timing and contents of the news and the analysts notes published everything was planned some guys sucked the blood of the bulls and then reaped the profit from the squeeze it is classic manipulation
ThePatrickBateman1,False,2019-06-07 14:30:00,205.869,TSLA drivers good luck finding parts for your douchebuggies after the BK
AlexanderHandleton,True,2019-06-07 14:30:00,205.869,TSLA squeeeeeeze above 2065 Backtest and held 20 day again Bears suck
nickoftime,True,2019-06-07 14:30:00,205.869,TSLA lets fill that gap at 195 and continue upward to 4000 already Sheesh Whats taking so long
zoupnasi,False,2019-06-07 14:30:00,205.869,TSLA the monthly pump is fizzling out Let the down trend continue
jackkorn,,2019-06-07 14:29:00,205.872,TSLA and ride it all the way to single digits by end of year
jackkorn,,2019-06-07 14:28:00,205.688,TSLA as I have predicted this mini rally should run out of steam around 210220get your truck ready to start loading with shorts and puts
ChartMill,,2019-06-07 14:28:00,205.688,The technical rating of TSLA is bad and it also does not present a quality setup at the moment chartmillcomanalyzephpu
roni76,False,2019-06-07 14:28:00,205.688,TSLA if you ask bulls is this a car company they answer not that is Elon Musks company They pay here not for stock they pay here price for their confidence to musk confidence nearly doubled down what happend with bulls or is correct answer a car company then this changes all
Blu3Dream,,2019-06-07 14:28:00,205.688,TSLA
jackkorn,,2019-06-07 14:27:00,205.445,TSLA on a 300 up day this is what she is able to do LOLguess deranged Musk worshippers running out of money to burn on the altar
lingeringMusk,True,2019-06-07 14:27:00,205.445,TSLA Yo Hand down out the window My Tesla Brothers Show UZ the Horns Poke the Bear
SmartSystems,True,2019-06-07 14:26:00,205.528,TSLA When can I buy this beast Do you realize how cool you would be owning this driving down the street
WielWatban,,2019-06-07 14:25:00,205.482,TSLA Now the best of the day big money start covering today
bbsmth,,2019-06-07 14:24:00,205.295,TSLA any thoughts on todays pin 200 20250 205 20750 210
moarphysics,False,2019-06-07 14:23:00,205.116,TSLA longs pumped and dumped again
rayzwong96,,2019-06-07 14:23:00,205.116,TSLA 225 EOW bulls said My yum puts
lingeringMusk,True,2019-06-07 14:22:00,205.183,TSLA The Elon Gated Man Glitches See Elon Dance
izzy2020,False,2019-06-07 14:22:00,205.183,TSLA tarrif man will open his mouth again so get ready for the 20 dollar drop
Lam6505,True,2019-06-07 14:21:00,205.033,TSLA Partnership with Tesla could happen anytime soon
kingmeteor,,2019-06-07 14:21:00,205.033,TSLA rejected over 210 twice nice double top what if china labels the BEV market as strategically important
Davidpaulson,,2019-06-07 14:19:00,205.422,TSLA June 21 max pain is 220 and it rises from there The MM will rip the stock up and down this afternoon for their own good
lingeringMusk,True,2019-06-07 14:19:00,205.422,TSLA Knock out dance
Davidpaulson,,2019-06-07 14:18:00,205.462,TSLA todays Max pain is 19750 because of the recent price action last month afternoon price action will hurt you today just dont watch
lingeringMusk,True,2019-06-07 14:18:00,205.462,TSLA Time for the Horns Bear
lingeringMusk,True,2019-06-07 14:17:00,205.402,TSLA Free US Let UZ Travel
babuuu,True,2019-06-07 14:17:00,205.402,TSLA NIO
lingeringMusk,True,2019-06-07 14:17:00,205.402,TSLA We ARE ALL POOR In a little box
Steven_L,False,2019-06-07 14:16:00,205.316,TSLA the show is over the manipulators sucked the blood from bulls two months and bears this week
sushrut123,False,2019-06-07 14:16:00,205.316,TSLA selling started
Davidpaulson,,2019-06-07 14:16:00,205.316,TSLA I have lost many thousands of dollars trying to trade Tesla on Friday afternoons Be smarter and learn from my years of mistakes
alexlive,True,2019-06-07 14:16:00,205.316,TSLA i feel like everyone who bought puts to hedge their position are now taking their profits and putting it back in the stocks
Osborne820,,2019-06-07 14:16:00,205.316,TSLA needs a strong bounce here
afernandez321,,2019-06-07 14:15:00,205.213,TSLA solid close back to 180 I told you to use the 10 day
SmartSystems,True,2019-06-07 14:14:00,204.971,TSLA Heres your chance to get in Love these mid day dips
Bystander51,False,2019-06-07 14:14:00,204.971,TSLA zerohedgecomnews201906
Terminalhorizon,False,2019-06-07 14:13:00,204.954,TSLA Worst stock in the market to be in Audi and Amazon bulls Wont help with their demand crisis
lingeringMusk,True,2019-06-07 14:13:00,204.954,TSLA Elon cleaning his Electrick Jeep Barebonez Ridaz All of UZ Little Cost
200pips,False,2019-06-07 14:13:00,204.954,TSLA dont forget every positive headline you see is a lie they are not selling those numbers ever and even if they are its at a Huge loss
WielWatban,True,2019-06-07 14:13:00,204.954,TSLA Very nice
aytone,,2019-06-07 14:12:00,205.053,TSLA I was a BULL for 2 days now im BEAR short 21053 20999 etc
prizedcow,True,2019-06-07 14:12:00,205.053,TSLA Good luck getting this below 200 again Been tested and failed Only one way to go from here
200pips,False,2019-06-07 14:12:00,205.053,TSLA nice start selling hard here should see back to 150 next week there are no scenarios where this ever goes back up
WarrenCoolidge,True,2019-06-07 14:11:00,205.406,TSLA its healthy accumulation as long as it lingers at 206 207s
lingeringMusk,True,2019-06-07 14:11:00,205.406,TSLA Email leak Elon with a Bear knock out in sight Employees are rallying
tkizzy,,2019-06-07 14:11:00,205.406,TSLA Tesla maintains gains amid Chanos renewed criticisms against TSLAYou can tell its personal with Chanos he lost a lot of money by 2018q4 teslaraticomteslatslare
Jegejig1,,2019-06-07 14:11:00,205.406,TSLA Covering at the solid lines
StoneThrower,False,2019-06-07 14:11:00,205.406,TSLA sub 200 today Thats what happens when you pump a stock on a Elon and Tsla fanboys projections
Davidpaulson,,2019-06-07 14:11:00,205.406,TSLA if you can read do not trade Tesla on Friday afternoons The OPEX will cause you to lose your money both ways I am experienced
BakedChicken,,2019-06-07 14:11:00,205.406,TSLA not looking too good hopenium very very low
jamesinvest,True,2019-06-07 14:11:00,205.406,TSLA major bear trap in progress
ThePatrickBateman1,False,2019-06-07 14:11:00,205.406,TSLA BYE BYE FRAUD
menos,,2019-06-07 14:10:00,205.061,TSLA probably going back down to 197
DreadnoughtCapital,,2019-06-07 14:10:00,205.061,TSLA Thats the sound of more retail bag holders being created after being sucked in by a dead cat bounceLMAO
Davidpaulson,,2019-06-07 14:10:00,205.061,TSLA DO NOT MESS WITH TESLA ON Friday afternoons it will just take your money
MsEnglish,,2019-06-07 14:09:00,205.063,TSLA The whole decline started when the media was painting a picture that Tesla was going to die This has a lot more room to run up in the coming weeks into ER
ChartTrader33,,2019-06-07 14:09:00,205.063,TSLA option pin killing all premiums Lol dont be a gambler on weeklies they will burn you
OptionTradesBB,True,2019-06-07 14:09:00,205.063,TSLA someone buy a bunch of shares to get shorts to cover make this a major squeeze
HODLor,,2019-06-07 14:08:00,205.128,TSLA hard to know which way this will go two days of basically the same 5050 on this
lingeringMusk,True,2019-06-07 14:08:00,205.128,TSLA Good ride up Musik Bear Trap If the day
Gpaisa,,2019-06-07 14:08:00,205.128,TSLA looking to flush maybe trying to pin to 200
3dspline,True,2019-06-07 14:07:00,205.244,TSLA oh come on you bastard
aytone,,2019-06-07 14:07:00,205.244,TSLA trade range 210201 9 diff
DavidTaylorInvestor,False,2019-06-07 14:06:00,205.477,TSLA Oh no Why is it underperforming QQQ
the_red_adventurer,True,2019-06-07 14:06:00,205.477,TSLA arrr pirates if you cant handle the waves dont sail the high seas For all yar other scoundrels out there load them cannons Bring the rum
Steven_L,False,2019-06-07 14:04:00,205.907,TSLA eod 205 most likely 200 possible
Bazokaa,False,2019-06-07 14:04:00,205.907,TSLA some selling is on
sunnychang,,2019-06-07 14:04:00,205.907,TSLA US and Mexican officials are discussing the outlines of a deal that would dramatically increase Mexicos immigration enforcement efforts and give the United States far more latitude to deport Central Americans seeking asylum according to a US official and a Mexican official who cautioned that the accord is not final and that President Trump might not accept it the Washington Post reported
OptionTradesBB,True,2019-06-07 14:03:00,206.11,TSLA Think those margins are due
lingeringMusk,True,2019-06-07 14:03:00,206.11,TSLA Divorce Gas Stop the Theft of Hard Work You Down with OPP We Are Teslas Property now
lingeringMusk,True,2019-06-07 14:01:00,206.389,TSLA Sid you know theres an online task force that hunts unjust censorship now Block me Block you Thanks Truths set you free Burn the box Go Green I am not a cop though I cant afford it
prizedcow,,2019-06-07 14:00:00,206.659,TSLA Lot of bear panic Not sure why they knew this was coming
Ryuk,True,2019-06-07 14:00:00,206.659,SPY CMG TSLA BYND this week
StoneThrower,False,2019-06-07 14:00:00,206.659,TSLA Fred Lambert is a Tesla fanboy and he gets credibility on a projections call No wonder he was stuttering on the CNBC call Pump scam artist
microm,,2019-06-07 13:59:00,206.599,TSLA failed to break yesterdays high as the 20 day EMA continues to act as resistance I shaved more off into strength just under 21000 today as the daily candles look like potential tweezer tops
Terminalhorizon,False,2019-06-07 13:59:00,206.599,TSLA Little factoid for today If I bought 10 JUL 19 50 puts my max loss would be 420 Max gain 99k Gonna have to do that Its a sign from the Tezzla gods
Trumpstertotherescue,False,2019-06-07 13:59:00,206.599,TSLA May day may day Tesla just had a blow out on both left side tires will the right side hold up or blow too stay tuned
Vodd,False,2019-06-07 13:59:00,206.599,TSLA ohh boy it will need to break 250 to confirm that 180 was the bottom if not 145 ish incoming
Jegejig1,,2019-06-07 13:58:00,206.489,TSLA 30 minute may have a double top alreadyBull trailing swing stop and possible middle M is the thin blue line
OptionTradesBB,True,2019-06-07 13:58:00,206.489,TSLA make shorts cover dont sell
StoneThrower,False,2019-06-07 13:57:00,205.992,TSLA this is the scam artist that wrote that fake pump N America projections article What garbage Arrest this guy and the criminal insiders that used him to effect pps PUMP AND DUMP SCAM
Jegejig1,,2019-06-07 13:56:00,206.223,TSLA Bearish entries are marked with dotted lines on the daily chart
narra,,2019-06-07 13:56:00,206.223,TSLA can we get another 30 run next week investors day on Tuesday may be catalyst
gebbyart,,2019-06-07 13:55:00,206.205,TSLA Barrons comes out and says Demand is not the biggest problem New competition and siphoning sales from modelXandS are the biggest problem Always a problem You think someone is paying a Barrons for these smear articles
Jegejig1,,2019-06-07 13:54:00,206.182,TSLA Monthly still bearishCurrently retracing
Lubanjo,True,2019-06-07 13:53:00,206.224,TSLA sold my swing position today for a small gain looking for reentry under 200
adahbali,,2019-06-07 13:53:00,206.224,TSLA thats bad
Terminalhorizon,False,2019-06-07 13:53:00,206.224,TSLA Dead cat complete That was a weak one Back to the sell program
glouie,,2019-06-07 13:50:00,205.923,TSLA what is going on why is this red
StoneThrower,False,2019-06-07 13:50:00,205.923,TSLA dumpster fire
lingeringMusk,True,2019-06-07 13:49:00,205.8,TSLA Time to smoke the BearZ Smoke Break Right Mark Sweet Baby Ray
JSears68,False,2019-06-07 13:49:00,205.8,TSLA corporate debt getting tougher may not be able to rely on this again for its cash needs double top on consecutive days selling resumes nxt wk
Trumpstertotherescue,False,2019-06-07 13:49:00,205.8,TSLA not looking so good can you say 199 ish Or 190
froz,True,2019-06-07 13:49:00,205.8,TSLA cleantechnicacom2019053
LongsInvestments2,,2019-06-07 13:49:00,205.8,TSLA bears are still trying but in vain
Opinionex,,2019-06-07 13:48:00,206.25,TSLA Shoot If we keep getting good news they may keep this moving all summer youtubecomwatchvcJJWkJj
AegonTradegaryen,True,2019-06-07 13:48:00,206.25,TSLA MMs dont wanna pay today Nonetheless bullish on this price action Lets see the break of 215 next week
MrMakeItGoUpOrDown,True,2019-06-07 13:48:00,206.25,NIO I remember SNAP board was so bearish just like thisby 2020 this company going to eat TSLA
andytave,True,2019-06-07 13:47:00,206.393,TSLA power hours
Thankfulness,,2019-06-07 13:46:00,206.42,TSLA Ihor Dusaniwasky has the short share facts
lingeringMusk,True,2019-06-07 13:46:00,206.42,TSLA Harassment Bullying
lingeringMusk,True,2019-06-07 13:46:00,206.42,TSLA Report the Bears
lingeringMusk,True,2019-06-07 13:45:00,206.65,TSLA Keep Pushing then down Hows it going Bear Are you Find
muchlove,True,2019-06-07 13:44:00,206.814,TSLA Watch Tesla owner summon his Model 3 from down the road electrekco20190607tesl
ELinvest,True,2019-06-07 13:44:00,206.814,TSLA The China presales numbers may be released on Tuesday expect a huge spike
joseph_ka,False,2019-06-07 13:44:00,206.814,TSLA Thats your big Tesler snap back short squeeze etc Pretty lame in the strongest tape in months
StockTownCali,,2019-06-07 13:43:00,206.7,TSLA a lil nervous about both my put and call today Wanted to day trade one Will have to see how this comes out looking 2 hours from now
DevonStation,,2019-06-07 13:43:00,206.7,TSLA i think people sell into the close with mexico tariff s coming monday
TESLAQ,False,2019-06-07 13:41:00,206.886,TSLA someone just bought quick 31m worth of 190220 puts expiring jun2128 Those will quadruple to 120m in a week or two Smart people buying puts because they have the inside knowledge this is going down to 150sBagholders to aisle 420 please
2pug,True,2019-06-07 13:41:00,206.886,TSLA on Monday what do you expect to move more upwards TSLA or AMD just thinking of extending one of those temporarily
JustAGlitchBTMFD,True,2019-06-07 13:41:00,206.886,TSLA lol the bulls here complaining must not have been buying at the bottom like the rest of us and are just fomo chasers
Gpaisa,,2019-06-07 13:39:00,206.87,TSLA they are smoking the premiums for calls next weekgood ol tsla BS for you Been smoking them since it hit HOD
q0123,,2019-06-07 13:39:00,206.87,TSLA i wonder where TheMusk is Is he LingeringMusk now
devmo808,,2019-06-07 13:38:00,206.67,TSLA if you care for the world Elon tsla listen to Elon talk about AI in his video its already too late to from there
lingeringMusk,True,2019-06-07 13:38:00,206.67,TSLA Do they buy your script Or do you sell it to them Yup
lingeringMusk,True,2019-06-07 13:36:00,206.592,TSLA Are you getting it Kramer Did the Bull kick you in your head yet
jamesz8,True,2019-06-07 13:36:00,206.592,TSLA Change is happening right before our very eyes How do you not see Teslas revised Summon in Beta on displayyoutubecomwatchvcZWJEXY
TeslaBullish,True,2019-06-07 13:35:00,206.73,TSLA 30 of the shares are shorted And large institutions are buying many shares as possible at lowest price and holding it meaning there will be short squeeze next Tuesday
SquadGuy2,,2019-06-07 13:34:00,206.65,TSLA woaw holy fk Everyday the same dang shit here its getting tired Pop till 11 then fade the heck away all day
jbrashear,True,2019-06-07 13:33:00,206.595,Special thanks to AMD SPY TSLA JNJ V for this awesome week of gains for me and my followers Let it continue next week
OptionTradesBB,True,2019-06-07 13:33:00,206.595,TSLA gonna be an interesting close squeeze em
muchlove,True,2019-06-07 13:33:00,206.595,TSLA Elon specifically mentions deploying Supercharger stations in the country which connects Asia and Europe electrekco20190604tesl
lingeringMusk,True,2019-06-07 13:33:00,206.595,TSLA GhostFace Pimp Slap Kramer How Could you Buy now
BurningShorts,False,2019-06-07 13:32:00,206.403,TSLA
lingeringMusk,True,2019-06-07 13:32:00,206.403,TSLA Got Elon Just Ask him GDP OPP We The People Rebuild this Steeple Mentor this Pewww Pull Full Cortex Engaged
muchlove,True,2019-06-07 13:29:00,206.208,TSLA Tesla is expanding in Kazakhstan this year says Elon Musk electrekco20190604tesl
jbrashear,True,2019-06-07 13:28:00,206.444,TSLA Sorry bears Try a different stock Tried to warn you Follow the money
lingeringMusk,True,2019-06-07 13:27:00,206.653,TSLA I love going 90 on back roads too baby Kazakistan Peace Ringing in their Ear What if they made the cheapest car and a lot of super chargers New WolksWagon Bug
sunnychang,,2019-06-07 13:27:00,206.653,TSLA President Trump tweets If we are able to make the deal with Mexico there is a good chance that we will they will begin purchasing Farm Agricultural products at very high levels starting immediately If we are unable to make the deal Mexico will begin paying Tariffs at the 5 level on Monday
RussianRocket,False,2019-06-07 13:26:00,206.621,TSLA red red red
abiguzndt,,2019-06-07 13:25:00,206.432,TSLA they should get rid of weekly options Every stock gets manipulated starting Thursday afternoon
drew3007,True,2019-06-07 13:25:00,206.432,TSLA Used the run up to 210 to buy 621 185p as a straddle to my open 621 220c Time to sit and wait for next Tuesday Will close to leverage up and out or down and out depending on move after that
lingeringMusk,True,2019-06-07 13:24:00,206.545,TSLA Hey Don Get it Don lol Not the Don of Tesla
lingeringMusk,True,2019-06-07 13:23:00,206.74,TSLA Yes Sir
froz,True,2019-06-07 13:22:00,206.805,TSLA tsla expanding to Kazakhstan this year says Elon Musk electrekco20190604tesl
StockyCreed,True,2019-06-07 13:22:00,206.805,TSLA enhanced summon Come to me my AI precious youtubecomwatchvcZWJEXY
rsarnow52,,2019-06-07 13:22:00,206.805,TSLA why anyone trades after 1030 on fri is beyond me All these fricken algos are in complete control
elonfan,,2019-06-07 13:21:00,206.998,TSLA Consolidating for a dash towards 240 Then stampede LOL
davy3819,True,2019-06-07 13:21:00,206.998,TSLA pinned for options expiration This will rip next week
lingeringMusk,True,2019-06-07 13:21:00,206.998,TSLA He still doesnt get it Get the clue guy Bot Ban Buy Buy
sunnychang,,2019-06-07 13:18:00,207.035,TSLA why Tesla is not participating in the rally today With this kind of rally TSLA should at least up ten points
jwsf,,2019-06-07 13:18:00,207.035,TSLA its been a great week though We recovered the 20ma great place to start a run back to 300 next week
Thankfulness,True,2019-06-07 13:17:00,206.999,TSLA They might try to hold us back at 230 but I see 260 coming up this month
WallStExploit,,2019-06-07 13:17:00,206.999,TSLA good catalysts next week Bears will not want to hold over the weekend Should see some covering 350pm
BestFisherman,False,2019-06-07 13:15:00,207.231,TSLA not what I like to say but it seems like Tesla is going back down again
jwsf,,2019-06-07 13:14:00,207.37,TSLA tweet something lets get back to 300
froz,True,2019-06-07 13:11:00,207.067,TSLA in Q4 2018 was trading at 380 This Q2 will beat Q4 of last year This should be north 380 Short squeeze will be epic on next ER
lingeringMusk,True,2019-06-07 13:09:00,207.15,TSLA Lunch Break over Bears needed help getting a new mouth piece
flourish,,2019-06-07 13:08:00,207.165,TSLA 180 to 210 Success We have proved time and again we can run on fumes even if we dont use ICE
lingeringMusk,True,2019-06-07 13:07:00,207.21,TSLA A Bear is A Bear Report that
Paladin7148,True,2019-06-07 13:06:00,207.502,TSLA buying more
FR3EK,True,2019-06-07 13:05:00,207.412,TSLA Does Elon ever sit around watching the stock thinking damn I wish I could just tweet one more thing about the amazing things that are coming from TSLA this stock would explode
LongTermGains,True,2019-06-07 13:05:00,207.412,TSLA Closing above hod
GainerAide00,False,2019-06-07 13:03:00,207.685,TSLA Haha on our way back down Bulls are fuggd 150 here we come
WarrenCoolidge,True,2019-06-07 13:03:00,207.685,TSLA after the Tue meeting this could hit 230s to 240s
lingeringMusk,True,2019-06-07 13:03:00,207.685,TSLA WE HAVE IT ALL RIGHT HERE MY BROTHERS
IAmSoLong,True,2019-06-07 13:03:00,207.685,TSLA will close green
RussianRocket,False,2019-06-07 13:02:00,207.498,TSLA will close red
lingeringMusk,True,2019-06-07 13:01:00,207.073,TSLA Drop them HEAR MY FINGAZ
hunanddone,,2019-06-07 13:00:00,207.15,TSLA AS A PS Check our STMP A mess now At 37 down from 288 Youll see why w neWs I think they successfully reinvent model and close contracts They threw everything negative at the wall rather than death by 1000 cuts Im banking on a double at least Speculative so caution Im am LOADED UP
adahbali,,2019-06-07 13:00:00,207.15,TSLA 210 close
FELONMUSK,False,2019-06-07 13:00:00,207.15,TSLA DOUBLE TOP Markets s bubble Elons a fraud Down we go
BloodOnTheStreets,False,2019-06-07 12:59:00,207.165,TSLA
lingeringMusk,True,2019-06-07 12:59:00,207.165,TSLA Ban me again I always come back
AngryChikin,,2019-06-07 12:59:00,207.165,TSLA finish your second martini and buy buy buy
lingeringMusk,True,2019-06-07 12:58:00,207.125,TSLA Who Do you think you are ICE Im Legal and Want to Free Mexico
ramtek57,,2019-06-07 12:58:00,207.125,TSLA 17 automakers reportedly ask Trump to back off his plan to lower emissions standards or they will have to pay Tesla Billions
lingeringMusk,True,2019-06-07 12:57:00,207.501,TSLA Ban One Ban All I tie the knot Join US Free US A LL Loyal Love Burns
afernandez321,,2019-06-07 12:57:00,207.501,TSLA SPY weak closes means bad news Study the last closes of TSLA or SPY
robertloo,,2019-06-07 12:56:00,207.125,TSLA sold the June 26th 180185 225230 Iron Condor for 225 each
candiswave,,2019-06-07 12:56:00,207.125,TSLA 205 was first step Looking for her to run right through 25 keep an eye bull stay sharp
kremun,True,2019-06-07 12:55:00,207.103,TSLA thx for the trade all cash again If this dump again I will get back in
Trumpstertotherescue,False,2019-06-07 12:55:00,207.103,TSLA Struggling to hang on options expiration will drive this much lower today
lingeringMusk,True,2019-06-07 12:55:00,207.103,TSLA Do it for the money and not the money Get it yet
leroy26,False,2019-06-07 12:53:00,206.935,TSLA bulls had their moment now its time to face the truth
muchlove,True,2019-06-07 12:53:00,206.935,TSLA Elon Musk Teslas pickup will be a better truck than Ford F150 cnbccom20190607elonmu
afernandez321,,2019-06-07 12:53:00,206.935,TSLA PUMP OR WILL END BELOW THE 10 DAY AND THEN ROLL OVER If you are short you will get big rewards next week
aytone,,2019-06-07 12:52:00,207.088,TSLA Elon Musk Teslas pickup will be a better truck than Ford F150 cnbccom20190607elonmu
JRoad,,2019-06-07 12:52:00,207.088,TSLA should go private CNBC is the enemy of Elon Musk there are many bullish analysts out there you dont hear their voice
lingeringMusk,True,2019-06-07 12:51:00,207.365,TSLA Did you know you can be the Bear Flood Lol Free Ban We Love You Report that
Osborne820,,2019-06-07 12:51:00,207.365,TSLA just bouncing around inside this big bullish pennant huge move when it breaks
Cash1234,True,2019-06-07 12:51:00,207.365,TSLA 300 again by August People rambling about the company not being profitable and no demand Just look over to your left on the carpool lanes Youll see a few of these cars pass by you while your jammed between a carolla and a yaris Ill wave to you as I pass you in my new Tesla model 3 or model Y
lingeringMusk,True,2019-06-07 12:50:00,207.021,TSLA Brother can you spare a dime Per Share
