posicaprinia,False,2019-06-07 11:35:00,207.35,TSLA Will 205 hold today
Enjoylifeandtrade,,2019-06-07 11:35:00,207.35,TSLA what a turd short it back to 180
PirateParty,True,2019-06-07 11:35:00,207.35,TSLA The opportunity for 3 is bigger than some understand because Tesla is not just competing with entrylevel luxury cars but also with nonluxury cars In fact our analysis suggests that 54 of M3 demand should come from consumers who otherwise would have chosen massmarket cars
potp999,,2019-06-07 11:35:00,207.35,TSLA can anyone recommend a more professional trading forum These to the moon and Tesla will crash to 1000 comments are exhausting
skhanpara,False,2019-06-07 11:35:00,207.35,TSLA its not even fun anymore
Trumpstertotherescue,False,2019-06-07 11:35:00,207.35,TSLA The Gap below is about to be filled in the 190s it seems
Blu3Dream,False,2019-06-07 11:34:00,207.387,TSLA Stop reporting ThaMusk just block him hes immortal
BigNews,True,2019-06-07 11:34:00,207.387,TSLA Now the narrative is shifting Demand isnt the problem it is China and Brand cannibalizationClueless Crooks Annnnalysts Prosper of lies
forsiz1,False,2019-06-07 11:34:00,207.387,TSLA sell off into close for sure today back under 200 Mark my words
Networking4Eyes,,2019-06-07 11:33:00,207.452,Im going to be signing off here Were headed to Indianapolis for the weekend Still short TSLA puts as only position Careful with BYND I still think more short squeeze is in the works but you never know SPY QQQ up a lot too Careful come Monday Have a great weekend
kabab,True,2019-06-07 11:33:00,207.452,Ode to TSLA shorts Wonderin what new story you bears are gonna spin When the quarters over and the numbers come in
SrHeisenbergBug,True,2019-06-07 11:33:00,207.452,TSLA in 2017 China was the largest car market with 30 of mostly ICE cars sold there Now China is banning ICE factories restricting number of ICEs to be sold per yr while aggressively pushing for EVs Tesla stands to benefit from the purge of ICEs in China True story
jamesz8,True,2019-06-07 11:33:00,207.452,TSLA Even Toyota finally realized BEVs are the future Fuel cells my arse financeyahoocomnewstoyo
roni76,False,2019-06-07 11:32:00,207.656,TSLA chart update
forsiz1,False,2019-06-07 11:32:00,207.656,TSLA Back to 189 with low Q2 deliveries
PirateParty,True,2019-06-07 11:32:00,207.656,TSLA Employer branding specialists Universum have just released their annual rankings of the most attractive employers in the US for 2019 1st SpaceX2nd Tesla
Bazooka_Joe,False,2019-06-07 11:32:00,207.656,TSLA bulls are a little to excited but heres the reality your dreams are already crushed recapturing your money is a fantasy After you remortgaged your house twice to buy the dip at 290 then 275 Those days are over see you back in pain town next week
JohnBer,,2019-06-07 11:32:00,207.656,TSLA 20MA daily is definitely line in the sand
ramtek57,,2019-06-07 11:32:00,207.656,TSLA The Tesla Model 3 is the fastest charging car in the world topgearcomcarnewselectr
DoctorBurry,False,2019-06-07 11:31:00,207.813,Looks like people are waking up to the fact that only 33000 deliveries by TSLA quarter to date is not at all bullish Big trouble
RedTeslaRocks,True,2019-06-07 11:30:00,207.327,Was just speaking to some long time stock friends Anyone remember when AAPL and MSFT and TSLA and GOOG were priced LOW where AMD is now and then suddenly took off like a SPACEX ROCKET You would then see all these new rich people driving around with vanity licence plates bragging about their successes Anyone remember seeing a few of those any LOL I think this might be time for a few of us to get excited and start designing some custom vanity license plates AMD1000 I like that one so no one take it for the state of California please until I order it LOL
StoneThrower,False,2019-06-07 11:30:00,207.327,TSLA pump and dump scam
bearcharts,False,2019-06-07 11:29:00,207.222,Covered at 82 next weeks TSLA strike185 hedge puts sold yesterday keeping 73 net gain Ill rewrite higher or roll to 187s
Terminalhorizon,False,2019-06-07 11:28:00,207.604,TSLA The nice thing about dead cat bounces here it makes the monthly 50 Tesla under multiple intermingled investigations puts super cheap
OptionTradesBB,True,2019-06-07 11:28:00,207.604,TSLAbuy buy buy this can go up to 300 quick on all those clueless shorts who thought this was going to 10
gotachance,,2019-06-07 11:27:00,208.071,TSLA 6 stocks with VWAP
ymd99,False,2019-06-07 11:26:00,208.078,TSLA thats it
roni76,False,2019-06-07 11:26:00,208.078,TSLA and now all way down bich
davy3819,True,2019-06-07 11:25:00,208.252,TSLA in with 35 shares for next 5 years Will keep adding on every dip more than 3 huzahhhh
NineElon,True,2019-06-07 11:24:00,208.529,TSLA TESLA IS LOVE AND FUN BEARS ARE BAD NEWZ Bounce the Bear head against the pavement with me hear
Teslaquilla73,True,2019-06-07 11:24:00,208.529,TSLA marketwatchcomstorytesla
DontBanRomanza,,2019-06-07 11:24:00,208.529,Teslas Model 3 demand worries are overblown Piper Jaffray MarketWatch TSLA marketwatchcomstorytesla
ELinvest,True,2019-06-07 11:24:00,208.529,TSLA this will settle around 211 today
Gocubsandelonmusk,,2019-06-07 11:24:00,208.529,TSLA
Trumpstertotherescue,False,2019-06-07 11:23:00,208.767,TSLA Easy come easy go V v v v v v vv v v v v v v
DolanDrumpf,False,2019-06-07 11:23:00,208.767,TSLA nice bull trap
StoneThrower,False,2019-06-07 11:22:00,208.784,TSLA
ELinvest,True,2019-06-07 11:22:00,208.784,TSLA this should gap up to 240 on Monday following positive news and reports over the weekend
PineappleTrading,False,2019-06-07 11:22:00,208.784,TSLA about to go red I guess
Steven_L,,2019-06-07 11:22:00,208.784,TSLA 205 eod
WarrenCoolidge,True,2019-06-07 11:20:00,208.877,TSLA we need a close above 210s
Dontbethatguy,True,2019-06-07 11:20:00,208.877,TSLA if not it goes back to 205206 ascending tri support
Dontbethatguy,True,2019-06-07 11:19:00,209.091,TSLA if this holds that 20884 support now its going to break that 211
mrcm,True,2019-06-07 11:19:00,209.091,TSLA Recovery will be epic
WarrenCoolidge,True,2019-06-07 11:18:00,209.368,TSLA nineelon blocked
VolumeBot,,2019-06-07 11:17:00,209.124,Percent short volume for TSLA was 4079 on 060619 volumebotcomsTSLA
afernandez321,,2019-06-07 11:17:00,209.124,TSLA closes below the 10 day it will be toast and will role over I have showed it 6 times in most recent times
ramtek57,,2019-06-07 11:16:00,208.887,TSLA Take off your Tesla blinkers the growth story is intact httpsthedrivenio20190603takeoffyourteslablinkersthegrowthstoryisintact
JohnBer,,2019-06-07 11:16:00,208.887,TSLA this is within the level of weekly straddle No spike in option IV I guess
gotachance,,2019-06-07 11:16:00,208.887,TSLA not with AMD now
StoneThrower,False,2019-06-07 11:16:00,208.887,TSLA will finish red today
Trumpstertotherescue,False,2019-06-07 11:15:00,208.979,TSLA Market is heading back down now and so will this overhyped Albatross
DolanDrumpf,False,2019-06-07 11:15:00,208.979,TSLA
skhanpara,False,2019-06-07 11:14:00,209.303,TSLA
sabre666,,2019-06-07 11:14:00,209.303,TSLA about to test that downtrend line againLikely to hit its head and reel away with a concussion
AlexanderHandleton,True,2019-06-07 11:13:00,209.428,TSLA up 20 in 4 days Soooo bearish
Ro_Patel,,2019-06-07 11:13:00,209.428,In a letter signed by 17 auto companies warns Trump admin that one of his most sweeping deregulatory efforts his plan to weaken tailpipe pollution standards threatens to cut their auto profits and produce untenable instability in a crucial manufacturing sector Trumps new rule which is expected to be made public this summer would all but eliminate the Obamaera auto pollution regulations essentially freezing mileage standards at about 37 miles per gallon for cars down from a target of 545 miles per gallon by 2025 The policy makes it a near certainty that California and 13 other states will sue the administration while continuing to enforce their own stricter rules in effect splitting the United States auto market in two For automakers a bifurcated market is their nightmare scenario In the letter to Mr Trump they warned of an extended period of litigation and instability should his plans be implemented GM F FCAU TM TSLA
Breel2351,,2019-06-07 11:13:00,209.428,TSLA important 21052 area
justmeagain,,2019-06-07 11:12:00,209.488,TSLA Im definitely bearish I believe Tesla will go into reorganization to keep the creditors at bay prior to them ultimately succeeding failing or merging That said I also now think this will go to the end of June at about 240 before it reverses on profit concerns
w97,True,2019-06-07 11:12:00,209.488,TSLA lol in musk I trust
Teslaquilla73,True,2019-06-07 11:12:00,209.488,TSLA hit 215 and we go to 350 in a month
ramtek57,,2019-06-07 11:11:00,209.755,TSLA Electric cars are 4times more efficient than gaspowered vehicles That means that if everyone in the US made the switch the countrys CO2 emissions wouldimmediately drop by 84
Kirkland_TO,True,2019-06-07 11:11:00,209.755,TSLA Shows no weakness Thats good
MsEnglish,,2019-06-07 11:10:00,209.732,TSLA Now underperforming markets
ramtek57,,2019-06-07 11:07:00,209.824,TSLA China limits the number of license plates they issue for all vehicles ICE and EVs They are now allowing license plates for EVs with no limitations In Beijing alone there are 3000000 people waiting to get approval for a license plate Last year Beijing gave approvals for 80000 cars When Tesla begins selling from the GF3 at end of year China will be buying all they can produce
Lillybear,,2019-06-07 11:07:00,209.824,TSLA 211 nut is hard to crack It will though if volume hits 7mm by noontime
Terminalhorizon,False,2019-06-07 11:06:00,210.175,TSLA Remember bulls you guys are 90 bucks a share away from 300 Ill be here for you when this cracks 175 Stock and company are dead long term
BigNews,True,2019-06-07 11:05:00,210.093,TSLA Demand worries for model 3 is overblown by short hedge fundsSEC Piper Jaffray
adahbali,,2019-06-07 11:05:00,210.093,TSLA come on babe
The_Day_Trader,,2019-06-07 11:04:00,210.02,TSLA buy buy buy like cramer would say
Phenix1,True,2019-06-07 11:04:00,210.02,PLUG TSLA TM GM China has unveiled a new megahydrogen station that produces 2 tonnes of H2 per day in Shanghai chinaorgcnchina201906
gotachance,,2019-06-07 11:03:00,210.404,TSLA SP rise with strong volume
ramtek57,,2019-06-07 11:03:00,210.404,TSLA forbescomsitessap20180
Jinweb,,2019-06-07 11:03:00,210.404,TSLA gap at 236 thats the peak
SrHeisenbergBug,,2019-06-07 11:03:00,210.404,TSLA short burning sizzling
ramtek57,,2019-06-07 11:02:00,210.496,TSLA Seven Reasons Why The Internal Combustion Engine Is A Dead Man Walking
omarmaarouf2012,True,2019-06-07 11:02:00,210.496,TSLA A bear is fighting the bull at 211 alot at stake for the bears if they lose this line
StoneThrower,False,2019-06-07 11:01:00,210.262,TSLA can just get to yesterdays high on yesterdays end of market pump and todays monster What does that tell you
WarrenCoolidge,True,2019-06-07 11:01:00,210.262,TSLA lets print 212 next
fightforjustice,,2019-06-07 11:01:00,210.262,TSLA Where are the nuts analyst calling for 10share Have they lost their mind They grabbed your weak hand shares for cheap last week and now running it up Buy when bloody
Kirkland_TO,True,2019-06-07 11:00:00,210.255,TSLA Lets print 212
xReck,,2019-06-07 11:00:00,210.255,TSLA
menos,True,2019-06-07 11:00:00,210.255,TSLA either break or big rejection here looks like rejection
BigNews,True,2019-06-07 11:00:00,210.255,TSLA Bears who are in denial and believed their own lies refusing to cover are about to whiteness a Massacre
ramtek57,,2019-06-07 10:58:00,210.557,TSLA Teslas Model 3 demand worries are overblown Piper Jaffray marketwatchcomstorytesla
gac123,,2019-06-07 10:58:00,210.557,TSLA people die every Xminute hitting trucks autopilot still much safer arkansasliveuamapcomen2
buyEMlow,True,2019-06-07 10:58:00,210.557,TSLA Beyond Gas Self Driving Cool Car Company blending in with the future of energy production and storage 4k stock
GAMAS,True,2019-06-07 10:57:00,210.54,TSLA So what happens when this mofo actually squeezes
JojoNYC,,2019-06-07 10:57:00,210.54,TSLA 100 more shares and I am fully loaded up
Jimmyza,,2019-06-07 10:57:00,210.54,TSLA autogeekcomuanatrassez blood is on slaughterpilot hands
AngryChikin,,2019-06-07 10:57:00,210.54,TSLA saw this same action yesterday on the spy its going to grind away at resistance then
ramtek57,,2019-06-07 10:57:00,210.54,TSLA Everybody will want oneTesla Model 3 Performance Will Smoke Your Sports Car insideevscomreviews35343
Surfaceguy,,2019-06-07 10:57:00,210.54,TSLA Little pullback action here for abit
OptionTradesBB,True,2019-06-07 10:55:00,210.195,TSLA Prepare for a huge squeeze there were no shares to short earlier
Terminalhorizon,False,2019-06-07 10:55:00,210.195,TSLA Pops like this are normal and expected in failing companies
InItToWinIt100,,2019-06-07 10:55:00,210.195,TSLA Crazy 30 pt run this week
taguru,,2019-06-07 10:55:00,210.195,TSLA Tesla TSLA 20595 was this quarters top loser falling 28 Expect a Downtrend reversal tickeroncomappnewsSearch
Teslaquilla73,True,2019-06-07 10:54:00,210.17,TSLA going to the moon
sina007,True,2019-06-07 10:54:00,210.17,TSLA 300 two weeks from now
tri99a,True,2019-06-07 10:53:00,210.58,TSLA big winner right here bless up
Lillybear,,2019-06-07 10:53:00,210.58,TSLA Here we go breaching 211
Teslaquilla73,True,2019-06-07 10:53:00,210.58,TSLA 220 coming soon
adahbali,,2019-06-07 10:52:00,210.473,TSLA can we break 212
JustAGlitchBTMFD,True,2019-06-07 10:52:00,210.473,TSLA come on lets squeeze these pigs do it for daddy
FehuTradr,True,2019-06-07 10:52:00,210.473,TSLA Nice lets break 215 today
WarrenCoolidge,True,2019-06-07 10:52:00,210.473,TSLA shorts r nuts have no clue whats coming
froz,True,2019-06-07 10:52:00,210.473,TSLA
walli26,,2019-06-07 10:52:00,210.473,TSLA We past 211 and well go directly to 230
WarrenCoolidge,True,2019-06-07 10:51:00,210.105,TSLA nice lets break 210
scheplick,,2019-06-07 10:51:00,210.105,The TATS are looking okay todayBaristas in Brooklyn love them millennial avocados love them TWTR AMD TSLA SNAP
Kirkland_TO,True,2019-06-07 10:50:00,209.653,TSLA seems healthy again after a while Most probably will go toward 300
DolanDrumpf,,2019-06-07 10:50:00,209.653,SPY GLD AMZN TSLA It all makes sense now
Jimmyza,,2019-06-07 10:50:00,209.653,TSLA robotaxiswow it cant even stop for trucks working on the highwayanother death on elons hands twittercomelonymousdolos
mrcm,True,2019-06-07 10:49:00,209.514,TSLA Can Elon please release Chinese reservations May be he is waiting for right moment to create ultimate squeeze
roni76,False,2019-06-07 10:49:00,209.514,TSLA NVDA AMD AAPL definitely an pump for dump attention could start now a sell off till close
mrcm,True,2019-06-07 10:48:00,209.43,TSLA Will buy a M3 performance with my profits
Terminalhorizon,False,2019-06-07 10:48:00,209.43,TSLA Dead cat Tezzla fizzle This was your chance bulls
pk8123,,2019-06-07 10:48:00,209.43,BYND coming to you soon electric TSLA powered TLRY CBD infused SNAP advertised 100x revenue falafel patties from BYND BUY
afernandez321,,2019-06-07 10:47:00,209.458,TSLA all I have to say is SCTY chart Did Musk say no brainer or no brains How is that working out for you So 26 Billion flushed down the toilet Who else wants to let some money too Musk
Jimmyza,,2019-06-07 10:47:00,209.458,TSLA twittercomblackopscyber1 another autopilot deathwhen will they stop Elon from selling this software as FSD
Osborne820,,2019-06-07 10:47:00,209.458,TSLA bears literally have no case left they better pray analyst upgrades dont come till next week
stocktowatch7,,2019-06-07 10:46:00,209.337,TSLA here goes on stocksequitycomactivesto
rsarnow52,,2019-06-07 10:46:00,209.337,TSLA this is over time to go fishing
JustAGlitchBTMFD,True,2019-06-07 10:46:00,209.337,TSLA everything running right now and his is getting slammed by desperate shorts smh
Lam6505,True,2019-06-07 10:46:00,209.337,TSLA
roni76,False,2019-06-07 10:45:00,209.258,TSLA NVDA AMD AAPL nasdaq dramatic macdprice divergence in 5m chart wow this bubble makes boom soon
danielb1976,,2019-06-07 10:45:00,209.258,SHOP fuck just killed it today 14k in one fuckn hour lord o lord this is better then TSLA long
Trumpstertotherescue,False,2019-06-07 10:45:00,209.258,TSLA She is starting to tumble down now
StoneThrower,False,2019-06-07 10:45:00,209.258,TSLA weakness
the_red_adventurer,True,2019-06-07 10:44:00,209.396,TSLA they might be pushing this up all the way into Tuesday meeting yearly
Trumpstertotherescue,False,2019-06-07 10:44:00,209.396,TSLA Look out below is all I can see Nice Gap to fill
marketchameleonwins,,2019-06-07 10:44:00,209.396,TSLA TSLA 21Jun19 190220 Put Spread traded 500 times for 1290 with the market at 12701295 marketchameleoncomOvervie
rsarnow52,,2019-06-07 10:43:00,209.738,TSLA thats it boys closes between 20750 and 210 next week a new week
AlexanderHandleton,True,2019-06-07 10:43:00,209.738,TSLA hope you bought more puts We need to if we are going to get to 280
Saolof,True,2019-06-07 10:42:00,209.934,TSLA Institutional buying is picking up Yesterday was a pocket pivot and also there was a single buy order for 420k shares at 1144
MapTechnicalForecasting,,2019-06-07 10:42:00,209.934,SPY SPX TSLA winners always win because they never quit Dont blow the whole wad at once layer it in keep trying Dont short
PublicNME,True,2019-06-07 10:42:00,209.934,TSLA options value getting smashed man wtf I hate that
marketchameleonwins,,2019-06-07 10:42:00,209.934,TSLA TSLA 15Nov19 150 Puts Traded 1000 Times for 13 Million in Premium marketchameleoncomOvervie
Dontbethatguy,True,2019-06-07 10:41:00,210.337,TSLA pennant into an ascending tri now this is going to blow betas
Dontbethatguy,,2019-06-07 10:41:00,210.337,TSLA not sure how because all of the smaller time frames are over bought but thats another pennant forming to break up 211 goes and its 220
Trumpstertotherescue,False,2019-06-07 10:41:00,210.337,TSLA The numbers are going to fall way short again as usual Way short of the 90000 needed for the quarter
daddylongstroke,True,2019-06-07 10:40:00,209.979,TSLA beyond meat Beyond gasoline
therealpedro,False,2019-06-07 10:40:00,209.979,TSLA Tesla Insurance44 days since Elon Musk promised Tesla insurance in about a month
he123,True,2019-06-07 10:39:00,209.812,TSLA any chart expert Please
CornBuffet,,2019-06-07 10:39:00,209.812,TSLA NIO
WallStExploit,,2019-06-07 10:39:00,209.812,TSLA
Lam6505,True,2019-06-07 10:38:00,209.91,TSLA
Disgusting_Scumbag,False,2019-06-07 10:38:00,209.91,TSLA closes red
rsarnow52,,2019-06-07 10:37:00,210.069,TSLA gonna be tough to break this this 210 price
Osborne820,True,2019-06-07 10:37:00,210.069,TSLA keeps tapping that Mid 210 Resistance will eventually break and then strap on the rocket boosters
Lam6505,True,2019-06-07 10:37:00,210.069,TSLA 215 today
MapTechnicalForecasting,,2019-06-07 10:36:00,209.674,TSLA try try and try again Yes I did nail the bottom eventually
lingeringMusk,True,2019-06-07 10:35:00,209.805,TSLA Bad to the Bone Elon Gated Man is The Star Bad To Be Norm Get the ICE man Buy tickets to the big game here
TimApple1,True,2019-06-07 10:35:00,209.805,TSLA break 211 already
LongTermGains,True,2019-06-07 10:35:00,209.805,TSLA BEARS DONT WANT THE SMOKE
Jimmyza,,2019-06-07 10:34:00,209.955,TSLA I love these bullsyou got about a month and a half until that record loss report comes out Have funor maybe they miss deliveries anyways and its less than a month
sevenxs,True,2019-06-07 10:34:00,209.955,MCD TSLA MRK QQQ Ok fine last set because I have to get back to work WOWI POSTED ALL THESE ON HERE FOR FREE FOR U
froz,True,2019-06-07 10:34:00,209.955,TSLA price crosses above sma 20
lingeringMusk,True,2019-06-07 10:33:00,210.012,TSLA Bears about to be pumped into this jackpot
StockyCreed,True,2019-06-07 10:33:00,210.012,TSLA dip of the year last week Go go go
rsarnow52,,2019-06-07 10:33:00,210.012,TSLA looks like they are going to wrap it around this 210 sp oh well next week is investor day
outkast209,True,2019-06-07 10:33:00,210.012,TSLA its a buy Goooo
JustAGlitchBTMFD,True,2019-06-07 10:31:00,210.373,TSLA something tells me a lot of shorts who entered at 210 have their stops at 211 and just above lets get em
LosersParadise,True,2019-06-07 10:31:00,210.373,TSLA if it pass above 212 no stop till 222
lingeringMusk,True,2019-06-07 10:30:00,210.129,TSLA Bearz have man hands Ewww Out my face and pocket sucka
jbyers172,True,2019-06-07 10:30:00,210.129,TSLA Possible squeeze here
DesiHFM,True,2019-06-07 10:29:00,209.745,TSLA Piper Jaffray pt 396 demand worries are overblown 300 before next earnings
WineLovers,True,2019-06-07 10:29:00,209.745,TSLA Cheers Sante Cin cin Kanpai Skal Salid Chok dee Saudemedia0giphycommediaBLkb
lingeringMusk,True,2019-06-07 10:29:00,209.745,TSLA The danger zone is here Bearz Lol
JustAGlitchBTMFD,True,2019-06-07 10:28:00,209.841,TSLA lol so many shorts about to get squeeZed
Spartanofwallstreet24,True,2019-06-07 10:28:00,209.841,TSLA i smell 220 by nextweek
lingeringMusk,True,2019-06-07 10:28:00,209.841,TSLA Time to chalk up the bearz
JojoNYC,,2019-06-07 10:27:00,209.51,TSLA 400 2019 1000 2020
krisgosain,True,2019-06-07 10:27:00,209.51,TSLA Winter is coming
lingeringMusk,True,2019-06-07 10:27:00,209.51,TSLA Who Haz All The Hand Elon in Mr Hand Buy your ticketz hear
menos,True,2019-06-07 10:26:00,209.522,TSLA battle for 211 today on the way to 257
krisgosain,True,2019-06-07 10:26:00,209.522,TSLA muhahahahahahahaha
davegee,,2019-06-07 10:26:00,209.522,TSLA one day chart is looking an awful lot like 12 a middle finger
lingeringMusk,True,2019-06-07 10:25:00,209.836,TSLA Bulls have Hand Green boarded Chalk up the Bearz to the Beat
OptionTradesBB,True,2019-06-07 10:25:00,209.836,TSLA beam me up scottie
Stocks_All_Day,,2019-06-07 10:25:00,209.836,AAPL looking to acquire Driveai to get exposure to autonomous vehicles HmmmUBER LYFT TSLA
WarrenCoolidge,True,2019-06-07 10:25:00,209.836,TSLA nice and stead
TT_1,True,2019-06-07 10:24:00,209.76,TSLA nails in the coffin for bears1 Short squeeze hasnt started2 Rate cut3 Trade deal resolution SOON4 Q2 delivery PRSpread your cheeks bears
rsarnow52,,2019-06-07 10:22:00,209.34,TSLA I wonder if we break thru 210 and close at 215 fri with option algos makes it very tough
hrsa,,2019-06-07 10:22:00,209.34,MNK value investing my ass I woud have been better off staying with TSLA
the_dumpster_diver,,2019-06-07 10:22:00,209.34,TSLA 2025197 bear put 614 15
lingeringMusk,True,2019-06-07 10:22:00,209.34,TSLA Elon is the sharp dressed man Fly by the light Elon the Elon Gate Eliminator And Bear laminator
Dr_Stoxx,True,2019-06-07 10:22:00,209.34,TSLA 211 222 233 Then likely a pullback
iamLaKai,True,2019-06-07 10:21:00,209.63,TSLA Congrats to all who bought that 178 low I waited for confirmation and bought more at 205 I should have had more faith lol
AngiesFeet,,2019-06-07 10:21:00,209.63,TSLA holy Imagine this going back to 380 within the next few months
jayrome11,False,2019-06-07 10:21:00,209.63,TSLA gonna buy puts again on this terd
Manny007,True,2019-06-07 10:21:00,209.63,TSLA
ehttrader,True,2019-06-07 10:21:00,209.63,TSLA Bull flag in development 230 is coming
sabbie,,2019-06-07 10:21:00,209.63,The reason Im not short TSLA here is that they will have nutty Musk step aside and then massive rally
Greedling,False,2019-06-07 10:21:00,209.63,TSLA Keep shorting bears
DesiHFM,True,2019-06-07 10:21:00,209.63,TSLA ready for 250
lingeringMusk,True,2019-06-07 10:21:00,209.63,TSLA Beautiful picture
Stratostock,True,2019-06-07 10:21:00,209.63,TSLA Were on a uptrend Absolutely bullish Bullish
Dr_Stoxx,True,2019-06-07 10:20:00,209.978,TSLA Gap 1 filled 222 next up Short squeeze hasnt yet started either
bryancohen,,2019-06-07 10:20:00,209.978,TSLA u
lingeringMusk,True,2019-06-07 10:20:00,209.978,TSLA Correction unlike the fake news King Kong Not Kong Kong Im sorry Mira Mira
bryancohen,True,2019-06-07 10:20:00,209.978,TSLA how does winning feel bears
Terminalhorizon,False,2019-06-07 10:20:00,209.978,TSLA Dead cat is starting to wrap up little bit more until a good short entry if youve been wanting to short it
SwingingForward,False,2019-06-07 10:20:00,209.978,TSLA Short under 210 Long over it personally i wont touch the long
ehttrader,True,2019-06-07 10:20:00,209.978,TSLA good job Bulls Bears this is a great time to cover This will fly back to 300 in no time marketwatchcomstorytesla
KingHighlights,,2019-06-07 10:19:00,209.822,TSLA hey longs you cant take these silly bears seriously just troll them like I do lol they get really emotional
cimbom,True,2019-06-07 10:19:00,209.822,TSLA cover you assholes
lingeringMusk,True,2019-06-07 10:19:00,209.822,TSLA Vietnam Rockz Lets make Elon Gated Man a Viet Kong Kong
AngryPanda,True,2019-06-07 10:19:00,209.822,TSLA autopilot
bowieinspace,True,2019-06-07 10:18:00,210.165,TSLA And cue the Teslas on fire pictures
andytave,True,2019-06-07 10:18:00,210.165,TSLA best day lol
TheSleepyJewel,,2019-06-07 10:18:00,210.165,TSLA puts brah
RaginCajun,True,2019-06-07 10:18:00,210.165,TSLA no looking back long
Killerbee70,True,2019-06-07 10:17:00,210.211,TSLA MMs joining inlol
GreenTrail,True,2019-06-07 10:17:00,210.211,TSLA whats the target guys
JustAGlitchBTMFD,True,2019-06-07 10:17:00,210.211,TSLA SEND IT
mechatronic86,True,2019-06-07 10:17:00,210.211,great video about TSLA and Maxwell tech MXWLyoutubecomwatchvXMOFuEH
ElliottwaveForecast,,2019-06-07 10:17:00,210.211,Elliott Wave Analysis Forecasting the Decline In TSLA elliottwaveforecastcomst Elliottwave trading Tesla
GreenTrail,True,2019-06-07 10:17:00,210.211,TSLA this is going to run run today
lingeringMusk,True,2019-06-07 10:17:00,210.211,TSLA Feel the Bear Beating
ThePatrickBateman1,False,2019-06-07 10:16:00,209.485,TSLA is a joke Almost 40 Billion market cap Lucky if it sells 200000 cars this year Pathetic 0002 share of global automobile market
