illianamike,False,2019-06-07 15:59:00,204.484,TSLA what happened to insurance for Tesla drivers Elon lies again
itsallaboutheoptions,True,2019-06-07 15:59:00,204.484,Trade Ideas TSLA delayed JUN21 2125C swing still actionable
bullTrader1010,True,2019-06-07 15:59:00,204.484,TSLA nice pull back persist on top of 200 if news pop during weekend we could see good move next week charts looks good
StockTownCali,True,2019-06-07 15:59:00,204.484,TSLA time to see which direction this going starting neeoowww
lingeringMusk,True,2019-06-07 15:59:00,204.484,TSLA I think Tesla is just about Charged Wonder who or what is in that suit
Sdot94,,2019-06-07 15:59:00,204.484,TSLA smells like anxiety in here
jackp2020,,2019-06-07 15:57:00,204.418,TSLA Elon must will tweet he loves BYND and tsla will rally by 50 too
StockTownCali,,2019-06-07 15:57:00,204.418,TSLA I think bulls and bears are both nervous af rn lolol
lingeringMusk,True,2019-06-07 15:57:00,204.418,TSLA Even Freddy is A Bull What did the five fingers say to the Face Slap Thats what Bear
davy3819,True,2019-06-07 15:56:00,204.491,TSLA its so funny how hard the mm tried to keep this pinned under 205 Its ok next week they wont be able to contain it
StockTownCali,True,2019-06-07 15:55:00,204.524,TSLA new buyers in 4 mins Its good Lets bull run this dip
lingeringMusk,True,2019-06-07 15:54:00,204.447,TSLA Fake Bear Panik pickup cheap shares now
TRADERLETE,,2019-06-07 15:54:00,204.447,4 STOCKS FOR MONDAY JUNE WEEK 2 WATCH youtubecomwatchvT0ljGttAMD TSLA MSFT BYND1 MSFT While you have Alphabet Facebook and Apple all under gov investigation Amazon is sort of the innocent ticker in the tech sector currently Called out as a buy in our chat at 13070 the stock currently hit its HODhigh of day of 13225 READ HERE traderletecomblogsstock
posicaprinia,False,2019-06-07 15:54:00,204.447,TSLA no panic selling into the close
lingeringMusk,True,2019-06-07 15:54:00,204.447,TSLA Chop Suey Tome System of the Down Unite and tie their shoez
KingofAnalysts,True,2019-06-07 15:54:00,204.447,TSLA Piper Jaffrays upgrade just before the meeting seems we will see 400 soon
deetz32,,2019-06-07 15:54:00,204.447,AngryPanda I guess today was another example of your theory that AMZN and TSLA perform relatively inversely
OptionTradesBB,True,2019-06-07 15:53:00,204.467,TSLA Meeting on Tues see you at 250
lingeringMusk,True,2019-06-07 15:52:00,204.459,TSLA For 220 you get a free OZ in Cali
StockTownCali,True,2019-06-07 15:52:00,204.459,TSLA please run up AH
kddavis,False,2019-06-07 15:52:00,204.459,TSLA what a head fake yesterday market is up today and it bled out new bags
lingeringMusk,True,2019-06-07 15:52:00,204.459,TSLA The Bears are Scrooged
StockTownCali,True,2019-06-07 15:52:00,204.459,TSLA come on buyers just run this up to 20475 before close plzzzz
AlexanderHandleton,True,2019-06-07 15:51:00,204.46,TSLA 205 pin broken downtrend Ill take it
TESLAQ,False,2019-06-07 15:51:00,204.46,TSLA added another 10 august put contracts sp195 since they went on sale today Thanks bulls Looking forward to another easy 100200 gain at your expense
andytave,True,2019-06-07 15:51:00,204.46,TSLA 205 close
rbrwn12,True,2019-06-07 15:51:00,204.46,TSLA stock At multi year low into investor day and potential record deliveries lol Get that vaseline bears Elon going to give you his rocket Next stop Uranus
DolanDrumpf,False,2019-06-07 15:50:00,204.429,TSLA shoulda listened to Dolan
Teslaquilla73,True,2019-06-07 15:49:00,204.373,TSLA
lingeringMusk,True,2019-06-07 15:49:00,204.373,TSLA I think the Bear Trap got one Waive Hahahah Again 210 Rally for Sport
lingeringMusk,True,2019-06-07 15:47:00,204.276,TSLA 210 220 201 313
lingeringMusk,True,2019-06-07 15:47:00,204.276,TSLA 201 time Looney toonez go to the hospital
lingeringMusk,True,2019-06-07 15:46:00,204.3,TSLA 210 will ice them
lingeringMusk,True,2019-06-07 15:46:00,204.3,TSLA 201 will slaughter the Bears wallet Power What is Teamwork 313 860
StockFrank,,2019-06-07 15:45:00,204.211,TSLA I would hope one more short squeeze next week and then we will probably stay around 220 waiting for ER ER could send it back to 180 or push it to above 250
ibbi,,2019-06-07 15:45:00,204.211,TSLA 190s on Mondayfed will not cut rates in this monthmay be in septembertrade war will get worse and china will bycott of US products
lingeringMusk,True,2019-06-07 15:45:00,204.211,TSLA Bears leaving work Put your happy face on
goooodfellas,True,2019-06-07 15:44:00,204.24,TSLA 400 is coming
froz,True,2019-06-07 15:44:00,204.24,TSLA Tuesday meeting musk will open his mouth and this will fly
lingeringMusk,True,2019-06-07 15:43:00,204.39,TSLA Do you love me now that I can dance Dance Dance Wooo
JustAGlitchBTMFD,True,2019-06-07 15:42:00,204.196,TSLA i smell a 205 pin just below likely today mms didnt wanna pay out much this week short squeeze rescheduled for next week Have a great weekend
MsEnglish,,2019-06-07 15:42:00,204.196,TSLA Closing on LOD not usually good Likely will be closing the gap that exists below
TESLAQ,False,2019-06-07 15:41:00,204.097,TSLA is tezzzla making profit and FCF for all quarters moving forward Oh guess not What about FSD aka vaporware in 6 months 12 months definitely 2017 promise
Lam6505,True,2019-06-07 15:39:00,204.165,TSLA upside potential is far greater than down If you want to 20x your money this is a lifetime opportunity
afernandez321,,2019-06-07 15:39:00,204.165,TSLA supposedly decision will be made tonight or over the weekend So make a quick decision LOL
Hillhick,,2019-06-07 15:39:00,204.165,SPY I think BYND is replacing TSLA as my new favorite stock to sell premium on Craziest option prices ever
afernandez321,,2019-06-07 15:39:00,204.165,TSLA Mexico NO DEAL on Monday and this stock will open below 200 SPY
9ine,True,2019-06-07 15:39:00,204.165,TSLA its holding 200
TRADERLETE,True,2019-06-07 15:38:00,204.499,TSLA winning call read up on TSLA more here traderletecomblogsstock
StockTownCali,True,2019-06-07 15:38:00,204.499,TSLA lets gooooooo
menos,True,2019-06-07 15:38:00,204.499,TSLA counter attack begins
AlexanderHandleton,,2019-06-07 15:38:00,204.499,TSLA 205 pin is boring
PutItAllInGold,True,2019-06-07 15:37:00,204.479,TSLA Closing green Take that bears
sellmeonu,,2019-06-07 15:37:00,204.479,BYND I thought it would drop Nope This is TSLA on steroids Lance Armstrong going up a hill LOVE IT
marketchameleonwins,,2019-06-07 15:37:00,204.479,TSLA TSLA 26Jul19 135 Puts tied to stock traded 5000 for a total premium of 1085000 marketchameleoncomOvervie
Kirkland_TO,,2019-06-07 15:37:00,204.479,TSLA Shorts start covering
posicaprinia,False,2019-06-07 15:37:00,204.479,TSLA short covering bears are the best thing this stock has going for it for the bulls Wish the weak handed bears would just stop shorting
Steven_L,False,2019-06-07 15:36:00,204.342,TSLA dump the stock to the option dealers
ibbi,,2019-06-07 15:36:00,204.342,TSLA selling out due to vlow demand in china
nickoftime,True,2019-06-07 15:36:00,204.342,TSLA taking out trailing stops big news over weekend
VK2809orBust,,2019-06-07 15:35:00,203.968,BYND buying out TSLA
Lillybear,,2019-06-07 15:35:00,203.968,TSLA So the 205 20750 options were in play today after all at expiry MMs will close this at 20499 today just to be funny Watch
ckairforce,,2019-06-07 15:35:00,203.968,TSLA Between the 200 puts and 210 calls that expire today that going to be about 60K worthless contracts That sucks
TRADERLETE,True,2019-06-07 15:35:00,203.968,TOP 4 STOCKS FOR MONDAY traderletecomblogsstock1 BYND the plant based and meat alternative stock is up 30 on the day after they posted a larger than expected rise in quarterly sales Not only that its price target was raised to 120share from the lows of the 97 from JP Morgan They also stated in April partnerships with Del Taco and Carls Jr 2 AMD AMD is consolidating currently around the 3132 level AMD recently announced a partnership with Samsung as well as Apple stating the all new MacBook pro wilL READ HERE traderletecomblogsstock MTSLA
G0RD0,True,2019-06-07 15:34:00,204.24,TSLA doubled down on 621 calls Looking for a shareholders meeting bump
Lam6505,True,2019-06-07 15:34:00,204.24,TSLA 100k investment on tesla today will 20kIn five years
ibbi,,2019-06-07 15:34:00,204.24,TSLA Chinese are not buying American products chinese never welcomes competition like USA do they want to become more powerful than USA tsla sales will be much lower than expectations
DavidTaylorInvestor,False,2019-06-07 15:33:00,204.37,TSLA Why is this still over 200
Ohnoitshimagain,,2019-06-07 15:33:00,204.37,TSLA great indication that the rally was short covering
the_red_adventurer,True,2019-06-07 15:33:00,204.37,TSLA sold not holding anything over the weekend too risky if tesla goes good will buy on monday morning
OptionTradesBB,True,2019-06-07 15:33:00,204.37,TSLA green close
Osborne820,,2019-06-07 15:33:00,204.37,TSLA trying to break out of this downtrend
GNinja2006,,2019-06-07 15:32:00,204.3,TSLA Hmmm where to enter
posicaprinia,False,2019-06-07 15:32:00,204.3,TSLA A 201ISH close would be nice
BongEatBear,,2019-06-07 15:31:00,203.945,Why is TSLA dropping
posicaprinia,False,2019-06-07 15:31:00,203.945,TSLA Shorter than I have ever been Of course I have taken serious profits in 180s but shorter than ever
MrLe,True,2019-06-07 15:31:00,203.945,TSLA 15 gain in few days always smart to lock some profits incase market pulls back on monday
cp3zero,,2019-06-07 15:30:00,204.258,TSLA eod rally
OptionsBeast101,True,2019-06-07 15:30:00,204.258,TSLA if it holds above 200 considering we touched 210 I think high probability this grinds higher or gaps up
lingeringMusk,True,2019-06-07 15:30:00,204.258,TSLA Expired yet Beat meat
MrShortSqueez,True,2019-06-07 15:30:00,204.258,ANIX DCAR TSLA Had a great week trading these stocks finishing off strong with BYND Now time to celebrate my 1 year with my wife
ShortyMcFly,False,2019-06-07 15:30:00,204.258,TSLA holding some over the weekend I Own you ElonMuskrat and his many shenanigans Follow him as he Emails Silent Tweets himself into SEC Prison big end of the week Trades Ill take it ROKU LJPC GES HOME
BakedChicken,,2019-06-07 15:30:00,204.258,TSLA I wouldnt buy this even with your money
lingeringMusk,True,2019-06-07 15:29:00,204.273,TSLA In at 400 EOD
StockFrank,,2019-06-07 15:29:00,204.273,TSLA this is more like a controlled pull back by MM longs and shorts calm down and talk to you next week
Energyman3836,True,2019-06-07 15:28:00,204.416,TSLA in at 180
Davidpaulson,,2019-06-07 15:28:00,204.416,TSLA did everybody heed my warning about Friday afternoons
MsEnglish,,2019-06-07 15:28:00,204.416,TSLA Feels like a backwards world when BYND is flying 40
zoupnasi,,2019-06-07 15:28:00,204.416,TSLA you can tell when a bull is holding a bag when they start throwing insults Hahah
suresh36,True,2019-06-07 15:28:00,204.416,TSLA what a week
BakedChicken,,2019-06-07 15:26:00,204.12,TSLA all out of Hopenium
scaredmoneydontmake,,2019-06-07 15:26:00,204.12,TSLA
Lam6505,True,2019-06-07 15:26:00,204.12,TSLA
devangp,,2019-06-07 15:25:00,204.565,TSLA any news on Tesla insurance package
missingtrader,True,2019-06-07 15:25:00,204.565,Stuck at 20 MA Overall excellent weeklymonthly chart and more upside next week TSLA
OptionsBeast101,True,2019-06-07 15:25:00,204.565,TSLA buying dip
9ine,True,2019-06-07 15:24:00,204.31,TSLA
BigNews,True,2019-06-07 15:24:00,204.31,TSLA this should have been touching 220 if it wasnt for the massive money set to short it unseen 13B only todays short trade
WarrenCoolidge,True,2019-06-07 15:23:00,204.105,TSLA its ok closes 205s good for next week well done
Osborne820,,2019-06-07 15:23:00,204.105,TSLA should bounce here
idog,,2019-06-07 15:23:00,204.105,TSLA bought some aug 190 calls on the dip to 20350
andy91,,2019-06-07 15:22:00,204.083,TSLA 1 selloff after a 20 rally not bad
jackkorn,,2019-06-07 15:22:00,204.083,TSLA for pennies on the dollar
BakedChicken,,2019-06-07 15:22:00,204.083,TSLA next week we continue the bleeding SAD
jackkorn,,2019-06-07 15:22:00,204.083,TSLA rumors circulating Musk trying to peddle off his co To one of the big 3 he was laughed off and told we will buy it after bankruptcy
AlexanderHandleton,True,2019-06-07 15:22:00,204.083,TSLA theres the big buy volume Lets go
sellmeonu,,2019-06-07 15:21:00,203.799,TSLA The market flying this pig stuck in an overnight parking lot withe gates locked Nice ramp over 200 but its a slipping 203
jbrashear,True,2019-06-07 15:21:00,203.799,TSLA sold at 210 ready to buy back under 200
Lam6505,True,2019-06-07 15:21:00,203.799,TSLA Q2
abiguzndt,,2019-06-07 15:20:00,203.543,TSLA
davy3819,True,2019-06-07 15:20:00,203.543,TSLA crab song intensifies
lingeringMusk,True,2019-06-07 15:19:00,203.591,TSLA Rally like a dirt road formed
Dontbethatguy,,2019-06-07 15:19:00,203.591,TSLA gap fill time Hope that 197 holds or ehh
Egon12,False,2019-06-07 15:18:00,203.831,TSLA any TSLA Bulls want to guess how many times AMZN had to raise capital after IPO Zero times Tesla will have to raise more capital by end of the year
Stocknoobie25,True,2019-06-07 15:18:00,203.831,TSLA I just ordered my Model 3 Long Range RWD w the FULL SELF DRIVING computer today Includes Autopilot Also back in the TSLA stock game at 189 average with a decent position An absolute blessing Thank you s Its going to take low IQ bears a few months to truly understand what that FSD computer is The GAME HAS CHANGED Purchasing any other vehicle besides a Tesla or vehicle w FSD in 23 years will be like owning a horse
abiguzndt,,2019-06-07 15:18:00,203.831,TSLA incoming203
majohnson87,False,2019-06-07 15:16:00,204.143,TSLA braaaaaaaaaaap
lingeringMusk,True,2019-06-07 15:16:00,204.143,TSLA Bear Hunting time Shhh
Steven_L,False,2019-06-07 15:16:00,204.143,TSLA its sinking abandon the ship
evanspiegel,True,2019-06-07 15:15:00,204.064,TSLA soon when should we buy calls I think we dip a little more
MistaAdobo,,2019-06-07 15:14:00,204.047,TSLA come on bears cover your positions before the weekend Remember Tsla likes to release news during the weekend
prizedcow,,2019-06-07 15:13:00,204.093,TSLA Bears rejoicing over 1
abiguzndt,False,2019-06-07 15:13:00,204.093,TSLA more cow bell
tttnp,False,2019-06-07 15:13:00,204.093,TSLA sold my put too early
fernsl514,True,2019-06-07 15:13:00,204.093,TSLA bears are too funny is getting end of day
lingeringMusk,True,2019-06-07 15:13:00,204.093,TSLA Detroit 313
lingeringMusk,True,2019-06-07 15:13:00,204.093,TSLA Space X Is that you You can invest if they can right Hahahaha T8 T11 Ill be your bar tender Watch your grills Bear
Egon12,False,2019-06-07 15:12:00,203.913,TSLA downtrend continues next week Raise your hand if youre ready bull trap complete
Terminalhorizon,False,2019-06-07 15:12:00,203.913,TSLA How did you like the dead cat bounce bulls Time for new lows
Kirkland_TO,,2019-06-07 15:12:00,203.913,TSLA I wish I knew what would be the price in one monthyear
zoupnasi,,2019-06-07 15:11:00,203.79,TSLA bull excuses incoming
lingeringMusk,True,2019-06-07 15:11:00,203.79,TSLA We Are Jamming through the tough knots
profusionz25,,2019-06-07 15:11:00,203.79,TSLA slow controlled drop all afternoon
macro_economics,True,2019-06-07 15:11:00,203.79,TSLA out 209 reentry 20380
rexthai,True,2019-06-07 15:10:00,203.817,TSLA it just needs a breather for the continuation next week
AlexanderHandleton,,2019-06-07 15:10:00,203.817,TSLA it all comes down to the last hour Abovebelow 20 day Which shall it be
daddylongstroke,True,2019-06-07 15:10:00,203.817,TSLA Elon Musk first of his name breaker of shorts
sambro99,False,2019-06-07 15:10:00,203.817,TSLA IT is hard to get out of thedowntrend when you dont make money producing cars
DoctorBurry,False,2019-06-07 15:09:00,203.853,TSLA has only delivered 33000 this Q in its only real market F will sell 7 to 8 million vehicles this year GM will sell over 10 million Idiot TSLA Longs Bullish
Thankfulness,True,2019-06-07 15:09:00,203.853,TSLA sold puts here Bullish continuations
lingeringMusk,True,2019-06-07 15:09:00,203.853,TSLA Are you for Real Or am I just Dreaming Show yourselves Show them the Horns Make them say Elon Musk Live
Thankfulness,True,2019-06-07 15:09:00,203.853,TSLA 440 price target Piper Jeffries initiated today
AndersonInvesting,,2019-06-07 15:09:00,203.853,BYND Starting to remind me of TSLA Lots of dedicated believers that will probably start chanting about the veganvegetarian mission I wouldnt bet against a low float stock w investors that are evangelists
primitiveguy,,2019-06-07 15:09:00,203.853,TSLA told ya thts weak
Daddygofish,False,2019-06-07 15:08:00,203.986,TSLA rut roh reorge
sambro99,False,2019-06-07 15:08:00,203.986,TSLA Stop the machine By the end summer we are under 150
xio8ups,False,2019-06-07 15:08:00,203.986,TSLA
nearpoint,True,2019-06-07 15:08:00,203.986,TSLA The pullback is good right now which will help give the stock the energy it needs to start to pump again next week It needed a break but now next week it is setup prime to pump
lingeringMusk,True,2019-06-07 15:08:00,203.986,TSLA Stand with One Mind Fokus
froz,True,2019-06-07 15:07:00,204.276,TSLA 15 minute chart shows higher low This should go up now Buy
forsiz1,False,2019-06-07 15:07:00,204.276,TSLA Below 200 close today
ShortyMcFly,False,2019-06-07 15:07:00,204.276,LJPC another 100 shares added like a surgeon BOOM ROKU TSLA SPY BA LAST 30MIN will be fun to watch Whos Holding over this Weekend Gambling on Trump huh
lingeringMusk,True,2019-06-07 15:06:00,204.146,TSLA Is this a signal from Elon Hes out in the oil slicks Artistic Bears are dumb on purpose We have a new purpose Papoose stand up NYC
BloodOnTheStreets,False,2019-06-07 15:06:00,204.146,TSLA bye
nearpoint,True,2019-06-07 15:05:00,204.036,TSLA Next week will be a bull run like we have never seen before To those who are long get ready for wild ride
BigNews,True,2019-06-07 15:05:00,204.036,TSLA shorts are gathering support and resources to destroy this whatever it takes 55 shorted or 7M shares wow
TeslaBullish,True,2019-06-07 15:05:00,204.036,TSLA I see bears being desperate as fk Next Tuesday will make them even more desperate
PurpleTurkey,False,2019-06-07 15:05:00,204.036,TSLA Be careful here Dont think This is a bargain as it is rising in the last hour of trading
lingeringMusk,True,2019-06-07 15:04:00,204.145,TSLA Sir the Bears are on the phone Click Click Yup
lingeringMusk,True,2019-06-07 15:04:00,204.145,TSLA How clean iceman Hahaha we see fools
FehuTradr,True,2019-06-07 15:03:00,204.533,TSLA No way wall street who bailed out of short can give bulls 3 daysMonday it pyros short freaks had Friday and they maxed it F U next beek bish
JSears68,False,2019-06-07 15:03:00,204.533,TSLA on a big green mkt day TSLA getting smacked down with this weeks double top firmly in place stocktwitscomJSears68mes
lingeringMusk,True,2019-06-07 15:03:00,204.533,TSLA Got your Money BearZ Hahahaha
JohnWTrader,False,2019-06-07 15:02:00,204.66,TSLA Short to 150s
MistaAdobo,,2019-06-07 14:59:00,204.255,TSLA fuck it Im in 210 calls for next week
Richard310,True,2019-06-07 14:59:00,204.255,TSLA We know now Wall Street monkey analysts lied They made fake report TSLA Dooms day Demand Problem to sell more shorts by hurting TESLA Some analysts confess their lies Some of them are very evil Teslas Model 3 demand worries are overblown Piper Jaffray marketwatchcomstorytesla
afernandez321,,2019-06-07 14:57:00,204.106,TSLA 2 of 2 GO GRILL HIM I WOULD MAKE HIM TREMBLE
Kirkland_TO,,2019-06-07 14:57:00,204.106,TSLA bear trap
afernandez321,,2019-06-07 14:57:00,204.106,TSLA here longs Go give him a grilling Want a list of questions I will give them to you I will make him crap his pants first of two
lingeringMusk,True,2019-06-07 14:57:00,204.106,TSLA Jump in and work with me my brothers Wu Tang doesnt see me but Im Traveling Go Eaglez One Eagle Spin that metal
Kirkland_TO,,2019-06-07 14:56:00,204.255,TSLA bear trap closes GREEN
roni76,False,2019-06-07 14:56:00,204.255,TSLA NVDA AMD AAPL smart money want secure cash now
aytone,,2019-06-07 14:56:00,204.255,TSLA 201 incoming 1
judge1,True,2019-06-07 14:56:00,204.255,TSLA China needs TSLA for its EV ambition They even removed the License Plate Quota Elon Hey Xi I have 3Million preorders but since you put License Plate Quota how am I supposed to deliver all those ordersXi Is that right How about I remove License Plate QuotaElon Sounds good Thanks Xielectrekco20190606chin
MistaAdobo,,2019-06-07 14:56:00,204.255,TSLA Im not sure if Monday will be a better entry point for those 210 calls
Bazokaa,False,2019-06-07 14:55:00,204.607,TSLA 2045 gonna breach target below 203
Osborne820,,2019-06-07 14:55:00,204.607,TSLA has to rally on some volume or we are in trouble
ShortyMcFly,False,2019-06-07 14:55:00,204.607,TSLA Bear Raid BOOM Got Emmmm Patient traders Profit lol Coming for LJPC ROKU GES SPY This has been a revealing week in the market Bears will regroup and cause Havoc next week week worth of Pumping Dumping and blatant Melt ups on bad indifferent good news Wall Street is so disconnected from Main Street and Reality
WhaleDetector,True,2019-06-07 14:54:00,204.948,TSLA Beautiful setup into next Tuesdays annual shareholder meeting Should see more short covering ahead of that event Expecting to get 100K deliveries update China GF3 golive and Tesla Semi and Truck update
lingeringMusk,True,2019-06-07 14:54:00,204.948,TSLA Dont invite the bear to the party Hey you can have this poop back Party Pooperz Gross GDP
davy3819,True,2019-06-07 14:54:00,204.948,TSLA all they want to do is pin this under 205 for options expiration MM playing games all day
The_Day_Trader,,2019-06-07 14:53:00,204.97,TSLA everyone is nervous because Elon has a history of ducking up conference calls
Ninjaman,,2019-06-07 14:52:00,204.967,TSLA 150 or 250
FELONMUSK,False,2019-06-07 14:52:00,204.967,TSLA double top
lingeringMusk,True,2019-06-07 14:51:00,204.909,TSLA Different Bear bit that same message beat the Bear skin drum together
Steven_L,False,2019-06-07 14:51:00,204.909,TSLA repeat the drop from 200 to 170
Droid1,,2019-06-07 14:51:00,204.909,TSLA market maker tries to kill premiums btfd
RonBull,True,2019-06-07 14:51:00,204.909,TSLA time to load up calls for next week
WhaleDetector,True,2019-06-07 14:51:00,204.909,TSLA Falling wedge right into the weekend Thats exactly what you want if your holding long Get ready for the next leg higher 220230 on deck next week
BloodOnTheStreets,False,2019-06-07 14:48:00,204.875,TSLA Elons new creation Tesla Toast
lingeringMusk,True,2019-06-07 14:47:00,204.696,TSLA Break out the Zoo with Wu Tang Tesla Version Spin that metal son
Saolof,,2019-06-07 14:47:00,204.696,TSLA Instead of using technical analysis to predict where the stock we go I propose using astrology given that they have similar levels of reliability for largecaps The Tesla stock price has so far been correlated with the altitude distance from Earth of the Tesla roadster sent into space The downtrend in the stock price happened at the same time as the roadster fell back towards the sun earth The roadster is currently near its closest approach and will start to move away from earth significantly in September Clearly this predicts a significant rise of the stock at the same time
judge1,True,2019-06-07 14:46:00,205.042,TSLA One news away from major shift to upside I know you want to say it can go down from that news We had so many bad news Now its time for great news TSLA china number North american number Screw EU They are broke and they dont deserve good technology Overreaching laws that suppresses innovation Most EU countries looked like third world countries now and they still think their laws are for the good of the people
lingeringMusk,True,2019-06-07 14:45:00,204.962,TSLA Yesterday was DD but today is Bear Fry Day Go Tesla Money Talks Bear Shhh walks Free Elon ThaMusk Jordan
sunnychang,,2019-06-07 14:44:00,204.942,TSLA You might saw GF3 many times but do you see it at night Here you go visit this evening with friend Workers said machinery were setup in side Target to run at August
lingeringMusk,True,2019-06-07 14:44:00,204.942,TSLA What happened to Peacechunk of Peace sold hear Like this and that Creep up on them Bears
WhaleDetector,,2019-06-07 14:43:00,205.305,TSLA 6070 premium correction
zoupnasi,False,2019-06-07 14:43:00,205.305,TSLA has to mute lingering musk aka the musk aka lover of elongated musky balls Check out his followers what a sad bunch
techsmart,,2019-06-07 14:43:00,205.305,SPY TSLA next leg down to 135
lingeringMusk,True,2019-06-07 14:42:00,205.262,TSLA We Are All The E Long Gated Man Time to Ride the Unicorn son
WhaleDetector,True,2019-06-07 14:42:00,205.262,TSLA A bidding war by Apple Project Titan Amazon selfdriving meets local deliveries or Alphabet Waymo mass production would likely mean a 7070 premium from current levels or 330350 should Elon decide to sell or merge into one of the larger tech names
iamtheguy,,2019-06-07 14:41:00,205.313,TSLA Tesla bears
Trumpstertotherescue,,2019-06-07 14:41:00,205.313,TSLA Im out of this basicly broke even Gl everyone on both sides of this trade It obviously does not know which way it wants to go up down down up just like the Ceo i guess
lingeringMusk,True,2019-06-07 14:41:00,205.313,TSLA The Time has come to fly unicorn Save the Korn Go Eaglez
ShortyMcFly,False,2019-06-07 14:41:00,205.313,LJPC no Deadcat bounces here this is Shorts covering off that last Avalanche slide down to 1170s now theyll just Short this new top for more profit I love Shorting these Pump Dumps defiant Bulls be like Imma show you SPY ROKU TSLA SHOP all dusty and soon to drop Gamblers anonymous
TraderEquities,,2019-06-07 14:41:00,205.313,TSLA Piper Jaffray Explains Why Investors Underestimate Demand For Teslas TSLA Model 3 396 PT streetinsidercomAnalystC via StreetInsider
Lam6505,True,2019-06-07 14:40:00,205.184,TSLA
lingeringMusk,True,2019-06-07 14:39:00,205.363,TSLA If you aint down then I wonder why Finger on that trigger time to pull it Buy Buy Buy Every single time Brother brother can you space a dime
