FundSecured42069,,2019-06-07 12:50:00,207.021,TSLA RIP to the guy on CNBC that rolled over to 125 puts
xx2073,,2019-06-07 12:50:00,207.021,BYND Many dont want to touch this Me included Its like TSLA years ago So there is room to run
lingeringMusk,True,2019-06-07 12:50:00,207.021,TSLA We See The Front
hunanddone,,2019-06-07 12:49:00,206.692,TSLA sold today 1000 at 20885 and 1000 at 20985 going higher
WielWatban,True,2019-06-07 12:49:00,206.692,TSLA No comment just GREEN COLOR will see 300 next weeks
zulustar,True,2019-06-07 12:49:00,206.692,SOLO TSLA NIO FUV all upAll ev play
deces124,True,2019-06-07 12:49:00,206.692,TSLA Oversold again back up well go
sunnychang,,2019-06-07 12:49:00,206.692,TSLA Will they say how many model 3 order in China at the Shareholder Meeting Tesla Inc 2019 Annual Shareholder Meeting From the Computer History Museum 1401 N Shoreline Blvd Mountain View CA 94043 Tuesday June 11 2019 at 230 PM PDT
jbyers172,,2019-06-07 12:48:00,206.81,TSLA looks like a cup and handle if you ask me
StoneThrower,False,2019-06-07 12:48:00,206.81,TSLA DEATHTRAPS
forsiz1,,2019-06-07 12:48:00,206.81,TSLA Major selloff coming into close today
kremun,,2019-06-07 12:48:00,206.81,TSLA this kind of price movement drive me nuts
forsiz1,False,2019-06-07 12:47:00,206.751,TSLA Wish I had more money to ride this POS from 210 to 185
Trumpstertotherescue,False,2019-06-07 12:46:00,206.78,TSLA having hard time holding at these inflated levels all day long back below 199 soon enough
TT_1,True,2019-06-07 12:46:00,206.78,TSLA NVDA WYNN LYB BABA I update this almost daily Got crap for being a small fish at 3k and 4k and 5k and where Im at now But they forget this is a game They dont have the vision to realize this is 35M pace in 48 more months FROM 3500
forsiz1,False,2019-06-07 12:46:00,206.78,TSLA My 200 614 puts still looking great
hunanddone,,2019-06-07 12:46:00,206.78,TSLA Team Bulls Im off this train for now but very bullish and will be back Too many trades to list as I sold into runs generally w 2000 sh and bought back in dips year out at 21045 and bought back at 20355 For example and wrote calls twice for income Lowest but just under 180 Cleared 78600 all said and done See you soon GLTA
abiguzndt,False,2019-06-07 12:46:00,206.78,TSLA
BigWin631,False,2019-06-07 12:45:00,207.229,SPY Man just one hint from the fed that rate cut is a no go and this thing will crash and burn like a TSLA driven in China
forsiz1,False,2019-06-07 12:45:00,207.229,TSLA Was that a 290k shares sell just now
afernandez321,,2019-06-07 12:44:00,207.232,Please put me in your NOTES I took out Costolo with many more people But I blasted him out I will ultimately either crust TSLA in a massive short to the point he will get fired or he will go bankrupt I have studied and traded this stock more than any others 2M shares trades so far You cant BS a BS artist
kabab,True,2019-06-07 12:42:00,207.46,TSLA Ha Jim Chanos claims Teslas are poorly made He either doesnt own one and avoids those who do or hes just trash talking Whichever it is he lacks all credibility Maybe after his investors flee him well get to chuckle at another article about a loser The Man Who Lost X Billion Dollars giving Elon free advice
deces124,True,2019-06-07 12:42:00,207.46,TSLA 300 by Aug
Opinionex,,2019-06-07 12:41:00,207.747,TSLA No pain No gain Right Pavel youtubecomwatchv59Qlhg
froz,True,2019-06-07 12:41:00,207.747,TSLA Tesla Steers Solid Growth Prospects ETFs to Buy financeyahoocomnewstesl
Mike1974,False,2019-06-07 12:41:00,207.747,TSLA here comes the Friday dump as promised TGI F
JustAGlitchBTMFD,True,2019-06-07 12:40:00,207.497,TSLA bears like awww stupid bulls were winning so much Im still up over 100 on my August and September calls off the bottom
ShortyMcFly,False,2019-06-07 12:40:00,207.497,ROKU BULLS AFTER the Rug Pull EOD 105 Wait What stay off the SPY BA TSLA LJPC will all drop into close no one that brazing to hold CALLS into this overly PUMPED up trash can manipulated vitriolic mad Wall street type of trading bc they want a rate cut AmericanGreed
Cash1234,True,2019-06-07 12:39:00,207.623,TSLA how exciting This is truly and electrifying stock to play with Shocking moves A real buzz around this
K9G,True,2019-06-07 12:39:00,207.623,TSLA goin up
rsarnow52,,2019-06-07 12:39:00,207.623,TSLA Dont forget people tue is the annual shareholders meeting on june 11th tues bad thing is it doesnt start to 530 pm est after market closes
camhack,True,2019-06-07 12:38:00,207.82,TSLA Im wondering how many bears have actually driven a Tesla
DesiHFM,True,2019-06-07 12:37:00,208.3,VEEV EW TSLA AAPL bullish
BakedChicken,,2019-06-07 12:37:00,208.3,TSLA running low on Hopenium gotta stay over 205 for 3 more days to build confidence that it is indeed turning around
Lam6505,True,2019-06-07 12:36:00,208.41,TSLA record breaking Q2 2019
lingeringMusk,True,2019-06-07 12:35:00,208.79,TSLA Buy THE GET EM
ntrader1,True,2019-06-07 12:34:00,208.574,TSLA Lets help them to close 215 what u guys say
kremun,True,2019-06-07 12:34:00,208.574,TSLA A bit disappointed to tell u the truth too slow for hyper market
andytave,True,2019-06-07 12:34:00,208.574,TSLA waiting for power hours lets goooo 215 today and 230 next week
lingeringMusk,True,2019-06-07 12:34:00,208.574,TSLA Tesla is THE BEACH BOYZ
lingeringMusk,True,2019-06-07 12:33:00,208.422,TSLA This guy is a BEAR AD him
DoctorBurry,False,2019-06-07 12:32:00,208.559,FSD Crash and Burn 1000000 TSLA RoboTaxis Massive fraud
simpleplan,True,2019-06-07 12:32:00,208.559,TSLA All people even kids have smart phones and spend more and more time on the internet Please someone inform Jim Chanos 100 yearold dealership model was great in the age of telegram trains and snail mail not in 21st century This is one of Teslas major competitive advantage over legacy auto and their obsolete business models
afernandez321,,2019-06-07 12:31:00,208.5,210206 TSLA either longs are thanking you for letting them or short piling in I just checked None available at Fidelity
lingeringMusk,True,2019-06-07 12:31:00,208.5,TSLA BRB Brothers and Sistas
GNinja2006,,2019-06-07 12:31:00,208.5,TSLA Boy I would like some of this But its such a fickle mistress
Osborne820,,2019-06-07 12:30:00,208.225,TSLA rocket
Trumpstertotherescue,False,2019-06-07 12:30:00,208.225,TSLA The only thing holding this up even now is the marketWill drop like a rock when the market goes down
lingeringMusk,True,2019-06-07 12:30:00,208.225,TSLA Hey ZOO Land in the Know NOW BUY THEM UP Break the CAGE Free THE Animalz please
muskateer,True,2019-06-07 12:29:00,208.093,TSLA Chrysler to Renault I thought YOU had the batteries
lingeringMusk,True,2019-06-07 12:29:00,208.093,TSLA Look at these Bears SHAVE THEM HERE your Clippers
afernandez321,,2019-06-07 12:28:00,208.016,TSLA ss squezze is gone Volume died out LOL
lingeringMusk,True,2019-06-07 12:28:00,208.016,TSLA Report the INSTIGATORS Buffering
icedropper13,,2019-06-07 12:27:00,207.946,TSLA whos staying short over the weekend
TheSleepyJewel,,2019-06-07 12:27:00,207.946,TSLA i thought the bears were so smart why do they listen to CNBC all day and copy their trades
WarrenCoolidge,True,2019-06-07 12:27:00,207.946,TSLA Tuesday 11th ohh boy wouldnt wanna be short in tsla
lingeringMusk,True,2019-06-07 12:27:00,207.946,TSLA Hey Pat ITS YOU BEAR BOY LOL REPORT YOUR LIEZ
ShortyMcFly,False,2019-06-07 12:27:00,207.946,LJPC buying PUTS strategically after 1pm watch me play this out justttt right last few pumps in for Bulls then rug pull into wknd POSSIBLY OFFERING TOO SPY RUG pull too ahead of Mexico tariff deadline etc TSLA ROKU SHOP YES WE KNOW THE MARKET IS BEING MANIPULATED to trump own detriment for RATE CUT too SILLY RABBITS
PutItAllInGold,True,2019-06-07 12:27:00,207.946,TSLA 210 end of the day MARK THIS POST and report all bears
kremun,,2019-06-07 12:27:00,207.946,TSLA SEC taken off most powerfull weapon of tesla bull ELon musk twitter Most likely he would tweet something by now if not for the ban
lingeringMusk,True,2019-06-07 12:26:00,208.099,TSLA Report the badgeless BEARZ WE SEE YOU COWARDS
afernandez321,,2019-06-07 12:26:00,208.099,TSLA SPY You heard from traders that have more than 20 years of trading experience FADE THE TRADE
sellmeonu,,2019-06-07 12:26:00,208.099,BYND Short it Remember TSLA 5075100125150175200225250275300 Its a nothing burger but again its moving in the right direction Higher
icedropper13,,2019-06-07 12:25:00,208.123,TSLA squeeze the rest of the day
lingeringMusk,True,2019-06-07 12:25:00,208.123,TSLA Dude you type messages like a jealous BF WE AINT READIN YOU
KingHighlights,True,2019-06-07 12:24:00,207.731,TSLA Elon has been silent on Twitter besides I think he meant this towards the shorts
afernandez321,,2019-06-07 12:24:00,207.731,TSLA Quote Piper Jaffray expects 286296K Model 3 deliveries That is 6070K deliveries short of 360400K This is an easy short for lower lower prices Huge whiff Based on Morgan Stanley AJs numbers Same calcualtions Hugs WhifFF So good luck to bulls that like to sleep in a tent Wall Street I tired of Musks lies and underdelivering Therefore the flush I cant move this stock Millions of dollars can move it I can move a piece of crap penny stock which soon TSLA will be NOT Rocket science which Musk is not He has real scientists working for him Musk would not qualify for the first step of the physical Did you see the gut on that guy
DoctorBurry,False,2019-06-07 12:24:00,207.731,Seeing huge desperation with TSLAthamusk nineelon and now lingeringmusk are all spambots created to spam this board and influence algos Report and block them all
lingeringMusk,True,2019-06-07 12:24:00,207.731,TSLA Link is on the right side of history JUMP NOW ITS AWWWW Some
FundSecured42069,,2019-06-07 12:24:00,207.731,TSLA good time to accumulate if you plan to hold long term
DavidTaylorInvestor,False,2019-06-07 12:24:00,207.731,TSLA Waiting on the fundamentals to be revealed
szhao57,True,2019-06-07 12:23:00,207.779,TSLA We will use AI instead of big mouth
TheChartiste,,2019-06-07 12:23:00,207.779,TSLA line of the truth
lingeringMusk,True,2019-06-07 12:23:00,207.779,TSLA So quiet Thanks BRO
lingeringMusk,True,2019-06-07 12:21:00,207.32,TSLA Bears Are you STILL Need to get that Medium from the Trunk
andytave,True,2019-06-07 12:21:00,207.32,TSLA lets goo 215 today
lingeringMusk,True,2019-06-07 12:21:00,207.32,TSLA If you over pay by 5 cents Does it hurt OR SAVE Dont over pay for gas Over pay hear
menos,True,2019-06-07 12:20:00,207.42,TSLA most likely wont break 211 today
smellthecoffee,,2019-06-07 12:20:00,207.42,This site might actually be even more poorly designed than TSLA shitboxes
lingeringMusk,True,2019-06-07 12:19:00,207.755,TSLA Lunch time I will eat the Bears lunch and then
missingtrader,True,2019-06-07 12:19:00,207.755,TSLA bull flag
Osborne820,,2019-06-07 12:19:00,207.755,TSLA should see a nice rally here
tripplett,,2019-06-07 12:18:00,207.553,TSLA for the first time ever I may have to block a few new bulls that are too annoying for their own good
lingeringMusk,True,2019-06-07 12:18:00,207.553,TSLA BUY FLY Time is now to hop on
2020Millionaire,True,2019-06-07 12:17:00,207.437,TSLA would you trust Larry Ellison4th richest guy in world or stupid Jim Chanos Choice is simple
lingeringMusk,True,2019-06-07 12:16:00,207.337,TSLA Elon making good smart choices GOOD JOB CEO HERO WINZ REPORT THAT BEARZ No ok
DreadnoughtCapital,,2019-06-07 12:15:00,207.168,TSLA LMAOTurds gonna turd
TT_1,True,2019-06-07 12:15:00,207.168,TSLA
ipau1stock,True,2019-06-07 12:15:00,207.168,TSLA stocktwitscomipau1stockm haha Monday or Tuesday still up
lingeringMusk,True,2019-06-07 12:15:00,207.168,TSLA BEAR SEASON DUKE NUKE EM
lingeringMusk,True,2019-06-07 12:14:00,206.868,TSLA REPORT ON THEM FIRST
lingeringMusk,True,2019-06-07 12:14:00,206.868,TSLA Block those GNATS
Banko,,2019-06-07 12:13:00,207.061,TSLA Under 200 please again I want to load up
simpleplan,True,2019-06-07 12:13:00,207.061,TSLA Jim Chanos Auto makers foundout a 100 years ago that the best way to sell cars is through dealerships will someone inform him that Tesla has 90 less parts than an ICE car Also its 21st century Also internet didnt exist 100 years ago Also majority of commerce moving to internet
AlexanderHandleton,True,2019-06-07 12:13:00,207.061,TSLA consolidating below 211 and above the 20 day 210 pin is cool
lingeringMusk,True,2019-06-07 12:12:00,207.052,TSLA Wow BUY HOW MUCH PLAYA PLAYA I WISH SKEE LO OVER HEAR
missingtrader,True,2019-06-07 12:12:00,207.052,TSLA next rally Monday shareholder meeting
ClassifiedTrades,,2019-06-07 12:12:00,207.052,BYND TSLA CMG options we killed it Huge gains biggest one was CMG and BYND in FB calls since yesterday up nicely but will hold to next week playing with house now uuugeeeee
ipau1stock,,2019-06-07 12:11:00,206.621,TSLA someone just bought a lot
lingeringMusk,True,2019-06-07 12:09:00,206.604,TSLA Elon is good at the PICKUP GAME
rsarnow52,,2019-06-07 12:08:00,206.433,TSLA just got back I was wondering this Elon has been as silent as can be lately Is he going to make a huge announcement on tue Just wondering if anyone else gets that feeling
lingeringMusk,True,2019-06-07 12:08:00,206.433,TSLA Report all the bears Ai GO GO GET A CAR
lingeringMusk,True,2019-06-07 12:06:00,206.601,TSLA REPORT BATEMAN STARVE HIM AND HIS FOLLOWERS
afernandez321,False,2019-06-07 12:05:00,206.733,TSLA bear power
CuzOfAndroid,,2019-06-07 12:05:00,206.733,TSLA this wOnt touch 210 again today
venkz,True,2019-06-07 12:04:00,206.527,TSLA All In Added more 222 Calls 614 Lets Goooooooo
StockyCreed,True,2019-06-07 12:04:00,206.527,TSLA wonder if they will integrate IOTA Hmmm
ThePatrickBateman1,,2019-06-07 12:04:00,206.527,Everything with Musk and TSLA is a massive lieRemember when Musk said TSLA would be profitable every quarter going forwardRemember when Musk said TSLA would turn a slight profit Q1 2019 700 MILLION LOSS Boom
setsuna,,2019-06-07 12:03:00,206.447,TSLA isnt that a bear flag
lingeringMusk,True,2019-06-07 12:03:00,206.447,TSLA Tape THAT DUCK BUY TODAY
menos,True,2019-06-07 12:03:00,206.447,TSLA potential double top island reversal incoming very risky to buy here best to wait till monday
froz,True,2019-06-07 12:03:00,206.447,TSLA bears you know this is go to 400 by next ER
lingeringMusk,True,2019-06-07 12:02:00,206.435,TSLA NO MORE CHAINZ NO MORE BUY BULLZ
TheSleepyJewel,,2019-06-07 12:01:00,206.66,TSLA puts
simpleplan,True,2019-06-07 12:01:00,206.66,TSLA Peerless
cp3zero,True,2019-06-07 12:01:00,206.66,TSLA buying now
lingeringMusk,True,2019-06-07 12:01:00,206.66,TSLA Report that red DUCK
biggp216,,2019-06-07 12:00:00,206.95,TSLA 5 min bear flag forming
StoneThrower,False,2019-06-07 12:00:00,206.95,TSLA taking a 300pt move to keep this scam above water
DolanDrumpf,,2019-06-07 11:59:00,207.113,TSLA so many bulls here trying to pump their way out of chasing this up Hilarious
majohnson87,False,2019-06-07 11:58:00,206.993,TSLA last chance for bulls to cut their losses
JustAGlitchBTMFD,True,2019-06-07 11:58:00,206.993,TSLA hmm could be a cup and handle forming here at the 211 resistance glad I took profits one same day 210 calls and rolled those into June monthlys if we break out today Ill be a little dissapointed cant lie
bklynken1,,2019-06-07 11:58:00,206.993,TSLA bought more right at the bottom of the channel will get out next week when we test the 222 gap area
froz,True,2019-06-07 11:58:00,206.993,TSLA
StockyCreed,True,2019-06-07 11:58:00,206.993,TSLA they are putting frickin neutral net processors in their carsI mean this is skynet sht
JohnWTrader,False,2019-06-07 11:57:00,207.391,TSLA Fake moves lol
kyle62999,,2019-06-07 11:57:00,207.391,TSLA any date estimate for the earning report
hertcapital,,2019-06-07 11:57:00,207.391,TSLA A rebound into the 250 arc275200week sma price range creates an optimal short short entry
aztmm,False,2019-06-07 11:56:00,207.176,T5 Bearish Options Flow 500K 2M6719 SPY TSLA BILI TLT STXhodlnysenasdaqtradingoptionshedginghodltechaviatonoptionstradingstocksstocktradinghedgeittradewarsdowpharmachinausaindustrials
DungaGin,,2019-06-07 11:56:00,207.176,TSLA 11am coordinated take down Lol
Jsacrone,False,2019-06-07 11:56:00,207.176,TSLA I will also add on the pump from 100 to 140
daddylongstroke,,2019-06-07 11:56:00,207.176,TSLA Beyond Meat is people
Ash1290,True,2019-06-07 11:56:00,207.176,TSLA shorts trying so hard hereand we havent even squeezed yet Get ya popcorn ready
omarmaarouf2012,True,2019-06-07 11:55:00,207.095,TSLA some 70k puts are expiring today worthless only about 30k calls expiring worthless and even less if it closes above 210
forsiz1,False,2019-06-07 11:55:00,207.095,TSLA You know its going nowhere but down after 3day rallied manipulation no brainer
roni76,False,2019-06-07 11:55:00,207.095,TSLA NVDA AMD AAPL nasdaq how can someone rely this if we have so many risks now and this 400 points from ATH away Only if someone turns off his brain and hopes only Best way to become poorFor me absolutely a bait for bulls todays nasdaqs hype
illianamike,False,2019-06-07 11:55:00,207.095,TSLA Tesla pick up better than f150 Elon musk cant stop shooting his mouth off about something he has no idea about what a Asshole
12SNFU,,2019-06-07 11:54:00,206.825,TSLA sell 190 calls or hold this trash
DoctorBurry,False,2019-06-07 11:54:00,206.825,TSLANineElon is thamusk reincarnated Purely a TSLA spam bot flooding stream with nonsense Report and Block
JustAGlitchBTMFD,True,2019-06-07 11:54:00,206.825,TSLA holding 205 well grabbed some monthly 220 calls
alexlive,True,2019-06-07 11:53:00,207.088,TSLA pathetic automaker asking trump to weaken pollution politics good reason to double down on these mofo latimescompoliticslana
TheSleepyJewel,,2019-06-07 11:53:00,207.088,TSLA more puts
prizedcow,,2019-06-07 11:53:00,207.088,TSLA I thought this was supposed to be at under 100 by now
AlexanderHandleton,True,2019-06-07 11:53:00,207.088,TSLA thanks for the cheaper shares chanos
ChartTrader33,True,2019-06-07 11:53:00,207.088,TSLA daily chart update Where are the idiots calling for 50 Their puts are sizzling everyday lol
froz,True,2019-06-07 11:52:00,207.442,TSLA time to buy the dip
Stocksformoney,,2019-06-07 11:52:00,207.442,TSLA got 18 on closed puts today have calls now
AK56,,2019-06-07 11:52:00,207.442,TSLA Needs to close above 20MA
JustAGlitchBTMFD,True,2019-06-07 11:52:00,207.442,TSLA of course this rising wedge breaks down while the rest of the markets dont oh well great week swinging calls well get em next week
Jsacrone,False,2019-06-07 11:51:00,207.453,TSLA Tons of rape victims in this name that have been long and are going long This is not sustainable
Iwijn,,2019-06-07 11:51:00,207.453,TSLA go on bears start shorting
TheSleepyJewel,,2019-06-07 11:50:00,207.34,TSLA how come its not 10
BakedChicken,,2019-06-07 11:50:00,207.34,TSLA here it goes again
DoctorBurry,False,2019-06-07 11:50:00,207.34,Pretty funny Dumb Robinhood retail buying into fake fraudy Electrek TSLA pump but the options market is not buying into any of it Puts are expensive Calls are cheap
Freemium,,2019-06-07 11:49:00,206.944,TSLA Oh yeah take this down
scheplick,,2019-06-07 11:49:00,206.944,The TATS chart TWTR AMD TSLA SNAPHat tip to ScubaStevey and BadaBingCapital
TheSleepyJewel,,2019-06-07 11:48:00,206.628,TSLA maybe musk got called for margin on that last drop
Saolof,True,2019-06-07 11:48:00,206.628,TSLA businessinsidercomunivers
d1dave69,False,2019-06-07 11:48:00,206.628,TRNX How much longer until were happy Is it one month or two I forgot Scott said it so it must be true Seriously people get in on the ground floor of the next TSLA AMZN etc and buy WKHS now while its still affordable and hold that long term not this junk
gotachance,,2019-06-07 11:48:00,206.628,TSLA Bulls bears and option writers
OptionTradesBB,True,2019-06-07 11:48:00,206.628,TSLA oprah says you cover you cover
LuvinVolatility,False,2019-06-07 11:48:00,206.628,TSLA small play on 205 puts
omarmaarouf2012,True,2019-06-07 11:48:00,206.628,TSLA worst case bull scenario for today is market closes at 203 ie not scary bulls are at a v3 supercharger now getting ready for next week
OptionTradesBB,True,2019-06-07 11:47:00,206.584,TSLA nice trap
Trumpstertotherescue,False,2019-06-07 11:47:00,206.584,TSLA Back below 200 today Was 176 a few days ago before the hype right
BongEatBear,,2019-06-07 11:46:00,206.593,I thought TSLA was going down guess not
Jsacrone,False,2019-06-07 11:46:00,206.593,TSLA We can pin this at 206xx Today That would be fine with me
SrHeisenbergBug,True,2019-06-07 11:46:00,206.593,TSLA meanwhile let them short sighted shorts FF lovers Tesla haters keep chucking away FUD until they choke on their own vomit
forsiz1,False,2019-06-07 11:45:00,206.752,TSLA MY 200 puts looking
prizedcow,,2019-06-07 11:45:00,206.752,TSLA Bears fighting tooth and nail to stop the upwards trend
TheSleepyJewel,,2019-06-07 11:45:00,206.752,TSLA load puts brah
Jsacrone,False,2019-06-07 11:45:00,206.752,TSLA Filled more June 2020 200 puts today at a pretty nice price
forsiz1,False,2019-06-07 11:45:00,206.752,TSLA HERE WE GO BACK DOWN LOWER
Opinionex,,2019-06-07 11:45:00,206.752,TSLA Anybody got daily RSI We cooling off
smellthecoffee,,2019-06-07 11:45:00,206.752,TSLA Record high demand for these shitboxes that fall apart in the rain and lose wheels on the highway
Spartanofwallstreet24,True,2019-06-07 11:44:00,206.593,TSLA now demand isnt a problem but china is make up ur mind analshits
Bluetundra18,,2019-06-07 11:44:00,206.593,TSLA shes gonna fight for above 205 will fail though
TeslaBullish,True,2019-06-07 11:44:00,206.593,TSLA Thats all you got bears
StockyCreed,True,2019-06-07 11:44:00,206.593,TSLA they built this car in a tent With a box of scraps And its till the best car you can buy
rupert1,False,2019-06-07 11:44:00,206.593,TSLA looks like actual deliveries leaked
forsiz1,False,2019-06-07 11:43:00,206.034,TSLA SELLLLLLLLLLLLLLLLLLLLLLLLLLLLLLLLLLLLLLLLLLL WOW WHAT A DEADFALL
gainsforcenturies,True,2019-06-07 11:43:00,206.034,TSLA back to 212 EOD
ThePatrickBateman1,False,2019-06-07 11:43:00,206.034,TSLA pathetic automaker building douchebuggies in a circus tent and losing billions Dumb fanbois getting crushedThe end is near
forsiz1,False,2019-06-07 11:43:00,206.034,TSLA Teslas Biggest Problem Isnt Demand Analyst Says Barronscom TSLA
OptionTradesBB,True,2019-06-07 11:43:00,206.034,TSLA hold strong bulls make em squeeze
StoneThrower,False,2019-06-07 11:43:00,206.034,TSLA But North American PROJECTIONS You listened to this scam artist pump and dump should be arrested
biggp216,,2019-06-07 11:42:00,206.138,TSLA big selling on the 5 min candle
Bluetundra18,,2019-06-07 11:42:00,206.138,TSLA going red
TheSleepyJewel,,2019-06-07 11:41:00,206.127,TSLA puts brah
SrHeisenbergBug,True,2019-06-07 11:41:00,206.127,TSLA GF3 in China completed production to start soon ready to eat a share of that 30 of wolds car market
roni76,False,2019-06-07 11:41:00,206.127,TSLA bulltrap completed let see can they open it or
DavidTaylorInvestor,False,2019-06-07 11:41:00,206.127,TSLA oh no The Friday fade
tripplett,True,2019-06-07 11:40:00,206.443,Someone should be investigated over Q2 expectations but its not TSLA analysts at MS say Q2 whisper number is upper 70 thousands no one believed TSLAs original guidance of 90100k Elons most recent guidance was 90k new whisper number is 82k however the media uses FactSet and their est is 92k deliveriesEven if TSLA pulls off a miracle delivery of 90k it will still be considered a miss even though that would be 13 higher than the whisper number and 105 higher than investors expectations
Jimmyza,,2019-06-07 11:40:00,206.443,TSLA double toppotentially watch out below if this falls another dollar or two
ramtek57,,2019-06-07 11:40:00,206.443,TSLA Teslas outpacing its electric car competitors with May demand for Model 3 surprising Wall Street cnbccom20190605teslao
memoryisram,False,2019-06-07 11:40:00,206.443,TSLA Cracked 206 time to short
marketchameleonwins,,2019-06-07 11:40:00,206.443,TSLA TSLA 21Jun19 220 Calls tied to stock traded 3750 for a total premium of 2062500 marketchameleoncomOvervie
DolanDrumpf,False,2019-06-07 11:40:00,206.443,TSLA wonder how bad it will be in another 20 minutes
aytone,,2019-06-07 11:39:00,206.335,TSLA I became a BEAR changed from BULLY yesterday SHORT 21053
MsEnglish,,2019-06-07 11:39:00,206.335,TSLA What is causing the decline intraday Some news
ramtek57,,2019-06-07 11:38:00,206.522,TSLA EV Sales Are Set To Soar 540 nasdaqcomarticleevsales
kremun,,2019-06-07 11:38:00,206.522,TSLA Hate the price movement hedging position
PirateParty,True,2019-06-07 11:38:00,206.522,TSLA Please note that this is an to comparison as the Model 3 was the first time registered at February 15th
roni76,False,2019-06-07 11:37:00,206.701,TSLA never rely 60 degree tangent no matter 5m1h or 1d chart
BigNews,True,2019-06-07 11:37:00,206.701,TSLA Grand Manipulation over 2M shares dumped in 12mins
rupert1,,2019-06-07 11:37:00,206.701,TSLA close around 204 looks like
Dontbethatguy,True,2019-06-07 11:37:00,206.701,TSLA Time to roll on TSLA keeping an eye on this support next is just under or done for this run
memoryisram,False,2019-06-07 11:37:00,206.701,TSLA In for 10x 614 195Ps 200
DolanDrumpf,False,2019-06-07 11:36:00,207.167,TSLA bulls got greedy again Listened to Lamberts blog post like greedy little pigs
ramtek57,,2019-06-07 11:36:00,207.167,TSLA In balder terms 200kW equates to 850 miles for each hour of charging Given the Long Range version quotes at 329 miles on a full battery that means a complete charge in just over 20 minutes About the time itll take you to have a wee and order a chai latte at most service stations
BigNews,True,2019-06-07 11:36:00,207.167,TSLA 7M shares in 2 hours Highest volume recorded Shorts are trying hard
Flashback101,,2019-06-07 11:36:00,207.167,TSLA this pos is like an abusive relationship need take off watch list
SrHeisenbergBug,True,2019-06-07 11:36:00,207.167,TSLA indeed ICEs are doomed FF is doomed
