risenhoover,,2019-06-12 13:25:00,0.7531,Insider BURCH LUCIUS E III reports buying 150000 shares of AAC for a total cost of 12015000 httpsfintelionusaac
cctranscripts,,2019-06-12 13:25:00,0.7531,AAC Holdings director just picked up 150000 shares conferencecalltranscriptso AAC
livetraderalerts,,2019-06-12 13:25:00,0.7531,AAC 09m ago On 20190611 BURCH LUCIUS E III Director added 150000 118 shares at 08share Purchase SEC Fo secgovArchivesedgardata
MarketBeatInsiderTrades,,2019-06-12 11:21:00,0.7645,AAC Director Lucius Burch III Buys 4131243 in AAC marketbeatcomstocksNYSE
risenhoover,,2019-06-12 11:09:00,0.7904,Insider BURCH LUCIUS E III reports buying 51003 shares of AAC for a total cost of 4131243 httpsfintelionusaac
Vegas1,True,2019-06-12 11:02:00,0.7994,AAC FORM 4 Insider Purchase DIRECTOR P 51003 081 thanks TheTradeXchange
cctranscripts,,2019-06-12 11:02:00,0.7994,AAC Holdings director just picked up 51003 shares conferencecalltranscriptso AAC
livetraderalerts,,2019-06-12 11:01:00,0.7665,AAC 09m ago On 20190610 BURCH LUCIUS E III Director added 51003 46 shares at 081share Purchase SEC Form 4 secgovArchivesedgardata
Jesse_,True,2019-06-12 10:21:00,0.75,AAC lol not worried about current pps One day will wake up to a nice treat Average down if you can and youll be paid off soon enough
