sleekoptions_daytrade,False,2019-06-12 15:32:00,115.935,Update2 SPLK Jun14 110 Puts Down 88 since alerted on Jun 04
sleekOptions,True,2019-06-12 15:31:00,115.92,Peak gain percentage for last 5 expired setups SPLK 55679 per 16468 per 2421 per 6873 per 86667 per
WSAnalysis,True,2019-06-12 15:19:00,115.655,AYX what they offer is the brains to industry 40 being the next industrial revolution NVDA MSFT SPLK all of three play a part
zerohedge2018,,2019-06-12 14:43:00,115.466,ESTC is the next SPLK going not up but down Look at the signs in the chart Next target 61
AnalystRatingsNetwork,,2019-06-12 12:00:00,115.192,Insider QA Data management CEO mulls state of data laws SPLK SPLK marketbeatcomarticlesins
EstimizeAlerts,,2019-06-12 11:18:00,114.935,Estimize EPS expectations are 181 higher than that of Wall Street for SPLK Q2 Reporting 0822 AMCestimizecomintrosplkcha
