KoalaBULLL,True,2019-02-26 15:43:00,67.835,TDOC PT 80 tomorrow
KK1415,,2019-02-26 14:24:00,67.437,TDOC its little fishy to see this stock drops this much right before earning release Will see
worstin,,2019-02-26 13:55:00,67.375,TDOC whose buying here
worstin,,2019-02-26 12:44:00,67.895,TDOC going down before earnings Amazing
kblover,,2019-02-26 10:32:00,69.159,TDOC First earnings report with this name got in during the correction Interesting to see company data and how stock responds
VolumeBot,,2019-02-26 09:39:00,69.38,Per data reported to FINRA short volume divided by total volume for TDOC was 3918 on 022519 volumebotcomsTDOC
