Pneumatic_Alchemy,True,2019-06-13 15:27:00,4.606,CFMS Not bad for an off day
cambrady012,,2019-06-13 14:03:00,4.69,CFMS surprised its up today much lower volume than the past week
JTN1002,True,2019-06-13 12:36:00,4.62,CFMS held and consolidated around 4243 very well looking for breaking 5 from here
DMBMARK,,2019-06-13 12:34:00,4.645,CFMS New high of 467
shummy,True,2019-06-13 12:29:00,4.63,CFMS strange action todaySomething is coming
devil4201,,2019-06-13 11:41:00,4.623,CFMS shoulda bought this at 424 the other day when it fall from 478 oops still learning
DMBMARK,,2019-06-13 10:50:00,4.612,PRPO Shes fighting hard CFMS doing great things again
