Richmundo415,,2019-06-04 15:22:00,2.37,BLNK damn really pops when it gets close to 1 range
intrader,True,2019-06-04 15:19:00,2.386,BLNK in at 235
KidCooper,True,2019-06-04 12:44:00,2.28,BLNK they have new every week Just the beginning
collegefunder,,2019-06-04 11:57:00,2.33,BLNK NEWS
TomorrowsWatchlist,True,2019-06-04 11:19:00,2.23,BLNK glad I got filled at 211
kw30,True,2019-06-04 11:00:00,2.21,BLNK Blink Charging Co Reports Phoenix Convention Center Installed Level 2 Electric Vehicle Charging Stations In East Garage In Partnership With Co No Terms DisclosedBenzinga
