mooze,,2019-06-04 15:50:00,38.207,CPB bleed into the close rr is good enough to bet on another zombie staple a la KHC
daviddaubner,,2019-06-04 15:31:00,38.489,TOP SP500 Stocks with the worst Growth Rank CPB FE NI EFX EIX source finscreener
Stockhoot,,2019-06-04 14:19:00,38.522,Upcoming earnings AMC BMO CRM CPB stockhootcomEarningsCalen
InItToWinIt100,False,2019-06-04 13:54:00,38.479,Got some CPB 67 35 puts
epsguid,,2019-06-04 13:00:00,38.33,CPB is scheduled to report earnings before the market opens tomorrow via eWhispers earningswhisperscomstocks
Stockhoot,,2019-06-04 12:19:00,38.3,CPB Earnings tomorrow BMO Get Chart Ratings Trade Ideas stockhootcomEarningsCalen
mooze,,2019-06-04 11:58:00,38.6,CPB short interest 125 could explain the rip since fri
EstimizeAlerts,,2019-06-04 11:21:00,38.39,Wall St is expecting 2194 revenue for CPB Q4 Reporting 0829 BMOestimizecomintrocpbchar
mooze,,2019-06-04 10:44:00,38.367,In CPB 719 OTM ps ahead of er
AlexanderHandleton,True,2019-06-04 10:19:00,38.363,CPB best of the sector
ed29,,2019-06-04 09:43:00,38.126,CPB CPB JUN 355 PUT Activity on OFFER 1K 070 Expire JUN 21
