DesiHFM,True,2019-06-04 14:22:00,173.285,EW oversold and ready for 200
EstimizeAlerts,,2019-06-04 14:18:00,173.11,EWs Global THVT Sales is a key growth metric for their next report on 0725 AMC Will they beat last quarters 5977M Global THVT Salesestimizecomintroewchart
cybercash28,,2019-06-04 14:01:00,172.974,EW Edwards Lifesciences To Present At The Goldman Sachs 40th Annual Global Healthcare Conference financeyahoocomnewsedwa
cybercash28,,2019-06-04 13:40:00,172.664,EW HH Downtrend reversal Great entry Far from 198 ATH Great LT investment Gamer changer IHI XLV
fla,,2019-06-04 11:19:00,170.69,EW Press Release published article on June 04 110000 Edwards Lifesciences To Present At The Goldman Sachs 40th Annual Global Healthc prnewswirecom443newsrel
livetraderalerts,,2019-06-04 11:17:00,170.753,EW 176m ago Edwards Lifesciences To Present At The Goldman Sachs 40th Annual Global Healthcare Conference prnewswirecomnewsrelease
newbie_here2learn,True,2019-06-04 11:15:00,170.713,EW long here
stocktradersdaily,,2019-06-04 11:00:00,170.59,Edwards Lifesciences EW Technical Update newsstocktradersdailycom
EstimizeAlerts,,2019-06-04 10:39:00,170.56,Heres what 7 Estimize analysts believe EW will report for Q2 2019 EPS Reporting 0725 AMCestimizecomintroewchart
