Lawleycpa,,2019-06-04 15:39:00,28.051,Nutanix CEO Looking Forward To Outlasting Naysayers After Stock Drop NTNX crncomslideshowsdatace
EquityMaster33,False,2019-06-04 14:53:00,27.735,NTNX going lower
EstimizeAlerts,,2019-06-04 14:09:00,27.615,NTNXs Billings is a key growth metric for their next report on 0829 AMC Will they beat last quarters 34603M Billingsestimizecomintrontnxcha
FiveKegs,,2019-06-04 12:34:00,27.394,NTNX like this on a flush out around 20
rootofgaul,,2019-06-04 12:26:00,27.51,NTNX ferralCat Im nosing around this stock again looking a bit bullish to methoughts
stocktowatch7,,2019-06-04 11:56:00,27.654,NTNX here goes on stocksequitycomactivesto
Turtletrading,,2019-06-04 11:30:00,27.736,NTNX Nutanix NTNX 2709 was the months biggest loser shedding 31 tickeroncomeventid16159
goal_profit,,2019-06-04 10:35:00,28.048,NTNX it will probably have more than 5 upward move today
taguru,,2019-06-04 10:19:00,27.77,NTNX Nutanix NTNX 2709 was the stock markets top loser yesterday falling 349 Expect a Downtrend reversal tickeroncomeventid16109
FlynancialAnalyst,True,2019-06-04 10:10:00,27.628,ARKG keeps backing up the truck in NTNX day after day against the IPO base lows 2500 and lower monthly BB XBI
breaking_stocks,,2019-06-04 10:01:00,27.88,NTNX described at alphafinewscomearningsre
samcrew93,,2019-06-04 09:59:00,27.834,NTNX Will this hit 25 or 30 first
