itsallaboutheoptions,True,2019-06-04 15:58:00,97.634,Trade Ideas UPS delayed JUN7 985C100C swing still actionable
Chugger,,2019-06-04 15:26:00,97.466,chalk up two more winning trades today AMD and UPS thanks to TheStockWhisperer I SWEAR I am not being paid to say this
AlreadyPricedIn,,2019-06-04 14:53:00,97.045,FB FDX AMZN UPS lol
FinanceTrends,,2019-06-04 14:24:00,96.84,FDX and UPS getting a little bounce today Interesting to note that both stocks made their highs in early 18 STMP topped in mid2018 Economic takeaways
StockTrader234,True,2019-06-04 14:24:00,96.84,UPS Watching that MACD At Zero line today Possible aspect change
Eugene_Maslov,,2019-06-04 13:39:00,96.92,UPS sold I will try to buy again at 9550
EquityFeedAlerts,,2019-06-04 12:06:00,96.052,BLOCK TRADE UPS 980251 shares 9603 120525
taguru,,2019-06-04 10:46:00,95.287,UPS United Parcel Service UPS 9413 was the months biggest loser shedding 11 tickeroncomeventid16122
EstimizeAlerts,,2019-06-04 10:36:00,95.381,Heres what 10 Estimize analysts believe UPS will report for Q2 2019 revenue Reporting 0724 BMOestimizecomintroupschar
FASTgraphs,,2019-06-04 09:44:00,95.15,UPS Thanks SA Contributor Nicholas Ward for using fastgraphs in your article investing markets stocksseekingalphacomarticle42
