EquityFeedAlerts,,2019-06-11 15:39:00,5.51,BLOCK TRADE SIRI 250000 shares 551 153631
daviddaubner,,2019-06-11 15:34:00,5.51,Financials of SiriusXM SIRI SIRIfinscreenercomtitlefinan
daviddaubner,,2019-06-11 15:33:00,5.51,Top Most Active NDX Stocks today AMD SIRI AAPL CSCO MSFTsource finscreener
MoneyMendoza,True,2019-06-11 12:32:00,5.475,SIRI should be seeing 6 by end of July
pk8123,,2019-06-11 12:07:00,5.47,SIRI not a good stock to buy if economy tanks and car sales down like Pandora though Watching
EstimizeAlerts,,2019-06-11 10:36:00,5.505,SIRI analysts on Estimize are expecting 1454 YoY EPS growth for Q2 up from 1667 in Q1 Reporting 0724 BMOestimizecomintrosiricha
VolumeBot,,2019-06-11 10:23:00,5.51,Per data reported to FINRA short volume divided by total volume for SIRI was 4765 on 061019 volumebotcomsSIRI
blessme1,True,2019-06-11 10:02:00,5.5,SIRI in at 55
Billionaireclubcollc,,2019-06-11 09:41:00,5.454,SIRI hold the 20 MA
