AngryTrading,True,2019-06-11 15:47:00,193.36,SOXX why is this even rallying If we are expecting an economic slowdown historically semis are one of the groups that get absolutely wrecked
live2lose,False,2019-06-11 14:04:00,193.208,SPY please make the stupid ppl believe just for a few more days so i can buy more at a discount before ATH QQQ SOXX
live2lose,,2019-06-11 12:53:00,192.307,QQQ SPY SOXX ive got another big fat cash investment coming this week with plans to buy a shitload more stupid ppl cant even figure out this low volume fade and think well return to 2018 levels lulz
cybercash28,,2019-06-11 10:48:00,194.04,SPY Pulling back to test up gap this morning Very normal QQQ SOXX XLV
cybercash28,,2019-06-11 10:37:00,194.288,AAPL HH and above ma50 RSI rising to bullish zone DIA QQQ SOXX SPY
cybercash28,,2019-06-11 10:18:00,194.56,NVDA HH Downtrend reversal Bottom is in SOXX SOXL SPY
