Karpoligiano,True,2019-02-25 15:44:00,186.575,RTN financeyahoocomnewsgdr
CestrianCapitalResearch,,2019-02-25 14:59:00,186.638,AJRD RTN NOC See latest Cestrian Capital Research note a One To Watch note on SAIC here seekingalphacomarticle42
intelligentinvestisseur,,2019-02-25 14:32:00,186.459,SCHW long position BA LMT NOC GD RTN SQ PYPL GPN EPAY PAYC PAYX BLK BRKB GS MS MA V AXP
livetraderalerts,,2019-02-25 13:15:00,187.21,RTN GD 151m ago General Dynamics and Raytheon to Operate Reagan Ballistic Missile Test Site prnewswirecomnewsrelease
livetraderalerts,,2019-02-25 13:15:00,187.21,RTN 150m ago Raytheon and General Dynamics to operate Reagan Ballistic Missile Test Site prnewswirecomnewsrelease
EstimizeAlerts,,2019-02-25 11:03:00,187.759,RTN analysts on Estimize are expecting 1287 YoY EPS growth for Q1 down from 4433 in Q4 Reporting 0425 BMOestimizecomintrortnchar
sleekOptions,True,2019-02-25 10:23:00,187.388,Peak gain the last 3 expired setups RTN 143956 76481 984 3145
sleekOptions,False,2019-02-25 10:22:00,187.522,Update1 RTN Mar08 1825 Puts Down 49 since alerted on Feb 21
VolumeBot,,2019-02-25 10:21:00,187.542,Short volume for RTN on 022219 was 30th percentile in terms of last 20 trading days volumebotcomsRTN
