Vinny1990,True,2019-02-22 15:59:00,176.893,BABA VERY STRONG
FFCH,True,2019-02-22 15:59:00,176.893,BABA OMG
Feuerwerk,True,2019-02-22 15:58:00,176.811,BABA Exceeding my expectations So undervalued in past months Beast unchained again
Morpheus,,2019-02-22 15:58:00,176.811,BABA Winning is better than I could imagine
mrk2,True,2019-02-22 15:52:00,176.45,BABA 200 soon
Feuerwerk,True,2019-02-22 15:51:00,176.545,BABA what a day And do much more to come If this gets to 200 this year i quit my job
bababoeey,,2019-02-22 15:50:00,176.477,BABA I imagine we will get a small pullback on Monday Right Im bullish but may buy a few puts for protection
wangyingnan1202,True,2019-02-22 15:49:00,176.42,NIO people are beting big on Chinese stocks for a possible deal next week nice IQ BABA MOMO JD TIME BZUN WB
BullWithWings,,2019-02-22 15:49:00,176.42,BABA Well done bulls have a good weekend See you next week
stealyogirl,True,2019-02-22 15:48:00,176.377,BABA beautiful set up into next week
thaduke,True,2019-02-22 15:46:00,176.321,BABA 175 calls from 170 looking amazing for 31
MarketRealist,,2019-02-22 15:46:00,176.321,Is NIO Stock Readying for a Rally ahead of Its Q NIO TSLA TCEHY HUYA BIDU BABA UXIN marketrealistcom201902i
LeeZXT,True,2019-02-22 15:45:00,176.457,BABA China Delegation staying in US for 2 more extra days I think they may visit Krafts massage parlor in FL
LeeZXT,True,2019-02-22 15:44:00,176.369,BABA to summarize A deal more than likely to happen than not Reality TV at its finest
weltreader,True,2019-02-22 15:44:00,176.369,BABA volume over 13M nothing spectacular yet but still highest of February so far
Wolynes,,2019-02-22 15:43:00,176.457,BABA Trump telling lightheizer his job
Vincenz,,2019-02-22 15:42:00,176.455,BABA China helped us greatly w N Korea
EveryTimeICash,True,2019-02-22 15:42:00,176.455,BABA Great setups simpletrader1
FFCH,True,2019-02-22 15:41:00,176.434,BABA IMHO this should finally move to 180 by next week
alkalinetrio3x,,2019-02-22 15:41:00,176.434,BABA Order66 so mad right now ROFL
Vinny1990,True,2019-02-22 15:41:00,176.434,BABA GOING UP
Order66,False,2019-02-22 15:41:00,176.434,BABA Cooked
stealyogirl,True,2019-02-22 15:41:00,176.434,BABA breaking major levels Huge leg up coming into next week BOOM
Vincenz,,2019-02-22 15:40:00,176.392,BABA LighhizerMOU is a contractDisagrees w TrumpFascinatingWill use the term Trade Agreement
stealyogirl,True,2019-02-22 15:40:00,176.392,BABA prayers be with you if you tried shorting this today Or next week good luck
optionmaster_1,,2019-02-22 15:39:00,176.353,BABA Amazingeverything is exactly how I predicted it with Baba
OptionTradesBB,True,2019-02-22 15:39:00,176.353,BABA oprah says you cover you cover all shorts need to cover
Vincenz,,2019-02-22 15:39:00,176.353,BABA Trump Great cooperationBoth want a meaningful dealWant a lasting dealDont blame China for current situation
Vinny1990,True,2019-02-22 15:38:00,176.241,BABA After breaking key levels today if your a bear your a freaking idiot
Cousin_Vinny,True,2019-02-22 15:37:00,176.261,BABA no complaints heresensing institutions see an agreement soon China US a nice catalyst if theyre right Ride the wave
Order66,False,2019-02-22 15:36:00,176.233,BABA No Deal by next week Have to wait another month Let it come back to fill Gap
Vinny1990,True,2019-02-22 15:36:00,176.233,BABA BOOM BOOM
tacticaltraderlongUS,False,2019-02-22 15:35:00,176.229,BIDU MS Morgan Stanley downgrades Baidu to 175 from 188 they advise big NYC investors sell while you still can profitsdropped50 BABA
Order66,False,2019-02-22 15:35:00,176.229,BABA Have to wait for MaraLago baby
iTheBull,,2019-02-22 15:35:00,176.229,BABA Above 176 nowbull trap
Vinny1990,True,2019-02-22 15:35:00,176.229,BABA This could have a really strong close The day is not over
Vincenz,,2019-02-22 15:35:00,176.229,BABA TrumpNo MOUWants a deal only
Wolynes,,2019-02-22 15:35:00,176.229,BABA wow holly st
thaduke,True,2019-02-22 15:35:00,176.229,BABA pierced through the resistance will be a big run and even bigger with trade news 200 PT
MistressOfFortune,,2019-02-22 15:35:00,176.229,BABA Sheesh
GoodNewsBull,True,2019-02-22 15:35:00,176.229,SPY Bears have to move before DJIA moves back over 200 Bull Mrkt is really looking to take a lot of Shorts out here AAPL AMZN BABA
Feuerwerk,,2019-02-22 15:35:00,176.229,BABA now we might get 178 today Unleashed
Vinny1990,True,2019-02-22 15:34:00,176.202,BABA BUY BUY BUY BUY BUY
LeeZXT,True,2019-02-22 15:34:00,176.202,BABA short trolls better seek cover
Vinny1990,True,2019-02-22 15:34:00,176.202,BABA This will be 235 end of year
Feuerwerk,,2019-02-22 15:33:00,176.198,BABA we pierced through
Vinny1990,True,2019-02-22 15:33:00,176.198,BABA I moved money back into this name A LOT OF MONEY
stealyogirl,True,2019-02-22 15:33:00,176.198,BABA anything bearish posted on here Disregard completely This stock is a beast and its showing major strength into close
Vincenz,,2019-02-22 15:33:00,176.198,BABA Will discuss ZTE Huawei and the Canadian arrestWant open competitionWe have a deal on currency
Vinny1990,True,2019-02-22 15:33:00,176.198,BABA The Alibaba Stock we know of is BACK
Vinny1990,True,2019-02-22 15:32:00,176.101,BABA This is going to fly up and have some huge days
stealyogirl,True,2019-02-22 15:32:00,176.101,BABA boom broke 176 Easy 180 PT next week then up from there
Feuerwerk,,2019-02-22 15:32:00,176.101,BABA chipping away the wall
Cousin_Vinny,True,2019-02-22 15:31:00,176.037,BZUN daily trend break institutions accumulate shares Phase II markup starts 920 cross price above and rally follows BABA IQ JD
Order66,False,2019-02-22 15:30:00,175.938,BABA A gap that will fill Such a shame
GoodNewsBull,True,2019-02-22 15:29:00,175.945,SPY Trump saying a deal will happen is going to run this Mrkt hot into close def in Tech AAPL BABA AMZN NFLX QQQ MSFT
Vincenz,,2019-02-22 15:29:00,175.945,BABA LighthizerMade a lot of progress on IP
Vinny1990,True,2019-02-22 15:28:00,175.942,BABA This will go up 20 When a deal is made you want to own this stock
stealyogirl,True,2019-02-22 15:28:00,175.942,BABA watching Trump speak Hes very positive on a deal will happen and China much so wants to finish deal ASAP Very bullish week ahead
TrendRider1,True,2019-02-22 15:27:00,175.96,SPY QQQ AAPL MU BABA Trump and Liu He speaking now both confirm deal is likely to happen
Vincenz,,2019-02-22 15:27:00,175.96,BABA TrumpMore likely a deal will happenGood chance it will happenHe Very likely it will happen
Feuerwerk,,2019-02-22 15:26:00,175.945,BABA where is this end of next week Deal wont have been announced before end March I suppose
alls25,,2019-02-22 15:24:00,175.968,BABA finally going beast mode
alls25,True,2019-02-22 15:24:00,175.968,BABA
LeeZXT,,2019-02-22 15:24:00,175.968,BABA Trump is on CNBC
SonGoku,,2019-02-22 15:23:00,175.959,BABA wow guys
JShloush,True,2019-02-22 15:22:00,175.965,BABA how is this not trending
Feuerwerk,,2019-02-22 15:20:00,175.986,BABA will it take the 176 hill today
JAMES2052,,2019-02-22 15:19:00,175.98,BABA Bingo got alert on the 17600 hit
Vincenz,,2019-02-22 15:19:00,175.98,BABA WilburDont break out the champagne yetFoxFurther mtgs Sat Sun
Panther_Stocks,,2019-02-22 15:14:00,175.982,BABA is up 429 and this AMZN POS is struggling with even 055 Pathetic Worst investment I ever made
NaviAvatar,,2019-02-22 15:13:00,175.947,Trump and Xi look to make a positive deal China stocks ripping BABA IQ HUYA NIO
williamdaniel,,2019-02-22 15:12:00,175.959,BABA levels this could hit today 17688 17829
stealyogirl,True,2019-02-22 15:10:00,175.951,BABA broke 200 day MA This is a beast Ready to run easily to 180 just hold
SonGoku,,2019-02-22 15:10:00,175.951,BABA what a monster
Feuerwerk,,2019-02-22 15:08:00,175.966,BABA Reading China commits to buying lots of goods but wont cave in on respecting IP If Trump goes for this he is a short sighted fool
PEtraderPE,,2019-02-22 15:07:00,175.915,BABA U dont have to wait til Monday to know whether this will be red or green when the meeting is done it will show its head
ZenTrends,,2019-02-22 15:06:00,175.922,BABA Weekly is an impressive breakout but it looks like a chase and panic buy here Multiweek Bull Flag sets up a better riskreward
LeeZXT,,2019-02-22 15:05:00,175.898,BABA the need to bring in Trumps granddaughter to be the closer of this deal washingtonpostcomnewswor
LeeZXT,True,2019-02-22 15:03:00,175.879,BABA oh the reality show of this trade deal cnbc just giving updates SoS Likely a deal
Wolynes,,2019-02-22 15:03:00,175.879,BABA Agree good strength on the dip
Feuerwerk,,2019-02-22 15:02:00,175.865,BABA its good to see this so resilient
OptionTradesBB,True,2019-02-22 14:58:00,175.708,BABA lets see this deal
Raw_Dog,,2019-02-22 14:56:00,175.733,BABA this is recovering surprisingly well
williamdaniel,,2019-02-22 14:50:00,175.378,BABA this can hit 17828 on top levels of VWAP
jmuggastacks,,2019-02-22 14:48:00,175.317,BABA anyone got a link to what trump said
Wolynes,,2019-02-22 14:47:00,175.272,BABA just china folks are staying two more days
Feuerwerk,,2019-02-22 14:46:00,175.252,BABA set up still excellent Trump playing hard to get When he meets Xi it will fall into place If Trump fucks this up he is gone
Feuerwerk,,2019-02-22 14:43:00,175.21,BABA well that there is no deal today was clear Of course Ginger dies not deal with assistants
murdoc18,True,2019-02-22 14:42:00,175.201,BABA A little profit taking here
JWM2020,,2019-02-22 14:41:00,175.154,ROKU BABA took my profitwill get back in next week but seems like drop begins now
Vincenz,,2019-02-22 14:40:00,175.491,BABA Trump No deal todayWill make big decisions with Xi at a meeting soonSlightly disappointing
ElliottWaves,,2019-02-22 14:40:00,175.491,BABA hourly chart from the 21919 pre market update elliottwaveforecastcom ElliottWave BABA Alibaba
tradecruz,,2019-02-22 14:40:00,175.491,BABA ready for a repeat
Saddle_Fitter,True,2019-02-22 14:38:00,175.563,Love JD here Contemplating rotating some BABA holdings to add to my JD positions Bullish both though
Wolynes,,2019-02-22 14:38:00,175.563,BABA There was a couple big sell orders
Feuerwerk,,2019-02-22 14:37:00,175.384,BABA Fck Ginger opening his mouth
prom1000,,2019-02-22 14:36:00,175.364,BABA the drop
JorelLaraKalel,,2019-02-22 14:27:00,175.911,3 Stocks to Buy to Profit from the Mobile Payments Megatrend BABA SQ PYPL foolcominvesting201902
LeeZXT,True,2019-02-22 14:23:00,175.844,BABA if we get positive TrumpLiu He meeting press it could spike GL Bulls
Feuerwerk,,2019-02-22 14:23:00,175.844,BABA was there actually any trade news today
Stocknews18,,2019-02-22 14:22:00,175.833,NVDA FB BABA AAPL CAT BA SPY about to drop 23 near 2740 level I think
TinSoldier,,2019-02-22 14:16:00,175.891,BABA DIS nice week boys
stealyogirl,,2019-02-22 14:16:00,175.891,BABA excellent company that is only growing insanely
stealyogirl,True,2019-02-22 14:15:00,175.857,BABA beautiful run Expect much more to come Two week hold will be huge
Cantrunorhide,True,2019-02-22 14:15:00,175.857,IQ MSFT JD BABA next week
cybercash28,,2019-02-22 14:12:00,175.883,BABA Double top bo 185 186 next KWEB
clays26,True,2019-02-22 14:12:00,175.883,BABA were is saucymike His getting destroyed
Vincenz,,2019-02-22 14:07:00,175.77,BABA cnbcTo buy 12 trillion of goodsIP enforcement progressNo movement on Forced IP transfer or Cyber theftMtg in MaraLago end March
GoodNewsBull,True,2019-02-22 13:59:00,175.77,BABA Bears have about 30 mins left Any positive news on China this Tech is going to soar hard AAPL QQQ AMZN MSFT GOOG FB NFLX
LeeZXT,True,2019-02-22 13:57:00,175.68,BABA any of you chart experts see a cup handle last 3 months
SuzanaBlue,,2019-02-22 13:56:00,175.64,BABA Good old BABA There she goes Very nice Cheers fellow longs
LeeZXT,True,2019-02-22 13:55:00,175.633,BABA it going to be YUGE
OptionTradesBB,True,2019-02-22 13:53:00,175.641,BABA pistol pete that guy is everywhere
ZenTrends,,2019-02-22 13:53:00,175.641,BABA pretty notable breakout
TrendRider1,True,2019-02-22 13:53:00,175.641,SPY QQQ BABA AAPL MU Trump meeting with Liu He at 230EST Do you want to be long or short going into the weekend
Ascencore,,2019-02-22 13:52:00,175.654,BABAYoungHoundITF OptionTradesBB Tombarley pistolpete throck stealyogirl MariaSt onelia ag92 Feuerwerk
ag92,,2019-02-22 13:49:00,175.6,KWEB IQ NIO BABA Whos ready for a run
PharmaVet,,2019-02-22 13:45:00,175.745,AMRN ROKU BABA BA I think Ill find a good bottle of wine and a cigar for tonight
dhanainfoster,True,2019-02-22 13:44:00,175.838,BABA Trump Xi discussing late March summit at MaraLago sources sayPublished 23 Mins Agocnbccom20190222trumpx
HIGHTRADING,,2019-02-22 13:44:00,175.838,YRIV china names picking up and coal China talk going well CLD BABA AMZN SPY DJIA im making guap today thanks to ACHV and ZSAN AAOI
natanr,True,2019-02-22 13:43:00,175.802,BABA an actual done China deal possible perfect stage for Presidential bid and blow to Pelosi and company Enemy of good is better
OptionTradesBB,True,2019-02-22 13:40:00,175.788,BABA get ready for a big run
VinnieTheArm,True,2019-02-22 13:40:00,175.788,BABA O FactYuggggeeee
pistol_pete,,2019-02-22 13:40:00,175.788,FB three weeks ago FB was higher than BABA now Baba is 14 higherguess which one im invested in yupfb
Tombarley,True,2019-02-22 13:39:00,175.755,ANIK come watch the party start at ANIK Come everyone watch AAPL ARGS SYN BABA KR HD SNAP FIT
dhanainfoster,True,2019-02-22 13:39:00,175.755,BABAcnbccom20190222trumpx
ChartMill,,2019-02-22 13:37:00,175.666,BABA has an AltmanZ score of 619 meaning it is financially healthy with little risk of bankruptcy chartmillcomanalyzephpu
MariaSt,True,2019-02-22 13:30:00,175.505,BABA TCEHY Some fundamentals on whats going on with Chinese big cap stocksstudyinreuterscomarticleusm
MarketRealist,,2019-02-22 13:27:00,175.482,AAPL GOOG NVDA QCOM AMZN FB MU NFLX MSFT ORCL IBM GE T AMD BIDU BABA TCEHY JD TSLA GM F marketrealistcom201902c
Market_Psycholog,True,2019-02-22 13:26:00,175.497,BABA Broke above resistance and 200 MA BABA Price broke above resistance and the 200 MA probably due to rumors of t
ShrewdInvestor860,True,2019-02-22 13:24:00,175.455,IQ JD TCEHY BIDU BABAmarketbrothersmediacomiqi
throck,True,2019-02-22 13:16:00,175.37,BABA its gonna run into the close
Feuerwerk,,2019-02-22 13:09:00,175.481,BABA hope it holds on 175 level but for now it looks very strrrrrong
Lach14,,2019-02-22 13:03:00,175.426,ALIBABA BABA chart Hot and breaking out Chinese Net stocks on fire SPY FXI too
stealyogirl,True,2019-02-22 13:01:00,175.446,BABA 180 PT very soon
Vinny1990,True,2019-02-22 12:45:00,175.236,BABA This hitting 175 was a big deal I took winning money from ROKU GE Putting it right here This will hit 180
onelia,True,2019-02-22 12:42:00,175.246,JD I asked my Chinese friend living in China and his opinion was that JD and BABA are the best choices of the Chinese stocks
intelligentinvestisseur,,2019-02-22 12:34:00,175.388,NIO good movements on rising uschina trade hopes BABA BIDU WB TCEHY TME JD IQ QTT NIO PDD MOMO BILI BZUN AABA HTHT
blagoje_lukic,True,2019-02-22 12:26:00,175.405,BABA WB IQ Going Full Chinese I
cybercash28,,2019-02-22 12:17:00,175.46,BABA nice bo about time KWEB
MarketRealist,,2019-02-22 12:12:00,175.455,AAPL HOG KO GM F TSLA GE NVDA CAT MSFT BA QCOM NFLX ORCL INTC MU BABA T TCEHY BIDU GOOG AMD AMZN MMM marketrealistcom201902c
MariaSt,True,2019-02-22 12:08:00,175.498,BABA We hit 175 today
Bagabar,True,2019-02-22 12:06:00,175.41,BABA who thinks this will rise on Monday Or will it tank a few bucks before continue its rise later in the week
OptionTradesBB,True,2019-02-22 12:04:00,175.365,BABA if deal today 200
A_Warr_Is_Coming,True,2019-02-22 12:01:00,175.46,Patience in all things brings good results SHOP SQ PAYC TEUM IQ SMG BABA MJ OLED LT holds
iTheBull,,2019-02-22 12:01:00,175.46,BABA What time does Trump meet Xi
ccledez,,2019-02-22 11:58:00,175.238,JD BABA AMD deal or no deal That is the question 230pm est
thaduke,True,2019-02-22 11:55:00,175.255,BABA anyones FOMO kick in yet
SDJB,True,2019-02-22 11:51:00,175.272,BABA she has been triggering al my alerts In with a starter pos Gl trading stockstowatch twittercomsergdjb
Dr_Stoxx,True,2019-02-22 11:51:00,175.272,BABA Breakout Did you join me
StreetPlunger,,2019-02-22 11:42:00,175.063,BABA so much room for upside
EchoNature,,2019-02-22 11:41:00,174.988,BABA Amazing
TalonStrike,,2019-02-22 11:40:00,175.137,BIDU Forget this one Only four China stocks worth risk BABA or AABA TME IQ NIO last two specs Otherwise better off in MCHI
ThanhVII,,2019-02-22 11:40:00,175.137,FXI BABA BIDU IQ JD TENCENT Our FCC commissioner talking about 5G on CNBC SPY QQQ IWM DIA T VZ S DISH TMUS CMCSA CHTR
OptionTradesBB,True,2019-02-22 11:38:00,175.179,BABA 180 close
MariaC82,,2019-02-22 11:32:00,175.533,BABA 1M sweep on the May 180Cs def liking that
Vinny1990,True,2019-02-22 11:32:00,175.533,BABA time to load up
ElliottwaveForecast,,2019-02-22 11:31:00,175.583,BABA Short term pullbacks are expected to remain supported in 3 7 or 11 swings above 165 low elliottwave
billgunderson,True,2019-02-22 11:29:00,175.481,Outstanding breakout on BABA I remain long
ElliottwaveForecast,,2019-02-22 11:28:00,175.357,BABA Is still trading within the cycle from December low and showing an impulsive structure elliottwave
ElliottwaveForecast,,2019-02-22 11:27:00,175.28,BABA 1H Chart 0219 presented at elliottwaveforecastcom Looking for the stock to trade higher elliottwave
Shortseller,,2019-02-22 11:27:00,175.28,BABA a thing of beauty off that bottom overbought short term but going MUCH higher IMO
ElliottwaveForecast,,2019-02-22 11:26:00,175.142,BABA Made new high above February peak and looking to extend toward 177 182 area before 3 waves pullback is seen elliottwave
TakeProfits120,,2019-02-22 11:26:00,175.142,BABA sold calls too soon
Kabinc,True,2019-02-22 11:22:00,175.11,BABA BZUN QD SINA WB YY MOMO in celeberation of the trade conflict ending next week having a chinese food feast tonight
windycitycapital,,2019-02-22 11:21:00,175.122,BABA baba risen from the dead
the_chart_life,True,2019-02-22 11:20:00,175.164,BABA Alibaba Moving out of the box above a key support level
1985sam,True,2019-02-22 11:19:00,175.2,BABA 180s
SwingWinner,True,2019-02-22 11:18:00,175.098,BABA 10 more and my bags will be filled
TradinTemplar,True,2019-02-22 11:17:00,175.06,BABA 180
weltreader,,2019-02-22 11:13:00,174.957,BABA 160k shares on the ask at 175 dayummm
JShloush,True,2019-02-22 11:13:00,174.957,BABA gooooooooooo
Vinny1990,True,2019-02-22 11:11:00,174.954,BABA 200 stock on its way
mechatronic86,True,2019-02-22 11:10:00,174.982,XIACY this is a must have together with BABA TCEHY
MrGrowth,True,2019-02-22 11:08:00,174.992,BABA take advantage of the Chinese Foreign discount still applied to BABA Great FCF to grow and expand into new verticals
Dr_Stoxx,True,2019-02-22 11:08:00,174.992,BABA wow a very good week indeed Here is the breakout Ive been posting about all week
androsForm,,2019-02-22 11:07:00,174.999,BABA MAY19 175 Cs 458k notional ASK SIDE
LeeZXT,True,2019-02-22 11:07:00,174.999,BABA BeastMode This is the BABA we know
OptionTradesBB,True,2019-02-22 11:04:00,174.95,BABA loaded up
Cousin_Vinny,True,2019-02-22 11:02:00,174.82,BABA NDX Top 20 Stats NDX100 84 of 100 are GREEN 16 are red
gabbs,,2019-02-22 11:02:00,174.82,BABA has been going up for almost 3months now Goodgoos200 coming soonpatience
FreakMeister,True,2019-02-22 11:01:00,174.809,BABA Wonderfulall those poor souls who panic sold in december lol
ProphetOfProfits,True,2019-02-22 11:01:00,174.809,BABA Wow Im about even finally after avg down lol Will sell some at 200 225 etc
ShrewdInvestor860,,2019-02-22 10:59:00,174.938,IQ JD TCEHY BABA BIDU iQiyi just the tip of the iceberg chinese tech basket coming back in a big waymarketbrothersmediacomchi
w500kilo,,2019-02-22 10:56:00,174.72,BIDU BABA missed but went up big BIDU beats and down as shit What the fuck Load
Wolynes,,2019-02-22 10:55:00,174.733,BABA When would a short squeeze start
Cousin_Vinny,True,2019-02-22 10:50:00,174.513,BABA starting a new trend for a couple days minimum VIX 13 handle and dropping out of bear flag SPY 5min bo left to right
thaduke,True,2019-02-22 10:48:00,174.479,BABA calls looking good finally broke through resistance
cdgains,,2019-02-22 10:47:00,174.405,BABA Down for 34 months finally almost green after averaging down Finally baba good sheep
Cousin_Vinny,True,2019-02-22 10:47:00,174.405,BABA observations on TUES in the trading room
Cousin_Vinny,True,2019-02-22 10:46:00,174.515,BABA speaking of new trending pulse help should come from the shorts
natanr,True,2019-02-22 10:45:00,174.443,BABA baba may have strong political tailwind but also executing well the numbers may prove it
john92,,2019-02-22 10:41:00,174.332,BABA cant believe I sold the 165 call for 280 dollars would be exerciseable at 750 now nm earlier in wk at a g
StackTroder,,2019-02-22 10:39:00,174.229,IQ and BABA part of my portfolio are just dandy SOGO is so useless No revenue generation on their part
Lach14,,2019-02-22 10:37:00,174.186,Market update at 1035 am top3sectorportfoliocom SPY AAPL AMZN GOOGL NFLX BABA
Stocknews18,,2019-02-22 10:37:00,174.186,NVDA FB AAPL BABA SPY over bought looking for pull back
AquaKnight,,2019-02-22 10:37:00,174.186,BABA going to add more to index mutual funds and less individual stocks and awaiting pullback in the general market GL
natanr,True,2019-02-22 10:37:00,174.186,BABA 185 test trump to meet with Kim then Xi announce bid for whitehouse no tarrifs continued talks But Imagine a deal worked out
AquaKnight,,2019-02-22 10:37:00,174.186,BABA bagheld BABA from 200 to 130 over 15 years with average of 17420 sold all today love the company LT rebuilding my portfolio
Cousin_Vinny,True,2019-02-22 10:33:00,174.33,BABA observations just starting to trend again Probably
TradingCommonSense,,2019-02-22 10:29:00,174.2,If BABA closes above 173 today it would be very surprising if it didnt get to at least the August high of 186 in the next few weeks
MarketRealist,,2019-02-22 10:23:00,174.366,Tesla Stock Rises TSLA AAPL GM F NIO NVDA GOOG AMZN AMD INTC TCEHY BIDU BABA marketrealistcom201902t
tickertutor,,2019-02-22 10:23:00,174.366,long BABA short BIDU
OptionTradesBB,True,2019-02-22 10:20:00,174.25,BABA 200
ODCleaver,,2019-02-22 10:18:00,174.097,BABA Yea I finally went positive for a second
Vinny1990,True,2019-02-22 10:05:00,173.936,BABA A trade deal is close and this will explode
Vinny1990,True,2019-02-22 10:05:00,173.936,BABA Moved profits from Roku into Alibaba
Vinny1990,True,2019-02-22 10:04:00,174.016,BABA load up
ieatcat,True,2019-02-22 10:04:00,174.016,BABA been holding since 181 from year ago
pblas,,2019-02-22 10:01:00,173.958,BABA need volume if youre long
ATMcharts,,2019-02-22 09:52:00,173.796,BABA new move highs
Feuerwerk,,2019-02-22 09:51:00,173.759,BABA hope it keeps going now Any news on trade
Cousin_Vinny,True,2019-02-22 09:46:00,173.761,BABA marketsmith alerts going off this morning theclosingprintcomCVBlog others too like IQ IBDinvestors InvestorsBusinessdaily BABA
Market_Watch,,2019-02-22 09:40:00,173.359,IQ clowns are trying to trade thisand failing miserablybuy your shares and put them awaywill be a 5 to 10 bagger BABA JD
krister19us,True,2019-02-22 09:39:00,173.354,Options is great if u hedge it right Thank u for the house money CRON APHA NIO SQ AAPL TLRY EXEL IEP BABA AMD STUDY
AlexanderHandleton,True,2019-02-22 09:37:00,173.649,KWEB BABA BIDU JD YY IQ HUYA just keep buying
