Riverwalk,True,2019-02-28 15:07:00,71.37,IONS Morgan Stanley raises PT to 71 from 51
HowieR,True,2019-02-28 14:04:00,71.86,IONS Restoring Home and Heart Ionis Provides MuchNeeded Construction for Patient Family httpcarlsbadlifeinactioncomrestoringhomeandheartionisprovidesmuchneededconstructionforpatientfamilyfbclidIwAR0Y4eqUfkQHZ4yKsaHbs7jpKcJi7bKn8KUx68zeGKlA1KcRlqa3F87s
taguru,,2019-02-28 11:50:00,70.565,IONS Ionis Pharmaceuticals IONS 7094 was the markets top weekly gainer with a 22 jump tickeroncomeventid644919
Work_Life,,2019-02-28 10:58:00,70.734,IONS anyone know what Goldmans will do
StockTrader21,,2019-02-28 10:12:00,71.558,IONS I made the correct move selling at 70 but may have not been the best move Theres a difference
ValuEngine,True,2019-02-28 10:00:00,71.257,ValuEngine upgrades IONS to a STRONG BUY rating 6Month Expected Return 580
