Vegas1,True,2019-05-24 15:39:00,4.273,PLAG nice 13D and weekly is primed for a nice move swing in play
risenhoover,,2019-05-24 15:33:00,4.273,Zhou Bin has filed a new activist 13D reporting 1478 ownership in ALN httpsfinteliosousaln
kentrader_Oorah,True,2019-05-24 15:28:00,4.392,PLAG
livetraderalerts,,2019-05-24 15:23:00,4.442,PLAG 15m ago SEC Beneficial Ownership Report SC 13D Planet Green Holdings Corp secgovArchivesedgardata
cctranscripts,,2019-05-24 15:23:00,4.442,General statement of acquisition of beneficial ownership conferencecalltranscriptso ALN
fla,,2019-05-24 15:23:00,4.442,ALN filed form SC 13D on May 24 152204 secgovArchivesedgardata
