OceanThunder7,,2019-02-20 14:03:00,7.48,GLMD one good thing is this has never been in a bubble to deflate Undervalued by 350 million
OceanThunder7,True,2019-02-20 12:42:00,7.537,GLMD ICPT NASH resolution endpoint it was 8 placebo and 117 OCA can Aramchol do better
OceanThunder7,True,2019-02-20 12:24:00,7.588,GLMD has a great chance that its phase3 results will beat ICPT recent results
OceanThunder7,,2019-02-20 11:08:00,7.53,GLMD rubber band is stretched on this about to snap
OceanThunder7,,2019-02-20 10:24:00,7.504,GLMD currently 764 resistance
OceanThunder7,True,2019-02-20 10:06:00,7.548,GLMD major triangle about to breakout to upside Look for triple average daily volume
