powerhauns01,True,2019-02-20 15:44:00,5.86,LJPC Did anyone attend the SCCM conference in San Diego this week to hear La Jollas presentations How was it
free2dream,,2019-02-20 14:40:00,5.854,LJPC like to see the angry revenge posts Sometimes thats a good sign of a wash out
edog31,,2019-02-20 13:35:00,5.837,LJPC paramoimt annoined a new movie Butthurt Bears Staring look below
PeakySellers,,2019-02-20 12:45:00,5.77,LJPC La Garbage
tothebeach,,2019-02-20 12:21:00,5.801,LJPC fucking scam beware tang
Motorcitymayhm,False,2019-02-20 12:20:00,5.803,LJPC Garbage learning anything bagholders TANG IS BAD NEWS44 to 5
