marketchameleonwins,,2019-02-20 15:25:00,17.135,MRO 18Oct19 ATM Implied Vol Decreases 03 to 348 Straddle Implies a Move of 224 marketchameleoncomOvervie
TaxLossMaster,,2019-02-20 14:24:00,17.028,MRO cant win them all Only L today stop hit 60 from 69 entry Failed bullflag bo here imo no play at the moment
EstimizeAlerts,,2019-02-20 13:03:00,17.16,Estimize revenue expectations are 436 higher than that of Wall Street for MRO Q1 Reporting 0501 AMCestimizecomintromrochar
sister,,2019-02-20 12:43:00,17.185,RIG punch through that 905 and unleash mother of all squeezes back towards 1434 XOM CVX MRO
marosrin48,True,2019-02-20 12:27:00,17.218,MRO oil impressed me w 12 mil brllsPer day expected from US alone tomorrowmore reason to see 19 in the near term
OptionsTech,,2019-02-20 12:19:00,17.234,MRO Max Pain1650 Maturity02222019 maxpain options maximumpaincomoptionsma
TaxLossMaster,True,2019-02-20 11:49:00,17.26,MRO 315 17C 69 know the risk holding this into Fed meeting minutes release 1400 EST
