Tradereversal,,2019-02-20 15:17:00,74.89,MRTX Looking really goodheaded up IMO
ChartMill,,2019-02-20 12:08:00,74.528,Most gaining stocks today TWLO MRTX and GRMN chartmillcomstockscreener
Shotgun777,True,2019-02-20 11:46:00,74.91,MRTX SQUEEZEEE BABY SQUEEZEEE
Shotgun777,True,2019-02-20 10:36:00,73.697,MRTX hehe silly bears lmfao
BobBuran,,2019-02-20 10:15:00,74.425,Wednesday ALL ACTIVE BUY STOP ORDERS ABOVE THE MARKET 4 TODAY already bot past 10 minutes ACIA NVTA MRTX CHRS
Joe_Mama,False,2019-02-20 10:07:00,74.83,MRTX 25B market cap on zero revenue zero actual products Definition of insider scam extraordinaire Go ahead go long Its worth it
Doozio,True,2019-02-20 09:56:00,74.35,MRTX been huckleberry riding before most leaders Roger started rocking with em late Dec Handoff to Newton LEADER YUGE potential
Joe_Mama,False,2019-02-20 09:30:00,71.989,MRTX Just like clockwork Insider sells thousands of shares and soon after another analyst upgrade How about some trial results PD
