shortvolumes,,2019-02-20 15:19:00,15.986,Short sale volume not short interest for SLCA on 20190219 is 53 shortvolumescomtSLCA via shortvolumes
Crom5775,,2019-02-20 14:42:00,16.068,SLCA short squeeze
xsinner72,,2019-02-20 14:22:00,15.87,SLCA In at 1567 Good luck all
BRC15,True,2019-02-20 13:39:00,15.769,SLCA Nice Make us proud
Tyler_Durden,,2019-02-20 13:21:00,15.723,SLCA short covering could take it to 18
MariaC82,,2019-02-20 12:39:00,15.411,Upgrades Downgrades Initiations More CS CSIQ AXL PFE EHTH SAIL SLCA FIVN WMT EXPD
ChartMill,,2019-02-20 11:47:00,15.405,SLCA has an average volume of 2180140 This is a good sign as it is always nice to have a liquid stock chartmillcomanalyzephpu
Ro_Patel,,2019-02-20 09:39:00,15.326,Cowen Co reiterates Outperform Rating on SLCA ups TP to 23 from 17
