sleekOptions,False,2019-02-08 15:10:00,42.407,Update9 FXI Feb22 41 Puts Up 73 since alerted on Feb 06 Peak 118
shortvolumes,,2019-02-08 14:55:00,42.43,20190207 Short sale volume not short interest for FXI is 63 shortvolumescomtFXI via shortvolumes
Opinvestments,,2019-02-08 14:22:00,42.441,BSTI is down and all of China is up BIDU BABA YY WB FXI BZUN JD ZTO Seems about right A close above 490 would show strength
EquityFeedAlerts,,2019-02-08 14:15:00,42.46,BLOCK TRADE FXI 1000000 shares 4240 141445
ThanhVII,,2019-02-08 13:19:00,42.338,BABA BIDU FXI IQ JKS WB TCEHY TME Their stock market should be rolling over if it wasnt for the gov buying SPY DIA IWM QQQ
marketchameleonwins,,2019-02-08 10:32:00,42.21,FXI Implied Volatility Decreased 16 to 206 IV Rank Falls to 037 Subdued Level marketchameleoncomOvervie
TraderBoy777,,2019-02-08 10:17:00,42.188,FXI Nice set up for next weekFor the next Good News on Trade Deal Calls hitting tape
NFTRH,,2019-02-08 09:33:00,42.347,NFTRH A Precious Metals Update nftrhcom20190208aprec GLD SLV GDX GDXJ HUI SPY DIA QQQ ACWX FXI DBC USO UUP XME
