harmongreg,,2019-02-08 15:39:00,98.21,added MDB Mar 100 calls
ChartMill,,2019-02-08 14:54:00,98.65,DECK AMT and MDB are amongst the strongest stocks in the market nearing a new high chartmillcomstockscreener
cybercash28,,2019-02-08 14:22:00,98.418,MDB ATH Ty AMZN for cheap shares at 72 IGV QQQ XLK
Tischendorf,,2019-02-08 13:02:00,97.637,MEDP CHGG continue to show weakness Better stocks to replace them with are COUP XLNX OKTA ZEN TEAM MDB to name just a few
intraTrader,,2019-02-08 12:46:00,97.714,MDB Stocks Under Review here it goes seekingfincom20190208s
esrouter,False,2019-02-08 11:39:00,97.073,MDB One analyst downgrade should give this the spanking it deserves Trading at 20x revenues
StocksGalleryChamelleon,,2019-02-08 09:30:00,94.58,MDB only on journalfinancenet201902
