moonshines1979,True,2019-02-08 15:54:00,26.234,PBYI load up
lets_do_it,,2019-02-08 14:38:00,26.711,PBYI Is this the only stock thats not joining the pullback or is there any other crap out there
moonshines1979,True,2019-02-08 14:37:00,26.76,PBYI loaded here
Dekooning,,2019-02-08 11:03:00,26.562,PBYI POS Auerbach do something
EuropenUSBull,True,2019-02-08 10:40:00,26.58,PBYI Glad I got out of this POS and instead got into the liver machine
moonshines1979,True,2019-02-08 09:49:00,27.08,PBYI any news out
moonshines1979,True,2019-02-08 09:47:00,26.97,PBYI squeeze is on
