stockcoast,,2019-02-08 15:17:00,10.3,SIEN bouncy
steve6969,True,2019-02-08 15:16:00,10.297,SIEN looks like more buying of July 20s yesterday
stockcoast,,2019-02-08 13:48:00,10.212,Tradereversal SIEN bouncing off trend
TechnicalMike,True,2019-02-08 12:19:00,10.29,SIEN added
jeffg3412,,2019-02-08 11:18:00,10.134,SIEN gonna take some see what happens Might be a positions hold instead of a swing
steve6969,True,2019-02-08 10:28:00,10.28,SIEN Blackrock bought so I bought more
TechnicalMike,True,2019-02-08 09:56:00,10.363,SIEN
