OptionTradesBB,,2019-06-10 11:07:00,193.746,AAPL China will not make a deal under trump Waiting for this pump to accumulate
Abo3lee,True,2019-06-10 11:06:00,193.823,AAPL 196 before closing
PaPiChulo312,True,2019-06-10 11:04:00,193.789,AAPL 205 calls for June 28 les go
jiminsocal,True,2019-06-10 11:03:00,193.741,AAPL if there is a deal with China by the end of the month going back to the 230 level by end of year So much uncertainty
tacticaltraderlongUS,True,2019-06-10 11:02:00,193.771,BIDU officially just covered at 113 and bought 500 shares of the stock It is way oversold and RSI is screaming a buy AAPL BABA Baidu will bounce back up to 125 and if theres a deal it will go to 200 great time to double your money in the google of China BIDU
xroshx,True,2019-06-10 11:02:00,193.771,AAPL back to 230
m71mmm,True,2019-06-10 11:02:00,193.771,AAPL if the DOW picks up oh boy
hoop_tradingcom,True,2019-06-10 10:59:00,193.524,SPY if BYND was 5 of spy instead of AAPL
jiminsocal,True,2019-06-10 10:57:00,193.531,AAPL definitely looks like the market is pricing in a deal with China Is the market getting ahead of itself
redbear7,,2019-06-10 10:57:00,193.531,AAPL If this looks like a strong market to you just quit trading now
AlphaTrader8,,2019-06-10 10:52:00,193.668,RVLV SPY BYND AAPL Despite rally in the Market Be careful here with being Long on RVLN BYND possibly a reversal underway Look out below
cybercash28,,2019-06-10 10:51:00,193.724,AAPL Reversal started Frid PF has 239 PT QQQ SPY XLK TQQQ
mytyme,,2019-06-10 10:48:00,193.9,Veritas28 post some trades for this week I assume youre getting rektd as usual SPY QQQ BTCX DJIA AAPL
m71mmm,True,2019-06-10 10:47:00,193.838,AAPL she gone
jiminsocal,True,2019-06-10 10:44:00,193.505,AAPL Dont trade it own it
LULLULULUL,True,2019-06-10 10:42:00,193.333,AAPL ATH coming
m71mmm,True,2019-06-10 10:41:00,193.178,AAPL AMZN market will double with Trump 2020
OptionsForecast4U,,2019-06-10 10:39:00,193.082,AAPL 19278 for a call scalpthats 15 minute buy zone
AlphaTrader8,,2019-06-10 10:39:00,193.082,MU XLNX SPY QQQ AAPL Follow through Rally after US reaches deal with Mexico on Trade Short Term Trade Bullish all except Micron
DiverX,,2019-06-10 10:39:00,193.082,AAPL I know its very unlikely but a gap fill would be hilarious
m71mmm,True,2019-06-10 10:39:00,193.082,AAPL AMZN
TrendLineMaster,,2019-06-10 10:35:00,193.436,AAPL little pivot here nice run but hit angular R in the rising wedge bullishbearscomrisingwed
bearcharts,,2019-06-10 10:34:00,193.471,Sold rest of AAPL long in upper 193s for a loss
davis13,False,2019-06-10 10:34:00,193.471,AAPL shorted to 190
m71mmm,,2019-06-10 10:33:00,193.463,feed some of NFLX back into AAPL
45andbelow,True,2019-06-10 10:32:00,193.526,AAPL BABA AMD AMZN dont forget to add BIDU on the dip
Chrisdodge,False,2019-06-10 10:32:00,193.526,AAPL lol shorted 194 weeeeeeeeeeeeeeeeeeeee
m71mmm,True,2019-06-10 10:31:00,193.497,AAPL tech comeback led by apple
camham22,True,2019-06-10 10:30:00,193.688,AAPL watch out for those bear traps Fair warning This is moving higher
OphirGottlieb,,2019-06-10 10:29:00,193.761,AAPL When to buy the dip in Apple cmlvizcom20190604AAPL
kenbkb,,2019-06-10 10:27:00,193.656,AAPL TLRY AMZN Meheeco Meheeco MeheecoTrumpDow 30000BidenDow 15000
DeadRoses,True,2019-06-10 10:26:00,193.672,AAPL I doubled my money GLTA
Skidoome,True,2019-06-10 10:26:00,193.672,AAPL Squuuuueeezeeee shorties hard
MommyTrades,,2019-06-10 10:24:00,193.831,AAPL Hourly chart
caffy,True,2019-06-10 10:19:00,193.599,AAPL if you hated it at 170 you gotta love it here at 193
cybercash28,,2019-06-10 10:17:00,193.643,QQQ HH here we go above ma200 Downtrend broken Time to cover TQQQ SPY AAPL
caffy,True,2019-06-10 10:16:00,193.524,AAPL on the way to close some gaps above and continue even higher
caffy,True,2019-06-10 10:13:00,193.565,AAPL the more you hate it the higher it will go hahaha
GoodNewsBull,True,2019-06-10 10:13:00,193.565,AMZN Bears Young Traders this is whats called a Buffett Lesson AAPL SPY
Skidoome,True,2019-06-10 10:12:00,193.364,AAPL Jan 200s are 12 cheap kids
m71mmm,,2019-06-10 10:09:00,193.376,AAPL discounted
AlphaInvestor24,True,2019-06-10 10:08:00,193.105,AAPL our swings from last week Amazing run AMZN NVDA SPY BYND
BubbaFranks,False,2019-06-10 10:08:00,193.105,AAPL so when the FED doesnt cute rates are the BULLS ready for premium ass raping
NoRedDays,True,2019-06-10 10:08:00,193.105,AAPL 200 on deck imo
ElonMaskRocks,False,2019-06-10 10:07:00,193.171,AAPL 182 before 200
W1nW1n,,2019-06-10 10:07:00,193.171,AAPL Man I tell ya no game in town like options made 120 on a long 20 points away OTM call with a delta of like 10
PorcoRosso74,,2019-06-10 10:06:00,193.293,AAPL delighted with new ipadOS features finally they listened to customers I just order an ipadpro looking forward to the september os update
prstrader,True,2019-06-10 10:06:00,193.293,AAPL Crazy easy sht right here
tylahquartez,True,2019-06-10 10:05:00,193.212,AAPL
cybercash28,,2019-06-10 10:01:00,192.801,AAPL trying to go over ma50 It WILL QQQ about to cross MA200 and it WILL RSI rising to bullish zone and only 5601 MACD Xover TQQQ
stocktowatch7,,2019-06-10 09:59:00,192.624,AAPL here goes on stocksequitycomactivesto
JosephT43,,2019-06-10 09:53:00,192.298,SPY I understand MSFT going after E3 convention but I dont understand AAPL TREE has doubled since Christmas after missing the past 2 ers pretty badly Companies with negative earnings or posting very little profit are flying
GoodNewsBull,True,2019-06-10 09:52:00,192.409,SPY Silly to Short the Open since Bears cant hold overnight now theyre too nervous so Mrkt just set up to go higher EOD AMZN AAPL FB
sjs7,True,2019-06-10 09:49:00,192.4,AAPL Trade deal is done per AAPL chat room I do not believe most rumors but the inside note was a increase in manufacturing orders for APPLE in China and a pause in plans for a possible supply chain move out of ChinaMaybe COOK stepped upIf AAPL hits 19350 today then there might be clear sailing to over 200 next weekNo way Mnuchin leaks that out before G20 if Trump isnt going to make a huge deal splashThat is Trumps motus operandi
dunko,True,2019-06-10 09:49:00,192.4,AAPL 245 before 2020
SarahVI,True,2019-06-10 09:48:00,192.601,all of them going up hold long AMZN NVDA FB AAPL BABA
OverHyped,True,2019-06-10 09:48:00,192.601,AAPL 194 today
vikrampingili9,True,2019-06-10 09:46:00,192.931,AAPL China deal then Apple to 230
calvingrinder,,2019-06-10 09:38:00,192.303,AAPL Handson With The 28 Core Mac Pro Updated newsshootercom20190605
caffy,,2019-06-10 09:35:00,192.514,will AAPL buy NIO
caffy,True,2019-06-10 09:35:00,192.514,AAPL new highs soon on China deal
calvingrinder,,2019-06-10 09:33:00,192.132,AAPL Apple Pro Display XDR in portrait mode
caffy,True,2019-06-10 09:33:00,192.132,AAPL 240 soon
caffy,True,2019-06-10 09:30:00,192.001,AAPL going up on rampant negativity
caffy,True,2019-06-10 09:30:00,192.001,AAPL 199 this week
SExpert,True,2019-06-10 09:30:00,192.001,ATVI i say 4850 by Friday SPY EA TTWO AAPL
