censor,,2019-06-10 15:55:00,130.034,another huge day for a bunch of ticker besides CYBR
ChartMill,,2019-06-10 12:49:00,131.04,ENPH CYBR and NEE Strong technicals stocks and near a new high chartmillcomstockscreener
censor,,2019-06-10 12:47:00,130.905,CYBR the nasdaq doing better than this lol
fer12345,True,2019-06-10 12:36:00,131.303,CYBR anybody know the real price of this stock
EstimizeAlerts,,2019-06-10 10:57:00,132.24,Estimize revenue expectations are 004 higher than that of Wall Street for CYBR Q2 Reporting 0806 BMOhttpwwwestimizecomintrocybrchartchangeovertimemetricnamerevenueutmcontentCYBRutmmediumrevenuedifferenceutmsourcestocktwits
EstimizeAlerts,,2019-06-10 10:57:00,132.24,CYBRs License Revenue is a key growth metric for their next report on 0806 BMO Will they beat last quarters 5128M License Revenueestimizecomintrocybrcha
