stocksact,,2019-06-10 15:58:00,54.705,AAL DAL UAL LUVsell sell sell panic panic panicbastards
stocksact,True,2019-06-10 15:50:00,54.712,AAL DAL LUV UAL oh well just more of the same old BS nonsense Once theyre up 20 Ill sell and never buy airline stocks again
emeraldbayrider,,2019-06-10 13:49:00,55.008,ALK Added another 3k here at 6084 so long 15k now Holding the 17k long UAL as well both stocks going to run hard and top 100 within 15 months imo While these two are investment and taxation on them matters to me ie pushing off what will be a very large gain gain into 2020 at the earliest just reloaded 11k DAL at 5490 this morning as trade 22 on DAL so far this yr Playing for 58 but as group takes off is that fun or what likely will stay in for 60Shorting any of these three dumb unless one wants to generate capital losses LOL
mohammbrand,,2019-06-10 13:49:00,55.008,DAL piece of shit
EstimizeAlerts,,2019-06-10 10:21:00,55.717,Estimize revenue expectations are 073 lower than that of Wall Street for DAL Q2 Reporting 0711 BMOestimizecomintrodalchar
EstimizeAlerts,,2019-06-10 10:21:00,55.717,DAL reported 1483 PRASM last quarter Next report is on 0711 BMO Jury is still out on expectations Whats yoursestimizecomintrodalchar
