havivi77,True,2019-06-10 10:12:00,0.1915,HSGX nice action today 1 day closer
PEwing619,,2019-06-10 10:09:00,0.1888,HSGX wow
wolfandbutterfly,True,2019-06-10 10:06:00,0.1922,HSGX all you need is to cross to 24 then Im good
GoBillsGo,,2019-06-10 10:06:00,0.1922,HSGX exactly 19 million shares
GoBillsGo,,2019-06-10 10:05:00,0.1902,HSGX Today is not the day
Claird123,True,2019-06-10 10:03:00,0.1915,HSGX UGH
max_reverse,,2019-06-10 09:59:00,0.1907,HSGX why must you tease me like this
CST2019,,2019-06-10 09:59:00,0.1907,HSGX very typical of this stock Tons of hype and then fart noise
Lawbraydon,True,2019-06-10 09:58:00,0.189,HSGX Shes movin
stocktowatch7,,2019-06-10 09:53:00,0.1913,HSGX here goes on stocksequitycomactivesto
thePENNYdropper_,,2019-06-10 09:52:00,0.1924,HSGX bout to dip back under 19
onpunch,,2019-06-10 09:51:00,0.1933,HSGX Bring the bid up not just around 020 Make it 030 or more at least
demzo33,,2019-06-10 09:51:00,0.1933,HSGX papas buying an new BMW any day now
thePENNYdropper_,True,2019-06-10 09:51:00,0.1933,HSGX it will hold 185 until s4 and then we should see Id think 25 at least last chance to get in within next couple days almost guaranteed
LauraPicksRight,True,2019-06-10 09:50:00,0.193,YOGA bring the bids up might hop back in from here to 120 watching NBY DATA UTX holding HSGX for Thursday
GoBillsGo,,2019-06-10 09:48:00,0.194,HSGX
Claird123,True,2019-06-10 09:47:00,0.1948,HSGX so very close to
Glenn35is,,2019-06-10 09:46:00,0.1946,HSGX shes rolling
Vinnyb420,,2019-06-10 09:46:00,0.1946,HSGX holdddddd
JaysonD,True,2019-06-10 09:43:00,0.1945,HSGX here comes the boom Lets get it come on fker whip that bear give him alittle honey and we are off to the races
MDetox,True,2019-06-10 09:42:00,0.1929,HSGX watchers
stamperstock,True,2019-06-10 09:42:00,0.1929,HSGX let er rip
christianrodher,True,2019-06-10 09:40:00,0.195,HSGX not enough volume hold
MayonnaiseBoy,True,2019-06-10 09:40:00,0.195,HSGX this is going to be a great week
Jonathon_H20,True,2019-06-10 09:39:00,0.1958,HSGX fkn assholes have to sell to make a few hundred dollars with 10k shares when they could make a few thousand
Diver500,,2019-06-10 09:38:00,0.1939,HSGX buy buy buy
UncleTwits,,2019-06-10 09:38:00,0.1939,HSGX fading
unionfastcash,True,2019-06-10 09:38:00,0.1939,HSGX this is the beginning of the launch my people Get on this gravy train because the biscut wheels arent gonna have brakes today
Loren77,,2019-06-10 09:37:00,0.1985,HSGX 1M volume in 10 minutes
Loren77,True,2019-06-10 09:36:00,0.1973,HSGX destroy 02 come on
swerone,True,2019-06-10 09:36:00,0.1973,HSGX
Imgroote,,2019-06-10 09:35:00,0.1932,HSGX low volume Last Monday it was like this
thePENNYdropper_,True,2019-06-10 09:35:00,0.1932,HSGX not enough volume
thePENNYdropper_,,2019-06-10 09:34:00,0.1923,HSGX break 20
PositionMaster,True,2019-06-10 09:34:00,0.1923,HSGX up 48 whats the move
tmoore711,True,2019-06-10 09:30:00,0.1949,HSGX let the games begin
