Roaddancer53,True,2019-05-29 15:40:00,1.002,BTX Contrarian
MoneyMakinManhattan,False,2019-05-29 14:05:00,0.9962,BTX well I said it would hit sub 1s and it didI hope folks were able to snag those 97 cent shares todayanything sub 1 should be considered good luck folks and F YOU KeyserSoze6 you scumbag PUMPER
muskateer,True,2019-05-29 12:19:00,0.9798,BTX I still think this is the best investment Period
211SA,,2019-05-29 11:45:00,0.9799,BTX Cheap shares All good Cant wait for the news to hit
Brikki,,2019-05-29 11:40:00,0.9808,BTX Stuck holding 1830 shares at 119 wondering if I should just sit back and hold or put more money in this junk and average down
MoneyMakinManhattan,False,2019-05-29 11:20:00,0.9899,BTX Lets see some low 90s folks Im ready
oldwisetrader,True,2019-05-29 10:29:00,0.9973,BTX trading very actively we need news for a pop up
MoneyMakinManhattan,False,2019-05-29 10:09:00,0.973,BTX you deserve to lose EVERY SINGLE penny if you bought in the low 2s or high 1s Every single penny This turd has no real catalyst in 2019 and bulls thought it was safe to buyyou deserve to lose all your monies here
MoneyMakinManhattan,False,2019-05-29 10:07:00,0.9726,BTX there you go folkswhere are all the bulls who said otherwise
