michael82929,True,2019-05-29 12:54:00,38.87,AMRN MTNB AZN GSK so happy for us Amarin bulls she is holding up like viagra right now and maybe thats who might buy us this yr
rvc1881,False,2019-05-29 11:38:00,38.81,CLVS Appreciate the exit at 26 when this shows up at the bottom of my watch list every day Now 1B market capbut with an undeniably great drug that will forever remain under the heels of AZN olaparib and GSK niraparib without a big pharma patron Waiting to be this stocks shoulder to cry on when it sinks below 10
michael82929,,2019-05-29 11:34:00,38.803,AMRN GSK MTNB AZN lovemesomega 2019
michael82929,True,2019-05-29 11:06:00,38.908,AMRN GSK MTNB AZN omegaoutperformsweed 2019 2020
michael82929,True,2019-05-29 11:01:00,38.925,AMRN GSK MTNB AZN omegawillbethenewweedspace 20192020
michael82929,True,2019-05-29 10:56:00,38.911,AMRN lovemesomeomega AZN MTNB GSK AMRN
