Harry786N,,2019-05-29 15:26:00,6.035,KPTI lot of resistance in low 6s This stock has to go above 7 to breakout
gomez3420,,2019-05-29 12:43:00,6.08,KPTI its alive lol
canadian_trader,,2019-05-29 12:31:00,6.09,KPTI slow and steady rise up is okay by me
canadian_trader,,2019-05-29 12:21:00,6.05,SESN and KPTI both having a good day today not following overall trend of the market
taguru,,2019-05-29 11:12:00,5.86,KPTI Karyopharm Therapeutics KPTI 580 was the markets top weekly gainer with a 11 jump Expect an Uptrend reversal tickeroncomeventid13791
Turtletrading,,2019-05-29 11:09:00,5.931,KPTI Karyopharm Therapeutics KPTI 580 was the markets top quarterly gainer rising 32 tickeroncomeventid13786
