allawatis,,2019-05-20 13:36:00,80.194,ABBV stay above 80 for god sake for a day at least
Tesla73,True,2019-05-20 12:53:00,80.251,ABBV time to FLY to 125
Valuex,,2019-05-20 12:37:00,80.24,ABBV sold covered call notonlyequitycom8832
ChartMill,,2019-05-20 12:02:00,80.09,ABBV has a bad technical rating but it does show a decent setup pattern chartmillcomanalyzephpu
EstimizeAlerts,,2019-05-20 10:51:00,80.216,ABBV analysts on Estimize are expecting 1047 YoY EPS growth for Q2 down from 1444 in Q1 Reporting 0726 BMOestimizecomintroabbvcha
marketchameleonwins,,2019-05-20 10:34:00,79.94,ABBV 24May19 Straddle Implies a 22 move May 21 UBS Global Healthcare Conference marketchameleoncomOvervie
Senko_San,,2019-05-20 10:23:00,79.865,ABBV finally showing signs of life with that keen pipeline
