BabyGangsterTwits,True,2019-05-20 15:12:00,0.5168,AMPE news can be out anytimeee
mtn_biker,True,2019-05-20 15:06:00,0.5175,AMPE still here and waiting for spa
BigV5150,,2019-05-20 15:03:00,0.5175,AMPE wheres the news at tho
Walt81,,2019-05-20 14:05:00,0.5181,AMPE I could be wrong but looks like some bigger blocks than the usual hundreds odd shares are crossing in the last 60 minutes or so Wonder if some sort of new info is leaking out
loanguy78,True,2019-05-20 11:49:00,0.5082,AMPE MM better be preparing to blow our socks off in a good way All Bulls are due for good news
BabyGangsterTwits,True,2019-05-20 10:34:00,0.501,AMPE looking good love red before news uphill is scary and this stock is ALWAYS skyrocket from the bottom
onesixpack,True,2019-05-20 10:07:00,0.502,AMPE
AuntMarie,True,2019-05-20 09:41:00,0.5025,AMPE holding long and good morning all
justin966,False,2019-05-20 09:31:00,0.5199,AMPE SPLAT
