BioMania33,False,2019-02-14 15:49:00,3.957,PFNX Under 4 Right again More bagholders created again
BioMania33,False,2019-02-14 15:11:00,4.022,PFNX falling off a cliff where is bxvets Awefully quiet bruh
BioMania33,False,2019-02-14 15:05:00,4.06,PFNX more retail bagholders added today just like bxvets
BioMania33,,2019-02-14 15:03:00,4.11,PFNX oh no bxvets going RED
BioMania33,False,2019-02-14 14:25:00,4.17,PFNX are the lights still on in San Diego
BioMania33,False,2019-02-14 14:23:00,4.17,PFNX no volume no interest back under 4 no floor with NDA rejection
BioMania33,False,2019-02-14 13:57:00,4.201,PFNX volume is immaterial and therefore gains will not hold Day 66 still no NDA acceptance
bxvets,True,2019-02-14 12:49:00,4.25,PFNX BioMania33 why so quiet bruh lmmmmmmmmmmmmmmmfao
bxvets,True,2019-02-14 11:03:00,4.07,PFNX lookin good
