Kalkhose,,2019-02-14 14:54:00,3.833,Lower delinquency rates at PPDF vs YRD
InsiderForms,,2019-02-14 14:43:00,3.819,Krane Funds Advisors LLChas filed Form 13F for Q4 2018Opened NEW positions in JG BILI GDS HCM HUYA JKS KWEB PPDF PDD TME
Kalkhose,,2019-02-14 14:30:00,3.805,YRD If you like P2P PPDF has a stronger balance sheet and lower evaluation
risenhoover,,2019-02-14 14:06:00,3.765,Sig Asia Investment Lllp has filed an amended 13GA reporting 106 ownership in PPDF httpsfinteliosousppdf
cctranscripts,,2019-02-14 13:21:00,3.75,NEIL NANPENG SHEN just provided an update on share ownership of PPDAI Group conferencecalltranscriptso PPDF
InsiderForms,,2019-02-14 12:15:00,3.772,ZEVENBERGEN CAPITAL INVESTMENTS LLChas filed Form 13F for Q4 2018Opened NEW positions in DBX INGN IQ PPDF SIEN ESTC
