livetraderalerts,,2019-02-14 14:49:00,21.983,QRTEA 21m ago SEC Amended Beneficial Ownership Report SC 13GA Qurate Retail Inc secgovArchivesedgardata
risenhoover,,2019-02-14 14:43:00,21.976,Price T Rowe Associates Inc md has filed an amended 13GA reporting 00 ownership in QVCA httpsfinteliosousqvca
livetraderalerts,,2019-02-14 14:02:00,22.008,QRTEA 132m ago SEC Amended Beneficial Ownership Report SC 13GA Qurate Retail Inc secgovArchivesedgardata
risenhoover,,2019-02-14 13:18:00,22,Dodge Cox has filed an amended 13GA reporting 129 ownership in QVCA httpsfinteliosousqvca
InsiderForms,,2019-02-14 13:13:00,22.008,GOLDENTREE ASSET MANAGEMENT LPhas filed Form 13F for Q4 2018Opened NEW positions in CZR XOG FBC GS NVR QRTEA TEVA IGT PACD
livetraderalerts,,2019-02-14 13:10:00,22.023,QRTEA 23m ago SEC Amended Beneficial Ownership Report SC 13GA Qurate Retail Inc secgovArchivesedgardata
