marketexclusive,,2019-02-14 13:31:00,51.286,SEIC SEI Investments NASDAQSEIC Insider Trading Activity EVP Sold 10000 shares of Stock marketexclusivecomseiinv
MarketBeatInsiderTrades,,2019-02-14 12:39:00,51.102,SEI Investments EVP Wayne Withrow Sells 50500000 in SEIC marketbeatcomstocksNASDA
cctranscripts,,2019-02-14 11:11:00,50.975,SEI Investments Companys EXECUTIVE VICE PRESIDENT just cashedin 10000 options conferencecalltranscriptso SEIC
insiderbuyingselling,,2019-02-14 10:59:00,51.05,SEIC new insider selling 10000 shares insiderbuyingsellingcomt
risenhoover,,2019-02-14 10:36:00,51.143,Loomis Sayles Co L P has filed an amended 13GA reporting 1051 ownership in SEIC httpsfinteliosousseic
livetraderalerts,,2019-02-14 10:24:00,51.03,SEIC 94m ago SEI Adds 11 Billion in New OCIO Assets in FourthQuarter 2018 prnewswirecomnewsrelease
cctranscripts,,2019-02-14 10:12:00,51.09,Loomis Sayles Co LP just provided an update on share ownership of SEI Investments Company conferencecalltranscriptso SEIC
livetraderalerts,,2019-02-14 10:00:00,50.924,SEIC 21m ago SEC Amended Beneficial Ownership Report SC 13GA SEI INVESTMENTS CO secgovArchivesedgardata
