risenhoover,,2019-02-14 14:01:00,133.097,Price T Rowe Associates Inc md has filed a new 13G reporting 61 ownership in SRPT httpsfinteliosoussrpt
MakeMoney29,True,2019-02-14 13:58:00,133.1,SRPT one day soon we gonna pop and sizzle over 200
livetraderalerts,,2019-02-14 13:54:00,133.038,SRPT 66m ago SEC Beneficial Ownership Report SC 13G Sarepta Therapeutics Inc secgovArchivesedgardata
livetraderalerts,,2019-02-14 13:44:00,132.866,SRPT 22m ago SEC Amended Beneficial Ownership Report SC 13GA Sarepta Therapeutics Inc secgovArchivesedgardata
JORDAN__BELFORT,,2019-02-14 11:37:00,133.652,SRPT new drug app accepted
InsiderForms,,2019-02-14 10:45:00,134.68,Camber Capital Management LPhas filed Form 13F for Q4 2018Opened NEW positions in ALXN ALNY ARNA BHC CELG DVA GSK SRPT THOR
bluhorshue,,2019-02-14 10:19:00,135.224,SRPT from here on out all depends on Dr ingram and data results
TheBull113,,2019-02-14 09:54:00,133.898,SRPT so much for good news Dang POS
