sunshineave,,2019-02-14 14:51:00,4.721,short ratio of VSLR is 975 at 20190131 and short to float is 593 sunshineavenuecomstock via sunshineave
TradeMaster11,,2019-02-14 14:30:00,4.745,VSLR this is a good short here
rhysespieces,True,2019-02-14 13:46:00,4.75,VSLR can you just like hold on for a week or so I am awaiting funds come on now
MystockDreamer,,2019-02-14 13:42:00,4.736,VSLR in or out
cctranscripts,,2019-02-14 12:15:00,4.636,Stephen A Schwarzman just provided an update on share ownership of Vivint Solar Inc conferencecalltranscriptso VSLR
livetraderalerts,,2019-02-14 12:11:00,4.633,VSLR 23m ago SEC Amended Beneficial Ownership Report SC 13GA Vivint Solar Inc secgovArchivesedgardata
Jaguar1986,,2019-02-14 12:03:00,4.635,TERP VSLR CSIQ If you buy stock and then the price drops you have to buy more shares at least once imo to get a better average price
