EstimizeAlerts,,2019-05-22 15:19:00,187.921,LRCXs Gross Margins is a key growth metric for their next report on 0725 AMC Will they beat last quarters 451 Gross Marginsestimizecomintrolrcxcha
cybercash28,,2019-05-22 14:13:00,187.42,LRCX Green green chips is good for tech mrkt SOXX SOXL
sleekOptions,True,2019-05-22 12:07:00,187.22,Peak gain percentage for last 5 expired setups LRCX 7087 per 488 per 2593 per 2665 per 35531 per 7352 per
ChartMill,,2019-05-22 11:22:00,186.468,LRCX has a Quick Ratio of 279 indicating it is financially healthy chartmillcomanalyzephpu
xosignalscom,,2019-05-22 11:07:00,185.942,LRCX 25 percent of the increases on the way xosignalscomensignals
EstimizeAlerts,,2019-05-22 11:03:00,185.85,Heres what 18 Estimize analysts believe LRCX will report for Q4 2019 EPS Reporting 0725 AMCestimizecomintrolrcxcha
