Laozi1,,2019-05-22 15:58:00,4.98,RNN Jan 3rd Corporation Presentation only no more
Laozi1,,2019-05-22 15:43:00,4.98,RNN Peter Pan iBrance 75m 100mg 125mg Supinoxin 200mg 250mg 300mg
Laozi1,,2019-05-22 15:41:00,4.98,RNN 2Q Rx3117 Rx5902 mono data mandating coming
Peanut08,,2019-05-22 14:47:00,4.836,RNN Doing everything they can to rob us of the 1 penny we have left of every dollar we invested Im sure they will try to justify another offering to terrorists Operating at this low of a market cap ISNT in the best interest of the shareholders the employees or THE PATIENTS Get it together
GoodInvestor,,2019-05-22 14:38:00,4.86,RNN whens the next offering Im ready to see some shareholders get sacrificed
Traderguy17,False,2019-05-22 13:33:00,4.8,RNN offering coming soon
Laozi1,,2019-05-22 10:57:00,4.93,RNN Propharm event propharmagroupcomblogeve
birdball29,True,2019-05-22 09:43:00,4.97,RNNseekingalphacomnews34660 Lets see how the combo with RX5902 stands up against TAVO keep in mind TAVO DOES NOT act in a monotherapeutic setting RX5902 CAN
BGCapital,True,2019-05-22 09:34:00,4.97,RNN
