ETFDailyNews,,2019-05-23 15:43:00,33.08,MJ Effort to pass laws aimed at increasing marijuana businesses access to banks is gaining momentum etfdailynewscom20190523
topstockalerts,,2019-05-23 15:35:00,33.122,Marijuana Producers Lobby Congress to Let Them Use BanksCGC TLRY MJmarketwatchcomarticlesma
jagwired,,2019-05-23 15:04:00,32.933,MJ US needs an inverse etf too I am waiting on 27 on MJ before buying back any pot stocks
Jumpman23,,2019-05-23 14:02:00,33.109,MJ cbis omg give yourself a break OTC ones have gone in the garbage cvsi is the one that I like cann and cbds used to party
JorelLaraKalel,,2019-05-23 12:11:00,33.132,3 Marijuana Stocks Where Investors Have Lost Faith in Management MJ foolcominvesting201905 APHA SVVTF NXTTF
Dankimus,True,2019-05-23 11:33:00,33.339,This is the kind of collaboration that is going to change the world CBIS isnt just another pot stock ACB MJ TLRY CGCfrontiersinorgarticles10
