ChartMill,,2019-05-23 15:19:00,106.267,MDLZ WRB and PG detected as possible swing trading plays by our stock screener chartmillcomstockscreener
cctranscripts,,2019-05-23 14:38:00,106.09,Procter Gamble Company Thes Group President NA SMO just cashedin 25645 options conferencecalltranscriptso PG
fla,,2019-05-23 14:37:00,106.084,PG filed SEC form 4 Insider TASTAD CAROLYN M Sold 8944 of Common Stock at price 10608 on 20190522 secgovArchivesedgardata
OptionsBeyond,,2019-05-23 12:53:00,106.05,PG out for a loss at 42 from 65 avg
agoraopus,False,2019-05-23 12:39:00,106.252,We expect a broad weakening of PGportfolioconstructionpack
EstimizeAlerts,,2019-05-23 10:54:00,106.645,PG analysts on Estimize are expecting 171 YoY revenue growth for Q4 up from 111 in Q3 Reporting 0730 BMOestimizecomintropgchart
CQGThom,,2019-05-23 09:58:00,106.748,SPY Today 858 CST the best performer in the DJIA is Procter Gamble PG CQGInc CQGThom
