Skippy_von_Snootington,True,2019-02-19 11:36:00,1.72,PED Its coming Be patient
ChartMill,,2019-02-19 11:26:00,1.718,PED has a Profit Margin of 102223 This is amongst the best returns in the industry chartmillcomanalyzephpu
risenhoover,,2019-02-19 10:44:00,1.718,PED Pedevco files form 8K httpsfinteliosusped
risenhoover,,2019-02-19 10:43:00,1.718,Sk Energy Llc has filed an amended 13DA reporting 803 ownership in PED httpsfinteliosousped
Guesss,,2019-02-19 09:36:00,1.842,PED Huge Bid 18
Narens,,2019-02-19 09:34:00,1.777,PED WATCH OVER 195 WITH 19 STOP
