cybercash28,,2019-02-19 14:20:00,127.885,MU Bullish engulfing SOXX SOXL
JimInvestor,False,2019-02-19 12:50:00,126.799,WarningTech DRAM Chip price epsbarrons Feb19 enclosediConnect Feb19 enclosSOXSHurts COMPQ QQQ SOXX SOXX SOXL MU WDC
TraderLeibniz,True,2019-02-19 10:19:00,127.366,AMD MU NVDA mojo is coming back to the 2018 winner SMH SOX SOXX SOXS SOXL
Phenix1,True,2019-02-19 10:05:00,127.393,SOXL on Way to 52 WEEK HIGH of 20900
NowTheFuture,False,2019-02-19 09:59:00,126.425,SOXL outlook is down
cybercash28,,2019-02-19 09:44:00,126.677,AMD HH broke 24 2514 next SOXX SOXL
